Sheet: Sheet1
A1: 名称 | B1: 区分 | C1: 区別語 | D1: 現地 | E1: 標柱 | F1: 上屋 | G1: 椅子 | H1: 撮影日 | I1: URL | J1: 緯度経度 | L1: 緯度 | M1: 経度 | N1: 親停留所ID | O1: 現地との差異
A2: 倉吉バスセンター | B2: 上り | E2: 柱 | F2: なし | G2: なし | H2: 2012-09 | I2: https://www.google.co.jp/maps/@35.4623052,133.8492411,3a,75y,92.81h,82.17t/data=!3m6!1e1!3m4!1sNIx4NOrzhYBKWv3siZ1EJQ!2e0!7i13312!8i6656?hl=ja | J2: 35.462317, 133.849332 | L2: of:=MID([.J2];1;FIND(",";[.J2])-1) -> 35.462317 | M2: of:=MID([.J2];FIND(" ";[.J2])+1;LEN([.J2])) -> 133.849332 | N2: of:=1 -> 1 | O2: of:=IF([.A2]=[.D2];"";IF([.D2]="";"";"あり")) -> 
A3: 倉吉バスセンター | B3: 下り | D3: 倉吉バスセンター | E3: 柱 | F3: あり | G3: なし | H3: 2012-09 | I3: https://www.google.co.jp/maps/@35.4622152,133.8492182,3a,60y,259.08h,90t/data=!3m6!1e1!3m4!1sxgWs0PH2ph77yINUsTizHQ!2e0!7i13312!8i6656?hl=ja | J3: 35.462187, 133.849161 | L3: of:=MID([.J3];1;FIND(",";[.J3])-1) -> 35.462187 | M3: of:=MID([.J3];FIND(" ";[.J3])+1;LEN([.J3])) -> 133.849161 | N3: of:=IF([.A2]=[.A3];[.N2];[.N2]+1) -> 1 | O3: of:=IF([.A3]=[.D3];"";IF([.D3]="";"";"あり")) -> 
A4: 海田 | B4: 上り | D4: 海田 | E4: 柱 | F4: なし | G4: なし | H4: 2012-09 | I4: https://www.google.co.jp/maps/@35.4596368,133.8464004,3a,75y,143.85h,80.35t/data=!3m6!1e1!3m4!1sfXHcOr3AYoWyvKRbOzoN3g!2e0!7i13312!8i6656?hl=ja | J4: 35.459581, 133.846470 | L4: of:=MID([.J4];1;FIND(",";[.J4])-1) -> 35.459581 | M4: of:=MID([.J4];FIND(" ";[.J4])+1;LEN([.J4])) -> 133.846470 | N4: of:=IF([.A3]=[.A4];[.N3];[.N3]+1) -> 2 | O4: of:=IF([.A4]=[.D4];"";IF([.D4]="";"";"あり")) -> 
A5: 海田 | B5: 下り | D5: 海田 | E5: 柱 | F5: なし | G5: なし | H5: 2012-09 | I5: https://www.google.co.jp/maps/@35.4597045,133.8466125,3a,60y,304.89h,79.04t/data=!3m6!1e1!3m4!1sHcK-m-CjiV4WZ000DVt1xg!2e0!7i13312!8i6656?hl=ja | J5: 35.459733, 133.846581 | L5: of:=MID([.J5];1;FIND(",";[.J5])-1) -> 35.459733 | M5: of:=MID([.J5];FIND(" ";[.J5])+1;LEN([.J5])) -> 133.846581 | N5: of:=IF([.A4]=[.A5];[.N4];[.N4]+1) -> 2 | O5: of:=IF([.A5]=[.D5];"";IF([.D5]="";"";"あり")) -> 
A6: 河北中学校前 | B6: 上り | E6: 板 | F6: なし | G6: なし | H6: 2012-09 | I6: https://www.google.co.jp/maps/@35.4531774,133.8460417,3a,60y,90t/data=!3m6!1e1!3m4!1sgQoG_jU7MVHL3h_lZz8QQA!2e0!7i13312!8i6656?hl=ja | J6: 35.453247, 133.846025 | L6: of:=MID([.J6];1;FIND(",";[.J6])-1) -> 35.453247 | M6: of:=MID([.J6];FIND(" ";[.J6])+1;LEN([.J6])) -> 133.846025 | N6: of:=IF([.A5]=[.A6];[.N5];[.N5]+1) -> 3 | O6: of:=IF([.A6]=[.D6];"";IF([.D6]="";"";"あり")) -> 
A7: 河北中学校前 | B7: 下り | D7: 河北中学校前 | E7: 板 | F7: なし | G7: なし | H7: 2012-09 | I7: https://www.google.co.jp/maps/@35.4531805,133.8459384,3a,75y,179.58h,79.12t/data=!3m6!1e1!3m4!1s8x8jfdnvu0EsfYnF0HVUhA!2e0!7i13312!8i6656?hl=ja | J7: 35.453150, 133.845955 | L7: of:=MID([.J7];1;FIND(",";[.J7])-1) -> 35.453150 | M7: of:=MID([.J7];FIND(" ";[.J7])+1;LEN([.J7])) -> 133.845955 | N7: of:=IF([.A6]=[.A7];[.N6];[.N6]+1) -> 3 | O7: of:=IF([.A7]=[.D7];"";IF([.D7]="";"";"あり")) -> 
A8: 倉吉駅 | B8: 1 | E8: 柱 | F8: あり | G8: あり | H8: 2012-09 | I8: https://www.google.co.jp/maps/@35.4540965,133.8499079,3a,75y,346.56h,89.7t/data=!3m6!1e1!3m4!1sfAkcHapuVboJklR69F_gCg!2e0!7i13312!8i6656?hl=ja | J8: 35.454166, 133.849896 | L8: of:=MID([.J8];1;FIND(",";[.J8])-1) -> 35.454166 | M8: of:=MID([.J8];FIND(" ";[.J8])+1;LEN([.J8])) -> 133.849896 | N8: of:=IF([.A7]=[.A8];[.N7];[.N7]+1) -> 4 | O8: of:=IF([.A8]=[.D8];"";IF([.D8]="";"";"あり")) -> 
A9: 倉吉駅 | B9: 2 | E9: あり | F9: あり | G9: あり | H9: 2012-09 | I9: https://www.google.co.jp/maps/@35.454007,133.8504208,3a,15y,36.57h,89.23t/data=!3m6!1e1!3m4!1stWAGx_dwuSUPHQISXs7ZoA!2e0!7i13312!8i6656?hl=ja | J9: 35.454216, 133.850643 | L9: of:=MID([.J9];1;FIND(",";[.J9])-1) -> 35.454216 | M9: of:=MID([.J9];FIND(" ";[.J9])+1;LEN([.J9])) -> 133.850643 | N9: of:=IF([.A8]=[.A9];[.N8];[.N8]+1) -> 4 | O9: of:=IF([.A9]=[.D9];"";IF([.D9]="";"";"あり")) -> 
A10: 倉吉駅 | B10: 3 | E10: あり | F10: あり | G10: あり | H10: 2012-09 | I10: https://www.google.co.jp/maps/@35.4538136,133.8509287,3a,15y,343.6h,90.4t/data=!3m6!1e1!3m4!1sIHiJG8Eypbvj0gprromQ0w!2e0!7i13312!8i6656?hl=ja | J10: 35.454149, 133.850810 | L10: of:=MID([.J10];1;FIND(",";[.J10])-1) -> 35.454149 | M10: of:=MID([.J10];FIND(" ";[.J10])+1;LEN([.J10])) -> 133.850810 | N10: of:=IF([.A9]=[.A10];[.N9];[.N9]+1) -> 4 | O10: of:=IF([.A10]=[.D10];"";IF([.D10]="";"";"あり")) -> 
A11: 倉吉駅 | B11: 4 | E11: あり | F11: あり | G11: あり | H11: 2012-09 | I11: https://www.google.co.jp/maps/@35.4538525,133.850827,3a,41.6y,26.28h,90.29t/data=!3m6!1e1!3m4!1seeZSbwDMxCPEre8czRykqQ!2e0!7i13312!8i6656?hl=ja | J11: 35.454079, 133.850986 | L11: of:=MID([.J11];1;FIND(",";[.J11])-1) -> 35.454079 | M11: of:=MID([.J11];FIND(" ";[.J11])+1;LEN([.J11])) -> 133.850986 | N11: of:=IF([.A10]=[.A11];[.N10];[.N10]+1) -> 4 | O11: of:=IF([.A11]=[.D11];"";IF([.D11]="";"";"あり")) -> 
A12: 倉吉駅 | B12: 5 | E12: あり | F12: あり | G12: あり | H12: 2012-09 | I12: https://www.google.co.jp/maps/@35.4537734,133.8510331,3a,28.8y,19.37h,90.13t/data=!3m6!1e1!3m4!1sfYtWwpSy0qOGk9OWb481Uw!2e0!7i13312!8i6656?hl=ja | J12: 35.454034, 133.851104 | L12: of:=MID([.J12];1;FIND(",";[.J12])-1) -> 35.454034 | M12: of:=MID([.J12];FIND(" ";[.J12])+1;LEN([.J12])) -> 133.851104 | N12: of:=IF([.A11]=[.A12];[.N11];[.N11]+1) -> 4 | O12: of:=IF([.A12]=[.D12];"";IF([.D12]="";"";"あり")) -> 
A13: 倉吉駅 | B13: 6 | E13: あり | F13: あり | G13: なし | H13: 2012-09 | I13: https://www.google.co.jp/maps/@35.4537734,133.8510331,3a,28.8y,67.26h,89.8t/data=!3m6!1e1!3m4!1sfYtWwpSy0qOGk9OWb481Uw!2e0!7i13312!8i6656?hl=ja | J13: 35.453833, 133.851296 | L13: of:=MID([.J13];1;FIND(",";[.J13])-1) -> 35.453833 | M13: of:=MID([.J13];FIND(" ";[.J13])+1;LEN([.J13])) -> 133.851296 | N13: of:=IF([.A12]=[.A13];[.N12];[.N12]+1) -> 4 | O13: of:=IF([.A13]=[.D13];"";IF([.D13]="";"";"あり")) -> 
A14: 倉吉駅 | B14: 7 | E14: あり | F14: あり | G14: なし | H14: 2012-09 | I14: https://www.google.co.jp/maps/@35.4540965,133.8499079,3a,15y,84.56h,88.17t/data=!3m6!1e1!3m4!1sfAkcHapuVboJklR69F_gCg!2e0!7i13312!8i6656?hl=ja | J14: 35.454163, 133.850563 | L14: of:=MID([.J14];1;FIND(",";[.J14])-1) -> 35.454163 | M14: of:=MID([.J14];FIND(" ";[.J14])+1;LEN([.J14])) -> 133.850563 | N14: of:=IF([.A13]=[.A14];[.N13];[.N13]+1) -> 4 | O14: of:=IF([.A14]=[.D14];"";IF([.D14]="";"";"あり")) -> 
A15: 上井町一丁目西 | B15: 上り | D15: 上井町一丁目西、上井一丁目西 | E15: 箱 | F15: なし | G15: なし | H15: 2012-09 | I15: https://www.google.co.jp/maps/@35.4510182,133.8493652,3a,75y,284.41h,85.26t/data=!3m6!1e1!3m4!1sI3qU-8vZ2RJVFBziGHEd6Q!2e0!7i13312!8i6656?hl=ja | J15: 35.451037, 133.849342 | L15: of:=MID([.J15];1;FIND(",";[.J15])-1) -> 35.451037 | M15: of:=MID([.J15];FIND(" ";[.J15])+1;LEN([.J15])) -> 133.849342 | N15: of:=IF([.A14]=[.A15];[.N14];[.N14]+1) -> 5 | O15: of:=IF([.A15]=[.D15];"";IF([.D15]="";"";"あり")) -> あり
A16: 上井町一丁目西 | B16: 下り | D16: 上井町一丁目西 | E16: 板 | F16: なし | G16: なし | H16: 2012-09 | I16: https://www.google.co.jp/maps/@35.451401,133.8493723,3a,46.5y,89.11h,87.94t/data=!3m7!1e1!3m5!1shc7kGwlgWQOTkezIB-D5Tw!2e0!6s%2F%2Fgeo3.ggpht.com%2Fcbk%3Fpanoid%3Dhc7kGwlgWQOTkezIB-D5Tw%26output%3Dthumbnail%26cb_client%3Dmaps_sv.tactile.gps%26thumb%3D2%26 | J16: 35.451401, 133.849487 | L16: of:=MID([.J16];1;FIND(",";[.J16])-1) -> 35.451401 | M16: of:=MID([.J16];FIND(" ";[.J16])+1;LEN([.J16])) -> 133.849487 | N16: of:=IF([.A15]=[.A16];[.N15];[.N15]+1) -> 5 | O16: of:=IF([.A16]=[.D16];"";IF([.D16]="";"";"あり")) -> 
A17: 山根パープルタウン前 | B17: 上り | D17: 山根 | E17: 箱 | F17: あり | G17: あり | H17: 2012-09 | I17: https://www.google.co.jp/maps/@35.4479813,133.8494125,3a,32.9y,291.17h,87.63t/data=!3m6!1e1!3m4!1sKjylmNr5t9S3Xj2op6NDww!2e0!7i13312!8i6656?hl=ja | J17: 35.448034, 133.849294 | L17: of:=MID([.J17];1;FIND(",";[.J17])-1) -> 35.448034 | M17: of:=MID([.J17];FIND(" ";[.J17])+1;LEN([.J17])) -> 133.849294 | N17: of:=IF([.A16]=[.A17];[.N16];[.N16]+1) -> 6 | O17: of:=IF([.A17]=[.D17];"";IF([.D17]="";"";"あり")) -> あり
A18: 山根パープルタウン前 | B18: 下り | D18: 山根 | E18: 板 | F18: あり | G18: あり | H18: 2012-09 | I18: https://www.google.co.jp/maps/@35.447357,133.8494026,3a,75y,119.08h,78.95t/data=!3m6!1e1!3m4!1sbgpbwtDB78W1lxOI0_2LWw!2e0!7i13312!8i6656?hl=ja | J18: 35.447343, 133.849425 | L18: of:=MID([.J18];1;FIND(",";[.J18])-1) -> 35.447343 | M18: of:=MID([.J18];FIND(" ";[.J18])+1;LEN([.J18])) -> 133.849425 | N18: of:=IF([.A17]=[.A18];[.N17];[.N17]+1) -> 6 | O18: of:=IF([.A18]=[.D18];"";IF([.D18]="";"";"あり")) -> あり
A19: 伊木 | B19: 上り | D19: 伊木 | E19: 板 | F19: なし | G19: なし | H19: 2012-09 | I19: https://www.google.co.jp/maps/@35.444829,133.8493634,3a,29.2y,289.38h,85.94t/data=!3m6!1e1!3m4!1sfVIu7_zqo7SKLjA1UlBmnQ!2e0!7i13312!8i6656?hl=ja | J19: 35.444875, 133.849255 | L19: of:=MID([.J19];1;FIND(",";[.J19])-1) -> 35.444875 | M19: of:=MID([.J19];FIND(" ";[.J19])+1;LEN([.J19])) -> 133.849255 | N19: of:=IF([.A18]=[.A19];[.N18];[.N18]+1) -> 7 | O19: of:=IF([.A19]=[.D19];"";IF([.D19]="";"";"あり")) -> 
A20: 伊木 | B20: 下り | D20: 伊木 | E20: 板 | F20: なし | G20: なし | H20: 2012-09 | I20: https://www.google.co.jp/maps/@35.44465,133.8493613,3a,75y,31.44h,77.35t/data=!3m6!1e1!3m4!1sAHzR9BvTw5cSrxPVB2aHig!2e0!7i13312!8i6656?hl=ja | J20: 35.444689, 133.849396 | L20: of:=MID([.J20];1;FIND(",";[.J20])-1) -> 35.444689 | M20: of:=MID([.J20];FIND(" ";[.J20])+1;LEN([.J20])) -> 133.849396 | N20: of:=IF([.A19]=[.A20];[.N19];[.N19]+1) -> 7 | O20: of:=IF([.A20]=[.D20];"";IF([.D20]="";"";"あり")) -> 
A21: 八ツ屋 | B21: 上り | D21: 八屋 | E21: 箱 | F21: あり | G21: なし | H21: 2012-09 | I21: https://www.google.co.jp/maps/@35.4415585,133.8482624,3a,22.4y,337.8h,87.57t/data=!3m6!1e1!3m4!1sgSiivH0lB4uE3L8NhczqEQ!2e0!7i13312!8i6656?hl=ja | J21: 35.441670, 133.848206 | L21: of:=MID([.J21];1;FIND(",";[.J21])-1) -> 35.441670 | M21: of:=MID([.J21];FIND(" ";[.J21])+1;LEN([.J21])) -> 133.848206 | N21: of:=IF([.A20]=[.A21];[.N20];[.N20]+1) -> 8 | O21: of:=IF([.A21]=[.D21];"";IF([.D21]="";"";"あり")) -> あり
A22: 八ツ屋 | B22: 下り | D22: 八屋 | E22: 板 | F22: あり | G22: なし | H22: 2012-09 | I22: https://www.google.co.jp/maps/@35.4415196,133.8481637,3a,48.9y,214.71h,88.28t/data=!3m6!1e1!3m4!1sZxplnKfXRZ9lXpovIBYlmQ!2e0!7i13312!8i6656?hl=ja | J22: 35.441458, 133.848096 | L22: of:=MID([.J22];1;FIND(",";[.J22])-1) -> 35.441458 | M22: of:=MID([.J22];FIND(" ";[.J22])+1;LEN([.J22])) -> 133.848096 | N22: of:=IF([.A21]=[.A22];[.N21];[.N21]+1) -> 8 | O22: of:=IF([.A22]=[.D22];"";IF([.D22]="";"";"あり")) -> あり
A23: 総合事務所前 | B23: 上り | D23: 総合事務所前 | E23: 板 | F23: あり | G23: あり | H23: 2012-09 | I23: https://www.google.co.jp/maps/@35.4401346,133.8446134,3a,15.6y,307.39h,86.81t/data=!3m6!1e1!3m4!1sryUhPeWPBdBCDoBAfcWbIQ!2e0!7i13312!8i6656?hl=ja | J23: 35.440232, 133.844446 | L23: of:=MID([.J23];1;FIND(",";[.J23])-1) -> 35.440232 | M23: of:=MID([.J23];FIND(" ";[.J23])+1;LEN([.J23])) -> 133.844446 | N23: of:=IF([.A22]=[.A23];[.N22];[.N22]+1) -> 9 | O23: of:=IF([.A23]=[.D23];"";IF([.D23]="";"";"あり")) -> 
A24: 総合事務所前 | B24: 下り | D24: 総合事務所前 | E24: 板 | F24: あり | G24: あり | H24: 2012-09 | I24: https://www.google.co.jp/maps/@35.4400995,133.844515,3a,75y,163.06h,81.24t/data=!3m6!1e1!3m4!1sS2NqxVUA19Ves5Larq9VnQ!2e0!7i13312!8i6656?hl=ja | J24: 35.440051, 133.844532 | L24: of:=MID([.J24];1;FIND(",";[.J24])-1) -> 35.440051 | M24: of:=MID([.J24];FIND(" ";[.J24])+1;LEN([.J24])) -> 133.844532 | N24: of:=IF([.A23]=[.A24];[.N23];[.N23]+1) -> 9 | O24: of:=IF([.A24]=[.D24];"";IF([.D24]="";"";"あり")) -> 
A25: 厚生病院前 | B25: 上り | D25: 厚生病院前 | E25: 箱 | F25: あり | G25: あり | H25: 2012-09 | I25: https://www.google.co.jp/maps/@35.4371826,133.8395959,3a,42.5y,331.25h,87.85t/data=!3m6!1e1!3m4!1sxFaXHIITANDGBJyUVrhdlQ!2e0!7i13312!8i6656?hl=ja | J25: 35.437282, 133.839542 | L25: of:=MID([.J25];1;FIND(",";[.J25])-1) -> 35.437282 | M25: of:=MID([.J25];FIND(" ";[.J25])+1;LEN([.J25])) -> 133.839542 | N25: of:=IF([.A24]=[.A25];[.N24];[.N24]+1) -> 10 | O25: of:=IF([.A25]=[.D25];"";IF([.D25]="";"";"あり")) -> 
A26: 厚生病院前 | B26: 下り | D26: 厚生病院前 | E26: 箱 | F26: あり | G26: あり | H26: 2012-09 | I26: https://www.google.co.jp/maps/@35.4373318,133.8397896,3a,75y,194.29h,86.92t/data=!3m6!1e1!3m4!1sjqsepQaiRoJHfC6e_juoRA!2e0!7i13312!8i6656?hl=ja | J26: 35.437284, 133.839774 | L26: of:=MID([.J26];1;FIND(",";[.J26])-1) -> 35.437284 | M26: of:=MID([.J26];FIND(" ";[.J26])+1;LEN([.J26])) -> 133.839774 | N26: of:=IF([.A25]=[.A26];[.N25];[.N25]+1) -> 10 | O26: of:=IF([.A26]=[.D26];"";IF([.D26]="";"";"あり")) -> 
A27: 倉吉パークスクエア北口 | B27: 上り | D27: 倉吉パークスクエア北口（昭和町） | E27: 板 | F27: あり | G27: あり | H27: 2012-09 | I27: https://www.google.co.jp/maps/@35.4338583,133.835267,3a,60y,307.1h,88.39t/data=!3m6!1e1!3m4!1sUwgMef9ohe2PsUVsKszypg!2e0!7i13312!8i6656?hl=ja | J27: 35.433910, 133.835163 | L27: of:=MID([.J27];1;FIND(",";[.J27])-1) -> 35.433910 | M27: of:=MID([.J27];FIND(" ";[.J27])+1;LEN([.J27])) -> 133.835163 | N27: of:=IF([.A26]=[.A27];[.N26];[.N26]+1) -> 11 | O27: of:=IF([.A27]=[.D27];"";IF([.D27]="";"";"あり")) -> あり
A28: 倉吉パークスクエア北口 | B28: 下り | D28: 倉吉パークスクエア北口（昭和町） | E28: 板 | F28: あり | G28: あり | H28: 2012-09 | I28: https://www.google.co.jp/maps/@35.4341789,133.8356844,3a,75y,166.87h,88t/data=!3m6!1e1!3m4!1sRxyzwPsoiFIe7ZoIoCXrBA!2e0!7i13312!8i6656?hl=ja | J28: 35.434130, 133.835666 | L28: of:=MID([.J28];1;FIND(",";[.J28])-1) -> 35.434130 | M28: of:=MID([.J28];FIND(" ";[.J28])+1;LEN([.J28])) -> 133.835666 | N28: of:=IF([.A27]=[.A28];[.N27];[.N27]+1) -> 11 | O28: of:=IF([.A28]=[.D28];"";IF([.D28]="";"";"あり")) -> あり
A29: 宮川町 | B29: 上り | D29: 宮川町 | E29: 板 | F29: あり | G29: あり | H29: 2012-09 | I29: https://www.google.co.jp/maps/@35.4328453,133.8308998,3a,44.6y,41.68h,85.6t/data=!3m6!1e1!3m4!1soFA32AkcogVd-gVmOtzB5w!2e0!7i13312!8i6656?hl=ja | J29: 35.432889, 133.830946 | L29: of:=MID([.J29];1;FIND(",";[.J29])-1) -> 35.432889 | M29: of:=MID([.J29];FIND(" ";[.J29])+1;LEN([.J29])) -> 133.830946 | N29: of:=IF([.A28]=[.A29];[.N28];[.N28]+1) -> 12 | O29: of:=IF([.A29]=[.D29];"";IF([.D29]="";"";"あり")) -> 
A30: 宮川町 | B30: 下り | D30: 宮川町 | E30: 板 | F30: なし | G30: あり | H30: 2012-09 | I30: https://www.google.co.jp/maps/@35.4328639,133.8311713,3a,75y,172.73h,84.66t/data=!3m6!1e1!3m4!1seSyBR2oW7RkFsElVytjiGQ!2e0!7i13312!8i6656?hl=ja | J30: 35.432811, 133.831151 | L30: of:=MID([.J30];1;FIND(",";[.J30])-1) -> 35.432811 | M30: of:=MID([.J30];FIND(" ";[.J30])+1;LEN([.J30])) -> 133.831151 | N30: of:=IF([.A29]=[.A30];[.N29];[.N29]+1) -> 12 | O30: of:=IF([.A30]=[.D30];"";IF([.D30]="";"";"あり")) -> 
A31: 堺町 | B31: 上り | D31: 堺町 | E31: 箱 | F31: なし | G31: あり | H31: 2015-04 | I31: https://www.google.co.jp/maps/@35.4330337,133.8278311,3a,85.3y,348.87h,88.96t/data=!3m6!1e1!3m4!1s5aIRa_egGdb5cpXOgRszpw!2e0!7i13312!8i6656?hl=ja | J31: 35.433091, 133.827761 | L31: of:=MID([.J31];1;FIND(",";[.J31])-1) -> 35.433091 | M31: of:=MID([.J31];FIND(" ";[.J31])+1;LEN([.J31])) -> 133.827761 | N31: of:=IF([.A30]=[.A31];[.N30];[.N30]+1) -> 13 | O31: of:=IF([.A31]=[.D31];"";IF([.D31]="";"";"あり")) -> 
A32: 堺町 | B32: 下り | D32: 堺町 | E32: 板 | F32: あり | G32: あり | H32: 2015-04 | I32: https://www.google.co.jp/maps/@35.4330091,133.8282471,3a,46.7y,236h,86.43t/data=!3m6!1e1!3m4!1ssFToDCjcIwKvPZ55UN-Dww!2e0!7i13312!8i6656?hl=ja | J32: 35.432970, 133.828152 | L32: of:=MID([.J32];1;FIND(",";[.J32])-1) -> 35.432970 | M32: of:=MID([.J32];FIND(" ";[.J32])+1;LEN([.J32])) -> 133.828152 | N32: of:=IF([.A31]=[.A32];[.N31];[.N31]+1) -> 13 | O32: of:=IF([.A32]=[.D32];"";IF([.D32]="";"";"あり")) -> 
A33: 赤瓦・白壁土蔵 | B33: 上り | D33: 赤瓦・白壁土蔵（明治町） | E33: 柱 | F33: なし | G33: なし | H33: 2015-04 | I33: https://www.google.co.jp/maps/@35.4331858,133.8253082,3a,49.9y,342.55h,85.33t/data=!3m6!1e1!3m4!1seL0p6_Z8UOagpkBcRt5Aqg!2e0!7i13312!8i6656?hl=ja | J33: 35.433246, 133.825263 | L33: of:=MID([.J33];1;FIND(",";[.J33])-1) -> 35.433246 | M33: of:=MID([.J33];FIND(" ";[.J33])+1;LEN([.J33])) -> 133.825263 | N33: of:=IF([.A32]=[.A33];[.N32];[.N32]+1) -> 14 | O33: of:=IF([.A33]=[.D33];"";IF([.D33]="";"";"あり")) -> あり
A34: 赤瓦・白壁土蔵 | B34: 下り | D34: 赤瓦・白壁土蔵（明治町） | E34: 柱 | F34: なし | G34: なし | H34: 2015-04 | I34: https://www.google.co.jp/maps/@35.4332941,133.8236191,3a,75y,140.07h,79.13t/data=!3m6!1e1!3m4!1svAQNmQ7YIqfkwA-_mpmz0g!2e0!7i13312!8i6656?hl=ja | J34: 35.433254, 133.823665 | L34: of:=MID([.J34];1;FIND(",";[.J34])-1) -> 35.433254 | M34: of:=MID([.J34];FIND(" ";[.J34])+1;LEN([.J34])) -> 133.823665 | N34: of:=IF([.A33]=[.A34];[.N33];[.N33]+1) -> 14 | O34: of:=IF([.A34]=[.D34];"";IF([.D34]="";"";"あり")) -> あり
A35: 新町 | B35: 上り | D35: 新町 | E35: 板 | F35: あり | G35: あり | H35: 2015-04 | I35: https://www.google.co.jp/maps/@35.433499,133.8206387,3a,35.7y,352.24h,88.85t/data=!3m6!1e1!3m4!1sVZk2D-Z6Kzvol-1egldx5g!2e0!7i13312!8i6656?hl=ja | J35: 35.433600, 133.820587 | L35: of:=MID([.J35];1;FIND(",";[.J35])-1) -> 35.433600 | M35: of:=MID([.J35];FIND(" ";[.J35])+1;LEN([.J35])) -> 133.820587 | N35: of:=IF([.A34]=[.A35];[.N34];[.N34]+1) -> 15 | O35: of:=IF([.A35]=[.D35];"";IF([.D35]="";"";"あり")) -> 
A36: 新町 | B36: 下り | D36: 新町 | E36: 板 | F36: あり | G36: あり | H36: 2015-04 | I36: https://www.google.co.jp/maps/@35.433499,133.8206387,3a,35.7y,247.67h,86.35t/data=!3m6!1e1!3m4!1sVZk2D-Z6Kzvol-1egldx5g!2e0!7i13312!8i6656?hl=ja | J36: 35.433475, 133.820569 | L36: of:=MID([.J36];1;FIND(",";[.J36])-1) -> 35.433475 | M36: of:=MID([.J36];FIND(" ";[.J36])+1;LEN([.J36])) -> 133.820569 | N36: of:=IF([.A35]=[.A36];[.N35];[.N35]+1) -> 15 | O36: of:=IF([.A36]=[.D36];"";IF([.D36]="";"";"あり")) -> 
A37: 福吉町 | B37: 上り | E37: 板 | F37: あり | G37: あり | H37: 2015-04 | I37: https://www.google.co.jp/maps/@35.4335134,133.8176779,3a,42.9y,316.98h,86.53t/data=!3m6!1e1!3m4!1se3BHDNSPs4RwLA3Kz-H1TA!2e0!7i13312!8i6656?hl=ja | J37: 35.433578, 133.817625 | L37: of:=MID([.J37];1;FIND(",";[.J37])-1) -> 35.433578 | M37: of:=MID([.J37];FIND(" ";[.J37])+1;LEN([.J37])) -> 133.817625 | N37: of:=IF([.A36]=[.A37];[.N36];[.N36]+1) -> 16 | O37: of:=IF([.A37]=[.D37];"";IF([.D37]="";"";"あり")) -> 
A38: 福吉町 | B38: 下り | D38: 福吉町 | E38: 板 | F38: なし | G38: なし | H38: 2015-04 | I38: https://www.google.co.jp/maps/@35.4335134,133.8176779,3a,68.9y,114.44h,85.68t/data=!3m6!1e1!3m4!1se3BHDNSPs4RwLA3Kz-H1TA!2e0!7i13312!8i6656?hl=ja | J38: 35.433481, 133.817778 | L38: of:=MID([.J38];1;FIND(",";[.J38])-1) -> 35.433481 | M38: of:=MID([.J38];FIND(" ";[.J38])+1;LEN([.J38])) -> 133.817778 | N38: of:=IF([.A37]=[.A38];[.N37];[.N37]+1) -> 16 | O38: of:=IF([.A38]=[.D38];"";IF([.D38]="";"";"あり")) -> 
A39: 広瀬町 | B39: 上り | E39: 板 | F39: なし | G39: なし | H39: 2015-04 | I39: https://www.google.co.jp/maps/@35.4316694,133.8137688,3a,75.8y,8.91h,89.15t/data=!3m6!1e1!3m4!1sw79knoZWNsLnX2dt5mpplQ!2e0!7i13312!8i6656?hl=ja | J39: 35.431753, 133.813775 | L39: of:=MID([.J39];1;FIND(",";[.J39])-1) -> 35.431753 | M39: of:=MID([.J39];FIND(" ";[.J39])+1;LEN([.J39])) -> 133.813775 | N39: of:=IF([.A38]=[.A39];[.N38];[.N38]+1) -> 17 | O39: of:=IF([.A39]=[.D39];"";IF([.D39]="";"";"あり")) -> 
A40: 広瀬町 | B40: 下り | D40: 広瀬町 | E40: 板 | F40: なし | G40: なし | H40: 2015-04 | I40: https://www.google.co.jp/maps/@35.4318454,133.8141434,3a,79.9y,151.74h,85.19t/data=!3m6!1e1!3m4!1s30dg1K1_ULsmsu42RPlKzw!2e0!7i13312!8i6656?hl=ja | J40: 35.431812, 133.814144 | L40: of:=MID([.J40];1;FIND(",";[.J40])-1) -> 35.431812 | M40: of:=MID([.J40];FIND(" ";[.J40])+1;LEN([.J40])) -> 133.814144 | N40: of:=IF([.A39]=[.A40];[.N39];[.N39]+1) -> 17 | O40: of:=IF([.A40]=[.D40];"";IF([.D40]="";"";"あり")) -> 
A41: 河原町 | B41: 上り | D41: 河原町 | E41: 板 | F41: なし | G41: なし | H41: 2015-04 | I41: https://www.google.co.jp/maps/@35.4302264,133.8107303,3a,46y,288.96h,91.83t/data=!3m6!1e1!3m4!1sheMI4E76eWjKEPHYZZD02Q!2e0!7i13312!8i6656?hl=ja | J41: 35.430248, 133.810585 | L41: of:=MID([.J41];1;FIND(",";[.J41])-1) -> 35.430248 | M41: of:=MID([.J41];FIND(" ";[.J41])+1;LEN([.J41])) -> 133.810585 | N41: of:=IF([.A40]=[.A41];[.N40];[.N40]+1) -> 18 | O41: of:=IF([.A41]=[.D41];"";IF([.D41]="";"";"あり")) -> 
A42: 河原町 | B42: 下り | D42: 河原町 | E42: 板 | F42: なし | G42: なし | H42: 2015-04 | I42: https://www.google.co.jp/maps/@35.4302264,133.8107303,3a,90y,154.71h,78.64t/data=!3m6!1e1!3m4!1sheMI4E76eWjKEPHYZZD02Q!2e0!7i13312!8i6656?hl=ja | J42: 35.430183, 133.810756 | L42: of:=MID([.J42];1;FIND(",";[.J42])-1) -> 35.430183 | M42: of:=MID([.J42];FIND(" ";[.J42])+1;LEN([.J42])) -> 133.810756 | N42: of:=IF([.A41]=[.A42];[.N41];[.N41]+1) -> 18 | O42: of:=IF([.A42]=[.D42];"";IF([.D42]="";"";"あり")) -> 
A43: 岡田 | B43: 上り | E43: 柱 | F43: なし | G43: なし | H43: 2012-09 | I43: https://www.google.co.jp/maps/@35.4288875,133.8068757,3a,24y,63.05h,87.48t/data=!3m6!1e1!3m4!1sFRgE-A620cZbckR0YrqQRg!2e0!7i13312!8i6656?hl=ja | J43: 35.429003, 133.807117 | L43: of:=MID([.J43];1;FIND(",";[.J43])-1) -> 35.429003 | M43: of:=MID([.J43];FIND(" ";[.J43])+1;LEN([.J43])) -> 133.807117 | N43: of:=IF([.A42]=[.A43];[.N42];[.N42]+1) -> 19 | O43: of:=IF([.A43]=[.D43];"";IF([.D43]="";"";"あり")) -> 
A44: 岡田 | B44: 下り | E44: 柱 | F44: なし | G44: なし | H44: 2012-09 | I44: https://www.google.co.jp/maps/@35.4291252,133.80777,3a,15y,243.37h,86.59t/data=!3m6!1e1!3m4!1sJI1VJQHcY0SGOCjlj6quOg!2e0!7i13312!8i6656?hl=ja | J44: 35.428949, 133.807359 | L44: of:=MID([.J44];1;FIND(",";[.J44])-1) -> 35.428949 | M44: of:=MID([.J44];FIND(" ";[.J44])+1;LEN([.J44])) -> 133.807359 | N44: of:=IF([.A43]=[.A44];[.N43];[.N43]+1) -> 19 | O44: of:=IF([.A44]=[.D44];"";IF([.D44]="";"";"あり")) -> 
A45: 岡田 | B45: 下り折返 | E45: 板 | F45: なし | G45: なし | H45: 2012-10 | I45: https://www.google.co.jp/maps/@35.4283881,133.8080452,3a,75y,123.83h,85.62t/data=!3m6!1e1!3m4!1sMNTNboliaz31h0gHsHYPPw!2e0!7i13312!8i6656?hl=ja | J45: 35.428319, 133.808121 | L45: of:=MID([.J45];1;FIND(",";[.J45])-1) -> 35.428319 | M45: of:=MID([.J45];FIND(" ";[.J45])+1;LEN([.J45])) -> 133.808121 | N45: of:=IF([.A44]=[.A45];[.N44];[.N44]+1) -> 19 | O45: of:=IF([.A45]=[.D45];"";IF([.D45]="";"";"あり")) -> 
A46: 西倉吉 | B46: 上り折返 | E46: 柱 | F46: あり | G46: あり | H46: 2012-09 | I46: https://www.google.co.jp/maps/@35.4287013,133.8054976,3a,47.8y,207.86h,91.56t/data=!3m6!1e1!3m4!1sy1TcYlufL6O04qwhc1z-dg!2e0!7i13312!8i6656?hl=ja | J46: 35.428567, 133.805404 | L46: of:=MID([.J46];1;FIND(",";[.J46])-1) -> 35.428567 | M46: of:=MID([.J46];FIND(" ";[.J46])+1;LEN([.J46])) -> 133.805404 | N46: of:=IF([.A45]=[.A46];[.N45];[.N45]+1) -> 20 | O46: of:=IF([.A46]=[.D46];"";IF([.D46]="";"";"あり")) -> 
A47: 西倉吉 | B47: 上り | E47: 板 | F47: なし | G47: なし | H47: 2012-09 | I47: https://www.google.co.jp/maps/@35.4287412,133.8057821,3a,75y,305.71h,87.03t/data=!3m6!1e1!3m4!1sbcG_RhyPhx2aoZXqg5gI3A!2e0!7i13312!8i6656?hl=ja | J47: 35.428758, 133.805740 | L47: of:=MID([.J47];1;FIND(",";[.J47])-1) -> 35.428758 | M47: of:=MID([.J47];FIND(" ";[.J47])+1;LEN([.J47])) -> 133.805740 | N47: of:=IF([.A46]=[.A47];[.N46];[.N46]+1) -> 20 | O47: of:=IF([.A47]=[.D47];"";IF([.D47]="";"";"あり")) -> 
A48: 西倉吉 | B48: 下り | E48: 板 | F48: なし | G48: なし | H48: 2012-09 | I48: https://www.google.co.jp/maps/@35.4287774,133.8060163,3a,75y,129.86h,85.94t/data=!3m6!1e1!3m4!1syXu-XTBBSFV2CdOqBeeAMg!2e0!7i13312!8i6656?hl=ja | J48: 35.428728, 133.806088 | L48: of:=MID([.J48];1;FIND(",";[.J48])-1) -> 35.428728 | M48: of:=MID([.J48];FIND(" ";[.J48])+1;LEN([.J48])) -> 133.806088 | N48: of:=IF([.A47]=[.A48];[.N47];[.N47]+1) -> 20 | O48: of:=IF([.A48]=[.D48];"";IF([.D48]="";"";"あり")) -> 
A49: 西倉吉町 | B49: 上り | E49: 柱 | F49: なし | G49: なし | H49: 2012-09 | I49: https://www.google.co.jp/maps/@35.4272718,133.8059565,3a,32.4y,166.5h,83.25t/data=!3m6!1e1!3m4!1sujFWv9bq4im40vP44rxULQ!2e0!7i13312!8i6656?hl=ja | J49: 35.427206, 133.805977 | L49: of:=MID([.J49];1;FIND(",";[.J49])-1) -> 35.427206 | M49: of:=MID([.J49];FIND(" ";[.J49])+1;LEN([.J49])) -> 133.805977 | N49: of:=IF([.A48]=[.A49];[.N48];[.N48]+1) -> 21 | O49: of:=IF([.A49]=[.D49];"";IF([.D49]="";"";"あり")) -> 
A50: 西倉吉町 | B50: 下り | D50: 西倉吉町 | E50: 柱 | F50: なし | G50: なし | H50: 2012-09 | I50: https://www.google.co.jp/maps/@35.4272731,133.8061825,3a,75y,343.42h,72.65t/data=!3m6!1e1!3m4!1ssHyT1G507y-r_eu9krVtJA!2e0!7i13312!8i6656?hl=ja | J50: 35.427315, 133.806171 | L50: of:=MID([.J50];1;FIND(",";[.J50])-1) -> 35.427315 | M50: of:=MID([.J50];FIND(" ";[.J50])+1;LEN([.J50])) -> 133.806171 | N50: of:=IF([.A49]=[.A50];[.N49];[.N49]+1) -> 21 | O50: of:=IF([.A50]=[.D50];"";IF([.D50]="";"";"あり")) -> 
A51: 丸山 | B51: 上り | E51: なし | F51: なし | G51: なし | H51: 2012-10 | J51: 35.425075, 133.808048 | L51: of:=MID([.J51];1;FIND(",";[.J51])-1) -> 35.425075 | M51: of:=MID([.J51];FIND(" ";[.J51])+1;LEN([.J51])) -> 133.808048 | N51: of:=IF([.A50]=[.A51];[.N50];[.N50]+1) -> 22 | O51: of:=IF([.A51]=[.D51];"";IF([.D51]="";"";"あり")) -> 
A52: 丸山 | B52: 下り | D52: 丸山 | E52: 板 | F52: なし | G52: なし | H52: 2012-10 | I52: https://www.google.co.jp/maps/@35.4250491,133.8079749,3a,68.6y,78.12h,83.85t/data=!3m6!1e1!3m4!1shZ3SKgEmL0Tc4QdzWurs6Q!2e0!7i13312!8i6656?hl=ja | J52: 35.425075, 133.808048 | L52: of:=MID([.J52];1;FIND(",";[.J52])-1) -> 35.425075 | M52: of:=MID([.J52];FIND(" ";[.J52])+1;LEN([.J52])) -> 133.808048 | N52: of:=IF([.A51]=[.A52];[.N51];[.N51]+1) -> 22 | O52: of:=IF([.A52]=[.D52];"";IF([.D52]="";"";"あり")) -> 
A53: 生田 | B53: 上り | D53: 生田 | E53: 柱 | F53: なし | G53: なし | H53: 2012-10 | I53: https://www.google.co.jp/maps/@35.4206735,133.8063014,3a,60y,343.01h,81.91t/data=!3m6!1e1!3m4!1sI7SS5_jN60GSNNO-uaQ7Sw!2e0!7i13312!8i6656?hl=ja | J53: 35.420747, 133.806289 | L53: of:=MID([.J53];1;FIND(",";[.J53])-1) -> 35.420747 | M53: of:=MID([.J53];FIND(" ";[.J53])+1;LEN([.J53])) -> 133.806289 | N53: of:=IF([.A52]=[.A53];[.N52];[.N52]+1) -> 23 | O53: of:=IF([.A53]=[.D53];"";IF([.D53]="";"";"あり")) -> 
A54: 生田 | B54: 下り | D54: 生田 | E54: 板 | F54: なし | G54: なし | H54: 2012-10 | I54: https://www.google.co.jp/maps/@35.4206735,133.8063014,3a,60y,128.83h,84.32t/data=!3m6!1e1!3m4!1sI7SS5_jN60GSNNO-uaQ7Sw!2e0!7i13312!8i6656?hl=ja | J54: 35.420643, 133.806359 | L54: of:=MID([.J54];1;FIND(",";[.J54])-1) -> 35.420643 | M54: of:=MID([.J54];FIND(" ";[.J54])+1;LEN([.J54])) -> 133.806359 | N54: of:=IF([.A53]=[.A54];[.N53];[.N53]+1) -> 23 | O54: of:=IF([.A54]=[.D54];"";IF([.D54]="";"";"あり")) -> 
A55: 生田日ノ丸前 | B55: 上り | D55: 生田日ノ丸車庫前 | E55: 柱 | F55: なし | G55: なし | H55: 2012-10 | I55: https://www.google.co.jp/maps/@35.4186311,133.8055284,3a,60y,303.79h,82.13t/data=!3m6!1e1!3m4!1sVZMkqO6c3TkcVr2w_qRaNg!2e0!7i13312!8i6656?hl=ja | J55: 35.418675, 133.805485 | L55: of:=MID([.J55];1;FIND(",";[.J55])-1) -> 35.418675 | M55: of:=MID([.J55];FIND(" ";[.J55])+1;LEN([.J55])) -> 133.805485 | N55: of:=IF([.A54]=[.A55];[.N54];[.N54]+1) -> 24 | O55: of:=IF([.A55]=[.D55];"";IF([.D55]="";"";"あり")) -> あり
A56: 生田日ノ丸前 | B56: 下り | D56: 生田日ノ丸前 | E56: 柱 | F56: なし | G56: なし | H56: 2012-10 | I56: https://www.google.co.jp/maps/@35.4186311,133.8055284,3a,46.4y,65.25h,82.26t/data=!3m6!1e1!3m4!1sVZMkqO6c3TkcVr2w_qRaNg!2e0!7i13312!8i6656?hl=ja | J56: 35.418680, 133.805622 | L56: of:=MID([.J56];1;FIND(",";[.J56])-1) -> 35.418680 | M56: of:=MID([.J56];FIND(" ";[.J56])+1;LEN([.J56])) -> 133.805622 | N56: of:=IF([.A55]=[.A56];[.N55];[.N55]+1) -> 24 | O56: of:=IF([.A56]=[.D56];"";IF([.D56]="";"";"あり")) -> 
A57: 保育園前 | B57: 上り | D57: 保育園前 | E57: 板 | F57: あり | G57: あり | H57: 2012-10 | I57: https://www.google.co.jp/maps/@35.4118304,133.8024743,3a,33.9y,356.98h,88.24t/data=!3m6!1e1!3m4!1soGFh9FTfjNGHLDHIUswjgg!2e0!7i13312!8i6656?hl=ja | J57: 35.411918, 133.802465 | L57: of:=MID([.J57];1;FIND(",";[.J57])-1) -> 35.411918 | M57: of:=MID([.J57];FIND(" ";[.J57])+1;LEN([.J57])) -> 133.802465 | N57: of:=IF([.A56]=[.A57];[.N56];[.N56]+1) -> 25 | O57: of:=IF([.A57]=[.D57];"";IF([.D57]="";"";"あり")) -> 
A58: 保育園前 | B58: 下り | D58: 保育園前 | E58: 板 | F58: なし | G58: なし | H58: 2012-10 | I58: https://www.google.co.jp/maps/@35.4118304,133.8024743,3a,33.9y,179.07h,87.71t/data=!3m6!1e1!3m4!1soGFh9FTfjNGHLDHIUswjgg!2e0!7i13312!8i6656?hl=ja | J58: 35.411753, 133.802471 | L58: of:=MID([.J58];1;FIND(",";[.J58])-1) -> 35.411753 | M58: of:=MID([.J58];FIND(" ";[.J58])+1;LEN([.J58])) -> 133.802471 | N58: of:=IF([.A57]=[.A58];[.N57];[.N57]+1) -> 25 | O58: of:=IF([.A58]=[.D58];"";IF([.D58]="";"";"あり")) -> 
A59: 中河原 | B59: 上り | E59: 柱 | F59: あり | G59: あり | H59: 2012-10 | I59: https://www.google.co.jp/maps/@35.4087991,133.8001543,3a,52.4y,316.67h,86.62t/data=!3m6!1e1!3m4!1s6KZNhwvWL20wuH-PaMFxow!2e0!7i13312!8i6656?hl=ja | J59: 35.408869, 133.800044 | L59: of:=MID([.J59];1;FIND(",";[.J59])-1) -> 35.408869 | M59: of:=MID([.J59];FIND(" ";[.J59])+1;LEN([.J59])) -> 133.800044 | N59: of:=IF([.A58]=[.A59];[.N58];[.N58]+1) -> 26 | O59: of:=IF([.A59]=[.D59];"";IF([.D59]="";"";"あり")) -> 
A60: 中河原 | B60: 下り | D60: 中河原 | E60: 柱 | F60: なし | G60: なし | H60: 2012-10 | I60: https://www.google.co.jp/maps/@35.4094447,133.8007095,3a,23y,167.75h,87.93t/data=!3m6!1e1!3m4!1sGhKp8tEohMbPJSBCTfUU-w!2e0!7i13312!8i6656?hl=ja | J60: 35.409311, 133.800729 | L60: of:=MID([.J60];1;FIND(",";[.J60])-1) -> 35.409311 | M60: of:=MID([.J60];FIND(" ";[.J60])+1;LEN([.J60])) -> 133.800729 | N60: of:=IF([.A59]=[.A60];[.N59];[.N59]+1) -> 26 | O60: of:=IF([.A60]=[.D60];"";IF([.D60]="";"";"あり")) -> 
A61: 市場 | B61: 上り | D61: 市場 | E61: 柱 | F61: あり | G61: あり | H61: 2012-10 | I61: https://www.google.co.jp/maps/@35.4060157,133.7973192,3a,75y,306.03h,80.82t/data=!3m6!1e1!3m4!1s8p0lo-ywgMuEs7qSO71vSw!2e0!7i13312!8i6656?hl=ja | J61: 35.406038, 133.797271 | L61: of:=MID([.J61];1;FIND(",";[.J61])-1) -> 35.406038 | M61: of:=MID([.J61];FIND(" ";[.J61])+1;LEN([.J61])) -> 133.797271 | N61: of:=IF([.A60]=[.A61];[.N60];[.N60]+1) -> 27 | O61: of:=IF([.A61]=[.D61];"";IF([.D61]="";"";"あり")) -> 
A62: 市場 | B62: 下り | D62: 市場 | E62: 板 | F62: なし | G62: なし | H62: 2012-10 | I62: https://www.google.co.jp/maps/@35.4061837,133.7974873,3a,75y,159.51h,85.49t/data=!3m6!1e1!3m4!1sZlXJKV1u3QRWBW7oGPwwiQ!2e0!7i13312!8i6656?hl=ja | J62: 35.406105, 133.797520 | L62: of:=MID([.J62];1;FIND(",";[.J62])-1) -> 35.406105 | M62: of:=MID([.J62];FIND(" ";[.J62])+1;LEN([.J62])) -> 133.797520 | N62: of:=IF([.A61]=[.A62];[.N61];[.N61]+1) -> 27 | O62: of:=IF([.A62]=[.D62];"";IF([.D62]="";"";"あり")) -> 
A63: 蔵内入口 | B63: 上り | D63: 蔵内入口 | E63: 柱 | F63: あり | G63: あり | H63: 2012-10 | I63: https://www.google.co.jp/maps/@35.4010384,133.7923435,3a,75y,300.63h,86.2t/data=!3m6!1e1!3m4!1sFIFJGBIQqn9WGW2Z-O2b7w!2e0!7i13312!8i6656?hl=ja | J63: 35.401040, 133.792305 | L63: of:=MID([.J63];1;FIND(",";[.J63])-1) -> 35.401040 | M63: of:=MID([.J63];FIND(" ";[.J63])+1;LEN([.J63])) -> 133.792305 | N63: of:=IF([.A62]=[.A63];[.N62];[.N62]+1) -> 28 | O63: of:=IF([.A63]=[.D63];"";IF([.D63]="";"";"あり")) -> 
A64: 蔵内入口 | B64: 下り | D64: 蔵内入口 | E64: 板 | F64: なし | G64: なし | H64: 2012-10 | I64: https://www.google.co.jp/maps/@35.401389,133.7926984,3a,15y,64.17h,89.16t/data=!3m6!1e1!3m4!1s_rioO-_-umNTzpAsu_Fl7Q!2e0!7i13312!8i6656?hl=ja | J64: 35.401490, 133.792930 | L64: of:=MID([.J64];1;FIND(",";[.J64])-1) -> 35.401490 | M64: of:=MID([.J64];FIND(" ";[.J64])+1;LEN([.J64])) -> 133.792930 | N64: of:=IF([.A63]=[.A64];[.N63];[.N63]+1) -> 28 | O64: of:=IF([.A64]=[.D64];"";IF([.D64]="";"";"あり")) -> 
A65: 上古川 | B65: 上り | D65: 上古川 | E65: 板 | F65: あり | G65: あり | H65: 2012-10 | I65: https://www.google.co.jp/maps/@35.3986448,133.7899868,3a,60.6y,277.14h,84.65t/data=!3m6!1e1!3m4!1sBu8C9fJbeJ1oKO_7GeRxGw!2e0!7i13312!8i6656?hl=ja | J65: 35.398655, 133.789894 | L65: of:=MID([.J65];1;FIND(",";[.J65])-1) -> 35.398655 | M65: of:=MID([.J65];FIND(" ";[.J65])+1;LEN([.J65])) -> 133.789894 | N65: of:=IF([.A64]=[.A65];[.N64];[.N64]+1) -> 29 | O65: of:=IF([.A65]=[.D65];"";IF([.D65]="";"";"あり")) -> 
A66: 上古川 | B66: 下り | E66: なし | F66: なし | G66: なし | H66: 2012-10 | J66: 35.398655, 133.789894 | L66: of:=MID([.J66];1;FIND(",";[.J66])-1) -> 35.398655 | M66: of:=MID([.J66];FIND(" ";[.J66])+1;LEN([.J66])) -> 133.789894 | N66: of:=IF([.A65]=[.A66];[.N65];[.N65]+1) -> 29 | O66: of:=IF([.A66]=[.D66];"";IF([.D66]="";"";"あり")) -> 
A67: 石塚入口 | B67: 上り | D67: 石塚入口 | E67: 柱 | F67: あり | G67: あり | H67: 2012-10 | I67: https://www.google.co.jp/maps/@35.3963056,133.7875988,3a,60y,273.19h,85.37t/data=!3m6!1e1!3m4!1sit-JwIxiI8nkYHFS--uOTw!2e0!7i13312!8i6656?hl=ja | J67: 35.396291, 133.787537 | L67: of:=MID([.J67];1;FIND(",";[.J67])-1) -> 35.396291 | M67: of:=MID([.J67];FIND(" ";[.J67])+1;LEN([.J67])) -> 133.787537 | N67: of:=IF([.A66]=[.A67];[.N66];[.N66]+1) -> 30 | O67: of:=IF([.A67]=[.D67];"";IF([.D67]="";"";"あり")) -> 
A68: 石塚入口 | B68: 下り | E68: なし | F68: なし | G68: なし | H68: 2012-10 | J68: 35.396291, 133.787537 | L68: of:=MID([.J68];1;FIND(",";[.J68])-1) -> 35.396291 | M68: of:=MID([.J68];FIND(" ";[.J68])+1;LEN([.J68])) -> 133.787537 | N68: of:=IF([.A67]=[.A68];[.N67];[.N67]+1) -> 30 | O68: of:=IF([.A68]=[.D68];"";IF([.D68]="";"";"あり")) -> 
A69: 診療所前 | B69: 上り | D69: 診療所前 | E69: 柱 | F69: あり | G69: なし | H69: 2012-10 | I69: https://www.google.co.jp/maps/@35.3937047,133.7850004,3a,60y,321.58h,86.36t/data=!3m6!1e1!3m4!1szmP_oaFZF1Tzmy97_1puDQ!2e0!7i13312!8i6656?hl=ja | J69: 35.393760, 133.785021 | L69: of:=MID([.J69];1;FIND(",";[.J69])-1) -> 35.393760 | M69: of:=MID([.J69];FIND(" ";[.J69])+1;LEN([.J69])) -> 133.785021 | N69: of:=IF([.A68]=[.A69];[.N68];[.N68]+1) -> 31 | O69: of:=IF([.A69]=[.D69];"";IF([.D69]="";"";"あり")) -> 
A70: 診療所前 | B70: 下り | E70: なし | F70: なし | G70: なし | H70: 2012-10 | J70: 35.393760, 133.785021 | L70: of:=MID([.J70];1;FIND(",";[.J70])-1) -> 35.393760 | M70: of:=MID([.J70];FIND(" ";[.J70])+1;LEN([.J70])) -> 133.785021 | N70: of:=IF([.A69]=[.A70];[.N69];[.N69]+1) -> 31 | O70: of:=IF([.A70]=[.D70];"";IF([.D70]="";"";"あり")) -> 
A71: 福山 | B71: 上り | D71: 福山 | E71: 柱 | F71: あり | G71: あり | H71: 2012-10 | I71: https://www.google.co.jp/maps/@35.391422,133.7824097,3a,33.3y,15.23h,86.05t/data=!3m6!1e1!3m4!1spGYnNuKhi89SPDnJx8pLTw!2e0!7i13312!8i6656?hl=ja | J71: 35.391515, 133.782440 | L71: of:=MID([.J71];1;FIND(",";[.J71])-1) -> 35.391515 | M71: of:=MID([.J71];FIND(" ";[.J71])+1;LEN([.J71])) -> 133.782440 | N71: of:=IF([.A70]=[.A71];[.N70];[.N70]+1) -> 32 | O71: of:=IF([.A71]=[.D71];"";IF([.D71]="";"";"あり")) -> 
A72: 福山 | B72: 下り | E72: 柱 | F72: なし | G72: なし | H72: 2012-10 | I72: https://www.google.co.jp/maps/@35.391422,133.7824097,3a,33.3y,132.46h,80.79t/data=!3m6!1e1!3m4!1spGYnNuKhi89SPDnJx8pLTw!2e0!7i13312!8i6656?hl=ja | J72: 35.391391, 133.782482 | L72: of:=MID([.J72];1;FIND(",";[.J72])-1) -> 35.391391 | M72: of:=MID([.J72];FIND(" ";[.J72])+1;LEN([.J72])) -> 133.782482 | N72: of:=IF([.A71]=[.A72];[.N71];[.N71]+1) -> 32 | O72: of:=IF([.A72]=[.D72];"";IF([.D72]="";"";"あり")) -> 
A73: 若土 | B73: 上り | D73: 若土 | E73: 柱 | F73: あり | G73: あり | H73: 2012-10 | I73: https://www.google.co.jp/maps/@35.386138,133.780061,3a,23.7y,301.19h,85.67t/data=!3m6!1e1!3m4!1sFl0Lr9Eb9UGnwZXoo557Wg!2e0!7i13312!8i6656?hl=ja | J73: 35.386189, 133.779964 | L73: of:=MID([.J73];1;FIND(",";[.J73])-1) -> 35.386189 | M73: of:=MID([.J73];FIND(" ";[.J73])+1;LEN([.J73])) -> 133.779964 | N73: of:=IF([.A72]=[.A73];[.N72];[.N72]+1) -> 33 | O73: of:=IF([.A73]=[.D73];"";IF([.D73]="";"";"あり")) -> 
A74: 若土 | B74: 下り | D74: 若土 | E74: 柱 | F74: なし | G74: なし | H74: 2012-10 | I74: https://www.google.co.jp/maps/@35.3872517,133.7806472,3a,33.4y,127.17h,88.3t/data=!3m6!1e1!3m4!1sajBi3HZ0YsrmsrDryoAAmA!2e0!7i13312!8i6656?hl=ja | J74: 35.387171, 133.780749 | L74: of:=MID([.J74];1;FIND(",";[.J74])-1) -> 35.387171 | M74: of:=MID([.J74];FIND(" ";[.J74])+1;LEN([.J74])) -> 133.780749 | N74: of:=IF([.A73]=[.A74];[.N73];[.N73]+1) -> 33 | O74: of:=IF([.A74]=[.D74];"";IF([.D74]="";"";"あり")) -> 
A75: 生竹 | B75: 上り | D75: 生竹 | E75: 柱 | F75: なし | G75: なし | H75: 2012-10 | I75: https://www.google.co.jp/maps/@35.3777395,133.7744415,3a,51.6y,227.95h,80.35t/data=!3m6!1e1!3m4!1shUJKUozoauyQ-NYm5R0HMQ!2e0!7i13312!8i6656?hl=ja | J75: 35.377706, 133.774377 | L75: of:=MID([.J75];1;FIND(",";[.J75])-1) -> 35.377706 | M75: of:=MID([.J75];FIND(" ";[.J75])+1;LEN([.J75])) -> 133.774377 | N75: of:=IF([.A74]=[.A75];[.N74];[.N74]+1) -> 34 | O75: of:=IF([.A75]=[.D75];"";IF([.D75]="";"";"あり")) -> 
A76: 生竹 | B76: 下り | E76: なし | F76: なし | G76: なし | H76: 2012-10 | J76: 35.377706, 133.774377 | L76: of:=MID([.J76];1;FIND(",";[.J76])-1) -> 35.377706 | M76: of:=MID([.J76];FIND(" ";[.J76])+1;LEN([.J76])) -> 133.774377 | N76: of:=IF([.A75]=[.A76];[.N75];[.N75]+1) -> 34 | O76: of:=IF([.A76]=[.D76];"";IF([.D76]="";"";"あり")) -> 
A77: 耳 | B77: 上り | D77: 耳 | E77: 柱 | F77: なし | G77: なし | H77: 2012-09 | I77: https://www.google.co.jp/maps/@35.3751158,133.7723563,3a,60y,341.39h,85.57t/data=!3m6!1e1!3m4!1s2MY75dhx3QmUbBMwfnJlvw!2e0!7i13312!8i6656?hl=ja | J77: 35.375171, 133.772299 | L77: of:=MID([.J77];1;FIND(",";[.J77])-1) -> 35.375171 | M77: of:=MID([.J77];FIND(" ";[.J77])+1;LEN([.J77])) -> 133.772299 | N77: of:=IF([.A76]=[.A77];[.N76];[.N76]+1) -> 35 | O77: of:=IF([.A77]=[.D77];"";IF([.D77]="";"";"あり")) -> 
A78: 耳 | B78: 下り | E78: なし | F78: あり | G78: あり | H78: 2012-09 | I78: https://www.google.co.jp/maps/@35.3751158,133.7723563,3a,60y,121.11h,80.04t/data=!3m6!1e1!3m4!1s2MY75dhx3QmUbBMwfnJlvw!2e0!7i13312!8i6656?hl=ja | J78: 35.375171, 133.772299 | L78: of:=MID([.J78];1;FIND(",";[.J78])-1) -> 35.375171 | M78: of:=MID([.J78];FIND(" ";[.J78])+1;LEN([.J78])) -> 133.772299 | N78: of:=IF([.A77]=[.A78];[.N77];[.N77]+1) -> 35 | O78: of:=IF([.A78]=[.D78];"";IF([.D78]="";"";"あり")) -> 
A79: 関金入口 | B79: 上り | D79: 関金入口 | E79: 柱 | F79: なし | G79: なし | H79: 2012-09 | I79: https://www.google.co.jp/maps/@35.3687317,133.7646981,3a,49.5y,319.43h,85.75t/data=!3m6!1e1!3m4!1sdML8X-nhHdvs0KtjscEBpQ!2e0!7i13312!8i6656?hl=ja | J79: 35.368783, 133.764598 | L79: of:=MID([.J79];1;FIND(",";[.J79])-1) -> 35.368783 | M79: of:=MID([.J79];FIND(" ";[.J79])+1;LEN([.J79])) -> 133.764598 | N79: of:=IF([.A78]=[.A79];[.N78];[.N78]+1) -> 36 | O79: of:=IF([.A79]=[.D79];"";IF([.D79]="";"";"あり")) -> 
A80: 関金入口 | B80: 下り | E80: 柱 | F80: あり | G80: あり | H80: 2012-09 | I80: https://www.google.co.jp/maps/@35.3686671,133.7644567,3a,75y,148.99h,72.9t/data=!3m6!1e1!3m4!1sz08J6l9-TMAPfBbIyhFphQ!2e0!7i13312!8i6656?hl=ja | J80: 35.368607, 133.764484 | L80: of:=MID([.J80];1;FIND(",";[.J80])-1) -> 35.368607 | M80: of:=MID([.J80];FIND(" ";[.J80])+1;LEN([.J80])) -> 133.764484 | N80: of:=IF([.A79]=[.A80];[.N79];[.N79]+1) -> 36 | O80: of:=IF([.A80]=[.D80];"";IF([.D80]="";"";"あり")) -> 
A81: 関金温泉 | B81: 上り | D81: 関金温泉 | E81: 板 | F81: あり | G81: あり | H81: 2012-09 | I81: https://www.google.co.jp/maps/@35.3661281,133.7597197,3a,45.8y,338.89h,91t/data=!3m6!1e1!3m4!1sUWxKgHdOQPIzWHW_nMTnvA!2e0!7i13312!8i6656?hl=ja | J81: 35.366218, 133.759678 | L81: of:=MID([.J81];1;FIND(",";[.J81])-1) -> 35.366218 | M81: of:=MID([.J81];FIND(" ";[.J81])+1;LEN([.J81])) -> 133.759678 | N81: of:=IF([.A80]=[.A81];[.N80];[.N80]+1) -> 37 | O81: of:=IF([.A81]=[.D81];"";IF([.D81]="";"";"あり")) -> 
A82: 関金温泉 | B82: 下り | D82: 関金温泉 | E82: 板 | F82: あり | G82: あり | H82: 2012-09 | I82: https://www.google.co.jp/maps/@35.3663514,133.7600675,3a,80.3y,188.83h,90.09t/data=!3m6!1e1!3m4!1sgn6tUwb530TYgPWbXnz5uw!2e0!7i13312!8i6656?hl=ja | J82: 35.366216, 133.760049 | L82: of:=MID([.J82];1;FIND(",";[.J82])-1) -> 35.366216 | M82: of:=MID([.J82];FIND(" ";[.J82])+1;LEN([.J82])) -> 133.760049 | N82: of:=IF([.A81]=[.A82];[.N81];[.N81]+1) -> 37 | O82: of:=IF([.A82]=[.D82];"";IF([.D82]="";"";"あり")) -> 
A83: 金谷 | B83: 上り | E83: なし | F83: なし | G83: なし | H83: 2012-10 | J83: 35.367865, 133.758305 | L83: of:=MID([.J83];1;FIND(",";[.J83])-1) -> 35.367865 | M83: of:=MID([.J83];FIND(" ";[.J83])+1;LEN([.J83])) -> 133.758305 | N83: of:=IF([.A82]=[.A83];[.N82];[.N82]+1) -> 38 | O83: of:=IF([.A83]=[.D83];"";IF([.D83]="";"";"あり")) -> 
A84: 金谷 | B84: 下り | D84: 金谷 | E84: 板 | F84: あり | G84: あり | H84: 2012-10 | I84: https://www.google.co.jp/maps/@35.3677334,133.7583674,3a,51.3y,325.19h,87.11t/data=!3m6!1e1!3m4!1sSAwhmKrwEJiG4yq3l812iw!2e0!7i13312!8i6656?hl=ja | J84: 35.367865, 133.758305 | L84: of:=MID([.J84];1;FIND(",";[.J84])-1) -> 35.367865 | M84: of:=MID([.J84];FIND(" ";[.J84])+1;LEN([.J84])) -> 133.758305 | N84: of:=IF([.A83]=[.A84];[.N83];[.N83]+1) -> 38 | O84: of:=IF([.A84]=[.D84];"";IF([.D84]="";"";"あり")) -> 
A85: 中学校入口 | B85: 上り | E85: 柱 | F85: あり | G85: なし | H85: 2012-10 | I85: https://www.google.co.jp/maps/@35.3696486,133.7569813,3a,60y,358.13h,89.38t/data=!3m6!1e1!3m4!1sUAum_up7hsqzsB5-oIvvdg!2e0!7i13312!8i6656?hl=ja | J85: 35.369690, 133.756957 | L85: of:=MID([.J85];1;FIND(",";[.J85])-1) -> 35.369690 | M85: of:=MID([.J85];FIND(" ";[.J85])+1;LEN([.J85])) -> 133.756957 | N85: of:=IF([.A84]=[.A85];[.N84];[.N84]+1) -> 39 | O85: of:=IF([.A85]=[.D85];"";IF([.D85]="";"";"あり")) -> 
A86: 中学校入口 | B86: 下り | E86: なし | F86: なし | G86: なし | H86: 2012-10 | J86: 35.369690, 133.756957 | L86: of:=MID([.J86];1;FIND(",";[.J86])-1) -> 35.369690 | M86: of:=MID([.J86];FIND(" ";[.J86])+1;LEN([.J86])) -> 133.756957 | N86: of:=IF([.A85]=[.A86];[.N85];[.N85]+1) -> 39 | O86: of:=IF([.A86]=[.D86];"";IF([.D86]="";"";"あり")) -> 
A87: 関金庁舎前 | B87: 上り | E87: 柱 | F87: なし | G87: なし | H87: 2012-10 | I87: https://www.google.co.jp/maps/@35.3698505,133.7546795,3a,52.5y,25.68h,86.4t/data=!3m6!1e1!3m4!1sOEp7quNYIGRIdvNom3gJ3w!2e0!7i13312!8i6656?hl=ja | J87: 35.369891, 133.754702 | L87: of:=MID([.J87];1;FIND(",";[.J87])-1) -> 35.369891 | M87: of:=MID([.J87];FIND(" ";[.J87])+1;LEN([.J87])) -> 133.754702 | N87: of:=IF([.A86]=[.A87];[.N86];[.N86]+1) -> 40 | O87: of:=IF([.A87]=[.D87];"";IF([.D87]="";"";"あり")) -> 
A88: 関金庁舎前 | B88: 下り | E88: 柱 | F88: なし | G88: なし | H88: 2012-10 | I88: https://www.google.co.jp/maps/@35.3698505,133.7546795,3a,52.5y,158.86h,83.82t/data=!3m6!1e1!3m4!1sOEp7quNYIGRIdvNom3gJ3w!2e0!7i13312!8i6656?hl=ja | J88: 35.369793, 133.754695 | L88: of:=MID([.J88];1;FIND(",";[.J88])-1) -> 35.369793 | M88: of:=MID([.J88];FIND(" ";[.J88])+1;LEN([.J88])) -> 133.754695 | N88: of:=IF([.A87]=[.A88];[.N87];[.N87]+1) -> 40 | O88: of:=IF([.A88]=[.D88];"";IF([.D88]="";"";"あり")) -> 
A89: 関金バスセンター | B89: 上り | E89: なし | F89: あり | G89: あり | H89: 2012-10 | I89: https://www.google.co.jp/maps/@35.3701741,133.7518384,3a,75y,346.36h,81.46t/data=!3m6!1e1!3m4!1sl_avmaJmr--LupAV88o6wQ!2e0!7i13312!8i6656?hl=ja | J89: 35.370217, 133.751790 | L89: of:=MID([.J89];1;FIND(",";[.J89])-1) -> 35.370217 | M89: of:=MID([.J89];FIND(" ";[.J89])+1;LEN([.J89])) -> 133.751790 | N89: of:=IF([.A88]=[.A89];[.N88];[.N88]+1) -> 41 | O89: of:=IF([.A89]=[.D89];"";IF([.D89]="";"";"あり")) -> 
A90: 関金バスセンター | B90: 下り | E90: なし | F90: なし | G90: なし | H90: 2012-10 | J90: 35.370217, 133.751790 | L90: of:=MID([.J90];1;FIND(",";[.J90])-1) -> 35.370217 | M90: of:=MID([.J90];FIND(" ";[.J90])+1;LEN([.J90])) -> 133.751790 | N90: of:=IF([.A89]=[.A90];[.N89];[.N89]+1) -> 41 | O90: of:=IF([.A90]=[.D90];"";IF([.D90]="";"";"あり")) -> 
A91: 大鳥居 | B91: 上り | D91: 大鳥居 | E91: 柱 | F91: なし | G91: なし | H91: 2012-10 | I91: https://www.google.co.jp/maps/@35.3705737,133.7478993,3a,75y,343.28h,84.35t/data=!3m6!1e1!3m4!1sJpZhYKFkM_n_u3w4pBVcjQ!2e0!7i13312!8i6656?hl=ja | J91: 35.370593, 133.747886 | L91: of:=MID([.J91];1;FIND(",";[.J91])-1) -> 35.370593 | M91: of:=MID([.J91];FIND(" ";[.J91])+1;LEN([.J91])) -> 133.747886 | N91: of:=IF([.A90]=[.A91];[.N90];[.N90]+1) -> 42 | O91: of:=IF([.A91]=[.D91];"";IF([.D91]="";"";"あり")) -> 
A92: 大鳥居 | B92: 下り | E92: なし | F92: なし | G92: なし | H92: 2012-10 | J92: 35.370593, 133.747886 | L92: of:=MID([.J92];1;FIND(",";[.J92])-1) -> 35.370593 | M92: of:=MID([.J92];FIND(" ";[.J92])+1;LEN([.J92])) -> 133.747886 | N92: of:=IF([.A91]=[.A92];[.N91];[.N91]+1) -> 42 | O92: of:=IF([.A92]=[.D92];"";IF([.D92]="";"";"あり")) -> 
A93: 松河原 | B93: 上り | D93: 松河原 | E93: 柱 | F93: あり | G93: あり | H93: 2012-10 | I93: https://www.google.co.jp/maps/@35.3694709,133.7423283,3a,42.1y,54.5h,85.63t/data=!3m6!1e1!3m4!1s7JkDhmcKpgn9ErhmnfcZ2g!2e0!7i13312!8i6656?hl=ja | J93: 35.369517, 133.742414 | L93: of:=MID([.J93];1;FIND(",";[.J93])-1) -> 35.369517 | M93: of:=MID([.J93];FIND(" ";[.J93])+1;LEN([.J93])) -> 133.742414 | N93: of:=IF([.A92]=[.A93];[.N92];[.N92]+1) -> 43 | O93: of:=IF([.A93]=[.D93];"";IF([.D93]="";"";"あり")) -> 
A94: 松河原 | B94: 下り | D94: 松河原 | E94: 柱 | F94: なし | G94: なし | H94: 2012-10 | I94: https://www.google.co.jp/maps/@35.3693655,133.7415427,3a,75y,198.97h,77.97t/data=!3m6!1e1!3m4!1syK0Yew60OLcswg90giMD9A!2e0!7i13312!8i6656?hl=ja | J94: 35.369321, 133.741511 | L94: of:=MID([.J94];1;FIND(",";[.J94])-1) -> 35.369321 | M94: of:=MID([.J94];FIND(" ";[.J94])+1;LEN([.J94])) -> 133.741511 | N94: of:=IF([.A93]=[.A94];[.N93];[.N93]+1) -> 43 | O94: of:=IF([.A94]=[.D94];"";IF([.D94]="";"";"あり")) -> 
A95: 松河原上 | B95: 上り | D95: 松河原上 | E95: 柱 | F95: あり | G95: あり | H95: 2012-10 | I95: https://www.google.co.jp/maps/@35.3689636,133.7376727,3a,52y,322.74h,82.42t/data=!3m6!1e1!3m4!1sPomiFiCqUAV19WYdn86npA!2e0!7i13312!8i6656?hl=ja | J95: 35.368997, 133.737586 | L95: of:=MID([.J95];1;FIND(",";[.J95])-1) -> 35.368997 | M95: of:=MID([.J95];FIND(" ";[.J95])+1;LEN([.J95])) -> 133.737586 | N95: of:=IF([.A94]=[.A95];[.N94];[.N94]+1) -> 44 | O95: of:=IF([.A95]=[.D95];"";IF([.D95]="";"";"あり")) -> 
A96: 松河原上 | B96: 下り | D96: 松河原上 | E96: 柱 | F96: なし | G96: なし | H96: 2012-10 | I96: https://www.google.co.jp/maps/@35.3688375,133.7366155,3a,75y,194.22h,77.61t/data=!3m6!1e1!3m4!1spF7vESniNOliGCCkItZ27g!2e0!7i13312!8i6656?hl=ja | J96: 35.368793, 133.736614 | L96: of:=MID([.J96];1;FIND(",";[.J96])-1) -> 35.368793 | M96: of:=MID([.J96];FIND(" ";[.J96])+1;LEN([.J96])) -> 133.736614 | N96: of:=IF([.A95]=[.A96];[.N95];[.N95]+1) -> 44 | O96: of:=IF([.A96]=[.D96];"";IF([.D96]="";"";"あり")) -> 
A97: 泰久寺入口 | B97: 上り | D97: 泰久寺入口 | E97: 柱 | F97: なし | G97: なし | H97: 2012-10 | I97: https://www.google.co.jp/maps/@35.3685276,133.7342292,3a,49.5y,16.51h,82.56t/data=!3m6!1e1!3m4!1sQBG9SDB5cbmikw8NKViRiA!2e0!7i13312!8i6656?hl=ja | J97: 35.368567, 133.734241 | L97: of:=MID([.J97];1;FIND(",";[.J97])-1) -> 35.368567 | M97: of:=MID([.J97];FIND(" ";[.J97])+1;LEN([.J97])) -> 133.734241 | N97: of:=IF([.A96]=[.A97];[.N96];[.N96]+1) -> 45 | O97: of:=IF([.A97]=[.D97];"";IF([.D97]="";"";"あり")) -> 
A98: 泰久寺入口 | B98: 下り | E98: なし | F98: なし | G98: なし | H98: 2012-10 | J98: 35.368567, 133.734241 | L98: of:=MID([.J98];1;FIND(",";[.J98])-1) -> 35.368567 | M98: of:=MID([.J98];FIND(" ";[.J98])+1;LEN([.J98])) -> 133.734241 | N98: of:=IF([.A97]=[.A98];[.N97];[.N97]+1) -> 45 | O98: of:=IF([.A98]=[.D98];"";IF([.D98]="";"";"あり")) -> 
A99: 泰久寺 | B99: 上り | D99: 泰久寺 | E99: 柱 | F99: あり | G99: あり | H99: 2012-10 | I99: https://www.google.co.jp/maps/@35.3680817,133.7304256,3a,48.6y,38.37h,84.01t/data=!3m6!1e1!3m4!1sJH83TIrm2IdyNeG1g7dQBw!2e0!7i13312!8i6656?hl=ja | J99: 35.368167, 133.730494 | L99: of:=MID([.J99];1;FIND(",";[.J99])-1) -> 35.368167 | M99: of:=MID([.J99];FIND(" ";[.J99])+1;LEN([.J99])) -> 133.730494 | N99: of:=IF([.A98]=[.A99];[.N98];[.N98]+1) -> 46 | O99: of:=IF([.A99]=[.D99];"";IF([.D99]="";"";"あり")) -> 
A100: 泰久寺 | B100: 下り | E100: なし | F100: なし | G100: なし | H100: 2012-10 | J100: 35.368167, 133.730494 | L100: of:=MID([.J100];1;FIND(",";[.J100])-1) -> 35.368167 | M100: of:=MID([.J100];FIND(" ";[.J100])+1;LEN([.J100])) -> 133.730494 | N100: of:=IF([.A99]=[.A100];[.N99];[.N99]+1) -> 46 | O100: of:=IF([.A100]=[.D100];"";IF([.D100]="";"";"あり")) -> 
A101: 崎山入口 | B101: 上り | D101: 崎山入口 | E101: 柱 | F101: なし | G101: なし | H101: 2012-10 | I101: https://www.google.co.jp/maps/@35.3613013,133.7163667,3a,46.5y,278.26h,80.45t/data=!3m6!1e1!3m4!1sc6s2icjbTFMGNczWrGH8nQ!2e0!7i13312!8i6656?hl=ja | J101: 35.361334, 133.716298 | L101: of:=MID([.J101];1;FIND(",";[.J101])-1) -> 35.361334 | M101: of:=MID([.J101];FIND(" ";[.J101])+1;LEN([.J101])) -> 133.716298 | N101: of:=IF([.A100]=[.A101];[.N100];[.N100]+1) -> 47 | O101: of:=IF([.A101]=[.D101];"";IF([.D101]="";"";"あり")) -> 
A102: 崎山入口 | B102: 下り | E102: 柱 | F102: なし | G102: なし | H102: 2012-10 | I102: https://www.google.co.jp/maps/@35.3612202,133.7163082,3a,75y,159.15h,85.6t/data=!3m6!1e1!3m4!1saUoE3dwuZFYAl5ArM0iXBA!2e0!7i13312!8i6656?hl=ja | J102: 35.361151, 133.716309 | L102: of:=MID([.J102];1;FIND(",";[.J102])-1) -> 35.361151 | M102: of:=MID([.J102];FIND(" ";[.J102])+1;LEN([.J102])) -> 133.716309 | N102: of:=IF([.A101]=[.A102];[.N101];[.N101]+1) -> 47 | O102: of:=IF([.A102]=[.D102];"";IF([.D102]="";"";"あり")) -> 
A103: 今西 | B103: 上り | D103: 今西 | E103: 柱 | F103: あり | G103: あり | H103: 2012-10 | I103: https://www.google.co.jp/maps/@35.3604548,133.7139595,3a,72.5y,25.15h,85.46t/data=!3m6!1e1!3m4!1sTtLDqflGGOF5PVfMxvG6RQ!2e0!7i13312!8i6656?hl=ja | J103: 35.360510, 133.714001 | L103: of:=MID([.J103];1;FIND(",";[.J103])-1) -> 35.360510 | M103: of:=MID([.J103];FIND(" ";[.J103])+1;LEN([.J103])) -> 133.714001 | N103: of:=IF([.A102]=[.A103];[.N102];[.N102]+1) -> 48 | O103: of:=IF([.A103]=[.D103];"";IF([.D103]="";"";"あり")) -> 
A104: 今西 | B104: 下り | E104: なし | F104: なし | G104: なし | H104: 2012-10 | J104: 35.360510, 133.714001 | L104: of:=MID([.J104];1;FIND(",";[.J104])-1) -> 35.360510 | M104: of:=MID([.J104];FIND(" ";[.J104])+1;LEN([.J104])) -> 133.714001 | N104: of:=IF([.A103]=[.A104];[.N103];[.N103]+1) -> 48 | O104: of:=IF([.A104]=[.D104];"";IF([.D104]="";"";"あり")) -> 
A105: 今西上 | B105: 上り | E105: なし | F105: なし | G105: なし | H105: 2012-10 | J105: 35.360680, 133.711454 | L105: of:=MID([.J105];1;FIND(",";[.J105])-1) -> 35.360680 | M105: of:=MID([.J105];FIND(" ";[.J105])+1;LEN([.J105])) -> 133.711454 | N105: of:=IF([.A104]=[.A105];[.N104];[.N104]+1) -> 49 | O105: of:=IF([.A105]=[.D105];"";IF([.D105]="";"";"あり")) -> 
A106: 今西上 | B106: 下り | D106: 今西上 | E106: 柱 | F106: なし | G106: なし | H106: 2012-10 | I106: https://www.google.co.jp/maps/@35.3607007,133.7114239,3a,60y,159.97h,82.48t/data=!3m6!1e1!3m4!1sD5uV8BCBXrpP6opELzSO5Q!2e0!7i13312!8i6656?hl=ja | J106: 35.360680, 133.711454 | L106: of:=MID([.J106];1;FIND(",";[.J106])-1) -> 35.360680 | M106: of:=MID([.J106];FIND(" ";[.J106])+1;LEN([.J106])) -> 133.711454 | N106: of:=IF([.A105]=[.A106];[.N105];[.N105]+1) -> 49 | O106: of:=IF([.A106]=[.D106];"";IF([.D106]="";"";"あり")) -> 
A107: 下堀 | B107: 上り | D107: 下堀 | E107: 柱 | F107: あり | G107: あり | H107: 2012-09 | I107: https://www.google.co.jp/maps/@35.3612282,133.706043,3a,75y,65.43h,76.36t/data=!3m6!1e1!3m4!1sjCGNgxnX7CkRmzK_OGdiVQ!2e0!7i13312!8i6656?hl=ja | J107: 35.361270, 133.706105 | L107: of:=MID([.J107];1;FIND(",";[.J107])-1) -> 35.361270 | M107: of:=MID([.J107];FIND(" ";[.J107])+1;LEN([.J107])) -> 133.706105 | N107: of:=IF([.A106]=[.A107];[.N106];[.N106]+1) -> 50 | O107: of:=IF([.A107]=[.D107];"";IF([.D107]="";"";"あり")) -> 
A108: 下堀 | B108: 下り | E108: なし | F108: なし | G108: なし | H108: 2012-09 | J108: 35.361270, 133.706105 | L108: of:=MID([.J108];1;FIND(",";[.J108])-1) -> 35.361270 | M108: of:=MID([.J108];FIND(" ";[.J108])+1;LEN([.J108])) -> 133.706105 | N108: of:=IF([.A107]=[.A108];[.N107];[.N107]+1) -> 50 | O108: of:=IF([.A108]=[.D108];"";IF([.D108]="";"";"あり")) -> 
A109: 堀集会場前 | B109: 上り | D109: 堀集会場前 | E109: 柱 | F109: あり | G109: あり | H109: 2012-10 | I109: https://www.google.co.jp/maps/@35.361366,133.7013899,3a,37.9y,28.14h,84.82t/data=!3m6!1e1!3m4!1sv-8E8fkWKiHKuQweCMBWjQ!2e0!7i13312!8i6656?hl=ja | J109: 35.361430, 133.701430 | L109: of:=MID([.J109];1;FIND(",";[.J109])-1) -> 35.361430 | M109: of:=MID([.J109];FIND(" ";[.J109])+1;LEN([.J109])) -> 133.701430 | N109: of:=IF([.A108]=[.A109];[.N108];[.N108]+1) -> 51 | O109: of:=IF([.A109]=[.D109];"";IF([.D109]="";"";"あり")) -> 
A110: 堀集会場前 | B110: 下り | D110: 堀集会場前 | E110: 柱 | F110: なし | G110: なし | H110: 2012-10 | I110: https://www.google.co.jp/maps/@35.3613712,133.7019866,3a,45.6y,203.3h,87.44t/data=!3m6!1e1!3m4!1s9eHv91iDMvb24RT0U2wVuA!2e0!7i13312!8i6656?hl=ja | J110: 35.361296, 133.701958 | L110: of:=MID([.J110];1;FIND(",";[.J110])-1) -> 35.361296 | M110: of:=MID([.J110];FIND(" ";[.J110])+1;LEN([.J110])) -> 133.701958 | N110: of:=IF([.A109]=[.A110];[.N109];[.N109]+1) -> 51 | O110: of:=IF([.A110]=[.D110];"";IF([.D110]="";"";"あり")) -> 
A111: 山守小学校前 | B111: 上り | D111: 山守小学校前 | E111: 柱 | F111: あり | G111: あり | H111: 2012-10 | I111: https://www.google.co.jp/maps/@35.3623607,133.6972387,3a,22.2y,8.15h,87.53t/data=!3m6!1e1!3m4!1s6WIlw677rjChrjzErxqsNg!2e0!7i13312!8i6656?hl=ja | J111: 35.362487, 133.697241 | L111: of:=MID([.J111];1;FIND(",";[.J111])-1) -> 35.362487 | M111: of:=MID([.J111];FIND(" ";[.J111])+1;LEN([.J111])) -> 133.697241 | N111: of:=IF([.A110]=[.A111];[.N110];[.N110]+1) -> 52 | O111: of:=IF([.A111]=[.D111];"";IF([.D111]="";"";"あり")) -> 
A112: 山守小学校前 | B112: 下り | D112: 山守小学校前 | E112: 柱 | F112: なし | G112: なし | H112: 2012-10 | I112: https://www.google.co.jp/maps/@35.362757,133.696737,3a,48.1y,204.41h,87.99t/data=!3m6!1e1!3m4!1s5AlCEXahEwgcMO58xiWxNA!2e0!7i13312!8i6656?hl=ja | J112: 35.362696, 133.696720 | L112: of:=MID([.J112];1;FIND(",";[.J112])-1) -> 35.362696 | M112: of:=MID([.J112];FIND(" ";[.J112])+1;LEN([.J112])) -> 133.696720 | N112: of:=IF([.A111]=[.A112];[.N111];[.N111]+1) -> 52 | O112: of:=IF([.A112]=[.D112];"";IF([.D112]="";"";"あり")) -> 
A113: 明高東口 | B113: 上り | D113: 明高東口 | E113: 柱 | F113: あり | G113: あり | H113: 2012-09 | I113: https://www.google.co.jp/maps/@35.3671674,133.6866579,3a,60y,32.61h,77.8t/data=!3m6!1e1!3m4!1sKZva82JWLYeQuDlCCZuj3A!2e0!7i13312!8i6656?hl=ja | J113: 35.367177, 133.686686 | L113: of:=MID([.J113];1;FIND(",";[.J113])-1) -> 35.367177 | M113: of:=MID([.J113];FIND(" ";[.J113])+1;LEN([.J113])) -> 133.686686 | N113: of:=IF([.A112]=[.A113];[.N112];[.N112]+1) -> 53 | O113: of:=IF([.A113]=[.D113];"";IF([.D113]="";"";"あり")) -> 
A114: 明高東口 | B114: 下り | D114: 明高東口 | E114: 柱 | F114: なし | G114: なし | H114: 2012-09 | I114: https://www.google.co.jp/maps/@35.3672469,133.6861618,3a,75y,152.97h,74.41t/data=!3m6!1e1!3m4!1sr3o7ha2L-7omhW1eeIRlPw!2e0!7i13312!8i6656?hl=ja | J114: 35.367194, 133.686186 | L114: of:=MID([.J114];1;FIND(",";[.J114])-1) -> 35.367194 | M114: of:=MID([.J114];FIND(" ";[.J114])+1;LEN([.J114])) -> 133.686186 | N114: of:=IF([.A113]=[.A114];[.N113];[.N113]+1) -> 53 | O114: of:=IF([.A114]=[.D114];"";IF([.D114]="";"";"あり")) -> 
A115: 明高入口 | B115: 上り | D115: 明高入口 | E115: 柱 | F115: あり | G115: あり | H115: 2012-09 | I115: https://www.google.co.jp/maps/@35.3689351,133.6807653,3a,60y,39.2h,79.98t/data=!3m6!1e1!3m4!1sD6cpLbcRo4sFPv2WhoY3Bg!2e0!7i13312!8i6656?hl=ja | J115: 35.368948, 133.680808 | L115: of:=MID([.J115];1;FIND(",";[.J115])-1) -> 35.368948 | M115: of:=MID([.J115];FIND(" ";[.J115])+1;LEN([.J115])) -> 133.680808 | N115: of:=IF([.A114]=[.A115];[.N114];[.N114]+1) -> 54 | O115: of:=IF([.A115]=[.D115];"";IF([.D115]="";"";"あり")) -> 
A116: 明高入口 | B116: 下り | E116: なし | F116: なし | G116: なし | H116: 2012-09 | J116: 35.368948, 133.680808 | L116: of:=MID([.J116];1;FIND(",";[.J116])-1) -> 35.368948 | M116: of:=MID([.J116];FIND(" ";[.J116])+1;LEN([.J116])) -> 133.680808 | N116: of:=IF([.A115]=[.A116];[.N115];[.N115]+1) -> 54 | O116: of:=IF([.A116]=[.D116];"";IF([.D116]="";"";"あり")) -> 
A117: 明高 | B117: 上り | D117: 明高 | E117: 柱 | F117: なし | G117: なし | H117: 2012-09 | I117: https://www.google.co.jp/maps/@35.3728271,133.6730685,3a,60y,94.47h,83.63t/data=!3m6!1e1!3m4!1sE4VC_EGSC-RDzISS6q9Dcg!2e0!7i13312!8i6656?hl=ja | J117: 35.372820, 133.673136 | L117: of:=MID([.J117];1;FIND(",";[.J117])-1) -> 35.372820 | M117: of:=MID([.J117];FIND(" ";[.J117])+1;LEN([.J117])) -> 133.673136 | N117: of:=IF([.A116]=[.A117];[.N116];[.N116]+1) -> 55 | O117: of:=IF([.A117]=[.D117];"";IF([.D117]="";"";"あり")) -> 
A118: 明高 | B118: 下り | E118: なし | F118: なし | G118: なし | H118: 2012-09 | J118: 35.372820, 133.673136 | L118: of:=MID([.J118];1;FIND(",";[.J118])-1) -> 35.372820 | M118: of:=MID([.J118];FIND(" ";[.J118])+1;LEN([.J118])) -> 133.673136 | N118: of:=IF([.A117]=[.A118];[.N117];[.N117]+1) -> 55 | O118: of:=IF([.A118]=[.D118];"";IF([.D118]="";"";"あり")) -> 
A119: 大坪 | B119: 上り | D119: 大坪 | E119: 柱 | F119: あり | G119: あり | H119: 2012-09 | I119: https://www.google.co.jp/maps/@35.3627546,133.7540736,3a,90y,303.46h,91.7t/data=!3m6!1e1!3m4!1sDEFD7SJ5rgnUfRqqynkbaA!2e0!7i13312!8i6656?hl=ja | J119: 35.362788, 133.753926 | L119: of:=MID([.J119];1;FIND(",";[.J119])-1) -> 35.362788 | M119: of:=MID([.J119];FIND(" ";[.J119])+1;LEN([.J119])) -> 133.753926 | N119: of:=IF([.A118]=[.A119];[.N118];[.N118]+1) -> 56 | O119: of:=IF([.A119]=[.D119];"";IF([.D119]="";"";"あり")) -> 
A120: 大坪 | B120: 下り | D120: 大坪 | E120: 柱 | F120: なし | G120: なし | H120: 2012-09 | I120: https://www.google.co.jp/maps/@35.3638273,133.7558022,3a,75y,155.29h,84.15t/data=!3m6!1e1!3m4!1sXlu1xwdSgG5wcAFOHDcjsg!2e0!7i13312!8i6656?hl=ja | J120: 35.363722, 133.755822 | L120: of:=MID([.J120];1;FIND(",";[.J120])-1) -> 35.363722 | M120: of:=MID([.J120];FIND(" ";[.J120])+1;LEN([.J120])) -> 133.755822 | N120: of:=IF([.A119]=[.A120];[.N119];[.N119]+1) -> 56 | O120: of:=IF([.A120]=[.D120];"";IF([.D120]="";"";"あり")) -> 
A121: 郡家 | B121: 上り | D121: 郡家 | E121: 柱 | F121: あり | G121: あり | H121: 2012-10 | I121: https://www.google.co.jp/maps/@35.3578684,133.7490748,3a,88.5y,320.6h,91.22t/data=!3m6!1e1!3m4!1s4-5IEP20khj4gNTqHVwmhQ!2e0!7i13312!8i6656?hl=ja | J121: 35.357885, 133.749005 | L121: of:=MID([.J121];1;FIND(",";[.J121])-1) -> 35.357885 | M121: of:=MID([.J121];FIND(" ";[.J121])+1;LEN([.J121])) -> 133.749005 | N121: of:=IF([.A120]=[.A121];[.N120];[.N120]+1) -> 57 | O121: of:=IF([.A121]=[.D121];"";IF([.D121]="";"";"あり")) -> 
A122: 郡家 | B122: 下り | D122: 郡家 | E122: 柱 | F122: なし | G122: なし | H122: 2012-10 | I122: https://www.google.co.jp/maps/@35.3586587,133.7496086,3a,60y,108.95h,86.59t/data=!3m6!1e1!3m4!1s4p7De7MVDZUpDP5J7kJ8IA!2e0!7i13312!8i6656?hl=ja | J122: 35.358624, 133.749733 | L122: of:=MID([.J122];1;FIND(",";[.J122])-1) -> 35.358624 | M122: of:=MID([.J122];FIND(" ";[.J122])+1;LEN([.J122])) -> 133.749733 | N122: of:=IF([.A121]=[.A122];[.N121];[.N121]+1) -> 57 | O122: of:=IF([.A122]=[.D122];"";IF([.D122]="";"";"あり")) -> 
A123: 曽谷入口 | B123: 上り | D123: 曽谷 | E123: 柱 | F123: あり | G123: あり | H123: 2012-09 | I123: https://www.google.co.jp/maps/@35.3535642,133.746803,3a,40.7y,312.97h,89.15t/data=!3m6!1e1!3m4!1sUuYJhcJCcweEjWPp8Qii7w!2e0!7i13312!8i6656?hl=ja | J123: 35.353585, 133.746744 | L123: of:=MID([.J123];1;FIND(",";[.J123])-1) -> 35.353585 | M123: of:=MID([.J123];FIND(" ";[.J123])+1;LEN([.J123])) -> 133.746744 | N123: of:=IF([.A122]=[.A123];[.N122];[.N122]+1) -> 58 | O123: of:=IF([.A123]=[.D123];"";IF([.D123]="";"";"あり")) -> あり
A124: 曽谷入口 | B124: 下り | D124: 曽谷入口 | E124: 柱 | F124: なし | G124: なし | H124: 2012-09 | I124: https://www.google.co.jp/maps/@35.3543854,133.7470792,3a,90y,71.47h,92t/data=!3m6!1e1!3m4!1sBjT3pHUfxPZocDU3Xy8jEQ!2e0!7i13312!8i6656?hl=ja | J124: 35.354400, 133.747226 | L124: of:=MID([.J124];1;FIND(",";[.J124])-1) -> 35.354400 | M124: of:=MID([.J124];FIND(" ";[.J124])+1;LEN([.J124])) -> 133.747226 | N124: of:=IF([.A123]=[.A124];[.N123];[.N123]+1) -> 58 | O124: of:=IF([.A124]=[.D124];"";IF([.D124]="";"";"あり")) -> 
A125: 田中 | B125: 上り | E125: 柱 | F125: あり | G125: あり | H125: 2012-09 | I125: https://www.google.co.jp/maps/@35.3478956,133.7457634,3a,75y,238.91h,79.25t/data=!3m6!1e1!3m4!1swERHHc-ViqdsbmaunAyByQ!2e0!7i13312!8i6656?hl=ja | J125: 35.347846, 133.745703 | L125: of:=MID([.J125];1;FIND(",";[.J125])-1) -> 35.347846 | M125: of:=MID([.J125];FIND(" ";[.J125])+1;LEN([.J125])) -> 133.745703 | N125: of:=IF([.A124]=[.A125];[.N124];[.N124]+1) -> 59 | O125: of:=IF([.A125]=[.D125];"";IF([.D125]="";"";"あり")) -> 
A126: 田中 | B126: 下り | D126: 田中 | E126: 柱 | F126: なし | G126: なし | H126: 2012-09 | I126: https://www.google.co.jp/maps/@35.3481878,133.7458154,3a,46.9y,100.33h,85.34t/data=!3m6!1e1!3m4!1sZzhKt_QegX6jg-FghDCySw!2e0!7i13312!8i6656?hl=ja | J126: 35.348143, 133.745937 | L126: of:=MID([.J126];1;FIND(",";[.J126])-1) -> 35.348143 | M126: of:=MID([.J126];FIND(" ";[.J126])+1;LEN([.J126])) -> 133.745937 | N126: of:=IF([.A125]=[.A126];[.N125];[.N125]+1) -> 59 | O126: of:=IF([.A126]=[.D126];"";IF([.D126]="";"";"あり")) -> 
A127: 山口 | B127: 上り | D127: 山口 | E127: 柱 | F127: あり | G127: あり | H127: 2012-09 | I127: https://www.google.co.jp/maps/@35.3436942,133.7430283,3a,60y,252.51h,85.92t/data=!3m6!1e1!3m4!1s6H08m3bdAbfR2vxcc2KBWA!2e0!7i13312!8i6656?hl=ja | J127: 35.343673, 133.742974 | L127: of:=MID([.J127];1;FIND(",";[.J127])-1) -> 35.343673 | M127: of:=MID([.J127];FIND(" ";[.J127])+1;LEN([.J127])) -> 133.742974 | N127: of:=IF([.A126]=[.A127];[.N126];[.N126]+1) -> 60 | O127: of:=IF([.A127]=[.D127];"";IF([.D127]="";"";"あり")) -> 
A128: 山口 | B128: 下り | D128: 山口 | E128: 柱 | F128: なし | G128: なし | H128: 2012-09 | I128: https://www.google.co.jp/maps/@35.3438433,133.743928,3a,46.7y,141.04h,87.59t/data=!3m6!1e1!3m4!1srpksC2L6cwV2s2TJ1BICEg!2e0!7i13312!8i6656?hl=ja | J128: 35.343807, 133.743981 | L128: of:=MID([.J128];1;FIND(",";[.J128])-1) -> 35.343807 | M128: of:=MID([.J128];FIND(" ";[.J128])+1;LEN([.J128])) -> 133.743981 | N128: of:=IF([.A127]=[.A128];[.N127];[.N127]+1) -> 60 | O128: of:=IF([.A128]=[.D128];"";IF([.D128]="";"";"あり")) -> 
A129: 山口上 | B129: 上り | D129: 山口上 | E129: 柱 | F129: あり | G129: あり | H129: 2012-09 | I129: https://www.google.co.jp/maps/@35.3409985,133.7412058,3a,42.8y,45.05h,91.1t/data=!3m6!1e1!3m4!1szIAMfFLtN8RwLmtzIPA87g!2e0!7i13312!8i6656?hl=ja | J129: 35.341160, 133.741355 | L129: of:=MID([.J129];1;FIND(",";[.J129])-1) -> 35.341160 | M129: of:=MID([.J129];FIND(" ";[.J129])+1;LEN([.J129])) -> 133.741355 | N129: of:=IF([.A128]=[.A129];[.N128];[.N128]+1) -> 61 | O129: of:=IF([.A129]=[.D129];"";IF([.D129]="";"";"あり")) -> 
A130: 山口上 | B130: 下り | E130: なし | F130: なし | G130: なし | H130: 2012-09 | J130: 35.341160, 133.741355 | L130: of:=MID([.J130];1;FIND(",";[.J130])-1) -> 35.341160 | M130: of:=MID([.J130];FIND(" ";[.J130])+1;LEN([.J130])) -> 133.741355 | N130: of:=IF([.A129]=[.A130];[.N129];[.N129]+1) -> 61 | O130: of:=IF([.A130]=[.D130];"";IF([.D130]="";"";"あり")) -> 
A131: 矢櫃 | B131: 上り | D131: 矢櫃 | E131: 柱 | F131: なし | G131: なし | H131: 2012-09 | I131: https://www.google.co.jp/maps/@35.3339871,133.7349779,3a,75y,48.61h,78.22t/data=!3m6!1e1!3m4!1sEtW_aJYr4nLlV8-MATBgag!2e0!7i13312!8i6656?hl=ja | J131: 35.334042, 133.735047 | L131: of:=MID([.J131];1;FIND(",";[.J131])-1) -> 35.334042 | M131: of:=MID([.J131];FIND(" ";[.J131])+1;LEN([.J131])) -> 133.735047 | N131: of:=IF([.A130]=[.A131];[.N130];[.N130]+1) -> 62 | O131: of:=IF([.A131]=[.D131];"";IF([.D131]="";"";"あり")) -> 
A132: 矢櫃 | B132: 下り | E132: なし | F132: なし | G132: なし | H132: 2012-09 | J132: 35.334042, 133.735047 | L132: of:=MID([.J132];1;FIND(",";[.J132])-1) -> 35.334042 | M132: of:=MID([.J132];FIND(" ";[.J132])+1;LEN([.J132])) -> 133.735047 | N132: of:=IF([.A131]=[.A132];[.N131];[.N131]+1) -> 62 | O132: of:=IF([.A132]=[.D132];"";IF([.D132]="";"";"あり")) -> 
A133: 大河原 | B133: 上り | E133: なし | F133: なし | G133: なし | H133: 2012-09 | J133: 35.332901, 133.732611 | L133: of:=MID([.J133];1;FIND(",";[.J133])-1) -> 35.332901 | M133: of:=MID([.J133];FIND(" ";[.J133])+1;LEN([.J133])) -> 133.732611 | N133: of:=IF([.A132]=[.A133];[.N132];[.N132]+1) -> 63 | O133: of:=IF([.A133]=[.D133];"";IF([.D133]="";"";"あり")) -> 
A134: 大河原 | B134: 下り | D134: 大河原 | E134: 柱 | F134: なし | G134: なし | H134: 2012-09 | I134: https://www.google.co.jp/maps/@35.3329021,133.7325329,3a,90y,96.63h,86.04t/data=!3m6!1e1!3m4!1sakX0PyloZXa6q7wUh9g6lw!2e0!7i13312!8i6656?hl=ja | J134: 35.332901, 133.732611 | L134: of:=MID([.J134];1;FIND(",";[.J134])-1) -> 35.332901 | M134: of:=MID([.J134];FIND(" ";[.J134])+1;LEN([.J134])) -> 133.732611 | N134: of:=IF([.A133]=[.A134];[.N133];[.N133]+1) -> 63 | O134: of:=IF([.A134]=[.D134];"";IF([.D134]="";"";"あり")) -> 
A135: 住吉町 | B135: 上り日本交通 | E135: 板 | F135: なし | G135: なし | H135: 2012-09 | I135: https://www.google.co.jp/maps/@35.4313306,133.8319807,3a,75y,311.11h,77.44t/data=!3m6!1e1!3m4!1stgzrYiHAI30SulbHpWSccQ!2e0!7i13312!8i6656 | J135: 35.431353, 133.831915 | L135: of:=MID([.J135];1;FIND(",";[.J135])-1) -> 35.431353 | M135: of:=MID([.J135];FIND(" ";[.J135])+1;LEN([.J135])) -> 133.831915 | N135: of:=IF([.A134]=[.A135];[.N134];[.N134]+1) -> 64 | O135: of:=IF([.A135]=[.D135];"";IF([.D135]="";"";"あり")) -> 
A136: 住吉町 | B136: 下り日本交通 | D136: 住吉町 | E136: 板 | F136: なし | G136: なし | H136: 2012-09 | I136: https://www.google.co.jp/maps/@35.4314542,133.832137,3a,75y,95.82h,85.43t/data=!3m6!1e1!3m4!1sWAPwZjpzsSEwBEVLlaAjkQ!2e0!7i13312!8i6656 | J136: 35.431455, 133.832197 | L136: of:=MID([.J136];1;FIND(",";[.J136])-1) -> 35.431455 | M136: of:=MID([.J136];FIND(" ";[.J136])+1;LEN([.J136])) -> 133.832197 | N136: of:=IF([.A135]=[.A136];[.N135];[.N135]+1) -> 64 | O136: of:=IF([.A136]=[.D136];"";IF([.D136]="";"";"あり")) -> 
A137: 住吉町 | B137: 上り日ノ丸自動車 | D137: 住吉町 | E137: 板 | F137: なし | G137: なし | H137: 2012-09 | I137: https://www.google.co.jp/maps/@35.4317965,133.8332562,3a,46.6y,316.49h,81.15t/data=!3m7!1e1!3m5!1sfx-fuW5jMrqcMt1k0gbEcA!2e0!6s%2F%2Fgeo2.ggpht.com%2Fcbk%3Fpanoid%3Dfx-fuW5jMrqcMt1k0gbEcA%26output%3Dthumbnail%26cb_client%3Dmaps_sv.tactile.gps%26thumb%3D2% | J137: 35.431844, 133.833225 | L137: of:=MID([.J137];1;FIND(",";[.J137])-1) -> 35.431844 | M137: of:=MID([.J137];FIND(" ";[.J137])+1;LEN([.J137])) -> 133.833225 | N137: of:=IF([.A136]=[.A137];[.N136];[.N136]+1) -> 64 | O137: of:=IF([.A137]=[.D137];"";IF([.D137]="";"";"あり")) -> 
A138: 住吉町 | B138: 下り日ノ丸自動車 | D138: 住吉町 | E138: 板 | F138: なし | G138: なし | H138: 2012-09 | I138: https://www.google.co.jp/maps/@35.4317965,133.8332562,3a,46.6y,111.02h,86.11t/data=!3m7!1e1!3m5!1sfx-fuW5jMrqcMt1k0gbEcA!2e0!6s%2F%2Fgeo2.ggpht.com%2Fcbk%3Fpanoid%3Dfx-fuW5jMrqcMt1k0gbEcA%26output%3Dthumbnail%26cb_client%3Dmaps_sv.tactile.gps%26thumb%3D2% | J138: 35.431781, 133.833319 | L138: of:=MID([.J138];1;FIND(",";[.J138])-1) -> 35.431781 | M138: of:=MID([.J138];FIND(" ";[.J138])+1;LEN([.J138])) -> 133.833319 | N138: of:=IF([.A137]=[.A138];[.N137];[.N137]+1) -> 64 | O138: of:=IF([.A138]=[.D138];"";IF([.D138]="";"";"あり")) -> 
A139: 総合運動公園入口 | B139: 上り | D139: 総合運動公園入口 | E139: 板 | F139: なし | G139: なし | H139: 2015-04 | I139: https://www.google.co.jp/maps/@35.4306379,133.8292113,3a,60y,324.14h,86.62t/data=!3m6!1e1!3m4!1seKfM1b4hCSI9AkQ0uVIZLQ!2e0!7i13312!8i6656 | J139: 35.430659, 133.829191 | L139: of:=MID([.J139];1;FIND(",";[.J139])-1) -> 35.430659 | M139: of:=MID([.J139];FIND(" ";[.J139])+1;LEN([.J139])) -> 133.829191 | N139: of:=IF([.A138]=[.A139];[.N138];[.N138]+1) -> 65 | O139: of:=IF([.A139]=[.D139];"";IF([.D139]="";"";"あり")) -> 
A140: 総合運動公園入口 | B140: 下り | D140: 総合運動公園入口 | E140: 板 | F140: なし | G140: なし | H140: 2015-04 | I140: https://www.google.co.jp/maps/@35.4306209,133.8287247,3a,46.8y,131.14h,85.97t/data=!3m6!1e1!3m4!1sgADERUy51OtbtnSedQ0Pyg!2e0!7i13312!8i6656 | J140: 35.430557, 133.828806 | L140: of:=MID([.J140];1;FIND(",";[.J140])-1) -> 35.430557 | M140: of:=MID([.J140];FIND(" ";[.J140])+1;LEN([.J140])) -> 133.828806 | N140: of:=IF([.A139]=[.A140];[.N139];[.N139]+1) -> 65 | O140: of:=IF([.A140]=[.D140];"";IF([.D140]="";"";"あり")) -> 
A141: 市役所・打吹公園入口 | B141: 上り | D141: 市役所打吹公園入口 | E141: 板 | F141: あり | G141: なし | H141: 2015-04 | I141: https://www.google.co.jp/maps/@35.4308663,133.8255451,3a,58.3y,328.06h,86.21t/data=!3m6!1e1!3m4!1sxh_OVjB_mJzmBnMzwmCRiQ!2e0!7i13312!8i6656 | J141: 35.430895, 133.825525 | L141: of:=MID([.J141];1;FIND(",";[.J141])-1) -> 35.430895 | M141: of:=MID([.J141];FIND(" ";[.J141])+1;LEN([.J141])) -> 133.825525 | N141: of:=IF([.A140]=[.A141];[.N140];[.N140]+1) -> 66 | O141: of:=IF([.A141]=[.D141];"";IF([.D141]="";"";"あり")) -> あり
A142: 市役所・打吹公園入口 | B142: 下り | D142: 市役所打吹公園入口 | E142: 板 | F142: あり | G142: なし | H142: 2015-04 | I142: https://www.google.co.jp/maps/@35.4308663,133.8255451,3a,48.3y,147.89h,85.69t/data=!3m6!1e1!3m4!1sxh_OVjB_mJzmBnMzwmCRiQ!2e0!7i13312!8i6656 | J142: 35.430781, 133.825630 | L142: of:=MID([.J142];1;FIND(",";[.J142])-1) -> 35.430781 | M142: of:=MID([.J142];FIND(" ";[.J142])+1;LEN([.J142])) -> 133.825630 | N142: of:=IF([.A141]=[.A142];[.N141];[.N141]+1) -> 66 | O142: of:=IF([.A142]=[.D142];"";IF([.D142]="";"";"あり")) -> あり
A143: 白壁土蔵群前 | B143: 上り | D143: 白壁土蔵群前 | E143: 板 | F143: なし | G143: なし | H143: 2015-04 | I143: https://www.google.co.jp/maps/@35.431071,133.823055,3a,58.4y,50.4h,87.39t/data=!3m6!1e1!3m4!1snPX-Cuv-FFiTVXYmN-nWWg!2e0!7i13312!8i6656 | J143: 35.431087, 133.823115 | L143: of:=MID([.J143];1;FIND(",";[.J143])-1) -> 35.431087 | M143: of:=MID([.J143];FIND(" ";[.J143])+1;LEN([.J143])) -> 133.823115 | N143: of:=IF([.A142]=[.A143];[.N142];[.N142]+1) -> 67 | O143: of:=IF([.A143]=[.D143];"";IF([.D143]="";"";"あり")) -> 
A144: 白壁土蔵群前 | B144: 下り | D144: 白壁土蔵群前 | E144: 板 | F144: なし | G144: なし | H144: 2015-04 | I144: https://www.google.co.jp/maps/@35.4310593,133.8231847,3a,48.5y,163.96h,88.81t/data=!3m6!1e1!3m4!1s56wGpQ47ifj5VgDztR42DA!2e0!7i13312!8i6656 | J144: 35.430985, 133.823223 | L144: of:=MID([.J144];1;FIND(",";[.J144])-1) -> 35.430985 | M144: of:=MID([.J144];FIND(" ";[.J144])+1;LEN([.J144])) -> 133.823223 | N144: of:=IF([.A143]=[.A144];[.N143];[.N143]+1) -> 67 | O144: of:=IF([.A144]=[.D144];"";IF([.D144]="";"";"あり")) -> 
A145: 瀬崎町 | B145: 上り | D145: 瀬崎町 | E145: 板 | F145: あり | G145: あり | H145: 2015-04 | I145: https://www.google.co.jp/maps/@35.4313148,133.8194163,3a,60y,330.34h,86.53t/data=!3m6!1e1!3m4!1s1bcjrVf_WknpluPBtDwg7w!2e0!7i13312!8i6656 | J145: 35.431337, 133.819410 | L145: of:=MID([.J145];1;FIND(",";[.J145])-1) -> 35.431337 | M145: of:=MID([.J145];FIND(" ";[.J145])+1;LEN([.J145])) -> 133.819410 | N145: of:=IF([.A144]=[.A145];[.N144];[.N144]+1) -> 68 | O145: of:=IF([.A145]=[.D145];"";IF([.D145]="";"";"あり")) -> 
A146: 瀬崎町 | B146: 下り | D146: 瀬崎町 | E146: 板 | F146: なし | G146: なし | H146: 2015-04 | I146: https://www.google.co.jp/maps/@35.4313158,133.8197793,3a,46.5y,151.38h,87.41t/data=!3m6!1e1!3m4!1sjo5oOza1hhpKFgerPgXR_g!2e0!7i13312!8i6656 | J146: 35.431244, 133.819968 | L146: of:=MID([.J146];1;FIND(",";[.J146])-1) -> 35.431244 | M146: of:=MID([.J146];FIND(" ";[.J146])+1;LEN([.J146])) -> 133.819968 | N146: of:=IF([.A145]=[.A146];[.N145];[.N145]+1) -> 68 | O146: of:=IF([.A146]=[.D146];"";IF([.D146]="";"";"あり")) -> 
A147: 鍛冶町一丁目 | B147: 上り | D147: 鍛冶町一丁目 | E147: 板 | F147: あり | G147: なし | H147: 2015-04 | I147: https://www.google.co.jp/maps/@35.4298444,133.8155578,3a,72.1y,292.14h,84.13t/data=!3m6!1e1!3m4!1sjbV_BlVkAV61FTK7WOc2SA!2e0!7i13312!8i6656 | J147: 35.429849, 133.815512 | L147: of:=MID([.J147];1;FIND(",";[.J147])-1) -> 35.429849 | M147: of:=MID([.J147];FIND(" ";[.J147])+1;LEN([.J147])) -> 133.815512 | N147: of:=IF([.A146]=[.A147];[.N146];[.N146]+1) -> 69 | O147: of:=IF([.A147]=[.D147];"";IF([.D147]="";"";"あり")) -> 
A148: 鍛冶町一丁目 | B148: 下り | D148: 鍛冶町一丁目 | E148: 板 | F148: あり | G148: なし | H148: 2015-04 | I148: https://www.google.co.jp/maps/@35.4299867,133.8158499,3a,48y,117.88h,87.95t/data=!3m6!1e1!3m4!1sdgybtymVT7l-02l0vkcLYQ!2e0!7i13312!8i6656 | J148: 35.429958, 133.815903 | L148: of:=MID([.J148];1;FIND(",";[.J148])-1) -> 35.429958 | M148: of:=MID([.J148];FIND(" ";[.J148])+1;LEN([.J148])) -> 133.815903 | N148: of:=IF([.A147]=[.A148];[.N147];[.N147]+1) -> 69 | O148: of:=IF([.A148]=[.D148];"";IF([.D148]="";"";"あり")) -> 
A149: 長谷寺西口 | B149: 上り | D149: 長谷寺西口 | E149: 板 | F149: なし | G149: なし | H149: 2015-04 | I149: https://www.google.co.jp/maps/@35.4272297,133.8152959,3a,60y,289.56h,81.62t/data=!3m6!1e1!3m4!1sXfp_5DQrjWkfxjQakNl70A!2e0!7i13312!8i6656 | J149: 35.427240, 133.815266 | L149: of:=MID([.J149];1;FIND(",";[.J149])-1) -> 35.427240 | M149: of:=MID([.J149];FIND(" ";[.J149])+1;LEN([.J149])) -> 133.815266 | N149: of:=IF([.A148]=[.A149];[.N148];[.N148]+1) -> 70 | O149: of:=IF([.A149]=[.D149];"";IF([.D149]="";"";"あり")) -> 
A150: 長谷寺西口 | B150: 下り | D150: 長谷寺西口 | E150: 板 | F150: なし | G150: なし | H150: 2015-04 | I150: https://www.google.co.jp/maps/@35.4272297,133.8152959,3a,60y,95.32h,87.35t/data=!3m6!1e1!3m4!1sXfp_5DQrjWkfxjQakNl70A!2e0!7i13312!8i6656 | J150: 35.427188, 133.815350 | L150: of:=MID([.J150];1;FIND(",";[.J150])-1) -> 35.427188 | M150: of:=MID([.J150];FIND(" ";[.J150])+1;LEN([.J150])) -> 133.815350 | N150: of:=IF([.A149]=[.A150];[.N149];[.N149]+1) -> 70 | O150: of:=IF([.A150]=[.D150];"";IF([.D150]="";"";"あり")) -> 
A151: みどり町 | B151: 上り | D151: みどり町 | E151: 板 | F151: なし | G151: なし | H151: 2015-04 | I151: https://www.google.co.jp/maps/@35.4243384,133.8145165,3a,88.1y,328.54h,76.37t/data=!3m6!1e1!3m4!1s-_eYzrG_eRX0cexIlCVwBw!2e0!7i13312!8i6656 | J151: 35.424391, 133.814478 | L151: of:=MID([.J151];1;FIND(",";[.J151])-1) -> 35.424391 | M151: of:=MID([.J151];FIND(" ";[.J151])+1;LEN([.J151])) -> 133.814478 | N151: of:=IF([.A150]=[.A151];[.N150];[.N150]+1) -> 71 | O151: of:=IF([.A151]=[.D151];"";IF([.D151]="";"";"あり")) -> 
A152: みどり町 | B152: 下り | E152: 板 | F152: なし | G152: なし | H152: 2015-04 | I152: https://www.google.co.jp/maps/@35.4244296,133.8145365,3a,20.8y,124.2h,88.47t/data=!3m6!1e1!3m4!1slG0n77Ir4B39cJsI6rRMuQ!2e0!7i13312!8i6656 | J152: 35.424352, 133.814648 | L152: of:=MID([.J152];1;FIND(",";[.J152])-1) -> 35.424352 | M152: of:=MID([.J152];FIND(" ";[.J152])+1;LEN([.J152])) -> 133.814648 | N152: of:=IF([.A151]=[.A152];[.N151];[.N151]+1) -> 71 | O152: of:=IF([.A152]=[.D152];"";IF([.D152]="";"";"あり")) -> 
A153: 八幡神社前 | B153: 上り | D153: 八幡神社前 | E153: 柱 | F153: なし | G153: なし | H153: 2015-04 | I153: https://www.google.co.jp/maps/@35.4216814,133.8120416,3a,45.3y,321.07h,86.28t/data=!3m6!1e1!3m4!1s9Bd53UKvx9N-ly4jJdDBEA!2e0!7i13312!8i6656 | J153: 35.421723, 133.812002 | L153: of:=MID([.J153];1;FIND(",";[.J153])-1) -> 35.421723 | M153: of:=MID([.J153];FIND(" ";[.J153])+1;LEN([.J153])) -> 133.812002 | N153: of:=IF([.A152]=[.A153];[.N152];[.N152]+1) -> 72 | O153: of:=IF([.A153]=[.D153];"";IF([.D153]="";"";"あり")) -> 
A154: 八幡神社前 | B154: 下り | D154: 八幡神社前 | E154: 柱 | F154: なし | G154: なし | H154: 2015-04 | I154: https://www.google.co.jp/maps/@35.4216814,133.8120416,3a,45.3y,180.66h,83.89t/data=!3m6!1e1!3m4!1s9Bd53UKvx9N-ly4jJdDBEA!2e0!7i13312!8i6656 | J154: 35.421585, 133.812003 | L154: of:=MID([.J154];1;FIND(",";[.J154])-1) -> 35.421585 | M154: of:=MID([.J154];FIND(" ";[.J154])+1;LEN([.J154])) -> 133.812003 | N154: of:=IF([.A153]=[.A154];[.N153];[.N153]+1) -> 72 | O154: of:=IF([.A154]=[.D154];"";IF([.D154]="";"";"あり")) -> 
A155: 生田東口 | B155: 上り | E155: なし | F155: なし | G155: なし | H155: 2015-04 | J155: 35.421466, 133.808154 | L155: of:=MID([.J155];1;FIND(",";[.J155])-1) -> 35.421466 | M155: of:=MID([.J155];FIND(" ";[.J155])+1;LEN([.J155])) -> 133.808154 | N155: of:=IF([.A154]=[.A155];[.N154];[.N154]+1) -> 73 | O155: of:=IF([.A155]=[.D155];"";IF([.D155]="";"";"あり")) -> 
A156: 生田東口 | B156: 下り | D156: 生田東口 | E156: 柱 | F156: なし | G156: なし | H156: 2015-04 | I156: https://www.google.co.jp/maps/@35.4215303,133.8082062,3a,60y,199.72h,81.87t/data=!3m6!1e1!3m4!1solBL-A0G9u2C7IbNQG6r0g!2e0!7i13312!8i6656 | J156: 35.421466, 133.808154 | L156: of:=MID([.J156];1;FIND(",";[.J156])-1) -> 35.421466 | M156: of:=MID([.J156];FIND(" ";[.J156])+1;LEN([.J156])) -> 133.808154 | N156: of:=IF([.A155]=[.A156];[.N155];[.N155]+1) -> 73 | O156: of:=IF([.A156]=[.D156];"";IF([.D156]="";"";"あり")) -> 
A157: 巌城 | B157: 上り | E157: 柱 | F157: なし | G157: なし | H157: 2018-08 | I157: https://www.google.com/maps/@35.4384694,133.8431737,3a,75y,270.2h,74.96t/data=!3m6!1e1!3m4!1sVNw_cyqtXxrctA4aBijCcg!2e0!7i13312!8i6656?hl=ja | J157: 35.438477, 133.843147 | L157: of:=MID([.J157];1;FIND(",";[.J157])-1) -> 35.438477 | M157: of:=MID([.J157];FIND(" ";[.J157])+1;LEN([.J157])) -> 133.843147 | N157: of:=IF([.A156]=[.A157];[.N156];[.N156]+1) -> 74 | O157: of:=IF([.A157]=[.D157];"";IF([.D157]="";"";"あり")) -> 
A158: 巌城 | B158: 下り | E158: 柱 | F158: なし | G158: なし | H158: 2018-08 | I158: https://www.google.com/maps/@35.4387967,133.8431591,3a,75y,65.29h,82.07t/data=!3m7!1e1!3m5!1sJ3k9C-NfGFZHI9RFXj0yUw!2e0!6s%2F%2Fgeo1.ggpht.com%2Fcbk%3Fpanoid%3DJ3k9C-NfGFZHI9RFXj0yUw%26output%3Dthumbnail%26cb_client%3Dmaps_sv.tactile.gps%26thumb%3D2%26w%3 | J158: 35.438811, 133.843331 | L158: of:=MID([.J158];1;FIND(",";[.J158])-1) -> 35.438811 | M158: of:=MID([.J158];FIND(" ";[.J158])+1;LEN([.J158])) -> 133.843331 | N158: of:=IF([.A157]=[.A158];[.N157];[.N157]+1) -> 74 | O158: of:=IF([.A158]=[.D158];"";IF([.D158]="";"";"あり")) -> 
A159: 厚生病院正面玄関前 | B159: 上り | D159: 厚生病院正面玄関前 | E159: 板 | F159: なし | G159: なし | H159: 2018-08 | I159: https://www.google.com/maps/@35.4354422,133.8412336,3a,75y,29.48h,87.52t/data=!3m6!1e1!3m4!1sMMMsy9wt2lj7lIg32FzNUw!2e0!7i13312!8i6656?hl=ja | J159: 35.435499, 133.841266 | L159: of:=MID([.J159];1;FIND(",";[.J159])-1) -> 35.435499 | M159: of:=MID([.J159];FIND(" ";[.J159])+1;LEN([.J159])) -> 133.841266 | N159: of:=IF([.A158]=[.A159];[.N158];[.N158]+1) -> 75 | O159: of:=IF([.A159]=[.D159];"";IF([.D159]="";"";"あり")) -> 
A160: 厚生病院正面玄関前 | B160: 下り | D160: 厚生病院正面玄関前 | E160: 板 | F160: なし | G160: なし | H160: 2018-08 | I160: https://www.google.com/maps/@35.4353857,133.8411595,3a,47.7y,143.02h,83.11t/data=!3m6!1e1!3m4!1swz_D1-91Qody2rsNOfxUYA!2e0!7i13312!8i6656?hl=ja | J160: 35.435325, 133.841206 | L160: of:=MID([.J160];1;FIND(",";[.J160])-1) -> 35.435325 | M160: of:=MID([.J160];FIND(" ";[.J160])+1;LEN([.J160])) -> 133.841206 | N160: of:=IF([.A159]=[.A160];[.N159];[.N159]+1) -> 75 | O160: of:=IF([.A160]=[.D160];"";IF([.D160]="";"";"あり")) -> 
A161: 合同庁舎前 | B161: 上り | D161: 合同庁舎前 | E161: 板 | F161: なし | G161: なし | H161: 2018-08 | I161: https://www.google.com/maps/@35.4304938,133.839228,3a,34.1y,330.29h,87.59t/data=!3m6!1e1!3m4!1svTEt3hHlwiibygI-TXB8lg!2e0!7i13312!8i6656?hl=ja | J161: 35.430548, 133.839176 | L161: of:=MID([.J161];1;FIND(",";[.J161])-1) -> 35.430548 | M161: of:=MID([.J161];FIND(" ";[.J161])+1;LEN([.J161])) -> 133.839176 | N161: of:=IF([.A160]=[.A161];[.N160];[.N160]+1) -> 76 | O161: of:=IF([.A161]=[.D161];"";IF([.D161]="";"";"あり")) -> 
A162: 合同庁舎前 | B162: 下り | D162: 合同庁舎前 | E162: 板 | F162: なし | G162: なし | H162: 2018-08 | I162: https://www.google.com/maps/@35.4304938,133.839228,3a,34.1y,246h,89.12t/data=!3m6!1e1!3m4!1svTEt3hHlwiibygI-TXB8lg!2e0!7i13312!8i6656?hl=ja | J162: 35.430473, 133.839142 | L162: of:=MID([.J162];1;FIND(",";[.J162])-1) -> 35.430473 | M162: of:=MID([.J162];FIND(" ";[.J162])+1;LEN([.J162])) -> 133.839142 | N162: of:=IF([.A161]=[.A162];[.N161];[.N161]+1) -> 76 | O162: of:=IF([.A162]=[.D162];"";IF([.D162]="";"";"あり")) -> 
A163: 倉吉パークスクエア | E163: あり | F163: あり | G163: あり | H163: 2018‐08 | I163: https://www.google.com/maps/@35.430716,133.8359702,3a,15y,351.26h,90.66t/data=!3m8!1e1!3m6!1sAF1QipM3piTMvuuc4W8TwqQxOBUdgqbQl9OY4H0UWu43!2e10!3e11!6shttps:%2F%2Flh5.googleusercontent.com%2Fp%2FAF1QipM3piTMvuuc4W8TwqQxOBUdgqbQl9OY4H0UWu43%3Dw203-h100-k-no | J163: 35.431046, 133.835901 | L163: of:=MID([.J163];1;FIND(",";[.J163])-1) -> 35.431046 | M163: of:=MID([.J163];FIND(" ";[.J163])+1;LEN([.J163])) -> 133.835901 | N163: of:=IF([.A162]=[.A163];[.N162];[.N162]+1) -> 77 | O163: of:=IF([.A163]=[.D163];"";IF([.D163]="";"";"あり")) -> 
A164: 河原町上 | B164: 上り | E164: なし | F164: なし | G164: なし | H164: 2018-08 | J164: 35.429331, 133.810126 | L164: of:=MID([.J164];1;FIND(",";[.J164])-1) -> 35.429331 | M164: of:=MID([.J164];FIND(" ";[.J164])+1;LEN([.J164])) -> 133.810126 | N164: of:=IF([.A163]=[.A164];[.N163];[.N163]+1) -> 78 | O164: of:=IF([.A164]=[.D164];"";IF([.D164]="";"";"あり")) -> 
A165: 河原町上 | B165: 下り | D165: 河原町上 | E165: 柱 | F165: あり | G165: あり | H165: 2018-08 | I165: https://www.google.com/maps/@35.4293904,133.8100436,3a,42.5y,118.97h,89.45t/data=!3m6!1e1!3m4!1sv_TRunVBh2TjbXEfrvlndA!2e0!7i13312!8i6656?hl=ja | J165: 35.429331, 133.810126 | L165: of:=MID([.J165];1;FIND(",";[.J165])-1) -> 35.429331 | M165: of:=MID([.J165];FIND(" ";[.J165])+1;LEN([.J165])) -> 133.810126 | N165: of:=IF([.A164]=[.A165];[.N164];[.N164]+1) -> 78 | O165: of:=IF([.A165]=[.D165];"";IF([.D165]="";"";"あり")) -> 
A166: 八幡町 | B166: 上り | E166: なし | F166: なし | G166: なし | H166: 2018-08 | J166: 35.423000, 133.810967 | L166: of:=MID([.J166];1;FIND(",";[.J166])-1) -> 35.423000 | M166: of:=MID([.J166];FIND(" ";[.J166])+1;LEN([.J166])) -> 133.810967 | N166: of:=IF([.A165]=[.A166];[.N165];[.N165]+1) -> 79 | O166: of:=IF([.A166]=[.D166];"";IF([.D166]="";"";"あり")) -> 
A167: 八幡町 | B167: 下り | D167: 八幡町 | E167: 柱 | F167: なし | G167: なし | H167: 2018-08 | I167: https://www.google.com/maps/@35.4230457,133.8109128,3a,75y,99.74h,84.28t/data=!3m6!1e1!3m4!1smHvT5SS-nNY-LCFwnPcWdQ!2e0!7i13312!8i6656?hl=ja | J167: 35.423000, 133.810967 | L167: of:=MID([.J167];1;FIND(",";[.J167])-1) -> 35.423000 | M167: of:=MID([.J167];FIND(" ";[.J167])+1;LEN([.J167])) -> 133.810967 | N167: of:=IF([.A166]=[.A167];[.N166];[.N166]+1) -> 79 | O167: of:=IF([.A167]=[.D167];"";IF([.D167]="";"";"あり")) -> 
A168: 八幡町上 | B168: 上り | D168: 八幡町上 | E168: 柱 | F168: なし | G168: なし | H168: 2012-09 | I168: https://www.google.com/maps/@35.4212305,133.811146,3a,26.1y,287.08h,82.04t/data=!3m6!1e1!3m4!1soFzNRiw6koFjRZkJiSaAZQ!2e0!7i13312!8i6656?hl=ja | J168: 35.421253, 133.811020 | L168: of:=MID([.J168];1;FIND(",";[.J168])-1) -> 35.421253 | M168: of:=MID([.J168];FIND(" ";[.J168])+1;LEN([.J168])) -> 133.811020 | N168: of:=IF([.A167]=[.A168];[.N167];[.N167]+1) -> 80 | O168: of:=IF([.A168]=[.D168];"";IF([.D168]="";"";"あり")) -> 
A169: 八幡町上 | B169: 下り | D169: 八幡町上 | E169: 柱 | F169: なし | G169: なし | H169: 2012-09 | I169: https://www.google.com/maps/@35.4212305,133.811146,3a,60y,63.52h,83.26t/data=!3m6!1e1!3m4!1soFzNRiw6koFjRZkJiSaAZQ!2e0!7i13312!8i6656?hl=ja | J169: 35.421241, 133.811207 | L169: of:=MID([.J169];1;FIND(",";[.J169])-1) -> 35.421241 | M169: of:=MID([.J169];FIND(" ";[.J169])+1;LEN([.J169])) -> 133.811207 | N169: of:=IF([.A168]=[.A169];[.N168];[.N168]+1) -> 80 | O169: of:=IF([.A169]=[.D169];"";IF([.D169]="";"";"あり")) -> 
A170: 富海 | B170: 上り | D170: 富海 | E170: 柱 | F170: あり | G170: あり | H170: 2012-09 | I170: https://www.google.com/maps/@35.4171783,133.8120673,3a,42.5y,274.97h,82.72t/data=!3m6!1e1!3m4!1sqJe3PbY5hSrCFvBYwZo8vg!2e0!7i13312!8i6656?hl=ja | J170: 35.417140, 133.811928 | L170: of:=MID([.J170];1;FIND(",";[.J170])-1) -> 35.417140 | M170: of:=MID([.J170];FIND(" ";[.J170])+1;LEN([.J170])) -> 133.811928 | N170: of:=IF([.A169]=[.A170];[.N169];[.N169]+1) -> 81 | O170: of:=IF([.A170]=[.D170];"";IF([.D170]="";"";"あり")) -> 
A171: 富海 | B171: 下り | E171: なし | F171: なし | G171: なし | H171: 2012-09 | J171: 35.417140, 133.811928 | L171: of:=MID([.J171];1;FIND(",";[.J171])-1) -> 35.417140 | M171: of:=MID([.J171];FIND(" ";[.J171])+1;LEN([.J171])) -> 133.811928 | N171: of:=IF([.A170]=[.A171];[.N170];[.N170]+1) -> 81 | O171: of:=IF([.A171]=[.D171];"";IF([.D171]="";"";"あり")) -> 
A172: 下大江 | B172: 上り | D172: 下大江 | E172: 柱 | F172: あり | G172: あり | H172: 2012-10 | I172: https://www.google.com/maps/@35.4122728,133.8111344,3a,25.6y,249.75h,83.95t/data=!3m6!1e1!3m4!1s_rBfiuCbxZyRDX5TWbAlfw!2e0!7i13312!8i6656?hl=ja | J172: 35.412210, 133.811050 | L172: of:=MID([.J172];1;FIND(",";[.J172])-1) -> 35.412210 | M172: of:=MID([.J172];FIND(" ";[.J172])+1;LEN([.J172])) -> 133.811050 | N172: of:=IF([.A171]=[.A172];[.N171];[.N171]+1) -> 82 | O172: of:=IF([.A172]=[.D172];"";IF([.D172]="";"";"あり")) -> 
A173: 下大江 | B173: 下り | E173: なし | F173: なし | G173: なし | H173: 2012-10 | J173: 35.412210, 133.811050 | L173: of:=MID([.J173];1;FIND(",";[.J173])-1) -> 35.412210 | M173: of:=MID([.J173];FIND(" ";[.J173])+1;LEN([.J173])) -> 133.811050 | N173: of:=IF([.A172]=[.A173];[.N172];[.N172]+1) -> 82 | O173: of:=IF([.A173]=[.D173];"";IF([.D173]="";"";"あり")) -> 
A174: 東鴨新町 | B174: 上り | D174: 東鴨新町 | E174: 柱 | F174: あり | G174: あり | H174: 2012-10 | I174: https://www.google.com/maps/@35.4096613,133.8097982,3a,60y,323.04h,81.65t/data=!3m6!1e1!3m4!1ss_CS8GwT6SRtaoBiE4FkYA!2e0!7i13312!8i6656?hl=ja | J174: 35.409730, 133.809755 | L174: of:=MID([.J174];1;FIND(",";[.J174])-1) -> 35.409730 | M174: of:=MID([.J174];FIND(" ";[.J174])+1;LEN([.J174])) -> 133.809755 | N174: of:=IF([.A173]=[.A174];[.N173];[.N173]+1) -> 83 | O174: of:=IF([.A174]=[.D174];"";IF([.D174]="";"";"あり")) -> 
A175: 東鴨新町 | B175: 下り | D175: 東鴨新町 | E175: 柱 | F175: なし | G175: なし | H175: 2012-10 | I175: https://www.google.com/maps/@35.4093537,133.8096986,3a,46.3y,36.39h,75.99t/data=!3m6!1e1!3m4!1shTC4s_Lc33qLYT1y-Ol9rA!2e0!7i13312!8i6656?hl=ja | J175: 35.409390, 133.809729 | L175: of:=MID([.J175];1;FIND(",";[.J175])-1) -> 35.409390 | M175: of:=MID([.J175];FIND(" ";[.J175])+1;LEN([.J175])) -> 133.809729 | N175: of:=IF([.A174]=[.A175];[.N174];[.N174]+1) -> 83 | O175: of:=IF([.A175]=[.D175];"";IF([.D175]="";"";"あり")) -> 
A176: 長坂新町入口 | B176: 上り | E176: なし | F176: なし | G176: なし | H176: 2012-10 | J176: 35.407140, 133.807646 | L176: of:=MID([.J176];1;FIND(",";[.J176])-1) -> 35.407140 | M176: of:=MID([.J176];FIND(" ";[.J176])+1;LEN([.J176])) -> 133.807646 | N176: of:=IF([.A175]=[.A176];[.N175];[.N175]+1) -> 84 | O176: of:=IF([.A176]=[.D176];"";IF([.D176]="";"";"あり")) -> 
A177: 長坂新町入口 | B177: 下り | D177: 長坂新町 | E177: 柱 | F177: なし | G177: なし | H177: 2012-10 | I177: https://www.google.com/maps/@35.4071678,133.8076286,3a,75y,176.27h,77.73t/data=!3m6!1e1!3m4!1sgCviFoD-6X7N9c_CoQJmFA!2e0!7i13312!8i6656?hl=ja | J177: 35.407140, 133.807646 | L177: of:=MID([.J177];1;FIND(",";[.J177])-1) -> 35.407140 | M177: of:=MID([.J177];FIND(" ";[.J177])+1;LEN([.J177])) -> 133.807646 | N177: of:=IF([.A176]=[.A177];[.N176];[.N176]+1) -> 84 | O177: of:=IF([.A177]=[.D177];"";IF([.D177]="";"";"あり")) -> あり
A178: 長坂 | B178: 上り | D178: 長坂 | E178: 柱 | F178: あり | G178: あり | H178: 2012-10 | I178: https://www.google.com/maps/@35.4059653,133.80569,3a,47.9y,340.49h,86.61t/data=!3m6!1e1!3m4!1s8GJyIUQQs5tudXchbl9pWg!2e0!7i13312!8i6656?hl=ja | J178: 35.405987, 133.805580 | L178: of:=MID([.J178];1;FIND(",";[.J178])-1) -> 35.405987 | M178: of:=MID([.J178];FIND(" ";[.J178])+1;LEN([.J178])) -> 133.805580 | N178: of:=IF([.A177]=[.A178];[.N177];[.N177]+1) -> 85 | O178: of:=IF([.A178]=[.D178];"";IF([.D178]="";"";"あり")) -> 
A179: 長坂 | B179: 下り | E179: なし | F179: なし | G179: なし | H179: 2012-10 | J179: 35.405987, 133.805580 | L179: of:=MID([.J179];1;FIND(",";[.J179])-1) -> 35.405987 | M179: of:=MID([.J179];FIND(" ";[.J179])+1;LEN([.J179])) -> 133.805580 | N179: of:=IF([.A178]=[.A179];[.N178];[.N178]+1) -> 85 | O179: of:=IF([.A179]=[.D179];"";IF([.D179]="";"";"あり")) -> 
A180: 弓削 | B180: 上り | D180: 弓削 | E180: 柱 | F180: あり | G180: あり | H180: 2012-10 | I180: https://www.google.com/maps/@35.4010248,133.8038663,3a,26.1y,260.55h,83.16t/data=!3m6!1e1!3m4!1s3uzb9nyA-59DFrrw-R301w!2e0!7i13312!8i6656?hl=ja | J180: 35.400979, 133.803785 | L180: of:=MID([.J180];1;FIND(",";[.J180])-1) -> 35.400979 | M180: of:=MID([.J180];FIND(" ";[.J180])+1;LEN([.J180])) -> 133.803785 | N180: of:=IF([.A179]=[.A180];[.N179];[.N179]+1) -> 86 | O180: of:=IF([.A180]=[.D180];"";IF([.D180]="";"";"あり")) -> 
A181: 弓削 | B181: 下り | E181: なし | F181: なし | G181: なし | H181: 2012-10 | J181: 35.400979, 133.803785 | L181: of:=MID([.J181];1;FIND(",";[.J181])-1) -> 35.400979 | M181: of:=MID([.J181];FIND(" ";[.J181])+1;LEN([.J181])) -> 133.803785 | N181: of:=IF([.A180]=[.A181];[.N180];[.N180]+1) -> 86 | O181: of:=IF([.A181]=[.D181];"";IF([.D181]="";"";"あり")) -> 
A182: 大宮 | B182: 上り | D182: 大宮 | E182: 柱 | F182: あり | G182: あり | H182: 2012-10 | I182: https://www.google.com/maps/@35.3981101,133.8029553,3a,60y,288.16h,80.46t/data=!3m6!1e1!3m4!1sEtxluykWVd9LPnKa-SOLkw!2e0!7i13312!8i6656?hl=ja | J182: 35.398122, 133.802897 | L182: of:=MID([.J182];1;FIND(",";[.J182])-1) -> 35.398122 | M182: of:=MID([.J182];FIND(" ";[.J182])+1;LEN([.J182])) -> 133.802897 | N182: of:=IF([.A181]=[.A182];[.N181];[.N181]+1) -> 87 | O182: of:=IF([.A182]=[.D182];"";IF([.D182]="";"";"あり")) -> 
A183: 大宮 | B183: 下り | E183: なし | F183: なし | G183: なし | H183: 2012-10 | J183: 35.398122, 133.802897 | L183: of:=MID([.J183];1;FIND(",";[.J183])-1) -> 35.398122 | M183: of:=MID([.J183];FIND(" ";[.J183])+1;LEN([.J183])) -> 133.802897 | N183: of:=IF([.A182]=[.A183];[.N182];[.N182]+1) -> 87 | O183: of:=IF([.A183]=[.D183];"";IF([.D183]="";"";"あり")) -> 
A184: 岩倉 | B184: 上り | D184: 岩倉 | E184: 柱 | F184: あり | G184: あり | H184: 2012-10 | I184: https://www.google.com/maps/@35.3916201,133.8019642,3a,47.6y,312.36h,78.74t/data=!3m6!1e1!3m4!1sDphbdkMF0N_JNUffnLzq2A!2e0!7i13312!8i6656?hl=ja | J184: 35.391643, 133.801903 | L184: of:=MID([.J184];1;FIND(",";[.J184])-1) -> 35.391643 | M184: of:=MID([.J184];FIND(" ";[.J184])+1;LEN([.J184])) -> 133.801903 | N184: of:=IF([.A183]=[.A184];[.N183];[.N183]+1) -> 88 | O184: of:=IF([.A184]=[.D184];"";IF([.D184]="";"";"あり")) -> 
A185: 岩倉 | B185: 下り | E185: なし | F185: なし | G185: なし | H185: 2012-10 | J185: 35.391643, 133.801903 | L185: of:=MID([.J185];1;FIND(",";[.J185])-1) -> 35.391643 | M185: of:=MID([.J185];FIND(" ";[.J185])+1;LEN([.J185])) -> 133.801903 | N185: of:=IF([.A184]=[.A185];[.N184];[.N184]+1) -> 88 | O185: of:=IF([.A185]=[.D185];"";IF([.D185]="";"";"あり")) -> 
A186: 広瀬口 | B186: 上り | D186: 広瀬口 | E186: 柱 | F186: あり | G186: あり | H186: 2012-10 | I186: https://www.google.com/maps/@35.3886743,133.7975806,3a,50.2y,272.81h,85.23t/data=!3m6!1e1!3m4!1s1p1A3KJ_LeiLD33oeQBsAw!2e0!7i13312!8i6656?hl=ja | J186: 35.388681, 133.797469 | L186: of:=MID([.J186];1;FIND(",";[.J186])-1) -> 35.388681 | M186: of:=MID([.J186];FIND(" ";[.J186])+1;LEN([.J186])) -> 133.797469 | N186: of:=IF([.A185]=[.A186];[.N185];[.N185]+1) -> 89 | O186: of:=IF([.A186]=[.D186];"";IF([.D186]="";"";"あり")) -> 
A187: 広瀬口 | B187: 下り | E187: なし | F187: なし | G187: なし | H187: 2012-10 | J187: 35.388681, 133.797469 | L187: of:=MID([.J187];1;FIND(",";[.J187])-1) -> 35.388681 | M187: of:=MID([.J187];FIND(" ";[.J187])+1;LEN([.J187])) -> 133.797469 | N187: of:=IF([.A186]=[.A187];[.N186];[.N186]+1) -> 89 | O187: of:=IF([.A187]=[.D187];"";IF([.D187]="";"";"あり")) -> 
A188: 広瀬中 | B188: 上り | E188: なし | F188: なし | G188: なし | H188: 2012-10 | J188: 35.383660, 133.796987 | L188: of:=MID([.J188];1;FIND(",";[.J188])-1) -> 35.383660 | M188: of:=MID([.J188];FIND(" ";[.J188])+1;LEN([.J188])) -> 133.796987 | N188: of:=IF([.A187]=[.A188];[.N187];[.N187]+1) -> 90 | O188: of:=IF([.A188]=[.D188];"";IF([.D188]="";"";"あり")) -> 
A189: 広瀬中 | B189: 下り | D189: 広瀬中 | E189: あり | F189: あり | G189: あり | H189: 2012-10 | I189: https://www.google.com/maps/@35.3836168,133.7969468,3a,38.4y,46.85h,81.27t/data=!3m6!1e1!3m4!1sV-4o4VRLfkmzdPHTBSTQUg!2e0!7i13312!8i6656?hl=ja | J189: 35.383660, 133.796987 | L189: of:=MID([.J189];1;FIND(",";[.J189])-1) -> 35.383660 | M189: of:=MID([.J189];FIND(" ";[.J189])+1;LEN([.J189])) -> 133.796987 | N189: of:=IF([.A188]=[.A189];[.N188];[.N188]+1) -> 90 | O189: of:=IF([.A189]=[.D189];"";IF([.D189]="";"";"あり")) -> 
A190: 広瀬 | B190: 上り | E190: なし | F190: あり | G190: あり | H190: 2012-10 | J190: 35.375448, 133.796463 | L190: of:=MID([.J190];1;FIND(",";[.J190])-1) -> 35.375448 | M190: of:=MID([.J190];FIND(" ";[.J190])+1;LEN([.J190])) -> 133.796463 | N190: of:=IF([.A189]=[.A190];[.N189];[.N189]+1) -> 91 | O190: of:=IF([.A190]=[.D190];"";IF([.D190]="";"";"あり")) -> 
A191: 広瀬 | B191: 下り | D191: 広瀬 | E191: 柱 | F191: なし | G191: なし | H191: 2012-10 | I191: https://www.google.com/maps/@35.3753922,133.7964404,3a,26.5y,21.39h,84.79t/data=!3m6!1e1!3m4!1s5rxTz9lBQLf2XbvjiVvOOA!2e0!7i13312!8i6656?hl=ja | J191: 35.375448, 133.796463 | L191: of:=MID([.J191];1;FIND(",";[.J191])-1) -> 35.375448 | M191: of:=MID([.J191];FIND(" ";[.J191])+1;LEN([.J191])) -> 133.796463 | N191: of:=IF([.A190]=[.A191];[.N190];[.N190]+1) -> 91 | O191: of:=IF([.A191]=[.D191];"";IF([.D191]="";"";"あり")) -> 
A192: 人材育成センター前 | B192: 上り | E192: 柱 | F192: なし | G192: なし | H192: 2018-08 | I192: https://www.google.com/maps/@35.4634854,133.8464639,3a,60y,339.74h,90.15t/data=!3m6!1e1!3m4!1sLdcr65FM3U0ypGFeUom_WA!2e0!7i13312!8i6656?hl=ja | J192: 35.463552, 133.846443 | L192: of:=MID([.J192];1;FIND(",";[.J192])-1) -> 35.463552 | M192: of:=MID([.J192];FIND(" ";[.J192])+1;LEN([.J192])) -> 133.846443 | N192: of:=IF([.A191]=[.A192];[.N191];[.N191]+1) -> 92 | O192: of:=IF([.A192]=[.D192];"";IF([.D192]="";"";"あり")) -> 
A193: 人材育成センター前 | B193: 下り | E193: 柱 | F193: なし | G193: なし | H193: 2018-08 | I193: https://www.google.com/maps/@35.4634779,133.8465202,3a,60y,186.76h,81.42t/data=!3m6!1e1!3m4!1stRQNtV3MsTyxLLERcCJd8Q!2e0!7i13312!8i6656?hl=ja | J193: 35.463450, 133.846525 | L193: of:=MID([.J193];1;FIND(",";[.J193])-1) -> 35.463450 | M193: of:=MID([.J193];FIND(" ";[.J193])+1;LEN([.J193])) -> 133.846525 | N193: of:=IF([.A192]=[.A193];[.N192];[.N192]+1) -> 92 | O193: of:=IF([.A193]=[.D193];"";IF([.D193]="";"";"あり")) -> 
A194: 新田 | B194: 上り | E194: なし | F194: なし | G194: なし | H194: 2012-09 | J194: 35.466727, 133.839788 | L194: of:=MID([.J194];1;FIND(",";[.J194])-1) -> 35.466727 | M194: of:=MID([.J194];FIND(" ";[.J194])+1;LEN([.J194])) -> 133.839788 | N194: of:=IF([.A193]=[.A194];[.N193];[.N193]+1) -> 93 | O194: of:=IF([.A194]=[.D194];"";IF([.D194]="";"";"あり")) -> 
A195: 新田 | B195: 下り | D195: 新田 | E195: 柱 | F195: あり | G195: あり | H195: 2012-09 | I195: https://www.google.com/maps/@35.4667455,133.8398428,3a,24.9y,299.3h,83.77t/data=!3m6!1e1!3m4!1sIEj00h-c-fgsaQ2A7p-TDw!2e0!7i13312!8i6656?hl=ja | J195: 35.466727, 133.839788 | L195: of:=MID([.J195];1;FIND(",";[.J195])-1) -> 35.466727 | M195: of:=MID([.J195];FIND(" ";[.J195])+1;LEN([.J195])) -> 133.839788 | N195: of:=IF([.A194]=[.A195];[.N194];[.N194]+1) -> 93 | O195: of:=IF([.A195]=[.D195];"";IF([.D195]="";"";"あり")) -> 
A196: 中江 | B196: 上り | E196: なし | F196: なし | G196: なし | H196: 2012-09 | J196: 35.468967, 133.840597 | L196: of:=MID([.J196];1;FIND(",";[.J196])-1) -> 35.468967 | M196: of:=MID([.J196];FIND(" ";[.J196])+1;LEN([.J196])) -> 133.840597 | N196: of:=IF([.A195]=[.A196];[.N195];[.N195]+1) -> 94 | O196: of:=IF([.A196]=[.D196];"";IF([.D196]="";"";"あり")) -> 
A197: 中江 | B197: 下り | D197: 中江 | E197: 柱 | F197: あり | G197: あり | H197: 2012-09 | I197: https://www.google.com/maps/@35.4690213,133.8406563,3a,50.8y,267.03h,84.35t/data=!3m6!1e1!3m4!1smRZzsroiqbAxOlWxAV3vJw!2e0!7i13312!8i6656?hl=ja | J197: 35.468967, 133.840597 | L197: of:=MID([.J197];1;FIND(",";[.J197])-1) -> 35.468967 | M197: of:=MID([.J197];FIND(" ";[.J197])+1;LEN([.J197])) -> 133.840597 | N197: of:=IF([.A196]=[.A197];[.N196];[.N196]+1) -> 94 | O197: of:=IF([.A197]=[.D197];"";IF([.D197]="";"";"あり")) -> 
A198: 大塚 | B198: 上り | E198: なし | F198: なし | G198: なし | H198: 2012-09 | J198: 35.473466, 133.842113 | L198: of:=MID([.J198];1;FIND(",";[.J198])-1) -> 35.473466 | M198: of:=MID([.J198];FIND(" ";[.J198])+1;LEN([.J198])) -> 133.842113 | N198: of:=IF([.A197]=[.A198];[.N197];[.N197]+1) -> 95 | O198: of:=IF([.A198]=[.D198];"";IF([.D198]="";"";"あり")) -> 
A199: 大塚 | B199: 下り | D199: 大塚 | E199: 柱 | F199: あり | G199: あり | H199: 2012-09 | I199: https://www.google.com/maps/@35.4734179,133.8421548,3a,35.9y,314.87h,85.37t/data=!3m6!1e1!3m4!1ss0Xp8Z3W-8vCUFj0gFM-bg!2e0!7i13312!8i6656?hl=ja | J199: 35.473466, 133.842113 | L199: of:=MID([.J199];1;FIND(",";[.J199])-1) -> 35.473466 | M199: of:=MID([.J199];FIND(" ";[.J199])+1;LEN([.J199])) -> 133.842113 | N199: of:=IF([.A198]=[.A199];[.N198];[.N198]+1) -> 95 | O199: of:=IF([.A199]=[.D199];"";IF([.D199]="";"";"あり")) -> 
A200: 天神橋 | B200: 上り | E200: なし | F200: なし | G200: なし | H200: 2015-05 | J200: 35.479878, 133.843520 | L200: of:=MID([.J200];1;FIND(",";[.J200])-1) -> 35.479878 | M200: of:=MID([.J200];FIND(" ";[.J200])+1;LEN([.J200])) -> 133.843520 | N200: of:=IF([.A199]=[.A200];[.N199];[.N199]+1) -> 96 | O200: of:=IF([.A200]=[.D200];"";IF([.D200]="";"";"あり")) -> 
A201: 天神橋 | B201: 下り | D201: 天神橋 | E201: 柱 | F201: あり | G201: あり | H201: 2015-05 | I201: https://www.google.com/maps/@35.4798943,133.8435425,3a,75y,265.44h,83.66t/data=!3m6!1e1!3m4!1s-ka2s7Gr2FefDL9gbSmrpA!2e0!7i13312!8i6656?hl=ja | J201: 35.479878, 133.843520 | L201: of:=MID([.J201];1;FIND(",";[.J201])-1) -> 35.479878 | M201: of:=MID([.J201];FIND(" ";[.J201])+1;LEN([.J201])) -> 133.843520 | N201: of:=IF([.A200]=[.A201];[.N200];[.N200]+1) -> 96 | O201: of:=IF([.A201]=[.D201];"";IF([.D201]="";"";"あり")) -> 
A202: 江北 | B202: 上り | D202: 江北 | E202: 柱 | F202: あり | G202: あり | H202: 2018-07 | I202: https://www.google.com/maps/@35.4810766,133.8418207,3a,33.5y,6.95h,89.18t/data=!3m6!1e1!3m4!1snpj8XGZTSA13H8raZiJ2Pw!2e0!7i13312!8i6656?hl=ja | J202: 35.481134, 133.841872 | L202: of:=MID([.J202];1;FIND(",";[.J202])-1) -> 35.481134 | M202: of:=MID([.J202];FIND(" ";[.J202])+1;LEN([.J202])) -> 133.841872 | N202: of:=IF([.A201]=[.A202];[.N201];[.N201]+1) -> 97 | O202: of:=IF([.A202]=[.D202];"";IF([.D202]="";"";"あり")) -> 
A203: 江北 | B203: 下り | D203: 江北 | E203: 柱 | F203: なし | G203: なし | H203: 2018-07 | I203: https://www.google.com/maps/@35.4811993,133.8410673,3a,23.3y,216.69h,87.4t/data=!3m6!1e1!3m4!1squHds-b-LzjSKv4R_MvnvA!2e0!7i13312!8i6656?hl=ja | J203: 35.481114, 133.841020 | L203: of:=MID([.J203];1;FIND(",";[.J203])-1) -> 35.481114 | M203: of:=MID([.J203];FIND(" ";[.J203])+1;LEN([.J203])) -> 133.841020 | N203: of:=IF([.A202]=[.A203];[.N202];[.N202]+1) -> 97 | O203: of:=IF([.A203]=[.D203];"";IF([.D203]="";"";"あり")) -> 
A204: 西みどり団地入口 | B204: 上り | D204: 西みどり団地入口 | E204: 柱 | F204: なし | G204: なし | H204: 2018-07 | I204: https://www.google.com/maps/@35.4818409,133.8362475,3a,75y,36.47h,79.83t/data=!3m6!1e1!3m4!1sZfvVxjwototD7WDa63Libw!2e0!7i13312!8i6656?hl=ja | J204: 35.481869, 133.836319 | L204: of:=MID([.J204];1;FIND(",";[.J204])-1) -> 35.481869 | M204: of:=MID([.J204];FIND(" ";[.J204])+1;LEN([.J204])) -> 133.836319 | N204: of:=IF([.A203]=[.A204];[.N203];[.N203]+1) -> 98 | O204: of:=IF([.A204]=[.D204];"";IF([.D204]="";"";"あり")) -> 
A205: 西みどり団地入口 | B205: 下り | D205: 西みどり団地入口 | E205: 柱 | F205: なし | G205: なし | H205: 2018-07 | I205: https://www.google.com/maps/@35.4818329,133.8363597,3a,17.9y,187.47h,86.03t/data=!3m6!1e1!3m4!1siXKOhcdRQP-yM-AgY5AMrQ!2e0!7i13312!8i6656?hl=ja | J205: 35.481743, 133.836362 | L205: of:=MID([.J205];1;FIND(",";[.J205])-1) -> 35.481743 | M205: of:=MID([.J205];FIND(" ";[.J205])+1;LEN([.J205])) -> 133.836362 | N205: of:=IF([.A204]=[.A205];[.N204];[.N204]+1) -> 98 | O205: of:=IF([.A205]=[.D205];"";IF([.D205]="";"";"あり")) -> 
A206: 国坂東口 | B206: 上り | D206: 国坂東口 | E206: 柱 | F206: あり | G206: あり | H206: 2018-07 | I206: https://www.google.com/maps/@35.4821462,133.8311216,3a,51.4y,340.23h,87.19t/data=!3m6!1e1!3m4!1smsBOyUre8mstmz8w1KZMYA!2e0!7i13312!8i6656?hl=ja | J206: 35.482185, 133.831071 | L206: of:=MID([.J206];1;FIND(",";[.J206])-1) -> 35.482185 | M206: of:=MID([.J206];FIND(" ";[.J206])+1;LEN([.J206])) -> 133.831071 | N206: of:=IF([.A205]=[.A206];[.N205];[.N205]+1) -> 99 | O206: of:=IF([.A206]=[.D206];"";IF([.D206]="";"";"あり")) -> 
A207: 国坂東口 | B207: 下り | D207: 国坂東口 | E207: 柱 | F207: なし | G207: なし | H207: 2018-07 | I207: https://www.google.com/maps/@35.4821489,133.8304613,3a,30.1y,209.11h,87.26t/data=!3m6!1e1!3m4!1sSZW-wgg6tv1aG3Fe0_YtPA!2e0!7i13312!8i6656?hl=ja | J207: 35.482065, 133.830411 | L207: of:=MID([.J207];1;FIND(",";[.J207])-1) -> 35.482065 | M207: of:=MID([.J207];FIND(" ";[.J207])+1;LEN([.J207])) -> 133.830411 | N207: of:=IF([.A206]=[.A207];[.N206];[.N206]+1) -> 99 | O207: of:=IF([.A207]=[.D207];"";IF([.D207]="";"";"あり")) -> 
A208: 国坂 | B208: 上り | D208: 国坂 | E208: 柱 | F208: あり | G208: あり | H208: 2018-07 | I208: https://www.google.com/maps/@35.4821677,133.8257934,3a,37.7y,7.71h,86.76t/data=!3m6!1e1!3m4!1sybMW_GbIbxoX0EINz7g-jg!2e0!7i13312!8i6656?hl=ja | J208: 35.482229, 133.825835 | L208: of:=MID([.J208];1;FIND(",";[.J208])-1) -> 35.482229 | M208: of:=MID([.J208];FIND(" ";[.J208])+1;LEN([.J208])) -> 133.825835 | N208: of:=IF([.A207]=[.A208];[.N207];[.N207]+1) -> 100 | O208: of:=IF([.A208]=[.D208];"";IF([.D208]="";"";"あり")) -> 
A209: 国坂 | B209: 下り | D209: 国坂 | E209: 柱 | F209: あり | G209: なし | H209: 2018-07 | I209: https://www.google.com/maps/@35.4821677,133.8257934,3a,39.3y,188.94h,87.82t/data=!3m6!1e1!3m4!1sybMW_GbIbxoX0EINz7g-jg!2e0!7i13312!8i6656?hl=ja | J209: 35.482104, 133.825787 | L209: of:=MID([.J209];1;FIND(",";[.J209])-1) -> 35.482104 | M209: of:=MID([.J209];FIND(" ";[.J209])+1;LEN([.J209])) -> 133.825787 | N209: of:=IF([.A208]=[.A209];[.N208];[.N208]+1) -> 100 | O209: of:=IF([.A209]=[.D209];"";IF([.D209]="";"";"あり")) -> 
A210: 田井 | B210: 上り | D210: 田井 | E210: 柱 | F210: あり | G210: なし | H210: 2015-04 | I210: https://www.google.com/maps/@35.4810895,133.8174798,3a,16.2y,35.43h,89.25t/data=!3m6!1e1!3m4!1s3vPAMa1K7aWScTdnUIsM3Q!2e0!7i13312!8i6656?hl=ja | J210: 35.481191, 133.817571 | L210: of:=MID([.J210];1;FIND(",";[.J210])-1) -> 35.481191 | M210: of:=MID([.J210];FIND(" ";[.J210])+1;LEN([.J210])) -> 133.817571 | N210: of:=IF([.A209]=[.A210];[.N209];[.N209]+1) -> 101 | O210: of:=IF([.A210]=[.D210];"";IF([.D210]="";"";"あり")) -> 
A211: 田井 | B211: 下り | D211: 田井 | E211: 柱 | F211: なし | G211: なし | H211: 2015-04 | I211: https://www.google.com/maps/@35.4811068,133.8176106,3a,50.9y,156.59h,87.03t/data=!3m6!1e1!3m4!1sTDnbknmULiKoVjnFKnTEWg!2e0!7i13312!8i6656?hl=ja | J211: 35.481047, 133.817628 | L211: of:=MID([.J211];1;FIND(",";[.J211])-1) -> 35.481047 | M211: of:=MID([.J211];FIND(" ";[.J211])+1;LEN([.J211])) -> 133.817628 | N211: of:=IF([.A210]=[.A211];[.N210];[.N210]+1) -> 101 | O211: of:=IF([.A211]=[.D211];"";IF([.D211]="";"";"あり")) -> 
A212: 弓原 | B212: 上り | D212: 弓原 | E212: 柱 | F212: あり | G212: あり | H212: 2018-07 | I212: https://www.google.com/maps/@35.4820547,133.812798,3a,35.6y,345.54h,88.89t/data=!3m6!1e1!3m4!1sQNZvvO-yBJL5a3taNd1VzQ!2e0!7i13312!8i6656?hl=ja | J212: 35.481921, 133.812681 | L212: of:=MID([.J212];1;FIND(",";[.J212])-1) -> 35.481921 | M212: of:=MID([.J212];FIND(" ";[.J212])+1;LEN([.J212])) -> 133.812681 | N212: of:=IF([.A211]=[.A212];[.N211];[.N211]+1) -> 102 | O212: of:=IF([.A212]=[.D212];"";IF([.D212]="";"";"あり")) -> 
A213: 弓原 | B213: 下り | D213: 弓原 | E213: 柱 | F213: なし | G213: なし | H213: 2018-07 | I213: https://www.google.com/maps/@35.4822215,133.8120799,3a,15.4y,219.68h,89.42t/data=!3m6!1e1!3m4!1sgFuLgMwCzhvrF9AqrJdK1Q!2e0!7i13312!8i6656?hl=ja | J213: 35.481978, 133.811915 | L213: of:=MID([.J213];1;FIND(",";[.J213])-1) -> 35.481978 | M213: of:=MID([.J213];FIND(" ";[.J213])+1;LEN([.J213])) -> 133.811915 | N213: of:=IF([.A212]=[.A213];[.N212];[.N212]+1) -> 102 | O213: of:=IF([.A213]=[.D213];"";IF([.D213]="";"";"あり")) -> 
A214: 下北条駅前 | B214: 上り | D214: 下北条駅前 | E214: 柱 | F214: なし | G214: なし | H214: 2018-07 | I214: https://www.google.com/maps/@35.483226,133.8080399,3a,75y,346.78h,83.01t/data=!3m6!1e1!3m4!1soje-EDE3H51FGEy56F9CCg!2e0!7i13312!8i6656?hl=ja | J214: 35.483256, 133.808050 | L214: of:=MID([.J214];1;FIND(",";[.J214])-1) -> 35.483256 | M214: of:=MID([.J214];FIND(" ";[.J214])+1;LEN([.J214])) -> 133.808050 | N214: of:=IF([.A213]=[.A214];[.N213];[.N213]+1) -> 103 | O214: of:=IF([.A214]=[.D214];"";IF([.D214]="";"";"あり")) -> 
A215: 下北条駅前 | B215: 下り | D215: 下北条駅前 | E215: 柱 | F215: なし | G215: なし | H215: 2018-07 | I215: https://www.google.com/maps/@35.4832381,133.8079912,3a,43.7y,229.58h,87.08t/data=!3m6!1e1!3m4!1sjlcb5xM-Az4ulmgcVEo0FA!2e0!7i13312!8i6656?hl=ja | J215: 35.483163, 133.807930 | L215: of:=MID([.J215];1;FIND(",";[.J215])-1) -> 35.483163 | M215: of:=MID([.J215];FIND(" ";[.J215])+1;LEN([.J215])) -> 133.807930 | N215: of:=IF([.A214]=[.A215];[.N214];[.N214]+1) -> 103 | O215: of:=IF([.A215]=[.D215];"";IF([.D215]="";"";"あり")) -> 
A216: 下神 | B216: 上り | D216: 下神 | E216: 柱 | F216: あり | G216: あり | H216: 2018-07 | I216: https://www.google.com/maps/@35.4845143,133.8018102,3a,75y,7.23h,87.01t/data=!3m6!1e1!3m4!1sruPsmYAhV1hRKIF8IRtLMw!2e0!7i13312!8i6656?hl=ja | J216: 35.484576, 133.801851 | L216: of:=MID([.J216];1;FIND(",";[.J216])-1) -> 35.484576 | M216: of:=MID([.J216];FIND(" ";[.J216])+1;LEN([.J216])) -> 133.801851 | N216: of:=IF([.A215]=[.A216];[.N215];[.N215]+1) -> 104 | O216: of:=IF([.A216]=[.D216];"";IF([.D216]="";"";"あり")) -> 
A217: 下神 | B217: 下り | D217: 下神 | E217: 柱 | F217: なし | G217: なし | H217: 2018-07 | I217: https://www.google.com/maps/@35.4846381,133.80093,3a,24.7y,188.3h,86.76t/data=!3m6!1e1!3m4!1sVUPYu-eBDuY9BLLF7SuECw!2e0!7i13312!8i6656?hl=ja | J217: 35.484541, 133.800898 | L217: of:=MID([.J217];1;FIND(",";[.J217])-1) -> 35.484541 | M217: of:=MID([.J217];FIND(" ";[.J217])+1;LEN([.J217])) -> 133.800898 | N217: of:=IF([.A216]=[.A217];[.N216];[.N216]+1) -> 104 | O217: of:=IF([.A217]=[.D217];"";IF([.D217]="";"";"あり")) -> 
A218: 松神 | B218: 上り | D218: 松神 | E218: 柱 | F218: あり | G218: あり | H218: 2018-07 | I218: https://www.google.com/maps/@35.4852658,133.7969082,3a,64.1y,2.81h,84.13t/data=!3m6!1e1!3m4!1sZp0bxLLhdc2tV4jbDo9qmg!2e0!7i13312!8i6656?hl=ja | J218: 35.485476, 133.796981 | L218: of:=MID([.J218];1;FIND(",";[.J218])-1) -> 35.485476 | M218: of:=MID([.J218];FIND(" ";[.J218])+1;LEN([.J218])) -> 133.796981 | N218: of:=IF([.A217]=[.A218];[.N217];[.N217]+1) -> 105 | O218: of:=IF([.A218]=[.D218];"";IF([.D218]="";"";"あり")) -> 
A219: 松神 | B219: 下り | D219: 松神 | E219: 柱 | F219: なし | G219: なし | H219: 2018-07 | I219: https://www.google.com/maps/@35.4852741,133.7968521,3a,26.7y,202.82h,86.44t/data=!3m6!1e1!3m4!1sM14W8q4n6JLZJur77xb4Lw!2e0!7i13312!8i6656?hl=ja | J219: 35.485376, 133.796879 | L219: of:=MID([.J219];1;FIND(",";[.J219])-1) -> 35.485376 | M219: of:=MID([.J219];FIND(" ";[.J219])+1;LEN([.J219])) -> 133.796879 | N219: of:=IF([.A218]=[.A219];[.N218];[.N218]+1) -> 105 | O219: of:=IF([.A219]=[.D219];"";IF([.D219]="";"";"あり")) -> 
A220: 東園 | B220: 上り | D220: 東園 | E220: 柱 | F220: あり | G220: なし | H220: 2018-07 | I220: https://www.google.com/maps/@35.4870313,133.7836921,3a,30.8y,-2.21h,90.06t/data=!3m6!1e1!3m4!1sTg8xcIkgOueQYkMvkMAHOQ!2e0!7i13312!8i6656?hl=ja | J220: 35.487197, 133.783740 | L220: of:=MID([.J220];1;FIND(",";[.J220])-1) -> 35.487197 | M220: of:=MID([.J220];FIND(" ";[.J220])+1;LEN([.J220])) -> 133.783740 | N220: of:=IF([.A219]=[.A220];[.N219];[.N219]+1) -> 106 | O220: of:=IF([.A220]=[.D220];"";IF([.D220]="";"";"あり")) -> 
A221: 東園 | B221: 下り | D221: 東園 | E221: 柱 | F221: なし | G221: なし | H221: 2018-07 | I221: https://www.google.com/maps/@35.4870989,133.7831276,3a,51.1y,172.95h,91.43t/data=!3m6!1e1!3m4!1sPrLFKvPm3OFJbo-ieHv0uw!2e0!7i13312!8i6656?hl=ja | J221: 35.487047, 133.783212 | L221: of:=MID([.J221];1;FIND(",";[.J221])-1) -> 35.487047 | M221: of:=MID([.J221];FIND(" ";[.J221])+1;LEN([.J221])) -> 133.783212 | N221: of:=IF([.A220]=[.A221];[.N220];[.N220]+1) -> 106 | O221: of:=IF([.A221]=[.D221];"";IF([.D221]="";"";"あり")) -> 
A222: 東園入口 | B222: 上り | D222: 東園入口 | E222: 柱 | F222: あり | G222: あり | H222: 2018-07 | I222: https://www.google.com/maps/@35.4877836,133.7771851,3a,50.8y,357.51h,91.86t/data=!3m6!1e1!3m4!1sRlX3pqw5OdOWaGzwIpr_Qw!2e0!7i13312!8i6656?hl=ja | J222: 35.487782, 133.777234 | L222: of:=MID([.J222];1;FIND(",";[.J222])-1) -> 35.487782 | M222: of:=MID([.J222];FIND(" ";[.J222])+1;LEN([.J222])) -> 133.777234 | N222: of:=IF([.A221]=[.A222];[.N221];[.N221]+1) -> 107 | O222: of:=IF([.A222]=[.D222];"";IF([.D222]="";"";"あり")) -> 
A223: 東園入口 | B223: 下り | D223: 東園入口 | E223: 柱 | F223: なし | G223: なし | H223: 2018-07 | I223: https://www.google.com/maps/@35.487744,133.7775259,3a,60y,187.93h,82.94t/data=!3m6!1e1!3m4!1szQEI1WBKufcihhQh-JPYCg!2e0!7i13312!8i6656?hl=ja | J223: 35.487573, 133.777533 | L223: of:=MID([.J223];1;FIND(",";[.J223])-1) -> 35.487573 | M223: of:=MID([.J223];FIND(" ";[.J223])+1;LEN([.J223])) -> 133.777533 | N223: of:=IF([.A222]=[.A223];[.N222];[.N222]+1) -> 107 | O223: of:=IF([.A223]=[.D223];"";IF([.D223]="";"";"あり")) -> 
A224: 西園 | B224: 上り | D224: 西園 | E224: 柱 | F224: なし | G224: なし | H224: 2018-07 | I224: https://www.google.com/maps/@35.4890256,133.7677519,3a,60.8y,5.64h,85.89t/data=!3m6!1e1!3m4!1sjh4j8igwEn7QCtFInb2rBw!2e0!7i13312!8i6656?hl=ja | J224: 35.489202, 133.767815 | L224: of:=MID([.J224];1;FIND(",";[.J224])-1) -> 35.489202 | M224: of:=MID([.J224];FIND(" ";[.J224])+1;LEN([.J224])) -> 133.767815 | N224: of:=IF([.A223]=[.A224];[.N223];[.N223]+1) -> 108 | O224: of:=IF([.A224]=[.D224];"";IF([.D224]="";"";"あり")) -> 
A225: 西園 | B225: 下り | D225: 西園 | E225: 柱 | F225: なし | G225: なし | H225: 2018-07 | I225: https://www.google.com/maps/@35.489117,133.766931,3a,18.9y,195.54h,86.33t/data=!3m6!1e1!3m4!1sDZC5qTQb6CMP-f6-yn8aow!2e0!7i13312!8i6656?hl=ja | J225: 35.489094, 133.766953 | L225: of:=MID([.J225];1;FIND(",";[.J225])-1) -> 35.489094 | M225: of:=MID([.J225];FIND(" ";[.J225])+1;LEN([.J225])) -> 133.766953 | N225: of:=IF([.A224]=[.A225];[.N224];[.N224]+1) -> 108 | O225: of:=IF([.A225]=[.D225];"";IF([.D225]="";"";"あり")) -> 
A226: 由良新橋 | B226: 上り | D226: 由良新橋 | E226: 柱 | F226: なし | G226: なし | H226: 2018-08 | I226: https://www.google.com/maps/@35.4894798,133.7614879,3a,41.8y,16.94h,86.19t/data=!3m6!1e1!3m4!1s9qCVTNhR-GIR2lI1zR9tYQ!2e0!7i13312!8i6656?hl=ja | J226: 35.489579, 133.761538 | L226: of:=MID([.J226];1;FIND(",";[.J226])-1) -> 35.489579 | M226: of:=MID([.J226];FIND(" ";[.J226])+1;LEN([.J226])) -> 133.761538 | N226: of:=IF([.A225]=[.A226];[.N225];[.N225]+1) -> 109 | O226: of:=IF([.A226]=[.D226];"";IF([.D226]="";"";"あり")) -> 
A227: 由良新橋 | B227: 下り | D227: 由良新橋 | E227: 柱 | F227: なし | G227: なし | H227: 2018-08 | I227: https://www.google.com/maps/@35.4895495,133.761188,3a,36.7y,194.88h,88.91t/data=!3m6!1e1!3m4!1s-er1x7cchx-aP1iu8k5MMw!2e0!7i13312!8i6656?hl=ja | J227: 35.489504, 133.761171 | L227: of:=MID([.J227];1;FIND(",";[.J227])-1) -> 35.489504 | M227: of:=MID([.J227];FIND(" ";[.J227])+1;LEN([.J227])) -> 133.761171 | N227: of:=IF([.A226]=[.A227];[.N226];[.N226]+1) -> 109 | O227: of:=IF([.A227]=[.D227];"";IF([.D227]="";"";"あり")) -> 
A228: 北条町役場大栄庁舎前 | B228: 上り | D228: 北栄町大栄庁舎前 | E228: 柱 | F228: なし | G228: あり | H228: 2018-07 | I228: https://www.google.com/maps/@35.4913055,133.7575739,3a,58.6y,15.75h,87.42t/data=!3m6!1e1!3m4!1sA9XLi4sU_NSVtz6q6nlWgQ!2e0!7i13312!8i6656?hl=ja | J228: 35.491335, 133.757616 | L228: of:=MID([.J228];1;FIND(",";[.J228])-1) -> 35.491335 | M228: of:=MID([.J228];FIND(" ";[.J228])+1;LEN([.J228])) -> 133.757616 | N228: of:=IF([.A227]=[.A228];[.N227];[.N227]+1) -> 110 | O228: of:=IF([.A228]=[.D228];"";IF([.D228]="";"";"あり")) -> あり
A229: 北条町役場大栄庁舎前 | B229: 下り | D229: 北栄町大栄庁舎前 | E229: 柱 | F229: あり | G229: なし | H229: 2018-07 | I229: https://www.google.com/maps/@35.4910369,133.7583956,3a,40.5y,233.25h,92t/data=!3m6!1e1!3m4!1siy0xigsACpxnyo9ndo9yBA!2e0!7i13312!8i6656?hl=ja | J229: 35.490989, 133.758306 | L229: of:=MID([.J229];1;FIND(",";[.J229])-1) -> 35.490989 | M229: of:=MID([.J229];FIND(" ";[.J229])+1;LEN([.J229])) -> 133.758306 | N229: of:=IF([.A228]=[.A229];[.N228];[.N228]+1) -> 110 | O229: of:=IF([.A229]=[.D229];"";IF([.D229]="";"";"あり")) -> あり
A230: 由良駅入口 | B230: 上り | D230: 由良駅入口 | E230: 柱 | F230: あり | G230: あり | H230: 2018-07 | I230: https://www.google.com/maps/@35.4919384,133.7548664,3a,34.4y,20.63h,88.64t/data=!3m6!1e1!3m4!1sh69G2gJfkMdpEKa2iC_Z_A!2e0!7i13312!8i6656?hl=ja | J230: 35.492003, 133.754886 | L230: of:=MID([.J230];1;FIND(",";[.J230])-1) -> 35.492003 | M230: of:=MID([.J230];FIND(" ";[.J230])+1;LEN([.J230])) -> 133.754886 | N230: of:=IF([.A229]=[.A230];[.N229];[.N229]+1) -> 111 | O230: of:=IF([.A230]=[.D230];"";IF([.D230]="";"";"あり")) -> 
A231: 由良駅入口 | B231: 下り | D231: 由良駅入口 | E231: 柱 | F231: なし | G231: あり | H231: 2018-07 | I231: https://www.google.com/maps/@35.4919384,133.7548664,3a,42.3y,175.42h,87.59t/data=!3m6!1e1!3m4!1sh69G2gJfkMdpEKa2iC_Z_A!2e0!7i13312!8i6656?hl=ja | J231: 35.491853, 133.754886 | L231: of:=MID([.J231];1;FIND(",";[.J231])-1) -> 35.491853 | M231: of:=MID([.J231];FIND(" ";[.J231])+1;LEN([.J231])) -> 133.754886 | N231: of:=IF([.A230]=[.A231];[.N230];[.N230]+1) -> 111 | O231: of:=IF([.A231]=[.D231];"";IF([.D231]="";"";"あり")) -> 
A232: 福庭北高前 | B232: 上り | E232: 柱 | F232: なし | G232: なし | H232: 2018-08 | I232: https://www.google.com/maps/@35.4649527,133.8499166,3a,60y,121.27h,84.65t/data=!3m6!1e1!3m4!1sNIfe04oHaBfm2eL2z7-GHA!2e0!7i13312!8i6656?hl=ja | J232: 35.464928, 133.849985 | L232: of:=MID([.J232];1;FIND(",";[.J232])-1) -> 35.464928 | M232: of:=MID([.J232];FIND(" ";[.J232])+1;LEN([.J232])) -> 133.849985 | N232: of:=IF([.A231]=[.A232];[.N231];[.N231]+1) -> 112 | O232: of:=IF([.A232]=[.D232];"";IF([.D232]="";"";"あり")) -> 
A233: 福庭北高前 | B233: 下り | E233: 柱 | F233: なし | G233: なし | H233: 2018-08 | I233: https://www.google.com/maps/@35.4649527,133.8499166,3a,75y,315.28h,79.99t/data=!3m6!1e1!3m4!1sNIfe04oHaBfm2eL2z7-GHA!2e0!7i13312!8i6656?hl=ja | J233: 35.464984, 133.849876 | L233: of:=MID([.J233];1;FIND(",";[.J233])-1) -> 35.464984 | M233: of:=MID([.J233];FIND(" ";[.J233])+1;LEN([.J233])) -> 133.849876 | N233: of:=IF([.A232]=[.A233];[.N232];[.N232]+1) -> 112 | O233: of:=IF([.A233]=[.D233];"";IF([.D233]="";"";"あり")) -> 
A234: 中電電力所前 | B234: 上り | D234: 福庭北 | E234: 柱 | F234: なし | G234: なし | H234: 2018-08 | I234: https://www.google.com/maps/@35.4675056,133.8505612,3a,30.3y,103.04h,85.11t/data=!3m6!1e1!3m4!1sD9l7NkDhkgxOfFfOjDDw6w!2e0!7i13312!8i6656?hl=ja | J234: 35.467485, 133.850619 | L234: of:=MID([.J234];1;FIND(",";[.J234])-1) -> 35.467485 | M234: of:=MID([.J234];FIND(" ";[.J234])+1;LEN([.J234])) -> 133.850619 | N234: of:=IF([.A233]=[.A234];[.N233];[.N233]+1) -> 113 | O234: of:=IF([.A234]=[.D234];"";IF([.D234]="";"";"あり")) -> あり
A235: 中電電力所前 | B235: 下り | E235: 柱 | F235: なし | G235: なし | H235: 2012-09 | I235: https://www.google.com/maps/@35.4670335,133.8504418,3a,75y,319.67h,83.78t/data=!3m6!1e1!3m4!1sm5O3OFH-2TUqMIAOaywNUw!2e0!7i13312!8i6656?hl=ja | J235: 35.467082, 133.850408 | L235: of:=MID([.J235];1;FIND(",";[.J235])-1) -> 35.467082 | M235: of:=MID([.J235];FIND(" ";[.J235])+1;LEN([.J235])) -> 133.850408 | N235: of:=IF([.A234]=[.A235];[.N234];[.N234]+1) -> 113 | O235: of:=IF([.A235]=[.D235];"";IF([.D235]="";"";"あり")) -> 
A236: 清谷 | B236: 上り | D236: 清谷 | E236: 柱 | F236: なし | G236: なし | H236: 2018-07 | I236: https://www.google.com/maps/@35.4727158,133.8519071,3a,75y,78.96h,79.83t/data=!3m6!1e1!3m4!1srXrJuEpRoanZMm3avadoNA!2e0!7i13312!8i6656?hl=ja | J236: 35.472730, 133.851944 | L236: of:=MID([.J236];1;FIND(",";[.J236])-1) -> 35.472730 | M236: of:=MID([.J236];FIND(" ";[.J236])+1;LEN([.J236])) -> 133.851944 | N236: of:=IF([.A235]=[.A236];[.N235];[.N235]+1) -> 114 | O236: of:=IF([.A236]=[.D236];"";IF([.D236]="";"";"あり")) -> 
A237: 清谷 | B237: 下り | D237: 清谷 | E237: 柱 | F237: なし | G237: なし | H237: 2018-07 | I237: https://www.google.com/maps/@35.4725898,133.8518758,3a,52y,294.08h,85.33t/data=!3m6!1e1!3m4!1s2_HTrOJqT1bgKSceTtxYVA!2e0!7i13312!8i6656?hl=ja | J237: 35.472630, 133.851789 | L237: of:=MID([.J237];1;FIND(",";[.J237])-1) -> 35.472630 | M237: of:=MID([.J237];FIND(" ";[.J237])+1;LEN([.J237])) -> 133.851789 | N237: of:=IF([.A236]=[.A237];[.N236];[.N236]+1) -> 114 | O237: of:=IF([.A237]=[.D237];"";IF([.D237]="";"";"あり")) -> 
A238: 田後入口 | B238: 上り | D238: 田後入口 | E238: 柱 | F238: なし | G238: なし | H238: 2018-07 | I238: https://www.google.com/maps/@35.4791283,133.8535221,3a,75y,111.19h,73.36t/data=!3m6!1e1!3m4!1skqTOaPPJzNCSDywcA8GsOw!2e0!7i13312!8i6656?hl=ja | J238: 35.479101, 133.853563 | L238: of:=MID([.J238];1;FIND(",";[.J238])-1) -> 35.479101 | M238: of:=MID([.J238];FIND(" ";[.J238])+1;LEN([.J238])) -> 133.853563 | N238: of:=IF([.A237]=[.A238];[.N237];[.N237]+1) -> 115 | O238: of:=IF([.A238]=[.D238];"";IF([.D238]="";"";"あり")) -> 
A239: 田後入口 | B239: 下り | D239: 田後入口 | E239: 柱 | F239: なし | G239: なし | H239: 2018-07 | I239: https://www.google.com/maps/@35.4792944,133.8535664,3a,29y,289.59h,88.91t/data=!3m6!1e1!3m4!1saU6-NvNpMvkDFbXHBqbcFQ!2e0!7i13312!8i6656?hl=ja | J239: 35.479334, 133.853495 | L239: of:=MID([.J239];1;FIND(",";[.J239])-1) -> 35.479334 | M239: of:=MID([.J239];FIND(" ";[.J239])+1;LEN([.J239])) -> 133.853495 | N239: of:=IF([.A238]=[.A239];[.N238];[.N238]+1) -> 115 | O239: of:=IF([.A239]=[.D239];"";IF([.D239]="";"";"あり")) -> 
A240: 田後 | B240: 上り | D240: 田後 | E240: 柱 | F240: あり | G240: あり | H240: 2018-07 | I240: https://www.google.com/maps/@35.4829847,133.8556835,3a,43.2y,135.43h,86.22t/data=!3m6!1e1!3m4!1srbchFzrQKmQxKprIIzxRrw!2e0!7i13312!8i6656?hl=ja | J240: 35.482899, 133.855778 | L240: of:=MID([.J240];1;FIND(",";[.J240])-1) -> 35.482899 | M240: of:=MID([.J240];FIND(" ";[.J240])+1;LEN([.J240])) -> 133.855778 | N240: of:=IF([.A239]=[.A240];[.N239];[.N239]+1) -> 116 | O240: of:=IF([.A240]=[.D240];"";IF([.D240]="";"";"あり")) -> 
A241: 田後 | B241: 下り | D241: 田後 | E241: 柱 | F241: なし | G241: あり | H241: 2018-07 | I241: https://www.google.com/maps/@35.4825203,133.8554839,3a,75y,325.67h,83.8t/data=!3m6!1e1!3m4!1sAD3hzb4OrduSDlFEsTetnw!2e0!7i13312!8i6656?hl=ja | J241: 35.482603, 133.855467 | L241: of:=MID([.J241];1;FIND(",";[.J241])-1) -> 35.482603 | M241: of:=MID([.J241];FIND(" ";[.J241])+1;LEN([.J241])) -> 133.855467 | N241: of:=IF([.A240]=[.A241];[.N240];[.N240]+1) -> 116 | O241: of:=IF([.A241]=[.D241];"";IF([.D241]="";"";"あり")) -> 
A242: 北溟中学校前 | B242: 上り | D242: 北溟中学校前 | E242: 柱 | F242: なし | G242: なし | H242: 2018-07 | I242: https://www.google.com/maps/@35.4857825,133.8579268,3a,45.6y,115.11h,91.97t/data=!3m6!1e1!3m4!1s2fyDTInSwr_xDXuqjtdWDA!2e0!7i13312!8i6656?hl=ja | J242: 35.485758, 133.858045 | L242: of:=MID([.J242];1;FIND(",";[.J242])-1) -> 35.485758 | M242: of:=MID([.J242];FIND(" ";[.J242])+1;LEN([.J242])) -> 133.858045 | N242: of:=IF([.A241]=[.A242];[.N241];[.N241]+1) -> 117 | O242: of:=IF([.A242]=[.D242];"";IF([.D242]="";"";"あり")) -> 
A243: 北溟中学校前 | B243: 下り | D243: 北溟中学校前 | E243: 柱 | F243: なし | G243: なし | H243: 2018-07 | I243: https://www.google.com/maps/@35.4852851,133.8573975,3a,50.4y,339.79h,86.47t/data=!3m6!1e1!3m4!1sF373Y3odiEEckyzmG1J_NA!2e0!7i13312!8i6656?hl=ja | J243: 35.485374, 133.857388 | L243: of:=MID([.J243];1;FIND(",";[.J243])-1) -> 35.485374 | M243: of:=MID([.J243];FIND(" ";[.J243])+1;LEN([.J243])) -> 133.857388 | N243: of:=IF([.A242]=[.A243];[.N242];[.N242]+1) -> 117 | O243: of:=IF([.A243]=[.D243];"";IF([.D243]="";"";"あり")) -> 
A244: 長瀬西口 | B244: 上り | D244: 長瀬西口 | E244: 柱 | F244: なし | G244: なし | H244: 2018-07 | I244: https://www.google.com/maps/@35.4882082,133.8619693,3a,40.2y,189.69h,87.66t/data=!3m6!1e1!3m4!1sFSb0SSnS3vraGQeR11nJyQ!2e0!7i13312!8i6656?hl=ja | J244: 35.488110, 133.861938 | L244: of:=MID([.J244];1;FIND(",";[.J244])-1) -> 35.488110 | M244: of:=MID([.J244];FIND(" ";[.J244])+1;LEN([.J244])) -> 133.861938 | N244: of:=IF([.A243]=[.A244];[.N243];[.N243]+1) -> 118 | O244: of:=IF([.A244]=[.D244];"";IF([.D244]="";"";"あり")) -> 
A245: 長瀬西口 | B245: 下り | D245: 長瀬西口 | E245: 柱 | F245: なし | G245: なし | H245: 2018-07 | I245: https://www.google.com/maps/@35.4883083,133.8623565,3a,75y,14.17h,80.32t/data=!3m6!1e1!3m4!1soG6K2BSFsY0mGZIbauC9Pg!2e0!7i13312!8i6656?hl=ja | J245: 35.488384, 133.862370 | L245: of:=MID([.J245];1;FIND(",";[.J245])-1) -> 35.488384 | M245: of:=MID([.J245];FIND(" ";[.J245])+1;LEN([.J245])) -> 133.862370 | N245: of:=IF([.A244]=[.A245];[.N244];[.N244]+1) -> 118 | O245: of:=IF([.A245]=[.D245];"";IF([.D245]="";"";"あり")) -> 
A246: 湯梨浜町役場前 | B246: 上り | D246: 湯梨浜町役場前 | E246: 柱 | F246: なし | G246: なし | H246: 2018-07 | I246: https://www.google.com/maps/@35.4893819,133.8659852,3a,18.6y,141.07h,86.35t/data=!3m6!1e1!3m4!1shi0fR6zOmEcXBUb-ekM-AA!2e0!7i13312!8i6656?hl=ja | J246: 35.489301, 133.866068 | L246: of:=MID([.J246];1;FIND(",";[.J246])-1) -> 35.489301 | M246: of:=MID([.J246];FIND(" ";[.J246])+1;LEN([.J246])) -> 133.866068 | N246: of:=IF([.A245]=[.A246];[.N245];[.N245]+1) -> 119 | O246: of:=IF([.A246]=[.D246];"";IF([.D246]="";"";"あり")) -> 
A247: 湯梨浜町役場前 | B247: 下り | D247: 湯梨浜町役場前 | E247: 柱 | F247: なし | G247: なし | H247: 2018-07 | I247: https://www.google.com/maps/@35.4893536,133.8658879,3a,60y,350.21h,86.7t/data=!3m6!1e1!3m4!1s9CKMlTVNcndg9ehN6A_Xxg!2e0!7i13312!8i6656?hl=ja | J247: 35.489387, 133.865872 | L247: of:=MID([.J247];1;FIND(",";[.J247])-1) -> 35.489387 | M247: of:=MID([.J247];FIND(" ";[.J247])+1;LEN([.J247])) -> 133.865872 | N247: of:=IF([.A246]=[.A247];[.N246];[.N246]+1) -> 119 | O247: of:=IF([.A247]=[.D247];"";IF([.D247]="";"";"あり")) -> 
A248: 久留西 | B248: 上り | D248: 久留西 | E248: 柱 | F248: あり | G248: あり | H248: 2018-07 | I248: https://www.google.com/maps/@35.491962,133.8714062,3a,69y,137.92h,87t/data=!3m6!1e1!3m4!1sec_LKwH0UBx41LmUK3r0Fw!2e0!7i13312!8i6656?hl=ja | J248: 35.491926, 133.871490 | L248: of:=MID([.J248];1;FIND(",";[.J248])-1) -> 35.491926 | M248: of:=MID([.J248];FIND(" ";[.J248])+1;LEN([.J248])) -> 133.871490 | N248: of:=IF([.A247]=[.A248];[.N247];[.N247]+1) -> 120 | O248: of:=IF([.A248]=[.D248];"";IF([.D248]="";"";"あり")) -> 
A249: 久留西 | B249: 下り | D249: 久留西 | E249: 柱 | F249: なし | G249: なし | H249: 2018-07 | I249: https://www.google.com/maps/@35.4916004,133.8707652,3a,75y,319.86h,88.29t/data=!3m6!1e1!3m4!1sxFSo1_wrxvsT0oe9MYrnJA!2e0!7i13312!8i6656?hl=ja | J249: 35.491634, 133.870716 | L249: of:=MID([.J249];1;FIND(",";[.J249])-1) -> 35.491634 | M249: of:=MID([.J249];FIND(" ";[.J249])+1;LEN([.J249])) -> 133.870716 | N249: of:=IF([.A248]=[.A249];[.N248];[.N248]+1) -> 120 | O249: of:=IF([.A249]=[.D249];"";IF([.D249]="";"";"あり")) -> 
A250: 長瀬東口 | B250: 上り | D250: 長瀬東口 | E250: 柱 | F250: あり | G250: なし | H250: 2018-07 | I250: https://www.google.com/maps/@35.4958692,133.8731914,3a,28.6y,82.96h,88.44t/data=!3m6!1e1!3m4!1s_ka1qJI1aqUJqM935eIc_Q!2e0!7i13312!8i6656?hl=ja | J250: 35.495872, 133.873325 | L250: of:=MID([.J250];1;FIND(",";[.J250])-1) -> 35.495872 | M250: of:=MID([.J250];FIND(" ";[.J250])+1;LEN([.J250])) -> 133.873325 | N250: of:=IF([.A249]=[.A250];[.N249];[.N249]+1) -> 121 | O250: of:=IF([.A250]=[.D250];"";IF([.D250]="";"";"あり")) -> 
A251: 長瀬東口 | B251: 下り | D251: 長瀬東口 | E251: 柱 | F251: なし | G251: なし | H251: 2018-07 | I251: https://www.google.com/maps/@35.4952597,133.8731773,3a,60y,280.9h,87.03t/data=!3m6!1e1!3m4!1shwOzg4_9DQ-6F1hzdlm5kw!2e0!7i13312!8i6656?hl=ja | J251: 35.495261, 133.873108 | L251: of:=MID([.J251];1;FIND(",";[.J251])-1) -> 35.495261 | M251: of:=MID([.J251];FIND(" ";[.J251])+1;LEN([.J251])) -> 133.873108 | N251: of:=IF([.A250]=[.A251];[.N250];[.N250]+1) -> 121 | O251: of:=IF([.A251]=[.D251];"";IF([.D251]="";"";"あり")) -> 
A252: 橋津中央入口 | B252: 上り | D252: 橋津中央入口 | E252: 柱 | F252: なし | G252: なし | H252: 2018-07 | I252: https://www.google.com/maps/@35.5018631,133.8731965,3a,44.1y,101.57h,84.98t/data=!3m6!1e1!3m4!1sdI9BV-heAy_RUcf5c9B_Ew!2e0!7i13312!8i6656?hl=ja | J252: 35.501869, 133.873195 | L252: of:=MID([.J252];1;FIND(",";[.J252])-1) -> 35.501869 | M252: of:=MID([.J252];FIND(" ";[.J252])+1;LEN([.J252])) -> 133.873195 | N252: of:=IF([.A251]=[.A252];[.N251];[.N251]+1) -> 122 | O252: of:=IF([.A252]=[.D252];"";IF([.D252]="";"";"あり")) -> 
A253: 橋津中央入口 | B253: 下り | D253: 橋津中央入口 | E253: 柱 | F253: なし | G253: なし | H253: 2018-07 | I253: https://www.google.com/maps/@35.5018631,133.8731965,3a,38.5y,263.74h,87.18t/data=!3m6!1e1!3m4!1sdI9BV-heAy_RUcf5c9B_Ew!2e0!7i13312!8i6656?hl=ja | J253: 35.501877, 133.872998 | L253: of:=MID([.J253];1;FIND(",";[.J253])-1) -> 35.501877 | M253: of:=MID([.J253];FIND(" ";[.J253])+1;LEN([.J253])) -> 133.872998 | N253: of:=IF([.A252]=[.A253];[.N252];[.N252]+1) -> 122 | O253: of:=IF([.A253]=[.D253];"";IF([.D253]="";"";"あり")) -> 
A254: 橋津東口 | B254: 上り | D254: 橋津東口 | E254: 柱 | F254: なし | G254: なし | H254: 2018-07 | I254: https://www.google.com/maps/@35.5057843,133.876733,3a,37.2y,142.29h,85.6t/data=!3m6!1e1!3m4!1s9TBNIw76BqsEsVbIgGlr6g!2e0!7i13312!8i6656?hl=ja | J254: 35.505956, 133.876761 | L254: of:=MID([.J254];1;FIND(",";[.J254])-1) -> 35.505956 | M254: of:=MID([.J254];FIND(" ";[.J254])+1;LEN([.J254])) -> 133.876761 | N254: of:=IF([.A253]=[.A254];[.N253];[.N253]+1) -> 123 | O254: of:=IF([.A254]=[.D254];"";IF([.D254]="";"";"あり")) -> 
A255: 橋津東口 | B255: 下り | D255: 橋津東口 | E255: 柱 | F255: あり | G255: あり | H255: 2018-07 | I255: https://www.google.com/maps/@35.5058173,133.8768216,3a,57.3y,330.1h,93.03t/data=!3m6!1e1!3m4!1slOJA7wMtVXBEzmr0G_NKDw!2e0!7i13312!8i6656?hl=ja | J255: 35.506105, 133.876711 | L255: of:=MID([.J255];1;FIND(",";[.J255])-1) -> 35.506105 | M255: of:=MID([.J255];FIND(" ";[.J255])+1;LEN([.J255])) -> 133.876711 | N255: of:=IF([.A254]=[.A255];[.N254];[.N254]+1) -> 123 | O255: of:=IF([.A255]=[.D255];"";IF([.D255]="";"";"あり")) -> 
A256: ハワイ海水浴場前 | B256: 上り | D256: ハワイ海水浴場 | E256: 柱 | F256: なし | G256: なし | H256: 2018-07 | I256: https://www.google.com/maps/@35.5063176,133.8800478,3a,22.6y,183.03h,87.4t/data=!3m6!1e1!3m4!1sugFGLSaFQChf2ZP2XPgSAQ!2e0!7i13312!8i6656?hl=ja | J256: 35.506401, 133.880070 | L256: of:=MID([.J256];1;FIND(",";[.J256])-1) -> 35.506401 | M256: of:=MID([.J256];FIND(" ";[.J256])+1;LEN([.J256])) -> 133.880070 | N256: of:=IF([.A255]=[.A256];[.N255];[.N255]+1) -> 124 | O256: of:=IF([.A256]=[.D256];"";IF([.D256]="";"";"あり")) -> あり
A257: ハワイ海水浴場前 | B257: 下り | D257: ハワイ海水浴場 | E257: 柱 | F257: なし | G257: なし | H257: 2018-07 | I257: https://www.google.com/maps/@35.5061118,133.8807621,3a,44.4y,25.9h,85.4t/data=!3m6!1e1!3m4!1sbAFwnqjtefzO7FGSZO8tRQ!2e0!7i13312!8i6656?hl=ja | J257: 35.506342, 133.880840 | L257: of:=MID([.J257];1;FIND(",";[.J257])-1) -> 35.506342 | M257: of:=MID([.J257];FIND(" ";[.J257])+1;LEN([.J257])) -> 133.880840 | N257: of:=IF([.A256]=[.A257];[.N256];[.N256]+1) -> 124 | O257: of:=IF([.A257]=[.D257];"";IF([.D257]="";"";"あり")) -> あり
A258: 三軒屋 | B258: 上り | D258: 三軒屋 | E258: 柱 | F258: なし | G258: なし | H258: 2018-07 | I258: https://www.google.com/maps/@35.506411,133.8850316,3a,46.8y,153.05h,91.05t/data=!3m6!1e1!3m4!1s6gDTF3ILvaUtskmHdaT0jw!2e0!7i13312!8i6656?hl=ja | J258: 35.506350, 133.885115 | L258: of:=MID([.J258];1;FIND(",";[.J258])-1) -> 35.506350 | M258: of:=MID([.J258];FIND(" ";[.J258])+1;LEN([.J258])) -> 133.885115 | N258: of:=IF([.A257]=[.A258];[.N257];[.N257]+1) -> 125 | O258: of:=IF([.A258]=[.D258];"";IF([.D258]="";"";"あり")) -> 
A259: 三軒屋 | B259: 下り | D259: 三軒屋 | E259: 柱 | F259: なし | G259: なし | H259: 2018-07 | I259: https://www.google.com/maps/@35.5062386,133.8845815,3a,60y,358.55h,76.53t/data=!3m6!1e1!3m4!1s7JRSiYBpG4bBxUxRYmt4mg!2e0!7i13312!8i6656?hl=ja | J259: 35.506348, 133.884614 | L259: of:=MID([.J259];1;FIND(",";[.J259])-1) -> 35.506348 | M259: of:=MID([.J259];FIND(" ";[.J259])+1;LEN([.J259])) -> 133.884614 | N259: of:=IF([.A258]=[.A259];[.N258];[.N258]+1) -> 125 | O259: of:=IF([.A259]=[.D259];"";IF([.D259]="";"";"あり")) -> 
A260: 宇野西口 | B260: 上り | D260: 宇野西口 | E260: 柱 | F260: あり | G260: あり | H260: 2018-07 | I260: https://www.google.com/maps/@35.5068177,133.8927833,3a,44y,160.59h,91.9t/data=!3m6!1e1!3m4!1szbkIVnioXDrF50SbuDHA7w!2e0!7i13312!8i6656?hl=ja | J260: 35.506549, 133.892965 | L260: of:=MID([.J260];1;FIND(",";[.J260])-1) -> 35.506549 | M260: of:=MID([.J260];FIND(" ";[.J260])+1;LEN([.J260])) -> 133.892965 | N260: of:=IF([.A259]=[.A260];[.N259];[.N259]+1) -> 126 | O260: of:=IF([.A260]=[.D260];"";IF([.D260]="";"";"あり")) -> 
A261: 宇野西口 | B261: 下り | D261: 宇野西口 | E261: 柱 | F261: なし | G261: なし | H261: 2018-07 | I261: https://www.google.com/maps/@35.5068606,133.8930584,3a,60y,335.19h,86.96t/data=!3m6!1e1!3m4!1sk_IsWjVut3vktQosIbftVA!2e0!7i13312!8i6656?hl=ja | J261: 35.506784, 133.893142 | L261: of:=MID([.J261];1;FIND(",";[.J261])-1) -> 35.506784 | M261: of:=MID([.J261];FIND(" ";[.J261])+1;LEN([.J261])) -> 133.893142 | N261: of:=IF([.A260]=[.A261];[.N260];[.N260]+1) -> 126 | O261: of:=IF([.A261]=[.D261];"";IF([.D261]="";"";"あり")) -> 
A262: 宇野東口 | B262: 上り | D262: 宇野東口 | E262: 柱 | F262: あり | G262: あり | H262: 2018-07 | I262: https://www.google.com/maps/@35.5073213,133.8967006,3a,75y,195.27h,88.41t/data=!3m6!1e1!3m4!1s9dYyHJ_KarRHtxTnEdSFTA!2e0!7i13312!8i6656?hl=ja | J262: 35.507220, 133.896778 | L262: of:=MID([.J262];1;FIND(",";[.J262])-1) -> 35.507220 | M262: of:=MID([.J262];FIND(" ";[.J262])+1;LEN([.J262])) -> 133.896778 | N262: of:=IF([.A261]=[.A262];[.N261];[.N261]+1) -> 127 | O262: of:=IF([.A262]=[.D262];"";IF([.D262]="";"";"あり")) -> 
A263: 宇野東口 | B263: 下り | D263: 宇野東口 | E263: 柱 | F263: なし | G263: なし | H263: 2018-07 | I263: https://www.google.com/maps/@35.5073298,133.8968026,3a,60y,14.15h,86.51t/data=!3m6!1e1!3m4!1shb_itaewGYu8PfjXK_BMbw!2e0!7i13312!8i6656?hl=ja | J263: 35.507345, 133.896905 | L263: of:=MID([.J263];1;FIND(",";[.J263])-1) -> 35.507345 | M263: of:=MID([.J263];FIND(" ";[.J263])+1;LEN([.J263])) -> 133.896905 | N263: of:=IF([.A262]=[.A263];[.N262];[.N262]+1) -> 127 | O263: of:=IF([.A263]=[.D263];"";IF([.D263]="";"";"あり")) -> 
A264: 宇谷 | B264: 上り | D264: 宇谷 | E264: 柱 | F264: あり | G264: あり | H264: 2018-07 | I264: https://www.google.com/maps/@35.5067673,133.9102156,3a,41.4y,199.24h,91.9t/data=!3m6!1e1!3m4!1s-B1MTWUkxKlqO8zJjr_-3Q!2e0!7i13312!8i6656?hl=ja | J264: 35.506533, 133.910005 | L264: of:=MID([.J264];1;FIND(",";[.J264])-1) -> 35.506533 | M264: of:=MID([.J264];FIND(" ";[.J264])+1;LEN([.J264])) -> 133.910005 | N264: of:=IF([.A263]=[.A264];[.N263];[.N263]+1) -> 128 | O264: of:=IF([.A264]=[.D264];"";IF([.D264]="";"";"あり")) -> 
A265: 宇谷 | B265: 下り | D265: 宇谷 | E265: 柱 | F265: なし | G265: なし | H265: 2018-07 | I265: https://www.google.com/maps/@35.506867,133.9099059,3a,75y,25.6h,89.61t/data=!3m6!1e1!3m4!1sCXvyzbu47UTpsMGgl9DO7Q!2e0!7i13312!8i6656?hl=ja | J265: 35.506723, 133.909816 | L265: of:=MID([.J265];1;FIND(",";[.J265])-1) -> 35.506723 | M265: of:=MID([.J265];FIND(" ";[.J265])+1;LEN([.J265])) -> 133.909816 | N265: of:=IF([.A264]=[.A265];[.N264];[.N264]+1) -> 128 | O265: of:=IF([.A265]=[.D265];"";IF([.D265]="";"";"あり")) -> 
A266: 宇谷東口 | B266: 上り | D266: 宇谷東口 | E266: 柱 | F266: あり | G266: あり | H266: 2018-07 | I266: https://www.google.com/maps/@35.5059754,133.9158194,3a,29.6y,169h,87.24t/data=!3m6!1e1!3m4!1sPnSeCLt2Wc1ihvhEgxkiYg!2e0!7i13312!8i6656?hl=ja | J266: 35.505677, 133.915838 | L266: of:=MID([.J266];1;FIND(",";[.J266])-1) -> 35.505677 | M266: of:=MID([.J266];FIND(" ";[.J266])+1;LEN([.J266])) -> 133.915838 | N266: of:=IF([.A265]=[.A266];[.N265];[.N265]+1) -> 129 | O266: of:=IF([.A266]=[.D266];"";IF([.D266]="";"";"あり")) -> 
A267: 宇谷東口 | B267: 下り | D267: 宇谷東口 | E267: 柱 | F267: なし | G267: なし | H267: 2018-07 | I267: https://www.google.com/maps/@35.5060019,133.915204,3a,75y,10.12h,80.54t/data=!3m6!1e1!3m4!1s6X4Do2mLamjLZmAMPddpAA!2e0!7i13312!8i6656?hl=ja | J267: 35.505829, 133.915422 | L267: of:=MID([.J267];1;FIND(",";[.J267])-1) -> 35.505829 | M267: of:=MID([.J267];FIND(" ";[.J267])+1;LEN([.J267])) -> 133.915422 | N267: of:=IF([.A266]=[.A267];[.N266];[.N266]+1) -> 129 | O267: of:=IF([.A267]=[.D267];"";IF([.D267]="";"";"あり")) -> 
A268: 原入口 | B268: 上り橋津線 | D268: 原入口 | E268: 柱 | F268: あり | G268: あり | H268: 2018-07 | I268: https://www.google.com/maps/@35.5056476,133.9231664,3a,39.4y,168.43h,89.26t/data=!3m6!1e1!3m4!1sQQkKvnTd3Qxw5biST9mIdg!2e0!7i13312!8i6656?hl=ja | J268: 35.505606, 133.923259 | L268: of:=MID([.J268];1;FIND(",";[.J268])-1) -> 35.505606 | M268: of:=MID([.J268];FIND(" ";[.J268])+1;LEN([.J268])) -> 133.923259 | N268: of:=IF([.A267]=[.A268];[.N267];[.N267]+1) -> 130 | O268: of:=IF([.A268]=[.D268];"";IF([.D268]="";"";"あり")) -> 
A269: 原入口 | B269: 下り橋津線 | D269: 原入口 | E269: 柱 | F269: あり | G269: あり | H269: 2018-07 | I269: https://www.google.com/maps/@35.5055363,133.9258151,3a,37y,29.37h,91.32t/data=!3m6!1e1!3m4!1sESplkPYU1oC7MNKhsEwzgg!2e0!7i13312!8i6656?hl=ja | J269: 35.505617, 133.925868 | L269: of:=MID([.J269];1;FIND(",";[.J269])-1) -> 35.505617 | M269: of:=MID([.J269];FIND(" ";[.J269])+1;LEN([.J269])) -> 133.925868 | N269: of:=IF([.A268]=[.A269];[.N268];[.N268]+1) -> 130 | O269: of:=IF([.A269]=[.D269];"";IF([.D269]="";"";"あり")) -> 
A270: 原入口 | B270: 上り松崎・北方線 | D270: 原入口 | E270: 柱 | F270: なし | G270: なし | H270: 2018-08 | I270: https://www.google.com/maps/@35.5047836,133.9262279,3a,35.9y,107.86h,84.66t/data=!3m6!1e1!3m4!1sdjNcp0iuXCMRdWRu92jYBQ!2e0!7i13312!8i6656?hl=ja | J270: 35.504701, 133.926234 | L270: of:=MID([.J270];1;FIND(",";[.J270])-1) -> 35.504701 | M270: of:=MID([.J270];FIND(" ";[.J270])+1;LEN([.J270])) -> 133.926234 | N270: of:=IF([.A269]=[.A270];[.N269];[.N269]+1) -> 130
A271: 原入口 | B271: 下り松崎・北方線 | D271: 原入口 | E271: 柱 | F271: なし | G271: なし | H271: 2018-08 | I271: https://www.google.com/maps/@35.5046975,133.9262073,3a,18.8y,275.75h,86.51t/data=!3m6!1e1!3m4!1sQEtKTp0Gg_hzO8ximW-Y4g!2e0!7i13312!8i6656?hl=ja | J271: 35.504670, 133.925979 | L271: of:=MID([.J271];1;FIND(",";[.J271])-1) -> 35.504670 | M271: of:=MID([.J271];FIND(" ";[.J271])+1;LEN([.J271])) -> 133.925979 | N271: of:=IF([.A270]=[.A271];[.N270];[.N270]+1) -> 130
A272: 泊駅前 | B272: 上り | D272: 泊駅前 | E272: 柱 | F272: あり | G272: あり | H272: 2018-08 | I272: https://www.google.com/maps/@35.5095366,133.9359496,3a,60y,133.56h,90.34t/data=!3m6!1e1!3m4!1scSq3LZWycWVgQH8mGLz93A!2e0!7i13312!8i6656?hl=ja | J272: 35.509459, 133.935991 | L272: of:=MID([.J272];1;FIND(",";[.J272])-1) -> 35.509459 | M272: of:=MID([.J272];FIND(" ";[.J272])+1;LEN([.J272])) -> 133.935991 | N272: of:=IF([.A271]=[.A272];[.N271];[.N271]+1) -> 131 | O272: of:=IF([.A272]=[.D272];"";IF([.D272]="";"";"あり")) -> 
A273: 泊駅前 | B273: 下り | D273: 泊駅前 | E273: 柱 | F273: なし | G273: なし | H273: 2018-08 | I273: https://www.google.com/maps/@35.5092929,133.9358433,3a,51.9y,281.92h,82.9t/data=!3m6!1e1!3m4!1sr6JFY7XEErs80shSBz6LQg!2e0!7i13312!8i6656?hl=ja | J273: 35.509272, 133.935767 | L273: of:=MID([.J273];1;FIND(",";[.J273])-1) -> 35.509272 | M273: of:=MID([.J273];FIND(" ";[.J273])+1;LEN([.J273])) -> 133.935767 | N273: of:=IF([.A272]=[.A273];[.N272];[.N272]+1) -> 131 | O273: of:=IF([.A273]=[.D273];"";IF([.D273]="";"";"あり")) -> 
A274: 泊庁舎前 | B274: 上り | D274: 泊庁舎前 | E274: 柱 | F274: あり | G274: あり | H274: 2018-08 | I274: https://www.google.com/maps/@35.5133832,133.9400648,3a,50.9y,182.55h,90.74t/data=!3m6!1e1!3m4!1sgNRttlqsFQ4ys8TOuCI18w!2e0!7i13312!8i6656?hl=ja | J274: 35.513330, 133.940087 | L274: of:=MID([.J274];1;FIND(",";[.J274])-1) -> 35.513330 | M274: of:=MID([.J274];FIND(" ";[.J274])+1;LEN([.J274])) -> 133.940087 | N274: of:=IF([.A273]=[.A274];[.N273];[.N273]+1) -> 132 | O274: of:=IF([.A274]=[.D274];"";IF([.D274]="";"";"あり")) -> 
A275: 泊庁舎前 | B275: 下り | D275: 泊庁舎前 | E275: 柱 | F275: あり | G275: あり | H275: 2018-08 | I275: https://www.google.com/maps/@35.513211,133.9392149,3a,75y,3.04h,93.6t/data=!3m6!1e1!3m4!1sqqVqywHDpJppEppJ0J0w3g!2e0!7i13312!8i6656?hl=ja | J275: 35.513300, 133.939267 | L275: of:=MID([.J275];1;FIND(",";[.J275])-1) -> 35.513300 | M275: of:=MID([.J275];FIND(" ";[.J275])+1;LEN([.J275])) -> 133.939267 | N275: of:=IF([.A274]=[.A275];[.N274];[.N274]+1) -> 132 | O275: of:=IF([.A275]=[.D275];"";IF([.D275]="";"";"あり")) -> 
A276: 恐竜広場前 | B276: 上り | D276: 恐竜広場前 | E276: 柱 | F276: あり | G276: なし | H276: 2018-08 | I276: https://www.google.com/maps/@35.5135316,133.9448511,3a,46.3y,183.7h,96.35t/data=!3m6!1e1!3m4!1sfxT1k0g1nXZWXu9tLJNx_w!2e0!7i13312!8i6656?hl=ja | J276: 35.513429, 133.944802 | L276: of:=MID([.J276];1;FIND(",";[.J276])-1) -> 35.513429 | M276: of:=MID([.J276];FIND(" ";[.J276])+1;LEN([.J276])) -> 133.944802 | N276: of:=IF([.A275]=[.A276];[.N275];[.N275]+1) -> 133 | O276: of:=IF([.A276]=[.D276];"";IF([.D276]="";"";"あり")) -> 
A277: 恐竜広場前 | B277: 下り | D277: 恐竜広場前 | E277: 柱 | F277: あり | G277: あり | H277: 2018-08 | I277: https://www.google.com/maps/@35.5135401,133.943972,3a,53.6y,356.48h,87.47t/data=!3m6!1e1!3m4!1sp_E68B58b5lr8HvueKZrcA!2e0!7i13312!8i6656?hl=ja | J277: 35.513595, 133.943909 | L277: of:=MID([.J277];1;FIND(",";[.J277])-1) -> 35.513595 | M277: of:=MID([.J277];FIND(" ";[.J277])+1;LEN([.J277])) -> 133.943909 | N277: of:=IF([.A276]=[.A277];[.N276];[.N276]+1) -> 133 | O277: of:=IF([.A277]=[.D277];"";IF([.D277]="";"";"あり")) -> 
A278: 石脇 | B278: 上り | D278: 石脇 | E278: 柱 | F278: あり | G278: あり | H278: 2018-08 | I278: https://www.google.com/maps/@35.5138728,133.9485973,3a,75y,165.91h,80.64t/data=!3m6!1e1!3m4!1s93sri_d2Q-NOwPbi-g6kXA!2e0!7i13312!8i6656?hl=ja | J278: 35.513829, 133.948680 | L278: of:=MID([.J278];1;FIND(",";[.J278])-1) -> 35.513829 | M278: of:=MID([.J278];FIND(" ";[.J278])+1;LEN([.J278])) -> 133.948680 | N278: of:=IF([.A277]=[.A278];[.N277];[.N277]+1) -> 134 | O278: of:=IF([.A278]=[.D278];"";IF([.D278]="";"";"あり")) -> 
A279: 石脇 | B279: 下り | D279: 石脇 | E279: 柱 | F279: あり | G279: あり | H279: 2018-08 | I279: https://www.google.com/maps/@35.5139039,133.9488037,3a,75y,348.1h,91.71t/data=!3m6!1e1!3m4!1s1fv6sQuxedyXVdmNixGfMQ!2e0!7i13312!8i6656?hl=ja | J279: 35.513983, 133.948864 | L279: of:=MID([.J279];1;FIND(",";[.J279])-1) -> 35.513983 | M279: of:=MID([.J279];FIND(" ";[.J279])+1;LEN([.J279])) -> 133.948864 | N279: of:=IF([.A278]=[.A279];[.N278];[.N278]+1) -> 134 | O279: of:=IF([.A279]=[.D279];"";IF([.D279]="";"";"あり")) -> 
A280: 石脇車庫 | D280: 石脇車庫 | E280: 柱 | F280: あり | G280: なし | H280: 2018-08 | I280: https://www.google.com/maps/@35.5152915,133.9543342,3a,75y,348.5h,81.49t/data=!3m6!1e1!3m4!1sv_E6J3Q_e7LKWXUAO44HeQ!2e0!7i13312!8i6656?hl=ja | J280: 35.515364, 133.954275 | L280: of:=MID([.J280];1;FIND(",";[.J280])-1) -> 35.515364 | M280: of:=MID([.J280];FIND(" ";[.J280])+1;LEN([.J280])) -> 133.954275 | N280: of:=IF([.A279]=[.A280];[.N279];[.N279]+1) -> 135 | O280: of:=IF([.A280]=[.D280];"";IF([.D280]="";"";"あり")) -> 
A281: 小浜 | B281: 上り | D281: 小浜 | E281: 柱 | F281: あり | G281: なし | H281: 2018-08 | I281: https://www.google.com/maps/@35.5192303,133.9610809,3a,60y,161.89h,84.99t/data=!3m6!1e1!3m4!1sI58Oeq1uVCdhsW_eGzNjcQ!2e0!7i13312!8i6656?hl=ja | J281: 35.519178, 133.961096 | L281: of:=MID([.J281];1;FIND(",";[.J281])-1) -> 35.519178 | M281: of:=MID([.J281];FIND(" ";[.J281])+1;LEN([.J281])) -> 133.961096 | N281: of:=IF([.A280]=[.A281];[.N280];[.N280]+1) -> 136 | O281: of:=IF([.A281]=[.D281];"";IF([.D281]="";"";"あり")) -> 
A282: 小浜 | B282: 下り | D282: 小浜 | E282: 柱 | F282: あり | G282: なし | H282: 2018-07 | I282: https://www.google.com/maps/@35.5192303,133.9610809,3a,44.4y,269.15h,86.33t/data=!3m6!1e1!3m4!1sI58Oeq1uVCdhsW_eGzNjcQ!2e0!7i13312!8i6656?hl=ja | J282: 35.519210, 133.960993 | L282: of:=MID([.J282];1;FIND(",";[.J282])-1) -> 35.519210 | M282: of:=MID([.J282];FIND(" ";[.J282])+1;LEN([.J282])) -> 133.960993 | N282: of:=IF([.A281]=[.A282];[.N281];[.N281]+1) -> 136 | O282: of:=IF([.A282]=[.D282];"";IF([.D282]="";"";"あり")) -> 
A283: ハワイアロハホール | B283: 上り | E283: 柱 | F283: なし | G283: なし | H283: 2014-09 | I283: https://www.google.com/maps/@35.4871309,133.8643575,3a,75y,259.94h,75.17t/data=!3m6!1e1!3m4!1sRUKyC9N0fuCNrQfoMKbDOg!2e0!7i13312!8i6656?hl=ja | J283: 35.487126, 133.864336 | L283: of:=MID([.J283];1;FIND(",";[.J283])-1) -> 35.487126 | M283: of:=MID([.J283];FIND(" ";[.J283])+1;LEN([.J283])) -> 133.864336 | N283: of:=IF([.A282]=[.A283];[.N282];[.N282]+1) -> 137 | O283: of:=IF([.A283]=[.D283];"";IF([.D283]="";"";"あり")) -> 
A284: ハワイアロハホール | B284: 下り | E284: 柱 | F284: あり | G284: あり | H284: 2014-09 | I284: https://www.google.com/maps/@35.4869337,133.8643559,3a,40.5y,73.99h,89.68t/data=!3m6!1e1!3m4!1sLS-7Hl5HgRHySLqZ2UdUhQ!2e0!7i13312!8i6656?hl=ja | J284: 35.486963, 133.864455 | L284: of:=MID([.J284];1;FIND(",";[.J284])-1) -> 35.486963 | M284: of:=MID([.J284];FIND(" ";[.J284])+1;LEN([.J284])) -> 133.864455 | N284: of:=IF([.A283]=[.A284];[.N283];[.N283]+1) -> 137 | O284: of:=IF([.A284]=[.D284];"";IF([.D284]="";"";"あり")) -> 
A285: 長江入口 | B285: 上り | E285: なし | F285: なし | G285: なし | H285: 2014-09 | J285: 35.483418, 133.867364 | L285: of:=MID([.J285];1;FIND(",";[.J285])-1) -> 35.483418 | M285: of:=MID([.J285];FIND(" ";[.J285])+1;LEN([.J285])) -> 133.867364 | N285: of:=IF([.A284]=[.A285];[.N284];[.N284]+1) -> 138 | O285: of:=IF([.A285]=[.D285];"";IF([.D285]="";"";"あり")) -> 
A286: 長江入口 | B286: 下り | D286: 長江入口 | E286: 柱 | F286: なし | G286: なし | H286: 2014-09 | I286: https://www.google.com/maps/@35.4833603,133.8673118,3a,41.7y,24.3h,85.94t/data=!3m6!1e1!3m4!1sTtXy8AGjj_ZABKmE_im8fw!2e0!7i13312!8i6656?hl=ja | J286: 35.483418, 133.867364 | L286: of:=MID([.J286];1;FIND(",";[.J286])-1) -> 35.483418 | M286: of:=MID([.J286];FIND(" ";[.J286])+1;LEN([.J286])) -> 133.867364 | N286: of:=IF([.A285]=[.A286];[.N285];[.N285]+1) -> 138 | O286: of:=IF([.A286]=[.D286];"";IF([.D286]="";"";"あり")) -> 
A287: 上浅津入口 | B287: 上り | D287: 上浅津入口 | E287: 柱 | F287: なし | G287: なし | H287: 2014-09 | I287: https://www.google.com/maps/@35.4818558,133.876488,3a,63.5y,204.87h,81.93t/data=!3m6!1e1!3m4!1sGzMV5Nyk37W1OMikiW4nuw!2e0!7i13312!8i6656?hl=ja | J287: 35.481814, 133.876462 | L287: of:=MID([.J287];1;FIND(",";[.J287])-1) -> 35.481814 | M287: of:=MID([.J287];FIND(" ";[.J287])+1;LEN([.J287])) -> 133.876462 | N287: of:=IF([.A286]=[.A287];[.N286];[.N286]+1) -> 139 | O287: of:=IF([.A287]=[.D287];"";IF([.D287]="";"";"あり")) -> 
A288: 上浅津入口 | B288: 下り | D288: 上浅津入口 | E288: 柱 | F288: なし | G288: なし | H288: 2014-09 | I288: https://www.google.com/maps/@35.4818558,133.876488,3a,60y,25.11h,83.83t/data=!3m6!1e1!3m4!1sGzMV5Nyk37W1OMikiW4nuw!2e0!7i13312!8i6656?hl=ja | J288: 35.481927, 133.876540 | L288: of:=MID([.J288];1;FIND(",";[.J288])-1) -> 35.481927 | M288: of:=MID([.J288];FIND(" ";[.J288])+1;LEN([.J288])) -> 133.876540 | N288: of:=IF([.A287]=[.A288];[.N287];[.N287]+1) -> 139 | O288: of:=IF([.A288]=[.D288];"";IF([.D288]="";"";"あり")) -> 
A289: 上浅津 | B289: 上り | D289: 上浅津 | E289: 柱 | F289: あり | G289: あり | H289: 2018-08 | I289: https://www.google.com/maps/@35.481169,133.8786998,3a,57.5y,202.55h,93.68t/data=!3m6!1e1!3m4!1s2Ked6rR5Z0wHgpSScXb2Nw!2e0!7i13312!8i6656?hl=ja | J289: 35.481081, 133.878670 | L289: of:=MID([.J289];1;FIND(",";[.J289])-1) -> 35.481081 | M289: of:=MID([.J289];FIND(" ";[.J289])+1;LEN([.J289])) -> 133.878670 | N289: of:=IF([.A288]=[.A289];[.N288];[.N288]+1) -> 140 | O289: of:=IF([.A289]=[.D289];"";IF([.D289]="";"";"あり")) -> 
A290: 上浅津 | B290: 下り | D290: 上浅津 | E290: 柱 | F290: なし | G290: なし | H290: 2018-08 | I290: https://www.google.com/maps/@35.4811352,133.8787939,3a,75y,47.96h,74.56t/data=!3m6!1e1!3m4!1sdfXyihR89qA9hAyt3ugmHA!2e0!7i13312!8i6656?hl=ja | J290: 35.481124, 133.878857 | L290: of:=MID([.J290];1;FIND(",";[.J290])-1) -> 35.481124 | M290: of:=MID([.J290];FIND(" ";[.J290])+1;LEN([.J290])) -> 133.878857 | N290: of:=IF([.A289]=[.A290];[.N289];[.N289]+1) -> 140 | O290: of:=IF([.A290]=[.D290];"";IF([.D290]="";"";"あり")) -> 
A291: はわい温泉 | E291: 柱 | F291: なし | G291: なし | H291: 2018-08 | I291: https://www.google.com/maps/@35.4780699,133.8839533,3a,75y,259.72h,89.82t/data=!3m6!1e1!3m4!1swzyuOwSwNk18I0XX8bs4xg!2e0!7i13312!8i6656?hl=ja | J291: 35.478054, 133.883885 | L291: of:=MID([.J291];1;FIND(",";[.J291])-1) -> 35.478054 | M291: of:=MID([.J291];FIND(" ";[.J291])+1;LEN([.J291])) -> 133.883885 | N291: of:=IF([.A290]=[.A291];[.N290];[.N290]+1) -> 141 | O291: of:=IF([.A291]=[.D291];"";IF([.D291]="";"";"あり")) -> 
A292: ハワイゆ～たうん前 | B292: 上り | E292: 柱 | F292: なし | G292: なし | H292: 2018-08 | I292: https://www.google.com/maps/@35.482411,133.8813607,3a,75y,138.73h,81.93t/data=!3m6!1e1!3m4!1s_yxS2VcEkpgGWGYlUuGVnw!2e0!7i13312!8i6656?hl=ja | J292: 35.482339, 133.881392 | L292: of:=MID([.J292];1;FIND(",";[.J292])-1) -> 35.482339 | M292: of:=MID([.J292];FIND(" ";[.J292])+1;LEN([.J292])) -> 133.881392 | N292: of:=IF([.A291]=[.A292];[.N291];[.N291]+1) -> 142 | O292: of:=IF([.A292]=[.D292];"";IF([.D292]="";"";"あり")) -> 
A293: ハワイゆ～たうん前 | B293: 下り | D293: ハワイゆーたうん前 | E293: 柱 | F293: なし | G293: なし | H293: 2018-08 | I293: https://www.google.com/maps/@35.4824961,133.8813657,3a,46.4y,287.67h,86.01t/data=!3m7!1e1!3m5!1sacBvWk1oJRo_6SyS4013rg!2e0!5s20180801T000000!7i13312!8i6656?hl=ja | J293: 35.482485, 133.881265 | L293: of:=MID([.J293];1;FIND(",";[.J293])-1) -> 35.482485 | M293: of:=MID([.J293];FIND(" ";[.J293])+1;LEN([.J293])) -> 133.881265 | N293: of:=IF([.A292]=[.A293];[.N292];[.N292]+1) -> 142 | O293: of:=IF([.A293]=[.D293];"";IF([.D293]="";"";"あり")) -> あり
A294: 運転免許試験場 | E294: 柱 | F294: あり | G294: なし | H294: 2014-09 | I294: https://www.google.com/maps/@35.4851313,133.8817395,3a,17y,210.01h,90.57t/data=!3m6!1e1!3m4!1scpKXVgypxQ-YcR0Z61MbqA!2e0!7i13312!8i6656?hl=ja | J294: 35.484809, 133.881523 | L294: of:=MID([.J294];1;FIND(",";[.J294])-1) -> 35.484809 | M294: of:=MID([.J294];FIND(" ";[.J294])+1;LEN([.J294])) -> 133.881523 | N294: of:=IF([.A293]=[.A294];[.N293];[.N293]+1) -> 143 | O294: of:=IF([.A294]=[.D294];"";IF([.D294]="";"";"あり")) -> 
A295: 臨海公園前 | B295: 上り | D295: 臨海公園前 | E295: 柱 | F295: なし | G295: なし | H295: 2018-08 | I295: https://www.google.com/maps/@35.4877844,133.8831865,3a,41.7y,90.29h,86.81t/data=!3m6!1e1!3m4!1soyPphe31lHjniu9fJq7ddg!2e0!7i13312!8i6656?hl=ja | J295: 35.487733, 133.883293 | L295: of:=MID([.J295];1;FIND(",";[.J295])-1) -> 35.487733 | M295: of:=MID([.J295];FIND(" ";[.J295])+1;LEN([.J295])) -> 133.883293 | N295: of:=IF([.A294]=[.A295];[.N294];[.N294]+1) -> 144 | O295: of:=IF([.A295]=[.D295];"";IF([.D295]="";"";"あり")) -> 
A296: 臨海公園前 | B296: 下り | D296: 臨海公園前 | E296: 柱 | F296: なし | G296: なし | H296: 2018-08 | I296: https://www.google.com/maps/@35.4875272,133.8831306,3a,18.2y,280.59h,87.1t/data=!3m6!1e1!3m4!1scIMNPs4ZS3r_V8Yy2FN4ew!2e0!7i13312!8i6656?hl=ja | J296: 35.487488, 133.883078 | L296: of:=MID([.J296];1;FIND(",";[.J296])-1) -> 35.487488 | M296: of:=MID([.J296];FIND(" ";[.J296])+1;LEN([.J296])) -> 133.883078 | N296: of:=IF([.A295]=[.A296];[.N295];[.N295]+1) -> 144 | O296: of:=IF([.A296]=[.D296];"";IF([.D296]="";"";"あり")) -> 
A297: 羽合ひかり園前 | B297: 上り | D297: 羽合ひかり園前 | E297: 柱 | F297: なし | G297: なし | H297: 2018-08 | I297: https://www.google.com/maps/@35.490953,133.8838017,3a,41.7y,124.27h,86.25t/data=!3m6!1e1!3m4!1st-5i_64LfPbrIYPs3yRAew!2e0!7i13312!8i6656?hl=ja | J297: 35.490867, 133.883850 | L297: of:=MID([.J297];1;FIND(",";[.J297])-1) -> 35.490867 | M297: of:=MID([.J297];FIND(" ";[.J297])+1;LEN([.J297])) -> 133.883850 | N297: of:=IF([.A296]=[.A297];[.N296];[.N296]+1) -> 145 | O297: of:=IF([.A297]=[.D297];"";IF([.D297]="";"";"あり")) -> 
A298: 羽合ひかり園前 | B298: 下り | D298: 羽合ひかり園前 | E298: 柱 | F298: なし | G298: なし | H298: 2018-08 | I298: https://www.google.com/maps/@35.4908588,133.8837848,3a,27.3y,304.02h,92.94t/data=!3m6!1e1!3m4!1sRBsU5gjjUGdYptvSnBMWsw!2e0!7i13312!8i6656?hl=ja | J298: 35.490888, 133.883675 | L298: of:=MID([.J298];1;FIND(",";[.J298])-1) -> 35.490888 | M298: of:=MID([.J298];FIND(" ";[.J298])+1;LEN([.J298])) -> 133.883675 | N298: of:=IF([.A297]=[.A298];[.N297];[.N297]+1) -> 145 | O298: of:=IF([.A298]=[.D298];"";IF([.D298]="";"";"あり")) -> 
A299: 衛生環境研究所前 | B299: 上り | D299: 衛生環境研究所前 | E299: 柱 | F299: なし | G299: なし | H299: 2014-09 | I299: https://www.google.com/maps/@35.4929588,133.8850633,3a,75y,32.58h,80.1t/data=!3m6!1e1!3m4!1sj4XaUyBV3UBxOQ0zpQNdbw!2e0!7i13312!8i6656?hl=ja | J299: 35.493015, 133.885065 | L299: of:=MID([.J299];1;FIND(",";[.J299])-1) -> 35.493015 | M299: of:=MID([.J299];FIND(" ";[.J299])+1;LEN([.J299])) -> 133.885065 | N299: of:=IF([.A298]=[.A299];[.N298];[.N298]+1) -> 146 | O299: of:=IF([.A299]=[.D299];"";IF([.D299]="";"";"あり")) -> 
A300: 衛生環境研究所前 | B300: 下り | E300: なし | F300: なし | G300: なし | H300: 2014-09 | J300: 35.493015, 133.885065 | L300: of:=MID([.J300];1;FIND(",";[.J300])-1) -> 35.493015 | M300: of:=MID([.J300];FIND(" ";[.J300])+1;LEN([.J300])) -> 133.885065 | N300: of:=IF([.A299]=[.A300];[.N299];[.N299]+1) -> 146 | O300: of:=IF([.A300]=[.D300];"";IF([.D300]="";"";"あり")) -> 
A301: 南谷大橋南側 | B301: 上り | D301: 南谷大橋南側 | E301: 柱 | F301: なし | G301: なし | H301: 2014-09 | I301: https://www.google.com/maps/@35.4947826,133.880701,3a,50.9y,73.07h,87.98t/data=!3m6!1e1!3m4!1sFN9rczp-xFf7_DhOQox6-w!2e0!7i13312!8i6656?hl=ja | J301: 35.494810, 133.880795 | L301: of:=MID([.J301];1;FIND(",";[.J301])-1) -> 35.494810 | M301: of:=MID([.J301];FIND(" ";[.J301])+1;LEN([.J301])) -> 133.880795 | N301: of:=IF([.A300]=[.A301];[.N300];[.N300]+1) -> 147 | O301: of:=IF([.A301]=[.D301];"";IF([.D301]="";"";"あり")) -> 
A302: 南谷大橋南側 | B302: 下り | E302: なし | F302: なし | G302: なし | H302: 2014-09 | J302: 35.494810, 133.880795 | L302: of:=MID([.J302];1;FIND(",";[.J302])-1) -> 35.494810 | M302: of:=MID([.J302];FIND(" ";[.J302])+1;LEN([.J302])) -> 133.880795 | N302: of:=IF([.A301]=[.A302];[.N301];[.N301]+1) -> 147 | O302: of:=IF([.A302]=[.D302];"";IF([.D302]="";"";"あり")) -> 
A303: 上橋津 | B303: 上り | D303: 上橋津 | E303: 柱 | F303: なし | G303: なし | H303: 2014-09 | I303: https://www.google.com/maps/@35.4975292,133.87828,3a,39.9y,91.4h,83.37t/data=!3m6!1e1!3m4!1s1Jj8N92SWu6qHYDVl77xWg!2e0!7i13312!8i6656?hl=ja | J303: 35.497525, 133.878381 | L303: of:=MID([.J303];1;FIND(",";[.J303])-1) -> 35.497525 | M303: of:=MID([.J303];FIND(" ";[.J303])+1;LEN([.J303])) -> 133.878381 | N303: of:=IF([.A302]=[.A303];[.N302];[.N302]+1) -> 148 | O303: of:=IF([.A303]=[.D303];"";IF([.D303]="";"";"あり")) -> 
A304: 上橋津 | B304: 下り | E304: なし | F304: なし | G304: なし | H304: 2014-09 | J304: 35.497525, 133.878381 | L304: of:=MID([.J304];1;FIND(",";[.J304])-1) -> 35.497525 | M304: of:=MID([.J304];FIND(" ";[.J304])+1;LEN([.J304])) -> 133.878381 | N304: of:=IF([.A303]=[.A304];[.N303];[.N303]+1) -> 148 | O304: of:=IF([.A304]=[.D304];"";IF([.D304]="";"";"あり")) -> 
A305: 橋津藩倉入口 | B305: 上り | D305: 橋津藩倉入口 | E305: 柱 | F305: なし | G305: なし | H305: 2014-09 | I305: https://www.google.com/maps/@35.5009781,133.8760265,3a,66.9y,56.49h,74.45t/data=!3m6!1e1!3m4!1sccbksnryasBg5JW2qhnBkw!2e0!7i13312!8i6656?hl=ja | J305: 35.500993, 133.876066 | L305: of:=MID([.J305];1;FIND(",";[.J305])-1) -> 35.500993 | M305: of:=MID([.J305];FIND(" ";[.J305])+1;LEN([.J305])) -> 133.876066 | N305: of:=IF([.A304]=[.A305];[.N304];[.N304]+1) -> 149 | O305: of:=IF([.A305]=[.D305];"";IF([.D305]="";"";"あり")) -> 
A306: 橋津藩倉入口 | B306: 下り | E306: なし | F306: なし | G306: なし | H306: 2014-09 | J306: 35.500993, 133.876066 | L306: of:=MID([.J306];1;FIND(",";[.J306])-1) -> 35.500993 | M306: of:=MID([.J306];FIND(" ";[.J306])+1;LEN([.J306])) -> 133.876066 | N306: of:=IF([.A305]=[.A306];[.N305];[.N305]+1) -> 149 | O306: of:=IF([.A306]=[.D306];"";IF([.D306]="";"";"あり")) -> 
A307: 上井町一丁目東 | B307: 上り | D307: 上井一丁目東 | E307: 柱 | F307: なし | G307: あり | H307: 2018-08 | I307: https://www.google.com/maps/@35.4527427,133.8522175,3a,57y,200.29h,84.53t/data=!3m6!1e1!3m4!1s_YOIbywYsRe4znUoEtlNgA!2e0!7i13312!8i6656?hl=ja | J307: 35.452703, 133.852186 | L307: of:=MID([.J307];1;FIND(",";[.J307])-1) -> 35.452703 | M307: of:=MID([.J307];FIND(" ";[.J307])+1;LEN([.J307])) -> 133.852186 | N307: of:=IF([.A306]=[.A307];[.N306];[.N306]+1) -> 150 | O307: of:=IF([.A307]=[.D307];"";IF([.D307]="";"";"あり")) -> あり
A308: 上井町一丁目東 | B308: 下り | D308: 上井一丁目東 | E308: 柱 | F308: なし | G308: なし | H308: 2018-08 | I308: https://www.google.com/maps/@35.4527427,133.8522175,3a,60y,90t/data=!3m6!1e1!3m4!1s_YOIbywYsRe4znUoEtlNgA!2e0!7i13312!8i6656?hl=ja | J308: 35.452804, 133.852228 | L308: of:=MID([.J308];1;FIND(",";[.J308])-1) -> 35.452804 | M308: of:=MID([.J308];FIND(" ";[.J308])+1;LEN([.J308])) -> 133.852228 | N308: of:=IF([.A307]=[.A308];[.N307];[.N307]+1) -> 150 | O308: of:=IF([.A308]=[.D308];"";IF([.D308]="";"";"あり")) -> あり
A309: 山根入口 | B309: 上り | D309: 山根入口 | E309: 柱 | F309: なし | G309: なし | H309: 2018-08 | I309: https://www.google.com/maps/@35.4526784,133.8545751,3a,75y,180.45h,80.55t/data=!3m6!1e1!3m4!1sMAp9ZLx8yAHyuOqYakU2uw!2e0!7i13312!8i6656?hl=ja | J309: 35.452645, 133.854564 | L309: of:=MID([.J309];1;FIND(",";[.J309])-1) -> 35.452645 | M309: of:=MID([.J309];FIND(" ";[.J309])+1;LEN([.J309])) -> 133.854564 | N309: of:=IF([.A308]=[.A309];[.N308];[.N308]+1) -> 151 | O309: of:=IF([.A309]=[.D309];"";IF([.D309]="";"";"あり")) -> 
A310: 山根入口 | B310: 下り | D310: 山根入口 | E310: 柱 | F310: なし | G310: なし | H310: 2018-08 | I310: https://www.google.com/maps/@35.4526854,133.8547163,3a,25.2y,333.66h,88.39t/data=!3m6!1e1!3m4!1sHYO9EhJT7YvgHZylYk9tUg!2e0!7i13312!8i6656?hl=ja | J310: 35.452769, 133.854664 | L310: of:=MID([.J310];1;FIND(",";[.J310])-1) -> 35.452769 | M310: of:=MID([.J310];FIND(" ";[.J310])+1;LEN([.J310])) -> 133.854664 | N310: of:=IF([.A309]=[.A310];[.N309];[.N309]+1) -> 151 | O310: of:=IF([.A310]=[.D310];"";IF([.D310]="";"";"あり")) -> 
A311: 倉吉病院前 | B311: 上り | D311: 倉吉病院前 | E311: 柱 | F311: なし | G311: なし | H311: 2018-08 | I311: https://www.google.com/maps/@35.452944,133.8572113,3a,54.5y,152.51h,89.57t/data=!3m6!1e1!3m4!1s4xHwSEww8tRHZJb4mc1AcQ!2e0!7i13312!8i6656?hl=ja | J311: 35.452939, 133.857221 | L311: of:=MID([.J311];1;FIND(",";[.J311])-1) -> 35.452939 | M311: of:=MID([.J311];FIND(" ";[.J311])+1;LEN([.J311])) -> 133.857221 | N311: of:=IF([.A310]=[.A311];[.N310];[.N310]+1) -> 152 | O311: of:=IF([.A311]=[.D311];"";IF([.D311]="";"";"あり")) -> 
A312: 倉吉病院前 | B312: 下り | E312: 柱 | F312: なし | G312: なし | H312: 2018-08 | I312: https://www.google.com/maps/@35.452944,133.8572113,3a,75y,9.68h,90.43t/data=!3m6!1e1!3m4!1s4xHwSEww8tRHZJb4mc1AcQ!2e0!7i13312!8i6656?hl=ja | J312: 35.453038, 133.857207 | L312: of:=MID([.J312];1;FIND(",";[.J312])-1) -> 35.453038 | M312: of:=MID([.J312];FIND(" ";[.J312])+1;LEN([.J312])) -> 133.857207 | N312: of:=IF([.A311]=[.A312];[.N311];[.N311]+1) -> 152 | O312: of:=IF([.A312]=[.D312];"";IF([.D312]="";"";"あり")) -> 
A313: 佐美 | B313: 上り | D313: 佐美 | E313: 柱 | F313: あり | G313: あり | H313: 2018-08 | I313: https://www.google.com/maps/@35.4533008,133.8648425,3a,47.4y,183.49h,91.81t/data=!3m6!1e1!3m4!1smia1vCEXPA-JbKFRaCdaTw!2e0!7i13312!8i6656?hl=ja | J313: 35.453233, 133.864812 | L313: of:=MID([.J313];1;FIND(",";[.J313])-1) -> 35.453233 | M313: of:=MID([.J313];FIND(" ";[.J313])+1;LEN([.J313])) -> 133.864812 | N313: of:=IF([.A312]=[.A313];[.N312];[.N312]+1) -> 153 | O313: of:=IF([.A313]=[.D313];"";IF([.D313]="";"";"あり")) -> 
A314: 佐美 | B314: 下り | E314: なし | F314: なし | G314: なし | H314: 2018-08 | J314: 35.453233, 133.864812 | L314: of:=MID([.J314];1;FIND(",";[.J314])-1) -> 35.453233 | M314: of:=MID([.J314];FIND(" ";[.J314])+1;LEN([.J314])) -> 133.864812 | N314: of:=IF([.A313]=[.A314];[.N313];[.N313]+1) -> 153 | O314: of:=IF([.A314]=[.D314];"";IF([.D314]="";"";"あり")) -> 
A315: 埴見入口 | B315: 上り | D315: 埴見入口 | E315: 柱 | F315: あり | G315: あり | H315: 2018-08 | I315: https://www.google.com/maps/@35.4564102,133.8702651,3a,48.3y,68.53h,89.35t/data=!3m6!1e1!3m4!1si8vNqeroE67DX56R3ZFRLQ!2e0!7i13312!8i6656?hl=ja | J315: 35.456448, 133.870356 | L315: of:=MID([.J315];1;FIND(",";[.J315])-1) -> 35.456448 | M315: of:=MID([.J315];FIND(" ";[.J315])+1;LEN([.J315])) -> 133.870356 | N315: of:=IF([.A314]=[.A315];[.N314];[.N314]+1) -> 154 | O315: of:=IF([.A315]=[.D315];"";IF([.D315]="";"";"あり")) -> 
A316: 埴身入口 | B316: 下り | D316: 埴見入口 | E316: 柱 | F316: なし | G316: なし | H316: 2018-08 | I316: https://www.google.com/maps/@35.4562103,133.8701332,3a,21.2y,311.84h,87.14t/data=!3m6!1e1!3m4!1sq_dmVnDYOkTBL28j_RtGvw!2e0!7i13312!8i6656?hl=ja | J316: 35.456270, 133.870052 | L316: of:=MID([.J316];1;FIND(",";[.J316])-1) -> 35.456270 | M316: of:=MID([.J316];FIND(" ";[.J316])+1;LEN([.J316])) -> 133.870052 | N316: of:=IF([.A315]=[.A316];[.N315];[.N315]+1) -> 155 | O316: of:=IF([.A316]=[.D316];"";IF([.D316]="";"";"あり")) -> あり
A317: 長和田 | B317: 上り | D317: 長和田 | E317: 柱 | F317: あり | G317: あり | H317: 2018-08 | I317: https://www.google.com/maps/@35.4615866,133.8781138,3a,16y,145.42h,88.23t/data=!3m6!1e1!3m4!1sqdPrkgbMYvv_NVdGARu6vw!2e0!7i13312!8i6656?hl=ja | J317: 35.461523, 133.878191 | L317: of:=MID([.J317];1;FIND(",";[.J317])-1) -> 35.461523 | M317: of:=MID([.J317];FIND(" ";[.J317])+1;LEN([.J317])) -> 133.878191 | N317: of:=IF([.A316]=[.A317];[.N316];[.N316]+1) -> 156 | O317: of:=IF([.A317]=[.D317];"";IF([.D317]="";"";"あり")) -> 
A318: 長和田 | B318: 下り | D318: 長和田 | E318: 柱 | F318: なし | G318: なし | H318: 2018-08 | I318: https://www.google.com/maps/@35.4613704,133.8778051,3a,30.2y,332.51h,85.3t/data=!3m6!1e1!3m4!1s-ioTZATKY2WiM6xgqKLbUg!2e0!7i13312!8i6656?hl=ja | J318: 35.461460, 133.877815 | L318: of:=MID([.J318];1;FIND(",";[.J318])-1) -> 35.461460 | M318: of:=MID([.J318];FIND(" ";[.J318])+1;LEN([.J318])) -> 133.877815 | N318: of:=IF([.A317]=[.A318];[.N317];[.N317]+1) -> 156 | O318: of:=IF([.A318]=[.D318];"";IF([.D318]="";"";"あり")) -> 
A319: 野花 | B319: 上り | E319: 柱 | F319: なし | G319: なし | H319: 2018-08 | I319: https://www.google.com/maps/@35.4624191,133.8887032,3a,50.9y,204.19h,85.17t/data=!3m6!1e1!3m4!1siF_J7Pl8Y9iGrmoFxWbJZA!2e0!7i13312!8i6656?hl=ja | J319: 35.462410, 133.888396 | L319: of:=MID([.J319];1;FIND(",";[.J319])-1) -> 35.462410 | M319: of:=MID([.J319];FIND(" ";[.J319])+1;LEN([.J319])) -> 133.888396 | N319: of:=IF([.A318]=[.A319];[.N318];[.N318]+1) -> 157 | O319: of:=IF([.A319]=[.D319];"";IF([.D319]="";"";"あり")) -> 
A320: 野花 | B320: 下り | E320: 柱 | F320: なし | G320: なし | H320: 2018-08 | I320: https://www.google.com/maps/@35.4624137,133.888567,3a,75y,13.19h,83.47t/data=!3m6!1e1!3m4!1sEZfjqArdSM6aNmq8dWPTzQ!2e0!7i13312!8i6656?hl=ja | J320: 35.462540, 133.888374 | L320: of:=MID([.J320];1;FIND(",";[.J320])-1) -> 35.462540 | M320: of:=MID([.J320];FIND(" ";[.J320])+1;LEN([.J320])) -> 133.888374 | N320: of:=IF([.A319]=[.A320];[.N319];[.N319]+1) -> 157 | O320: of:=IF([.A320]=[.D320];"";IF([.D320]="";"";"あり")) -> 
A321: 引地 | B321: 上り | D321: 引地 | E321: 柱 | F321: あり | G321: あり | H321: 2018-08 | I321: https://www.google.com/maps/@35.4638053,133.8943901,3a,43.8y,130.37h,87.64t/data=!3m6!1e1!3m4!1snH5636oF-IRaiWqWzdQX_g!2e0!7i13312!8i6656?hl=ja | J321: 35.463780, 133.894537 | L321: of:=MID([.J321];1;FIND(",";[.J321])-1) -> 35.463780 | M321: of:=MID([.J321];FIND(" ";[.J321])+1;LEN([.J321])) -> 133.894537 | N321: of:=IF([.A320]=[.A321];[.N320];[.N320]+1) -> 158 | O321: of:=IF([.A321]=[.D321];"";IF([.D321]="";"";"あり")) -> 
A322: 引地 | B322: 下り | D322: 引地 | E322: 柱 | F322: なし | G322: なし | H322: 2018-08 | I322: https://www.google.com/maps/@35.4640109,133.8947459,3a,51y,338.05h,89.88t/data=!3m6!1e1!3m4!1s9d4ueCpuvgF-QUtla4Vatg!2e0!7i13312!8i6656?hl=ja | J322: 35.464095, 133.894779 | L322: of:=MID([.J322];1;FIND(",";[.J322])-1) -> 35.464095 | M322: of:=MID([.J322];FIND(" ";[.J322])+1;LEN([.J322])) -> 133.894779 | N322: of:=IF([.A321]=[.A322];[.N321];[.N321]+1) -> 158 | O322: of:=IF([.A322]=[.D322];"";IF([.D322]="";"";"あり")) -> 
A323: 東郷橋 | B323: 上り | D323: 東郷橋 | E323: 柱 | F323: なし | G323: なし | H323: 2018-08 | I323: https://www.google.com/maps/@35.4655897,133.8969353,3a,47.1y,166.08h,86.23t/data=!3m6!1e1!3m4!1sSxrNah7bD0NBnqEbmeaTsg!2e0!7i13312!8i6656?hl=ja | J323: 35.465507, 133.896949 | L323: of:=MID([.J323];1;FIND(",";[.J323])-1) -> 35.465507 | M323: of:=MID([.J323];FIND(" ";[.J323])+1;LEN([.J323])) -> 133.896949 | N323: of:=IF([.A322]=[.A323];[.N322];[.N322]+1) -> 159 | O323: of:=IF([.A323]=[.D323];"";IF([.D323]="";"";"あり")) -> 
A324: 東郷橋 | B324: 下り | D324: 東郷橋 | E324: 柱 | F324: なし | G324: なし | H324: 2018-08 | I324: https://www.google.com/maps/@35.465375,133.8966798,3a,60y,21.94h,86.28t/data=!3m6!1e1!3m4!1skZyhAS02te-Wjbzc6-Xljw!2e0!7i13312!8i6656?hl=ja | J324: 35.465440, 133.896682 | L324: of:=MID([.J324];1;FIND(",";[.J324])-1) -> 35.465440 | M324: of:=MID([.J324];FIND(" ";[.J324])+1;LEN([.J324])) -> 133.896682 | N324: of:=IF([.A323]=[.A324];[.N323];[.N323]+1) -> 159 | O324: of:=IF([.A324]=[.D324];"";IF([.D324]="";"";"あり")) -> 
A325: 松崎駅前 | B325: 上り | D325: 松崎駅前 | E325: 柱 | F325: なし | G325: なし | H325: 2018-08 | I325: https://www.google.com/maps/@35.4692795,133.900541,3a,47.2y,152.39h,86.87t/data=!3m6!1e1!3m4!1sl0eA3wz_d1tP0AfT7XzQqw!2e0!7i13312!8i6656?hl=ja | J325: 35.469228, 133.900597 | L325: of:=MID([.J325];1;FIND(",";[.J325])-1) -> 35.469228 | M325: of:=MID([.J325];FIND(" ";[.J325])+1;LEN([.J325])) -> 133.900597 | N325: of:=IF([.A324]=[.A325];[.N324];[.N324]+1) -> 160 | O325: of:=IF([.A325]=[.D325];"";IF([.D325]="";"";"あり")) -> 
A326: 松崎駅前 | B326: 下り | D326: 松崎駅前 | E326: 柱 | F326: なし | G326: あり | H326: 2018-08 | I326: https://www.google.com/maps/@35.4694232,133.9008838,3a,60y,34.52h,85.29t/data=!3m6!1e1!3m4!1s2b-7WShKyeNzjZq0MeFulA!2e0!7i13312!8i6656?hl=ja | J326: 35.469466, 133.900910 | L326: of:=MID([.J326];1;FIND(",";[.J326])-1) -> 35.469466 | M326: of:=MID([.J326];FIND(" ";[.J326])+1;LEN([.J326])) -> 133.900910 | N326: of:=IF([.A325]=[.A326];[.N325];[.N325]+1) -> 160 | O326: of:=IF([.A326]=[.D326];"";IF([.D326]="";"";"あり")) -> 
A327: 松崎幼稚園入口 | B327: 上り | D327: 幼稚園入口 | E327: 柱 | F327: なし | G327: なし | H327: 2018-08 | I327: https://www.google.com/maps/@35.4728673,133.9037336,3a,24.9y,134.08h,88.53t/data=!3m6!1e1!3m4!1siQahW14ERVNebTaHwfLqVg!2e0!7i13312!8i6656?hl=ja | J327: 35.472788, 133.903998 | L327: of:=MID([.J327];1;FIND(",";[.J327])-1) -> 35.472788 | M327: of:=MID([.J327];FIND(" ";[.J327])+1;LEN([.J327])) -> 133.903998 | N327: of:=IF([.A326]=[.A327];[.N326];[.N326]+1) -> 161 | O327: of:=IF([.A327]=[.D327];"";IF([.D327]="";"";"あり")) -> あり
A328: 松崎幼稚園入口 | B328: 下り | D328: 幼稚園入口 | E328: 柱 | F328: なし | G328: なし | H328: 2018-08 | I328: https://www.google.com/maps/@35.4729476,133.9037654,3a,51.3y,320.99h,88.24t/data=!3m6!1e1!3m4!1skAoo7Jpns6Jw27BTt5S_Ig!2e0!7i13312!8i6656?hl=ja | J328: 35.472996, 133.903916 | L328: of:=MID([.J328];1;FIND(",";[.J328])-1) -> 35.472996 | M328: of:=MID([.J328];FIND(" ";[.J328])+1;LEN([.J328])) -> 133.903916 | N328: of:=IF([.A327]=[.A328];[.N327];[.N327]+1) -> 161 | O328: of:=IF([.A328]=[.D328];"";IF([.D328]="";"";"あり")) -> あり
A329: 藤津入口 | B329: 上り | D329: 藤津入口 | E329: 柱 | F329: あり | G329: あり | H329: 2014-09 | I329: https://www.google.com/maps/@35.4759639,133.9056134,3a,53y,329.56h,82.85t/data=!3m6!1e1!3m4!1shIwsJEm8hMbka83EDmRyMg!2e0!7i13312!8i6656?hl=ja | J329: 35.476049, 133.905549 | L329: of:=MID([.J329];1;FIND(",";[.J329])-1) -> 35.476049 | M329: of:=MID([.J329];FIND(" ";[.J329])+1;LEN([.J329])) -> 133.905549 | N329: of:=IF([.A328]=[.A329];[.N328];[.N328]+1) -> 162 | O329: of:=IF([.A329]=[.D329];"";IF([.D329]="";"";"あり")) -> 
A330: 藤津入口 | B330: 下り | E330: なし | F330: なし | G330: なし | H330: 2014-09 | J330: 35.476049, 133.905549 | L330: of:=MID([.J330];1;FIND(",";[.J330])-1) -> 35.476049 | M330: of:=MID([.J330];FIND(" ";[.J330])+1;LEN([.J330])) -> 133.905549 | N330: of:=IF([.A329]=[.A330];[.N329];[.N329]+1) -> 162 | O330: of:=IF([.A330]=[.D330];"";IF([.D330]="";"";"あり")) -> 
A331: 白石入口 | B331: 上り | D331: 白石入口 | E331: 柱 | F331: あり | G331: なし | H331: 2018-08 | I331: https://www.google.com/maps/@35.4801154,133.9169509,3a,44.6y,146.24h,91t/data=!3m6!1e1!3m4!1smIN8u4ays-UQ0MnmZLN6cw!2e0!7i13312!8i6656?hl=ja | J331: 35.480036, 133.916953 | L331: of:=MID([.J331];1;FIND(",";[.J331])-1) -> 35.480036 | M331: of:=MID([.J331];FIND(" ";[.J331])+1;LEN([.J331])) -> 133.916953 | N331: of:=IF([.A330]=[.A331];[.N330];[.N330]+1) -> 163 | O331: of:=IF([.A331]=[.D331];"";IF([.D331]="";"";"あり")) -> 
A332: 白石入口 | B332: 下り | E332: なし | F332: なし | G332: なし | H332: 2018-08 | J332: 35.480036, 133.916953 | L332: of:=MID([.J332];1;FIND(",";[.J332])-1) -> 35.480036 | M332: of:=MID([.J332];FIND(" ";[.J332])+1;LEN([.J332])) -> 133.916953 | N332: of:=IF([.A331]=[.A332];[.N331];[.N331]+1) -> 163 | O332: of:=IF([.A332]=[.D332];"";IF([.D332]="";"";"あり")) -> 
A333: 舎人 | B333: 上り | D333: 舎人 | E333: 柱 | F333: なし | G333: なし | H333: 2018-08 | I333: https://www.google.com/maps/@35.4816075,133.918649,3a,50.9y,115.99h,88.65t/data=!3m6!1e1!3m4!1sNPHHV_2nU8EkImdXwByuVw!2e0!7i13312!8i6656?hl=ja | J333: 35.481543, 133.918716 | L333: of:=MID([.J333];1;FIND(",";[.J333])-1) -> 35.481543 | M333: of:=MID([.J333];FIND(" ";[.J333])+1;LEN([.J333])) -> 133.918716 | N333: of:=IF([.A332]=[.A333];[.N332];[.N332]+1) -> 164 | O333: of:=IF([.A333]=[.D333];"";IF([.D333]="";"";"あり")) -> 
A334: 舎人 | B334: 下り | D334: 舎人 | E334: 柱 | F334: なし | G334: なし | H334: 2018-08 | I334: https://www.google.com/maps/@35.4812904,133.9183721,3a,40.8y,303.54h,90.23t/data=!3m6!1e1!3m4!1sfopdArn2-EV5gvsZx86GcA!2e0!7i13312!8i6656?hl=ja | J334: 35.481364, 133.918283 | L334: of:=MID([.J334];1;FIND(",";[.J334])-1) -> 35.481364 | M334: of:=MID([.J334];FIND(" ";[.J334])+1;LEN([.J334])) -> 133.918283 | N334: of:=IF([.A333]=[.A334];[.N333];[.N333]+1) -> 164 | O334: of:=IF([.A334]=[.D334];"";IF([.D334]="";"";"あり")) -> 
A335: 漆原 | B335: 上り | D335: 漆原 | E335: 柱 | F335: なし | G335: なし | H335: 2018-08 | I335: https://www.google.com/maps/@35.4841765,133.9208892,3a,75y,146.96h,81.06t/data=!3m6!1e1!3m4!1sMRghF_PQQZf8ZA3OA6x5SA!2e0!7i13312!8i6656?hl=ja | J335: 35.484104, 133.920888 | L335: of:=MID([.J335];1;FIND(",";[.J335])-1) -> 35.484104 | M335: of:=MID([.J335];FIND(" ";[.J335])+1;LEN([.J335])) -> 133.920888 | N335: of:=IF([.A334]=[.A335];[.N334];[.N334]+1) -> 165 | O335: of:=IF([.A335]=[.D335];"";IF([.D335]="";"";"あり")) -> 
A336: 漆原 | B336: 下り | E336: なし | F336: なし | G336: なし | H336: 2018-08 | J336: 35.484104, 133.920888 | L336: of:=MID([.J336];1;FIND(",";[.J336])-1) -> 35.484104 | M336: of:=MID([.J336];FIND(" ";[.J336])+1;LEN([.J336])) -> 133.920888 | N336: of:=IF([.A335]=[.A336];[.N335];[.N335]+1) -> 165 | O336: of:=IF([.A336]=[.D336];"";IF([.D336]="";"";"あり")) -> 
A337: 北方入口 | B337: 上り | D337: 北方入口 | E337: 柱 | F337: あり | G337: あり | H337: 2018-08 | I337: https://www.google.com/maps/@35.4869264,133.9228551,3a,22.3y,104.63h,88.88t/data=!3m6!1e1!3m4!1s72fl499bhMu8LO7yOwXaBA!2e0!7i13312!8i6656?hl=ja | J337: 35.486868, 133.922926 | L337: of:=MID([.J337];1;FIND(",";[.J337])-1) -> 35.486868 | M337: of:=MID([.J337];FIND(" ";[.J337])+1;LEN([.J337])) -> 133.922926 | N337: of:=IF([.A336]=[.A337];[.N336];[.N336]+1) -> 166 | O337: of:=IF([.A337]=[.D337];"";IF([.D337]="";"";"あり")) -> 
A338: 北方入口 | B338: 下り | D338: 北方入口 | E338: 柱 | F338: なし | G338: なし | H338: 2018-08 | I338: https://www.google.com/maps/@35.487016,133.9229001,3a,60y,259.61h,84.71t/data=!3m6!1e1!3m4!1sZQ_3WciI7wTA07OEHj93Qg!2e0!7i13312!8i6656?hl=ja | J338: 35.487002, 133.922814 | L338: of:=MID([.J338];1;FIND(",";[.J338])-1) -> 35.487002 | M338: of:=MID([.J338];FIND(" ";[.J338])+1;LEN([.J338])) -> 133.922814 | N338: of:=IF([.A337]=[.A338];[.N337];[.N337]+1) -> 166 | O338: of:=IF([.A338]=[.D338];"";IF([.D338]="";"";"あり")) -> 
A339: 原 | B339: 上り | D339: 原 | E339: 柱 | F339: あり | G339: あり | H339: 2018-08 | I339: https://www.google.com/maps/@35.5003942,133.9256885,3a,41.2y,103.86h,87.4t/data=!3m6!1e1!3m4!1sQovLZl-uEZ6TVphGhCj-_Q!2e0!7i13312!8i6656?hl=ja | J339: 35.500326, 133.925742 | L339: of:=MID([.J339];1;FIND(",";[.J339])-1) -> 35.500326 | M339: of:=MID([.J339];FIND(" ";[.J339])+1;LEN([.J339])) -> 133.925742 | N339: of:=IF([.A338]=[.A339];[.N338];[.N338]+1) -> 167 | O339: of:=IF([.A339]=[.D339];"";IF([.D339]="";"";"あり")) -> 
A340: 原 | B340: 下り | D340: 原 | E340: 柱 | F340: あり | G340: なし | H340: 2018-08 | I340: https://www.google.com/maps/@35.5017763,133.9257743,3a,23.1y,279.49h,89.26t/data=!3m6!1e1!3m4!1sdK__GRsZI4m5nPwqXBxzEQ!2e0!7i13312!8i6656?hl=ja | J340: 35.501722, 133.925517 | L340: of:=MID([.J340];1;FIND(",";[.J340])-1) -> 35.501722 | M340: of:=MID([.J340];FIND(" ";[.J340])+1;LEN([.J340])) -> 133.925517 | N340: of:=IF([.A339]=[.A340];[.N339];[.N339]+1) -> 167 | O340: of:=IF([.A340]=[.D340];"";IF([.D340]="";"";"あり")) -> 
O341: of:=IF([.A270]=[.D270];"";IF([.D270]="";"";"あり")) -> 
O342: of:=IF([.A271]=[.D271];"";IF([.D271]="";"";"あり")) -> 