Sheet: Sheet1
A1: 名称 | B1: のりば情報 | C1: 区分 | D1: 区別語 | E1: 現地 | F1: 標柱 | G1: 上屋 | H1: 椅子 | I1: 撮影日 | J1: URL | K1: 緯度経度 | M1: 緯度 | N1: 経度 | O1: 親停留所ID | P1: 現地との差異
A2: 倉吉バスセンター | C2: 上り | F2: 柱 | G2: なし | H2: なし | I2: 2012-09 | J2: https://www.google.co.jp/maps/@35.4623052,133.8492411,3a,75y,92.81h,82.17t/data=!3m6!1e1!3m4!1sNIx4NOrzhYBKWv3siZ1EJQ!2e0!7i13312!8i6656?hl=ja | K2: 35.462317, 133.849332 | M2: of:=MID([.K2];1;FIND(",";[.K2])-1) -> 35.462317 | N2: of:=MID([.K2];FIND(" ";[.K2])+1;LEN([.K2])) -> 133.849332 | O2: of:=1 -> 1 | P2: of:=IF([.A2]=[.E2];"";IF([.E2]="";"";"あり")) -> 
A3: 倉吉バスセンター | C3: 下り | E3: 倉吉バスセンター | F3: 柱 | G3: あり | H3: なし | I3: 2012-09 | J3: https://www.google.co.jp/maps/@35.4622152,133.8492182,3a,60y,259.08h,90t/data=!3m6!1e1!3m4!1sxgWs0PH2ph77yINUsTizHQ!2e0!7i13312!8i6656?hl=ja | K3: 35.462187, 133.849161 | M3: of:=MID([.K3];1;FIND(",";[.K3])-1) -> 35.462187 | N3: of:=MID([.K3];FIND(" ";[.K3])+1;LEN([.K3])) -> 133.849161 | O3: of:=IF([.A2]=[.A3];[.O2];[.O2]+1) -> 1 | P3: of:=IF([.A3]=[.E3];"";IF([.E3]="";"";"あり")) -> 
A4: 海田 | C4: 上り | E4: 海田 | F4: 柱 | G4: なし | H4: なし | I4: 2012-09 | J4: https://www.google.co.jp/maps/@35.4596368,133.8464004,3a,75y,143.85h,80.35t/data=!3m6!1e1!3m4!1sfXHcOr3AYoWyvKRbOzoN3g!2e0!7i13312!8i6656?hl=ja | K4: 35.459581, 133.846470 | M4: of:=MID([.K4];1;FIND(",";[.K4])-1) -> 35.459581 | N4: of:=MID([.K4];FIND(" ";[.K4])+1;LEN([.K4])) -> 133.846470 | O4: of:=IF([.A3]=[.A4];[.O3];[.O3]+1) -> 2 | P4: of:=IF([.A4]=[.E4];"";IF([.E4]="";"";"あり")) -> 
A5: 海田 | C5: 下り | E5: 海田 | F5: 柱 | G5: なし | H5: なし | I5: 2012-09 | J5: https://www.google.co.jp/maps/@35.4597045,133.8466125,3a,60y,304.89h,79.04t/data=!3m6!1e1!3m4!1sHcK-m-CjiV4WZ000DVt1xg!2e0!7i13312!8i6656?hl=ja | K5: 35.459733, 133.846581 | M5: of:=MID([.K5];1;FIND(",";[.K5])-1) -> 35.459733 | N5: of:=MID([.K5];FIND(" ";[.K5])+1;LEN([.K5])) -> 133.846581 | O5: of:=IF([.A4]=[.A5];[.O4];[.O4]+1) -> 2 | P5: of:=IF([.A5]=[.E5];"";IF([.E5]="";"";"あり")) -> 
A6: 河北中学校前 | C6: 上り | F6: 板 | G6: なし | H6: なし | I6: 2012-09 | J6: https://www.google.co.jp/maps/@35.4531774,133.8460417,3a,60y,90t/data=!3m6!1e1!3m4!1sgQoG_jU7MVHL3h_lZz8QQA!2e0!7i13312!8i6656?hl=ja | K6: 35.453247, 133.846025 | M6: of:=MID([.K6];1;FIND(",";[.K6])-1) -> 35.453247 | N6: of:=MID([.K6];FIND(" ";[.K6])+1;LEN([.K6])) -> 133.846025 | O6: of:=IF([.A5]=[.A6];[.O5];[.O5]+1) -> 3 | P6: of:=IF([.A6]=[.E6];"";IF([.E6]="";"";"あり")) -> 
A7: 河北中学校前 | C7: 下り | E7: 河北中学校前 | F7: 板 | G7: なし | H7: なし | I7: 2012-09 | J7: https://www.google.co.jp/maps/@35.4531805,133.8459384,3a,75y,179.58h,79.12t/data=!3m6!1e1!3m4!1s8x8jfdnvu0EsfYnF0HVUhA!2e0!7i13312!8i6656?hl=ja | K7: 35.453150, 133.845955 | M7: of:=MID([.K7];1;FIND(",";[.K7])-1) -> 35.453150 | N7: of:=MID([.K7];FIND(" ";[.K7])+1;LEN([.K7])) -> 133.845955 | O7: of:=IF([.A6]=[.A7];[.O6];[.O6]+1) -> 3 | P7: of:=IF([.A7]=[.E7];"";IF([.E7]="";"";"あり")) -> 
A8: 倉吉駅 | B8: 1 | C8: 1 | F8: 柱 | G8: あり | H8: あり | I8: 2012-09 | J8: https://www.google.co.jp/maps/@35.4540965,133.8499079,3a,75y,346.56h,89.7t/data=!3m6!1e1!3m4!1sfAkcHapuVboJklR69F_gCg!2e0!7i13312!8i6656?hl=ja | K8: 35.454166, 133.849896 | M8: of:=MID([.K8];1;FIND(",";[.K8])-1) -> 35.454166 | N8: of:=MID([.K8];FIND(" ";[.K8])+1;LEN([.K8])) -> 133.849896 | O8: of:=IF([.A7]=[.A8];[.O7];[.O7]+1) -> 4 | P8: of:=IF([.A8]=[.E8];"";IF([.E8]="";"";"あり")) -> 
A9: 倉吉駅 | B9: 2 | C9: 2 | F9: あり | G9: あり | H9: あり | I9: 2012-09 | J9: https://www.google.co.jp/maps/@35.454007,133.8504208,3a,15y,36.57h,89.23t/data=!3m6!1e1!3m4!1stWAGx_dwuSUPHQISXs7ZoA!2e0!7i13312!8i6656?hl=ja | K9: 35.454216, 133.850643 | M9: of:=MID([.K9];1;FIND(",";[.K9])-1) -> 35.454216 | N9: of:=MID([.K9];FIND(" ";[.K9])+1;LEN([.K9])) -> 133.850643 | O9: of:=IF([.A8]=[.A9];[.O8];[.O8]+1) -> 4 | P9: of:=IF([.A9]=[.E9];"";IF([.E9]="";"";"あり")) -> 
A10: 倉吉駅 | B10: 3 | C10: 3 | F10: あり | G10: あり | H10: あり | I10: 2012-09 | J10: https://www.google.co.jp/maps/@35.4538136,133.8509287,3a,15y,343.6h,90.4t/data=!3m6!1e1!3m4!1sIHiJG8Eypbvj0gprromQ0w!2e0!7i13312!8i6656?hl=ja | K10: 35.454149, 133.850810 | M10: of:=MID([.K10];1;FIND(",";[.K10])-1) -> 35.454149 | N10: of:=MID([.K10];FIND(" ";[.K10])+1;LEN([.K10])) -> 133.850810 | O10: of:=IF([.A9]=[.A10];[.O9];[.O9]+1) -> 4 | P10: of:=IF([.A10]=[.E10];"";IF([.E10]="";"";"あり")) -> 
A11: 倉吉駅 | B11: 4 | C11: 4 | F11: あり | G11: あり | H11: あり | I11: 2012-09 | J11: https://www.google.co.jp/maps/@35.4538525,133.850827,3a,41.6y,26.28h,90.29t/data=!3m6!1e1!3m4!1seeZSbwDMxCPEre8czRykqQ!2e0!7i13312!8i6656?hl=ja | K11: 35.454079, 133.850986 | M11: of:=MID([.K11];1;FIND(",";[.K11])-1) -> 35.454079 | N11: of:=MID([.K11];FIND(" ";[.K11])+1;LEN([.K11])) -> 133.850986 | O11: of:=IF([.A10]=[.A11];[.O10];[.O10]+1) -> 4 | P11: of:=IF([.A11]=[.E11];"";IF([.E11]="";"";"あり")) -> 
A12: 倉吉駅 | B12: 5 | C12: 5 | F12: あり | G12: あり | H12: あり | I12: 2012-09 | J12: https://www.google.co.jp/maps/@35.4537734,133.8510331,3a,28.8y,19.37h,90.13t/data=!3m6!1e1!3m4!1sfYtWwpSy0qOGk9OWb481Uw!2e0!7i13312!8i6656?hl=ja | K12: 35.454034, 133.851104 | M12: of:=MID([.K12];1;FIND(",";[.K12])-1) -> 35.454034 | N12: of:=MID([.K12];FIND(" ";[.K12])+1;LEN([.K12])) -> 133.851104 | O12: of:=IF([.A11]=[.A12];[.O11];[.O11]+1) -> 4 | P12: of:=IF([.A12]=[.E12];"";IF([.E12]="";"";"あり")) -> 
A13: 倉吉駅 | B13: 6 | C13: 6 | F13: あり | G13: あり | H13: なし | I13: 2012-09 | J13: https://www.google.co.jp/maps/@35.4537734,133.8510331,3a,28.8y,67.26h,89.8t/data=!3m6!1e1!3m4!1sfYtWwpSy0qOGk9OWb481Uw!2e0!7i13312!8i6656?hl=ja | K13: 35.453833, 133.851296 | M13: of:=MID([.K13];1;FIND(",";[.K13])-1) -> 35.453833 | N13: of:=MID([.K13];FIND(" ";[.K13])+1;LEN([.K13])) -> 133.851296 | O13: of:=IF([.A12]=[.A13];[.O12];[.O12]+1) -> 4 | P13: of:=IF([.A13]=[.E13];"";IF([.E13]="";"";"あり")) -> 
A14: 倉吉駅 | B14: 7 | C14: 7 | F14: あり | G14: あり | H14: なし | I14: 2012-09 | J14: https://www.google.co.jp/maps/@35.4540965,133.8499079,3a,15y,84.56h,88.17t/data=!3m6!1e1!3m4!1sfAkcHapuVboJklR69F_gCg!2e0!7i13312!8i6656?hl=ja | K14: 35.454163, 133.850563 | M14: of:=MID([.K14];1;FIND(",";[.K14])-1) -> 35.454163 | N14: of:=MID([.K14];FIND(" ";[.K14])+1;LEN([.K14])) -> 133.850563 | O14: of:=IF([.A13]=[.A14];[.O13];[.O13]+1) -> 4 | P14: of:=IF([.A14]=[.E14];"";IF([.E14]="";"";"あり")) -> 
A15: 上井町一丁目西 | C15: 上り | E15: 上井町一丁目西、上井一丁目西 | F15: 箱 | G15: なし | H15: なし | I15: 2012-09 | J15: https://www.google.co.jp/maps/@35.4510182,133.8493652,3a,75y,284.41h,85.26t/data=!3m6!1e1!3m4!1sI3qU-8vZ2RJVFBziGHEd6Q!2e0!7i13312!8i6656?hl=ja | K15: 35.451037, 133.849342 | M15: of:=MID([.K15];1;FIND(",";[.K15])-1) -> 35.451037 | N15: of:=MID([.K15];FIND(" ";[.K15])+1;LEN([.K15])) -> 133.849342 | O15: of:=IF([.A14]=[.A15];[.O14];[.O14]+1) -> 5 | P15: of:=IF([.A15]=[.E15];"";IF([.E15]="";"";"あり")) -> あり
A16: 上井町一丁目西 | C16: 下り | E16: 上井町一丁目西 | F16: 板 | G16: なし | H16: なし | I16: 2012-09 | J16: https://www.google.co.jp/maps/@35.451401,133.8493723,3a,46.5y,89.11h,87.94t/data=!3m7!1e1!3m5!1shc7kGwlgWQOTkezIB-D5Tw!2e0!6s%2F%2Fgeo3.ggpht.com%2Fcbk%3Fpanoid%3Dhc7kGwlgWQOTkezIB-D5Tw%26output%3Dthumbnail%26cb_client%3Dmaps_sv.tactile.gps%26thumb%3D2%26 | K16: 35.451401, 133.849487 | M16: of:=MID([.K16];1;FIND(",";[.K16])-1) -> 35.451401 | N16: of:=MID([.K16];FIND(" ";[.K16])+1;LEN([.K16])) -> 133.849487 | O16: of:=IF([.A15]=[.A16];[.O15];[.O15]+1) -> 5 | P16: of:=IF([.A16]=[.E16];"";IF([.E16]="";"";"あり")) -> 
A17: 山根パープルタウン前 | C17: 上り | E17: 山根 | F17: 箱 | G17: あり | H17: あり | I17: 2012-09 | J17: https://www.google.co.jp/maps/@35.4479813,133.8494125,3a,32.9y,291.17h,87.63t/data=!3m6!1e1!3m4!1sKjylmNr5t9S3Xj2op6NDww!2e0!7i13312!8i6656?hl=ja | K17: 35.448034, 133.849294 | M17: of:=MID([.K17];1;FIND(",";[.K17])-1) -> 35.448034 | N17: of:=MID([.K17];FIND(" ";[.K17])+1;LEN([.K17])) -> 133.849294 | O17: of:=IF([.A16]=[.A17];[.O16];[.O16]+1) -> 6 | P17: of:=IF([.A17]=[.E17];"";IF([.E17]="";"";"あり")) -> あり
A18: 山根パープルタウン前 | C18: 下り | E18: 山根 | F18: 板 | G18: あり | H18: あり | I18: 2012-09 | J18: https://www.google.co.jp/maps/@35.447357,133.8494026,3a,75y,119.08h,78.95t/data=!3m6!1e1!3m4!1sbgpbwtDB78W1lxOI0_2LWw!2e0!7i13312!8i6656?hl=ja | K18: 35.447343, 133.849425 | M18: of:=MID([.K18];1;FIND(",";[.K18])-1) -> 35.447343 | N18: of:=MID([.K18];FIND(" ";[.K18])+1;LEN([.K18])) -> 133.849425 | O18: of:=IF([.A17]=[.A18];[.O17];[.O17]+1) -> 6 | P18: of:=IF([.A18]=[.E18];"";IF([.E18]="";"";"あり")) -> あり
A19: 伊木 | C19: 上り | E19: 伊木 | F19: 板 | G19: なし | H19: なし | I19: 2012-09 | J19: https://www.google.co.jp/maps/@35.444829,133.8493634,3a,29.2y,289.38h,85.94t/data=!3m6!1e1!3m4!1sfVIu7_zqo7SKLjA1UlBmnQ!2e0!7i13312!8i6656?hl=ja | K19: 35.444875, 133.849255 | M19: of:=MID([.K19];1;FIND(",";[.K19])-1) -> 35.444875 | N19: of:=MID([.K19];FIND(" ";[.K19])+1;LEN([.K19])) -> 133.849255 | O19: of:=IF([.A18]=[.A19];[.O18];[.O18]+1) -> 7 | P19: of:=IF([.A19]=[.E19];"";IF([.E19]="";"";"あり")) -> 
A20: 伊木 | C20: 下り | E20: 伊木 | F20: 板 | G20: なし | H20: なし | I20: 2012-09 | J20: https://www.google.co.jp/maps/@35.44465,133.8493613,3a,75y,31.44h,77.35t/data=!3m6!1e1!3m4!1sAHzR9BvTw5cSrxPVB2aHig!2e0!7i13312!8i6656?hl=ja | K20: 35.444689, 133.849396 | M20: of:=MID([.K20];1;FIND(",";[.K20])-1) -> 35.444689 | N20: of:=MID([.K20];FIND(" ";[.K20])+1;LEN([.K20])) -> 133.849396 | O20: of:=IF([.A19]=[.A20];[.O19];[.O19]+1) -> 7 | P20: of:=IF([.A20]=[.E20];"";IF([.E20]="";"";"あり")) -> 
A21: 八ツ屋 | C21: 上り | E21: 八屋 | F21: 箱 | G21: あり | H21: なし | I21: 2012-09 | J21: https://www.google.co.jp/maps/@35.4415585,133.8482624,3a,22.4y,337.8h,87.57t/data=!3m6!1e1!3m4!1sgSiivH0lB4uE3L8NhczqEQ!2e0!7i13312!8i6656?hl=ja | K21: 35.441670, 133.848206 | M21: of:=MID([.K21];1;FIND(",";[.K21])-1) -> 35.441670 | N21: of:=MID([.K21];FIND(" ";[.K21])+1;LEN([.K21])) -> 133.848206 | O21: of:=IF([.A20]=[.A21];[.O20];[.O20]+1) -> 8 | P21: of:=IF([.A21]=[.E21];"";IF([.E21]="";"";"あり")) -> あり
A22: 八ツ屋 | C22: 下り | E22: 八屋 | F22: 板 | G22: あり | H22: なし | I22: 2012-09 | J22: https://www.google.co.jp/maps/@35.4415196,133.8481637,3a,48.9y,214.71h,88.28t/data=!3m6!1e1!3m4!1sZxplnKfXRZ9lXpovIBYlmQ!2e0!7i13312!8i6656?hl=ja | K22: 35.441458, 133.848096 | M22: of:=MID([.K22];1;FIND(",";[.K22])-1) -> 35.441458 | N22: of:=MID([.K22];FIND(" ";[.K22])+1;LEN([.K22])) -> 133.848096 | O22: of:=IF([.A21]=[.A22];[.O21];[.O21]+1) -> 8 | P22: of:=IF([.A22]=[.E22];"";IF([.E22]="";"";"あり")) -> あり
A23: 総合事務所前 | C23: 上り | E23: 総合事務所前 | F23: 板 | G23: あり | H23: あり | I23: 2012-09 | J23: https://www.google.co.jp/maps/@35.4401346,133.8446134,3a,15.6y,307.39h,86.81t/data=!3m6!1e1!3m4!1sryUhPeWPBdBCDoBAfcWbIQ!2e0!7i13312!8i6656?hl=ja | K23: 35.440232, 133.844446 | M23: of:=MID([.K23];1;FIND(",";[.K23])-1) -> 35.440232 | N23: of:=MID([.K23];FIND(" ";[.K23])+1;LEN([.K23])) -> 133.844446 | O23: of:=IF([.A22]=[.A23];[.O22];[.O22]+1) -> 9 | P23: of:=IF([.A23]=[.E23];"";IF([.E23]="";"";"あり")) -> 
A24: 総合事務所前 | C24: 下り | E24: 総合事務所前 | F24: 板 | G24: あり | H24: あり | I24: 2012-09 | J24: https://www.google.co.jp/maps/@35.4400995,133.844515,3a,75y,163.06h,81.24t/data=!3m6!1e1!3m4!1sS2NqxVUA19Ves5Larq9VnQ!2e0!7i13312!8i6656?hl=ja | K24: 35.440051, 133.844532 | M24: of:=MID([.K24];1;FIND(",";[.K24])-1) -> 35.440051 | N24: of:=MID([.K24];FIND(" ";[.K24])+1;LEN([.K24])) -> 133.844532 | O24: of:=IF([.A23]=[.A24];[.O23];[.O23]+1) -> 9 | P24: of:=IF([.A24]=[.E24];"";IF([.E24]="";"";"あり")) -> 
A25: 厚生病院前 | C25: 上り | E25: 厚生病院前 | F25: 箱 | G25: あり | H25: あり | I25: 2012-09 | J25: https://www.google.co.jp/maps/@35.4371826,133.8395959,3a,42.5y,331.25h,87.85t/data=!3m6!1e1!3m4!1sxFaXHIITANDGBJyUVrhdlQ!2e0!7i13312!8i6656?hl=ja | K25: 35.437282, 133.839542 | M25: of:=MID([.K25];1;FIND(",";[.K25])-1) -> 35.437282 | N25: of:=MID([.K25];FIND(" ";[.K25])+1;LEN([.K25])) -> 133.839542 | O25: of:=IF([.A24]=[.A25];[.O24];[.O24]+1) -> 10 | P25: of:=IF([.A25]=[.E25];"";IF([.E25]="";"";"あり")) -> 
A26: 厚生病院前 | C26: 下り | E26: 厚生病院前 | F26: 箱 | G26: あり | H26: あり | I26: 2012-09 | J26: https://www.google.co.jp/maps/@35.4373318,133.8397896,3a,75y,194.29h,86.92t/data=!3m6!1e1!3m4!1sjqsepQaiRoJHfC6e_juoRA!2e0!7i13312!8i6656?hl=ja | K26: 35.437284, 133.839774 | M26: of:=MID([.K26];1;FIND(",";[.K26])-1) -> 35.437284 | N26: of:=MID([.K26];FIND(" ";[.K26])+1;LEN([.K26])) -> 133.839774 | O26: of:=IF([.A25]=[.A26];[.O25];[.O25]+1) -> 10 | P26: of:=IF([.A26]=[.E26];"";IF([.E26]="";"";"あり")) -> 
A27: 倉吉パークスクエア北口 | C27: 上り | E27: 倉吉パークスクエア北口（昭和町） | F27: 板 | G27: あり | H27: あり | I27: 2012-09 | J27: https://www.google.co.jp/maps/@35.4338583,133.835267,3a,60y,307.1h,88.39t/data=!3m6!1e1!3m4!1sUwgMef9ohe2PsUVsKszypg!2e0!7i13312!8i6656?hl=ja | K27: 35.433910, 133.835163 | M27: of:=MID([.K27];1;FIND(",";[.K27])-1) -> 35.433910 | N27: of:=MID([.K27];FIND(" ";[.K27])+1;LEN([.K27])) -> 133.835163 | O27: of:=IF([.A26]=[.A27];[.O26];[.O26]+1) -> 11 | P27: of:=IF([.A27]=[.E27];"";IF([.E27]="";"";"あり")) -> あり
A28: 倉吉パークスクエア北口 | C28: 下り | E28: 倉吉パークスクエア北口（昭和町） | F28: 板 | G28: あり | H28: あり | I28: 2012-09 | J28: https://www.google.co.jp/maps/@35.4341789,133.8356844,3a,75y,166.87h,88t/data=!3m6!1e1!3m4!1sRxyzwPsoiFIe7ZoIoCXrBA!2e0!7i13312!8i6656?hl=ja | K28: 35.434130, 133.835666 | M28: of:=MID([.K28];1;FIND(",";[.K28])-1) -> 35.434130 | N28: of:=MID([.K28];FIND(" ";[.K28])+1;LEN([.K28])) -> 133.835666 | O28: of:=IF([.A27]=[.A28];[.O27];[.O27]+1) -> 11 | P28: of:=IF([.A28]=[.E28];"";IF([.E28]="";"";"あり")) -> あり
A29: 宮川町 | C29: 上り | E29: 宮川町 | F29: 板 | G29: あり | H29: あり | I29: 2012-09 | J29: https://www.google.co.jp/maps/@35.4328453,133.8308998,3a,44.6y,41.68h,85.6t/data=!3m6!1e1!3m4!1soFA32AkcogVd-gVmOtzB5w!2e0!7i13312!8i6656?hl=ja | K29: 35.432889, 133.830946 | M29: of:=MID([.K29];1;FIND(",";[.K29])-1) -> 35.432889 | N29: of:=MID([.K29];FIND(" ";[.K29])+1;LEN([.K29])) -> 133.830946 | O29: of:=IF([.A28]=[.A29];[.O28];[.O28]+1) -> 12 | P29: of:=IF([.A29]=[.E29];"";IF([.E29]="";"";"あり")) -> 
A30: 宮川町 | C30: 下り | E30: 宮川町 | F30: 板 | G30: なし | H30: あり | I30: 2012-09 | J30: https://www.google.co.jp/maps/@35.4328639,133.8311713,3a,75y,172.73h,84.66t/data=!3m6!1e1!3m4!1seSyBR2oW7RkFsElVytjiGQ!2e0!7i13312!8i6656?hl=ja | K30: 35.432811, 133.831151 | M30: of:=MID([.K30];1;FIND(",";[.K30])-1) -> 35.432811 | N30: of:=MID([.K30];FIND(" ";[.K30])+1;LEN([.K30])) -> 133.831151 | O30: of:=IF([.A29]=[.A30];[.O29];[.O29]+1) -> 12 | P30: of:=IF([.A30]=[.E30];"";IF([.E30]="";"";"あり")) -> 
A31: 堺町 | C31: 上り | E31: 堺町 | F31: 箱 | G31: なし | H31: あり | I31: 2015-04 | J31: https://www.google.co.jp/maps/@35.4330337,133.8278311,3a,85.3y,348.87h,88.96t/data=!3m6!1e1!3m4!1s5aIRa_egGdb5cpXOgRszpw!2e0!7i13312!8i6656?hl=ja | K31: 35.433091, 133.827761 | M31: of:=MID([.K31];1;FIND(",";[.K31])-1) -> 35.433091 | N31: of:=MID([.K31];FIND(" ";[.K31])+1;LEN([.K31])) -> 133.827761 | O31: of:=IF([.A30]=[.A31];[.O30];[.O30]+1) -> 13 | P31: of:=IF([.A31]=[.E31];"";IF([.E31]="";"";"あり")) -> 
A32: 堺町 | C32: 下り | E32: 堺町 | F32: 板 | G32: あり | H32: あり | I32: 2015-04 | J32: https://www.google.co.jp/maps/@35.4330091,133.8282471,3a,46.7y,236h,86.43t/data=!3m6!1e1!3m4!1ssFToDCjcIwKvPZ55UN-Dww!2e0!7i13312!8i6656?hl=ja | K32: 35.432970, 133.828152 | M32: of:=MID([.K32];1;FIND(",";[.K32])-1) -> 35.432970 | N32: of:=MID([.K32];FIND(" ";[.K32])+1;LEN([.K32])) -> 133.828152 | O32: of:=IF([.A31]=[.A32];[.O31];[.O31]+1) -> 13 | P32: of:=IF([.A32]=[.E32];"";IF([.E32]="";"";"あり")) -> 
A33: 赤瓦・白壁土蔵 | C33: 上り | E33: 赤瓦・白壁土蔵（明治町） | F33: 柱 | G33: なし | H33: なし | I33: 2015-04 | J33: https://www.google.co.jp/maps/@35.4331858,133.8253082,3a,49.9y,342.55h,85.33t/data=!3m6!1e1!3m4!1seL0p6_Z8UOagpkBcRt5Aqg!2e0!7i13312!8i6656?hl=ja | K33: 35.433246, 133.825263 | M33: of:=MID([.K33];1;FIND(",";[.K33])-1) -> 35.433246 | N33: of:=MID([.K33];FIND(" ";[.K33])+1;LEN([.K33])) -> 133.825263 | O33: of:=IF([.A32]=[.A33];[.O32];[.O32]+1) -> 14 | P33: of:=IF([.A33]=[.E33];"";IF([.E33]="";"";"あり")) -> あり
A34: 赤瓦・白壁土蔵 | C34: 下り | E34: 赤瓦・白壁土蔵（明治町） | F34: 柱 | G34: なし | H34: なし | I34: 2015-04 | J34: https://www.google.co.jp/maps/@35.4332941,133.8236191,3a,75y,140.07h,79.13t/data=!3m6!1e1!3m4!1svAQNmQ7YIqfkwA-_mpmz0g!2e0!7i13312!8i6656?hl=ja | K34: 35.433254, 133.823665 | M34: of:=MID([.K34];1;FIND(",";[.K34])-1) -> 35.433254 | N34: of:=MID([.K34];FIND(" ";[.K34])+1;LEN([.K34])) -> 133.823665 | O34: of:=IF([.A33]=[.A34];[.O33];[.O33]+1) -> 14 | P34: of:=IF([.A34]=[.E34];"";IF([.E34]="";"";"あり")) -> あり
A35: 新町 | C35: 上り | E35: 新町 | F35: 板 | G35: あり | H35: あり | I35: 2015-04 | J35: https://www.google.co.jp/maps/@35.433499,133.8206387,3a,35.7y,352.24h,88.85t/data=!3m6!1e1!3m4!1sVZk2D-Z6Kzvol-1egldx5g!2e0!7i13312!8i6656?hl=ja | K35: 35.433600, 133.820587 | M35: of:=MID([.K35];1;FIND(",";[.K35])-1) -> 35.433600 | N35: of:=MID([.K35];FIND(" ";[.K35])+1;LEN([.K35])) -> 133.820587 | O35: of:=IF([.A34]=[.A35];[.O34];[.O34]+1) -> 15 | P35: of:=IF([.A35]=[.E35];"";IF([.E35]="";"";"あり")) -> 
A36: 新町 | C36: 下り | E36: 新町 | F36: 板 | G36: あり | H36: あり | I36: 2015-04 | J36: https://www.google.co.jp/maps/@35.433499,133.8206387,3a,35.7y,247.67h,86.35t/data=!3m6!1e1!3m4!1sVZk2D-Z6Kzvol-1egldx5g!2e0!7i13312!8i6656?hl=ja | K36: 35.433475, 133.820569 | M36: of:=MID([.K36];1;FIND(",";[.K36])-1) -> 35.433475 | N36: of:=MID([.K36];FIND(" ";[.K36])+1;LEN([.K36])) -> 133.820569 | O36: of:=IF([.A35]=[.A36];[.O35];[.O35]+1) -> 15 | P36: of:=IF([.A36]=[.E36];"";IF([.E36]="";"";"あり")) -> 
A37: 福吉町 | C37: 上り | F37: 板 | G37: あり | H37: あり | I37: 2015-04 | J37: https://www.google.co.jp/maps/@35.4335134,133.8176779,3a,42.9y,316.98h,86.53t/data=!3m6!1e1!3m4!1se3BHDNSPs4RwLA3Kz-H1TA!2e0!7i13312!8i6656?hl=ja | K37: 35.433578, 133.817625 | M37: of:=MID([.K37];1;FIND(",";[.K37])-1) -> 35.433578 | N37: of:=MID([.K37];FIND(" ";[.K37])+1;LEN([.K37])) -> 133.817625 | O37: of:=IF([.A36]=[.A37];[.O36];[.O36]+1) -> 16 | P37: of:=IF([.A37]=[.E37];"";IF([.E37]="";"";"あり")) -> 
A38: 福吉町 | C38: 下り | E38: 福吉町 | F38: 板 | G38: なし | H38: なし | I38: 2015-04 | J38: https://www.google.co.jp/maps/@35.4335134,133.8176779,3a,68.9y,114.44h,85.68t/data=!3m6!1e1!3m4!1se3BHDNSPs4RwLA3Kz-H1TA!2e0!7i13312!8i6656?hl=ja | K38: 35.433481, 133.817778 | M38: of:=MID([.K38];1;FIND(",";[.K38])-1) -> 35.433481 | N38: of:=MID([.K38];FIND(" ";[.K38])+1;LEN([.K38])) -> 133.817778 | O38: of:=IF([.A37]=[.A38];[.O37];[.O37]+1) -> 16 | P38: of:=IF([.A38]=[.E38];"";IF([.E38]="";"";"あり")) -> 
A39: 広瀬町 | C39: 上り | F39: 板 | G39: なし | H39: なし | I39: 2015-04 | J39: https://www.google.co.jp/maps/@35.4316694,133.8137688,3a,75.8y,8.91h,89.15t/data=!3m6!1e1!3m4!1sw79knoZWNsLnX2dt5mpplQ!2e0!7i13312!8i6656?hl=ja | K39: 35.431753, 133.813775 | M39: of:=MID([.K39];1;FIND(",";[.K39])-1) -> 35.431753 | N39: of:=MID([.K39];FIND(" ";[.K39])+1;LEN([.K39])) -> 133.813775 | O39: of:=IF([.A38]=[.A39];[.O38];[.O38]+1) -> 17 | P39: of:=IF([.A39]=[.E39];"";IF([.E39]="";"";"あり")) -> 
A40: 広瀬町 | C40: 下り | E40: 広瀬町 | F40: 板 | G40: なし | H40: なし | I40: 2015-04 | J40: https://www.google.co.jp/maps/@35.4318454,133.8141434,3a,79.9y,151.74h,85.19t/data=!3m6!1e1!3m4!1s30dg1K1_ULsmsu42RPlKzw!2e0!7i13312!8i6656?hl=ja | K40: 35.431812, 133.814144 | M40: of:=MID([.K40];1;FIND(",";[.K40])-1) -> 35.431812 | N40: of:=MID([.K40];FIND(" ";[.K40])+1;LEN([.K40])) -> 133.814144 | O40: of:=IF([.A39]=[.A40];[.O39];[.O39]+1) -> 17 | P40: of:=IF([.A40]=[.E40];"";IF([.E40]="";"";"あり")) -> 
A41: 河原町 | C41: 上り | E41: 河原町 | F41: 板 | G41: なし | H41: なし | I41: 2015-04 | J41: https://www.google.co.jp/maps/@35.4302264,133.8107303,3a,46y,288.96h,91.83t/data=!3m6!1e1!3m4!1sheMI4E76eWjKEPHYZZD02Q!2e0!7i13312!8i6656?hl=ja | K41: 35.430248, 133.810585 | M41: of:=MID([.K41];1;FIND(",";[.K41])-1) -> 35.430248 | N41: of:=MID([.K41];FIND(" ";[.K41])+1;LEN([.K41])) -> 133.810585 | O41: of:=IF([.A40]=[.A41];[.O40];[.O40]+1) -> 18 | P41: of:=IF([.A41]=[.E41];"";IF([.E41]="";"";"あり")) -> 
A42: 河原町 | C42: 下り | E42: 河原町 | F42: 板 | G42: なし | H42: なし | I42: 2015-04 | J42: https://www.google.co.jp/maps/@35.4302264,133.8107303,3a,90y,154.71h,78.64t/data=!3m6!1e1!3m4!1sheMI4E76eWjKEPHYZZD02Q!2e0!7i13312!8i6656?hl=ja | K42: 35.430183, 133.810756 | M42: of:=MID([.K42];1;FIND(",";[.K42])-1) -> 35.430183 | N42: of:=MID([.K42];FIND(" ";[.K42])+1;LEN([.K42])) -> 133.810756 | O42: of:=IF([.A41]=[.A42];[.O41];[.O41]+1) -> 18 | P42: of:=IF([.A42]=[.E42];"";IF([.E42]="";"";"あり")) -> 
A43: 岡田 | C43: 上り | F43: 柱 | G43: なし | H43: なし | I43: 2012-09 | J43: https://www.google.co.jp/maps/@35.4288875,133.8068757,3a,24y,63.05h,87.48t/data=!3m6!1e1!3m4!1sFRgE-A620cZbckR0YrqQRg!2e0!7i13312!8i6656?hl=ja | K43: 35.429003, 133.807117 | M43: of:=MID([.K43];1;FIND(",";[.K43])-1) -> 35.429003 | N43: of:=MID([.K43];FIND(" ";[.K43])+1;LEN([.K43])) -> 133.807117 | O43: of:=IF([.A42]=[.A43];[.O42];[.O42]+1) -> 19 | P43: of:=IF([.A43]=[.E43];"";IF([.E43]="";"";"あり")) -> 
A44: 岡田 | C44: 下り | F44: 柱 | G44: なし | H44: なし | I44: 2012-09 | J44: https://www.google.co.jp/maps/@35.4291252,133.80777,3a,15y,243.37h,86.59t/data=!3m6!1e1!3m4!1sJI1VJQHcY0SGOCjlj6quOg!2e0!7i13312!8i6656?hl=ja | K44: 35.428949, 133.807359 | M44: of:=MID([.K44];1;FIND(",";[.K44])-1) -> 35.428949 | N44: of:=MID([.K44];FIND(" ";[.K44])+1;LEN([.K44])) -> 133.807359 | O44: of:=IF([.A43]=[.A44];[.O43];[.O43]+1) -> 19 | P44: of:=IF([.A44]=[.E44];"";IF([.E44]="";"";"あり")) -> 
A45: 岡田 | C45: 下り折返 | F45: 板 | G45: なし | H45: なし | I45: 2012-10 | J45: https://www.google.co.jp/maps/@35.4283881,133.8080452,3a,75y,123.83h,85.62t/data=!3m6!1e1!3m4!1sMNTNboliaz31h0gHsHYPPw!2e0!7i13312!8i6656?hl=ja | K45: 35.428319, 133.808121 | M45: of:=MID([.K45];1;FIND(",";[.K45])-1) -> 35.428319 | N45: of:=MID([.K45];FIND(" ";[.K45])+1;LEN([.K45])) -> 133.808121 | O45: of:=IF([.A44]=[.A45];[.O44];[.O44]+1) -> 19 | P45: of:=IF([.A45]=[.E45];"";IF([.E45]="";"";"あり")) -> 
A46: 西倉吉 | C46: 上り折返 | F46: 柱 | G46: あり | H46: あり | I46: 2012-09 | J46: https://www.google.co.jp/maps/@35.4287013,133.8054976,3a,47.8y,207.86h,91.56t/data=!3m6!1e1!3m4!1sy1TcYlufL6O04qwhc1z-dg!2e0!7i13312!8i6656?hl=ja | K46: 35.428567, 133.805404 | M46: of:=MID([.K46];1;FIND(",";[.K46])-1) -> 35.428567 | N46: of:=MID([.K46];FIND(" ";[.K46])+1;LEN([.K46])) -> 133.805404 | O46: of:=IF([.A45]=[.A46];[.O45];[.O45]+1) -> 20 | P46: of:=IF([.A46]=[.E46];"";IF([.E46]="";"";"あり")) -> 
A47: 西倉吉 | C47: 上り | F47: 板 | G47: なし | H47: なし | I47: 2012-09 | J47: https://www.google.co.jp/maps/@35.4287412,133.8057821,3a,75y,305.71h,87.03t/data=!3m6!1e1!3m4!1sbcG_RhyPhx2aoZXqg5gI3A!2e0!7i13312!8i6656?hl=ja | K47: 35.428758, 133.805740 | M47: of:=MID([.K47];1;FIND(",";[.K47])-1) -> 35.428758 | N47: of:=MID([.K47];FIND(" ";[.K47])+1;LEN([.K47])) -> 133.805740 | O47: of:=IF([.A46]=[.A47];[.O46];[.O46]+1) -> 20 | P47: of:=IF([.A47]=[.E47];"";IF([.E47]="";"";"あり")) -> 
A48: 西倉吉 | C48: 下り | F48: 板 | G48: なし | H48: なし | I48: 2012-09 | J48: https://www.google.co.jp/maps/@35.4287774,133.8060163,3a,75y,129.86h,85.94t/data=!3m6!1e1!3m4!1syXu-XTBBSFV2CdOqBeeAMg!2e0!7i13312!8i6656?hl=ja | K48: 35.428728, 133.806088 | M48: of:=MID([.K48];1;FIND(",";[.K48])-1) -> 35.428728 | N48: of:=MID([.K48];FIND(" ";[.K48])+1;LEN([.K48])) -> 133.806088 | O48: of:=IF([.A47]=[.A48];[.O47];[.O47]+1) -> 20 | P48: of:=IF([.A48]=[.E48];"";IF([.E48]="";"";"あり")) -> 
A49: 西倉吉町 | C49: 上り | F49: 柱 | G49: なし | H49: なし | I49: 2012-09 | J49: https://www.google.co.jp/maps/@35.4272718,133.8059565,3a,32.4y,166.5h,83.25t/data=!3m6!1e1!3m4!1sujFWv9bq4im40vP44rxULQ!2e0!7i13312!8i6656?hl=ja | K49: 35.427206, 133.805977 | M49: of:=MID([.K49];1;FIND(",";[.K49])-1) -> 35.427206 | N49: of:=MID([.K49];FIND(" ";[.K49])+1;LEN([.K49])) -> 133.805977 | O49: of:=IF([.A48]=[.A49];[.O48];[.O48]+1) -> 21 | P49: of:=IF([.A49]=[.E49];"";IF([.E49]="";"";"あり")) -> 
A50: 西倉吉町 | C50: 下り | E50: 西倉吉町 | F50: 柱 | G50: なし | H50: なし | I50: 2012-09 | J50: https://www.google.co.jp/maps/@35.4272731,133.8061825,3a,75y,343.42h,72.65t/data=!3m6!1e1!3m4!1ssHyT1G507y-r_eu9krVtJA!2e0!7i13312!8i6656?hl=ja | K50: 35.427315, 133.806171 | M50: of:=MID([.K50];1;FIND(",";[.K50])-1) -> 35.427315 | N50: of:=MID([.K50];FIND(" ";[.K50])+1;LEN([.K50])) -> 133.806171 | O50: of:=IF([.A49]=[.A50];[.O49];[.O49]+1) -> 21 | P50: of:=IF([.A50]=[.E50];"";IF([.E50]="";"";"あり")) -> 
A51: 丸山 | C51: 上り | F51: なし | G51: なし | H51: なし | I51: 2012-10 | K51: 35.425075, 133.808048 | M51: of:=MID([.K51];1;FIND(",";[.K51])-1) -> 35.425075 | N51: of:=MID([.K51];FIND(" ";[.K51])+1;LEN([.K51])) -> 133.808048 | O51: of:=IF([.A50]=[.A51];[.O50];[.O50]+1) -> 22 | P51: of:=IF([.A51]=[.E51];"";IF([.E51]="";"";"あり")) -> 
A52: 丸山 | C52: 下り | E52: 丸山 | F52: 板 | G52: なし | H52: なし | I52: 2012-10 | J52: https://www.google.co.jp/maps/@35.4250491,133.8079749,3a,68.6y,78.12h,83.85t/data=!3m6!1e1!3m4!1shZ3SKgEmL0Tc4QdzWurs6Q!2e0!7i13312!8i6656?hl=ja | K52: 35.425075, 133.808048 | M52: of:=MID([.K52];1;FIND(",";[.K52])-1) -> 35.425075 | N52: of:=MID([.K52];FIND(" ";[.K52])+1;LEN([.K52])) -> 133.808048 | O52: of:=IF([.A51]=[.A52];[.O51];[.O51]+1) -> 22 | P52: of:=IF([.A52]=[.E52];"";IF([.E52]="";"";"あり")) -> 
A53: 生田 | C53: 上り | E53: 生田 | F53: 柱 | G53: なし | H53: なし | I53: 2012-10 | J53: https://www.google.co.jp/maps/@35.4206735,133.8063014,3a,60y,343.01h,81.91t/data=!3m6!1e1!3m4!1sI7SS5_jN60GSNNO-uaQ7Sw!2e0!7i13312!8i6656?hl=ja | K53: 35.420747, 133.806289 | M53: of:=MID([.K53];1;FIND(",";[.K53])-1) -> 35.420747 | N53: of:=MID([.K53];FIND(" ";[.K53])+1;LEN([.K53])) -> 133.806289 | O53: of:=IF([.A52]=[.A53];[.O52];[.O52]+1) -> 23 | P53: of:=IF([.A53]=[.E53];"";IF([.E53]="";"";"あり")) -> 
A54: 生田 | C54: 下り | E54: 生田 | F54: 板 | G54: なし | H54: なし | I54: 2012-10 | J54: https://www.google.co.jp/maps/@35.4206735,133.8063014,3a,60y,128.83h,84.32t/data=!3m6!1e1!3m4!1sI7SS5_jN60GSNNO-uaQ7Sw!2e0!7i13312!8i6656?hl=ja | K54: 35.420643, 133.806359 | M54: of:=MID([.K54];1;FIND(",";[.K54])-1) -> 35.420643 | N54: of:=MID([.K54];FIND(" ";[.K54])+1;LEN([.K54])) -> 133.806359 | O54: of:=IF([.A53]=[.A54];[.O53];[.O53]+1) -> 23 | P54: of:=IF([.A54]=[.E54];"";IF([.E54]="";"";"あり")) -> 
A55: 生田日ノ丸前 | C55: 上り | E55: 生田日ノ丸車庫前 | F55: 柱 | G55: なし | H55: なし | I55: 2012-10 | J55: https://www.google.co.jp/maps/@35.4186311,133.8055284,3a,60y,303.79h,82.13t/data=!3m6!1e1!3m4!1sVZMkqO6c3TkcVr2w_qRaNg!2e0!7i13312!8i6656?hl=ja | K55: 35.418675, 133.805485 | M55: of:=MID([.K55];1;FIND(",";[.K55])-1) -> 35.418675 | N55: of:=MID([.K55];FIND(" ";[.K55])+1;LEN([.K55])) -> 133.805485 | O55: of:=IF([.A54]=[.A55];[.O54];[.O54]+1) -> 24 | P55: of:=IF([.A55]=[.E55];"";IF([.E55]="";"";"あり")) -> あり
A56: 生田日ノ丸前 | C56: 下り | E56: 生田日ノ丸前 | F56: 柱 | G56: なし | H56: なし | I56: 2012-10 | J56: https://www.google.co.jp/maps/@35.4186311,133.8055284,3a,46.4y,65.25h,82.26t/data=!3m6!1e1!3m4!1sVZMkqO6c3TkcVr2w_qRaNg!2e0!7i13312!8i6656?hl=ja | K56: 35.418680, 133.805622 | M56: of:=MID([.K56];1;FIND(",";[.K56])-1) -> 35.418680 | N56: of:=MID([.K56];FIND(" ";[.K56])+1;LEN([.K56])) -> 133.805622 | O56: of:=IF([.A55]=[.A56];[.O55];[.O55]+1) -> 24 | P56: of:=IF([.A56]=[.E56];"";IF([.E56]="";"";"あり")) -> 
A57: 保育園前 | C57: 上り | E57: 保育園前 | F57: 板 | G57: あり | H57: あり | I57: 2012-10 | J57: https://www.google.co.jp/maps/@35.4118304,133.8024743,3a,33.9y,356.98h,88.24t/data=!3m6!1e1!3m4!1soGFh9FTfjNGHLDHIUswjgg!2e0!7i13312!8i6656?hl=ja | K57: 35.411918, 133.802465 | M57: of:=MID([.K57];1;FIND(",";[.K57])-1) -> 35.411918 | N57: of:=MID([.K57];FIND(" ";[.K57])+1;LEN([.K57])) -> 133.802465 | O57: of:=IF([.A56]=[.A57];[.O56];[.O56]+1) -> 25 | P57: of:=IF([.A57]=[.E57];"";IF([.E57]="";"";"あり")) -> 
A58: 保育園前 | C58: 下り | E58: 保育園前 | F58: 板 | G58: なし | H58: なし | I58: 2012-10 | J58: https://www.google.co.jp/maps/@35.4118304,133.8024743,3a,33.9y,179.07h,87.71t/data=!3m6!1e1!3m4!1soGFh9FTfjNGHLDHIUswjgg!2e0!7i13312!8i6656?hl=ja | K58: 35.411753, 133.802471 | M58: of:=MID([.K58];1;FIND(",";[.K58])-1) -> 35.411753 | N58: of:=MID([.K58];FIND(" ";[.K58])+1;LEN([.K58])) -> 133.802471 | O58: of:=IF([.A57]=[.A58];[.O57];[.O57]+1) -> 25 | P58: of:=IF([.A58]=[.E58];"";IF([.E58]="";"";"あり")) -> 
A59: 中河原 | C59: 上り | F59: 柱 | G59: あり | H59: あり | I59: 2012-10 | J59: https://www.google.co.jp/maps/@35.4087991,133.8001543,3a,52.4y,316.67h,86.62t/data=!3m6!1e1!3m4!1s6KZNhwvWL20wuH-PaMFxow!2e0!7i13312!8i6656?hl=ja | K59: 35.408869, 133.800044 | M59: of:=MID([.K59];1;FIND(",";[.K59])-1) -> 35.408869 | N59: of:=MID([.K59];FIND(" ";[.K59])+1;LEN([.K59])) -> 133.800044 | O59: of:=IF([.A58]=[.A59];[.O58];[.O58]+1) -> 26 | P59: of:=IF([.A59]=[.E59];"";IF([.E59]="";"";"あり")) -> 
A60: 中河原 | C60: 下り | E60: 中河原 | F60: 柱 | G60: なし | H60: なし | I60: 2012-10 | J60: https://www.google.co.jp/maps/@35.4094447,133.8007095,3a,23y,167.75h,87.93t/data=!3m6!1e1!3m4!1sGhKp8tEohMbPJSBCTfUU-w!2e0!7i13312!8i6656?hl=ja | K60: 35.409311, 133.800729 | M60: of:=MID([.K60];1;FIND(",";[.K60])-1) -> 35.409311 | N60: of:=MID([.K60];FIND(" ";[.K60])+1;LEN([.K60])) -> 133.800729 | O60: of:=IF([.A59]=[.A60];[.O59];[.O59]+1) -> 26 | P60: of:=IF([.A60]=[.E60];"";IF([.E60]="";"";"あり")) -> 
A61: 市場 | C61: 上り | E61: 市場 | F61: 柱 | G61: あり | H61: あり | I61: 2012-10 | J61: https://www.google.co.jp/maps/@35.4060157,133.7973192,3a,75y,306.03h,80.82t/data=!3m6!1e1!3m4!1s8p0lo-ywgMuEs7qSO71vSw!2e0!7i13312!8i6656?hl=ja | K61: 35.406038, 133.797271 | M61: of:=MID([.K61];1;FIND(",";[.K61])-1) -> 35.406038 | N61: of:=MID([.K61];FIND(" ";[.K61])+1;LEN([.K61])) -> 133.797271 | O61: of:=IF([.A60]=[.A61];[.O60];[.O60]+1) -> 27 | P61: of:=IF([.A61]=[.E61];"";IF([.E61]="";"";"あり")) -> 
A62: 市場 | C62: 下り | E62: 市場 | F62: 板 | G62: なし | H62: なし | I62: 2012-10 | J62: https://www.google.co.jp/maps/@35.4061837,133.7974873,3a,75y,159.51h,85.49t/data=!3m6!1e1!3m4!1sZlXJKV1u3QRWBW7oGPwwiQ!2e0!7i13312!8i6656?hl=ja | K62: 35.406105, 133.797520 | M62: of:=MID([.K62];1;FIND(",";[.K62])-1) -> 35.406105 | N62: of:=MID([.K62];FIND(" ";[.K62])+1;LEN([.K62])) -> 133.797520 | O62: of:=IF([.A61]=[.A62];[.O61];[.O61]+1) -> 27 | P62: of:=IF([.A62]=[.E62];"";IF([.E62]="";"";"あり")) -> 
A63: 蔵内入口 | C63: 上り | E63: 蔵内入口 | F63: 柱 | G63: あり | H63: あり | I63: 2012-10 | J63: https://www.google.co.jp/maps/@35.4010384,133.7923435,3a,75y,300.63h,86.2t/data=!3m6!1e1!3m4!1sFIFJGBIQqn9WGW2Z-O2b7w!2e0!7i13312!8i6656?hl=ja | K63: 35.401040, 133.792305 | M63: of:=MID([.K63];1;FIND(",";[.K63])-1) -> 35.401040 | N63: of:=MID([.K63];FIND(" ";[.K63])+1;LEN([.K63])) -> 133.792305 | O63: of:=IF([.A62]=[.A63];[.O62];[.O62]+1) -> 28 | P63: of:=IF([.A63]=[.E63];"";IF([.E63]="";"";"あり")) -> 
A64: 蔵内入口 | C64: 下り | E64: 蔵内入口 | F64: 板 | G64: なし | H64: なし | I64: 2012-10 | J64: https://www.google.co.jp/maps/@35.401389,133.7926984,3a,15y,64.17h,89.16t/data=!3m6!1e1!3m4!1s_rioO-_-umNTzpAsu_Fl7Q!2e0!7i13312!8i6656?hl=ja | K64: 35.401490, 133.792930 | M64: of:=MID([.K64];1;FIND(",";[.K64])-1) -> 35.401490 | N64: of:=MID([.K64];FIND(" ";[.K64])+1;LEN([.K64])) -> 133.792930 | O64: of:=IF([.A63]=[.A64];[.O63];[.O63]+1) -> 28 | P64: of:=IF([.A64]=[.E64];"";IF([.E64]="";"";"あり")) -> 
A65: 上古川 | C65: 上り | E65: 上古川 | F65: 板 | G65: あり | H65: あり | I65: 2012-10 | J65: https://www.google.co.jp/maps/@35.3986448,133.7899868,3a,60.6y,277.14h,84.65t/data=!3m6!1e1!3m4!1sBu8C9fJbeJ1oKO_7GeRxGw!2e0!7i13312!8i6656?hl=ja | K65: 35.398655, 133.789894 | M65: of:=MID([.K65];1;FIND(",";[.K65])-1) -> 35.398655 | N65: of:=MID([.K65];FIND(" ";[.K65])+1;LEN([.K65])) -> 133.789894 | O65: of:=IF([.A64]=[.A65];[.O64];[.O64]+1) -> 29 | P65: of:=IF([.A65]=[.E65];"";IF([.E65]="";"";"あり")) -> 
A66: 上古川 | C66: 下り | F66: なし | G66: なし | H66: なし | I66: 2012-10 | K66: 35.398655, 133.789894 | M66: of:=MID([.K66];1;FIND(",";[.K66])-1) -> 35.398655 | N66: of:=MID([.K66];FIND(" ";[.K66])+1;LEN([.K66])) -> 133.789894 | O66: of:=IF([.A65]=[.A66];[.O65];[.O65]+1) -> 29 | P66: of:=IF([.A66]=[.E66];"";IF([.E66]="";"";"あり")) -> 
A67: 石塚入口 | C67: 上り | E67: 石塚入口 | F67: 柱 | G67: あり | H67: あり | I67: 2012-10 | J67: https://www.google.co.jp/maps/@35.3963056,133.7875988,3a,60y,273.19h,85.37t/data=!3m6!1e1!3m4!1sit-JwIxiI8nkYHFS--uOTw!2e0!7i13312!8i6656?hl=ja | K67: 35.396291, 133.787537 | M67: of:=MID([.K67];1;FIND(",";[.K67])-1) -> 35.396291 | N67: of:=MID([.K67];FIND(" ";[.K67])+1;LEN([.K67])) -> 133.787537 | O67: of:=IF([.A66]=[.A67];[.O66];[.O66]+1) -> 30 | P67: of:=IF([.A67]=[.E67];"";IF([.E67]="";"";"あり")) -> 
A68: 石塚入口 | C68: 下り | F68: なし | G68: なし | H68: なし | I68: 2012-10 | K68: 35.396291, 133.787537 | M68: of:=MID([.K68];1;FIND(",";[.K68])-1) -> 35.396291 | N68: of:=MID([.K68];FIND(" ";[.K68])+1;LEN([.K68])) -> 133.787537 | O68: of:=IF([.A67]=[.A68];[.O67];[.O67]+1) -> 30 | P68: of:=IF([.A68]=[.E68];"";IF([.E68]="";"";"あり")) -> 
A69: 診療所前 | C69: 上り | E69: 診療所前 | F69: 柱 | G69: あり | H69: なし | I69: 2012-10 | J69: https://www.google.co.jp/maps/@35.3937047,133.7850004,3a,60y,321.58h,86.36t/data=!3m6!1e1!3m4!1szmP_oaFZF1Tzmy97_1puDQ!2e0!7i13312!8i6656?hl=ja | K69: 35.393760, 133.785021 | M69: of:=MID([.K69];1;FIND(",";[.K69])-1) -> 35.393760 | N69: of:=MID([.K69];FIND(" ";[.K69])+1;LEN([.K69])) -> 133.785021 | O69: of:=IF([.A68]=[.A69];[.O68];[.O68]+1) -> 31 | P69: of:=IF([.A69]=[.E69];"";IF([.E69]="";"";"あり")) -> 
A70: 診療所前 | C70: 下り | F70: なし | G70: なし | H70: なし | I70: 2012-10 | K70: 35.393760, 133.785021 | M70: of:=MID([.K70];1;FIND(",";[.K70])-1) -> 35.393760 | N70: of:=MID([.K70];FIND(" ";[.K70])+1;LEN([.K70])) -> 133.785021 | O70: of:=IF([.A69]=[.A70];[.O69];[.O69]+1) -> 31 | P70: of:=IF([.A70]=[.E70];"";IF([.E70]="";"";"あり")) -> 
A71: 福山 | C71: 上り | E71: 福山 | F71: 柱 | G71: あり | H71: あり | I71: 2012-10 | J71: https://www.google.co.jp/maps/@35.391422,133.7824097,3a,33.3y,15.23h,86.05t/data=!3m6!1e1!3m4!1spGYnNuKhi89SPDnJx8pLTw!2e0!7i13312!8i6656?hl=ja | K71: 35.391515, 133.782440 | M71: of:=MID([.K71];1;FIND(",";[.K71])-1) -> 35.391515 | N71: of:=MID([.K71];FIND(" ";[.K71])+1;LEN([.K71])) -> 133.782440 | O71: of:=IF([.A70]=[.A71];[.O70];[.O70]+1) -> 32 | P71: of:=IF([.A71]=[.E71];"";IF([.E71]="";"";"あり")) -> 
A72: 福山 | C72: 下り | F72: 柱 | G72: なし | H72: なし | I72: 2012-10 | J72: https://www.google.co.jp/maps/@35.391422,133.7824097,3a,33.3y,132.46h,80.79t/data=!3m6!1e1!3m4!1spGYnNuKhi89SPDnJx8pLTw!2e0!7i13312!8i6656?hl=ja | K72: 35.391391, 133.782482 | M72: of:=MID([.K72];1;FIND(",";[.K72])-1) -> 35.391391 | N72: of:=MID([.K72];FIND(" ";[.K72])+1;LEN([.K72])) -> 133.782482 | O72: of:=IF([.A71]=[.A72];[.O71];[.O71]+1) -> 32 | P72: of:=IF([.A72]=[.E72];"";IF([.E72]="";"";"あり")) -> 
A73: 若土 | C73: 上り | E73: 若土 | F73: 柱 | G73: あり | H73: あり | I73: 2012-10 | J73: https://www.google.co.jp/maps/@35.386138,133.780061,3a,23.7y,301.19h,85.67t/data=!3m6!1e1!3m4!1sFl0Lr9Eb9UGnwZXoo557Wg!2e0!7i13312!8i6656?hl=ja | K73: 35.386189, 133.779964 | M73: of:=MID([.K73];1;FIND(",";[.K73])-1) -> 35.386189 | N73: of:=MID([.K73];FIND(" ";[.K73])+1;LEN([.K73])) -> 133.779964 | O73: of:=IF([.A72]=[.A73];[.O72];[.O72]+1) -> 33 | P73: of:=IF([.A73]=[.E73];"";IF([.E73]="";"";"あり")) -> 
A74: 若土 | C74: 下り | E74: 若土 | F74: 柱 | G74: なし | H74: なし | I74: 2012-10 | J74: https://www.google.co.jp/maps/@35.3872517,133.7806472,3a,33.4y,127.17h,88.3t/data=!3m6!1e1!3m4!1sajBi3HZ0YsrmsrDryoAAmA!2e0!7i13312!8i6656?hl=ja | K74: 35.387171, 133.780749 | M74: of:=MID([.K74];1;FIND(",";[.K74])-1) -> 35.387171 | N74: of:=MID([.K74];FIND(" ";[.K74])+1;LEN([.K74])) -> 133.780749 | O74: of:=IF([.A73]=[.A74];[.O73];[.O73]+1) -> 33 | P74: of:=IF([.A74]=[.E74];"";IF([.E74]="";"";"あり")) -> 
A75: 生竹 | C75: 上り | E75: 生竹 | F75: 柱 | G75: なし | H75: なし | I75: 2012-10 | J75: https://www.google.co.jp/maps/@35.3777395,133.7744415,3a,51.6y,227.95h,80.35t/data=!3m6!1e1!3m4!1shUJKUozoauyQ-NYm5R0HMQ!2e0!7i13312!8i6656?hl=ja | K75: 35.377706, 133.774377 | M75: of:=MID([.K75];1;FIND(",";[.K75])-1) -> 35.377706 | N75: of:=MID([.K75];FIND(" ";[.K75])+1;LEN([.K75])) -> 133.774377 | O75: of:=IF([.A74]=[.A75];[.O74];[.O74]+1) -> 34 | P75: of:=IF([.A75]=[.E75];"";IF([.E75]="";"";"あり")) -> 
A76: 生竹 | C76: 下り | F76: なし | G76: なし | H76: なし | I76: 2012-10 | K76: 35.377706, 133.774377 | M76: of:=MID([.K76];1;FIND(",";[.K76])-1) -> 35.377706 | N76: of:=MID([.K76];FIND(" ";[.K76])+1;LEN([.K76])) -> 133.774377 | O76: of:=IF([.A75]=[.A76];[.O75];[.O75]+1) -> 34 | P76: of:=IF([.A76]=[.E76];"";IF([.E76]="";"";"あり")) -> 
A77: 耳 | C77: 上り | E77: 耳 | F77: 柱 | G77: なし | H77: なし | I77: 2012-09 | J77: https://www.google.co.jp/maps/@35.3751158,133.7723563,3a,60y,341.39h,85.57t/data=!3m6!1e1!3m4!1s2MY75dhx3QmUbBMwfnJlvw!2e0!7i13312!8i6656?hl=ja | K77: 35.375171, 133.772299 | M77: of:=MID([.K77];1;FIND(",";[.K77])-1) -> 35.375171 | N77: of:=MID([.K77];FIND(" ";[.K77])+1;LEN([.K77])) -> 133.772299 | O77: of:=IF([.A76]=[.A77];[.O76];[.O76]+1) -> 35 | P77: of:=IF([.A77]=[.E77];"";IF([.E77]="";"";"あり")) -> 
A78: 耳 | C78: 下り | F78: なし | G78: あり | H78: あり | I78: 2012-09 | J78: https://www.google.co.jp/maps/@35.3751158,133.7723563,3a,60y,121.11h,80.04t/data=!3m6!1e1!3m4!1s2MY75dhx3QmUbBMwfnJlvw!2e0!7i13312!8i6656?hl=ja | K78: 35.375171, 133.772299 | M78: of:=MID([.K78];1;FIND(",";[.K78])-1) -> 35.375171 | N78: of:=MID([.K78];FIND(" ";[.K78])+1;LEN([.K78])) -> 133.772299 | O78: of:=IF([.A77]=[.A78];[.O77];[.O77]+1) -> 35 | P78: of:=IF([.A78]=[.E78];"";IF([.E78]="";"";"あり")) -> 
A79: 関金入口 | C79: 上り | E79: 関金入口 | F79: 柱 | G79: なし | H79: なし | I79: 2012-09 | J79: https://www.google.co.jp/maps/@35.3687317,133.7646981,3a,49.5y,319.43h,85.75t/data=!3m6!1e1!3m4!1sdML8X-nhHdvs0KtjscEBpQ!2e0!7i13312!8i6656?hl=ja | K79: 35.368783, 133.764598 | M79: of:=MID([.K79];1;FIND(",";[.K79])-1) -> 35.368783 | N79: of:=MID([.K79];FIND(" ";[.K79])+1;LEN([.K79])) -> 133.764598 | O79: of:=IF([.A78]=[.A79];[.O78];[.O78]+1) -> 36 | P79: of:=IF([.A79]=[.E79];"";IF([.E79]="";"";"あり")) -> 
A80: 関金入口 | C80: 下り | F80: 柱 | G80: あり | H80: あり | I80: 2012-09 | J80: https://www.google.co.jp/maps/@35.3686671,133.7644567,3a,75y,148.99h,72.9t/data=!3m6!1e1!3m4!1sz08J6l9-TMAPfBbIyhFphQ!2e0!7i13312!8i6656?hl=ja | K80: 35.368607, 133.764484 | M80: of:=MID([.K80];1;FIND(",";[.K80])-1) -> 35.368607 | N80: of:=MID([.K80];FIND(" ";[.K80])+1;LEN([.K80])) -> 133.764484 | O80: of:=IF([.A79]=[.A80];[.O79];[.O79]+1) -> 36 | P80: of:=IF([.A80]=[.E80];"";IF([.E80]="";"";"あり")) -> 
A81: 関金温泉 | C81: 上り | E81: 関金温泉 | F81: 板 | G81: あり | H81: あり | I81: 2012-09 | J81: https://www.google.co.jp/maps/@35.3661281,133.7597197,3a,45.8y,338.89h,91t/data=!3m6!1e1!3m4!1sUWxKgHdOQPIzWHW_nMTnvA!2e0!7i13312!8i6656?hl=ja | K81: 35.366218, 133.759678 | M81: of:=MID([.K81];1;FIND(",";[.K81])-1) -> 35.366218 | N81: of:=MID([.K81];FIND(" ";[.K81])+1;LEN([.K81])) -> 133.759678 | O81: of:=IF([.A80]=[.A81];[.O80];[.O80]+1) -> 37 | P81: of:=IF([.A81]=[.E81];"";IF([.E81]="";"";"あり")) -> 
A82: 関金温泉 | C82: 下り | E82: 関金温泉 | F82: 板 | G82: あり | H82: あり | I82: 2012-09 | J82: https://www.google.co.jp/maps/@35.3663514,133.7600675,3a,80.3y,188.83h,90.09t/data=!3m6!1e1!3m4!1sgn6tUwb530TYgPWbXnz5uw!2e0!7i13312!8i6656?hl=ja | K82: 35.366216, 133.760049 | M82: of:=MID([.K82];1;FIND(",";[.K82])-1) -> 35.366216 | N82: of:=MID([.K82];FIND(" ";[.K82])+1;LEN([.K82])) -> 133.760049 | O82: of:=IF([.A81]=[.A82];[.O81];[.O81]+1) -> 37 | P82: of:=IF([.A82]=[.E82];"";IF([.E82]="";"";"あり")) -> 
A83: 金谷 | C83: 上り | F83: なし | G83: なし | H83: なし | I83: 2012-10 | K83: 35.367865, 133.758305 | M83: of:=MID([.K83];1;FIND(",";[.K83])-1) -> 35.367865 | N83: of:=MID([.K83];FIND(" ";[.K83])+1;LEN([.K83])) -> 133.758305 | O83: of:=IF([.A82]=[.A83];[.O82];[.O82]+1) -> 38 | P83: of:=IF([.A83]=[.E83];"";IF([.E83]="";"";"あり")) -> 
A84: 金谷 | C84: 下り | E84: 金谷 | F84: 板 | G84: あり | H84: あり | I84: 2012-10 | J84: https://www.google.co.jp/maps/@35.3677334,133.7583674,3a,51.3y,325.19h,87.11t/data=!3m6!1e1!3m4!1sSAwhmKrwEJiG4yq3l812iw!2e0!7i13312!8i6656?hl=ja | K84: 35.367865, 133.758305 | M84: of:=MID([.K84];1;FIND(",";[.K84])-1) -> 35.367865 | N84: of:=MID([.K84];FIND(" ";[.K84])+1;LEN([.K84])) -> 133.758305 | O84: of:=IF([.A83]=[.A84];[.O83];[.O83]+1) -> 38 | P84: of:=IF([.A84]=[.E84];"";IF([.E84]="";"";"あり")) -> 
A85: 中学校入口 | C85: 上り | F85: 柱 | G85: あり | H85: なし | I85: 2012-10 | J85: https://www.google.co.jp/maps/@35.3696486,133.7569813,3a,60y,358.13h,89.38t/data=!3m6!1e1!3m4!1sUAum_up7hsqzsB5-oIvvdg!2e0!7i13312!8i6656?hl=ja | K85: 35.369690, 133.756957 | M85: of:=MID([.K85];1;FIND(",";[.K85])-1) -> 35.369690 | N85: of:=MID([.K85];FIND(" ";[.K85])+1;LEN([.K85])) -> 133.756957 | O85: of:=IF([.A84]=[.A85];[.O84];[.O84]+1) -> 39 | P85: of:=IF([.A85]=[.E85];"";IF([.E85]="";"";"あり")) -> 
A86: 中学校入口 | C86: 下り | F86: なし | G86: なし | H86: なし | I86: 2012-10 | K86: 35.369690, 133.756957 | M86: of:=MID([.K86];1;FIND(",";[.K86])-1) -> 35.369690 | N86: of:=MID([.K86];FIND(" ";[.K86])+1;LEN([.K86])) -> 133.756957 | O86: of:=IF([.A85]=[.A86];[.O85];[.O85]+1) -> 39 | P86: of:=IF([.A86]=[.E86];"";IF([.E86]="";"";"あり")) -> 
A87: 関金庁舎前 | C87: 上り | F87: 柱 | G87: なし | H87: なし | I87: 2012-10 | J87: https://www.google.co.jp/maps/@35.3698505,133.7546795,3a,52.5y,25.68h,86.4t/data=!3m6!1e1!3m4!1sOEp7quNYIGRIdvNom3gJ3w!2e0!7i13312!8i6656?hl=ja | K87: 35.369891, 133.754702 | M87: of:=MID([.K87];1;FIND(",";[.K87])-1) -> 35.369891 | N87: of:=MID([.K87];FIND(" ";[.K87])+1;LEN([.K87])) -> 133.754702 | O87: of:=IF([.A86]=[.A87];[.O86];[.O86]+1) -> 40 | P87: of:=IF([.A87]=[.E87];"";IF([.E87]="";"";"あり")) -> 
A88: 関金庁舎前 | C88: 下り | F88: 柱 | G88: なし | H88: なし | I88: 2012-10 | J88: https://www.google.co.jp/maps/@35.3698505,133.7546795,3a,52.5y,158.86h,83.82t/data=!3m6!1e1!3m4!1sOEp7quNYIGRIdvNom3gJ3w!2e0!7i13312!8i6656?hl=ja | K88: 35.369793, 133.754695 | M88: of:=MID([.K88];1;FIND(",";[.K88])-1) -> 35.369793 | N88: of:=MID([.K88];FIND(" ";[.K88])+1;LEN([.K88])) -> 133.754695 | O88: of:=IF([.A87]=[.A88];[.O87];[.O87]+1) -> 40 | P88: of:=IF([.A88]=[.E88];"";IF([.E88]="";"";"あり")) -> 
A89: 関金バスセンター | C89: 上り | F89: なし | G89: あり | H89: あり | I89: 2012-10 | J89: https://www.google.co.jp/maps/@35.3701741,133.7518384,3a,75y,346.36h,81.46t/data=!3m6!1e1!3m4!1sl_avmaJmr--LupAV88o6wQ!2e0!7i13312!8i6656?hl=ja | K89: 35.370217, 133.751790 | M89: of:=MID([.K89];1;FIND(",";[.K89])-1) -> 35.370217 | N89: of:=MID([.K89];FIND(" ";[.K89])+1;LEN([.K89])) -> 133.751790 | O89: of:=IF([.A88]=[.A89];[.O88];[.O88]+1) -> 41 | P89: of:=IF([.A89]=[.E89];"";IF([.E89]="";"";"あり")) -> 
A90: 関金バスセンター | C90: 下り | F90: なし | G90: なし | H90: なし | I90: 2012-10 | K90: 35.370217, 133.751790 | M90: of:=MID([.K90];1;FIND(",";[.K90])-1) -> 35.370217 | N90: of:=MID([.K90];FIND(" ";[.K90])+1;LEN([.K90])) -> 133.751790 | O90: of:=IF([.A89]=[.A90];[.O89];[.O89]+1) -> 41 | P90: of:=IF([.A90]=[.E90];"";IF([.E90]="";"";"あり")) -> 
A91: 大鳥居 | C91: 上り | E91: 大鳥居 | F91: 柱 | G91: なし | H91: なし | I91: 2012-10 | J91: https://www.google.co.jp/maps/@35.3705737,133.7478993,3a,75y,343.28h,84.35t/data=!3m6!1e1!3m4!1sJpZhYKFkM_n_u3w4pBVcjQ!2e0!7i13312!8i6656?hl=ja | K91: 35.370593, 133.747886 | M91: of:=MID([.K91];1;FIND(",";[.K91])-1) -> 35.370593 | N91: of:=MID([.K91];FIND(" ";[.K91])+1;LEN([.K91])) -> 133.747886 | O91: of:=IF([.A90]=[.A91];[.O90];[.O90]+1) -> 42 | P91: of:=IF([.A91]=[.E91];"";IF([.E91]="";"";"あり")) -> 
A92: 大鳥居 | C92: 下り | F92: なし | G92: なし | H92: なし | I92: 2012-10 | K92: 35.370593, 133.747886 | M92: of:=MID([.K92];1;FIND(",";[.K92])-1) -> 35.370593 | N92: of:=MID([.K92];FIND(" ";[.K92])+1;LEN([.K92])) -> 133.747886 | O92: of:=IF([.A91]=[.A92];[.O91];[.O91]+1) -> 42 | P92: of:=IF([.A92]=[.E92];"";IF([.E92]="";"";"あり")) -> 
A93: 松河原 | C93: 上り | E93: 松河原 | F93: 柱 | G93: あり | H93: あり | I93: 2012-10 | J93: https://www.google.co.jp/maps/@35.3694709,133.7423283,3a,42.1y,54.5h,85.63t/data=!3m6!1e1!3m4!1s7JkDhmcKpgn9ErhmnfcZ2g!2e0!7i13312!8i6656?hl=ja | K93: 35.369517, 133.742414 | M93: of:=MID([.K93];1;FIND(",";[.K93])-1) -> 35.369517 | N93: of:=MID([.K93];FIND(" ";[.K93])+1;LEN([.K93])) -> 133.742414 | O93: of:=IF([.A92]=[.A93];[.O92];[.O92]+1) -> 43 | P93: of:=IF([.A93]=[.E93];"";IF([.E93]="";"";"あり")) -> 
A94: 松河原 | C94: 下り | E94: 松河原 | F94: 柱 | G94: なし | H94: なし | I94: 2012-10 | J94: https://www.google.co.jp/maps/@35.3693655,133.7415427,3a,75y,198.97h,77.97t/data=!3m6!1e1!3m4!1syK0Yew60OLcswg90giMD9A!2e0!7i13312!8i6656?hl=ja | K94: 35.369321, 133.741511 | M94: of:=MID([.K94];1;FIND(",";[.K94])-1) -> 35.369321 | N94: of:=MID([.K94];FIND(" ";[.K94])+1;LEN([.K94])) -> 133.741511 | O94: of:=IF([.A93]=[.A94];[.O93];[.O93]+1) -> 43 | P94: of:=IF([.A94]=[.E94];"";IF([.E94]="";"";"あり")) -> 
A95: 松河原上 | C95: 上り | E95: 松河原上 | F95: 柱 | G95: あり | H95: あり | I95: 2012-10 | J95: https://www.google.co.jp/maps/@35.3689636,133.7376727,3a,52y,322.74h,82.42t/data=!3m6!1e1!3m4!1sPomiFiCqUAV19WYdn86npA!2e0!7i13312!8i6656?hl=ja | K95: 35.368997, 133.737586 | M95: of:=MID([.K95];1;FIND(",";[.K95])-1) -> 35.368997 | N95: of:=MID([.K95];FIND(" ";[.K95])+1;LEN([.K95])) -> 133.737586 | O95: of:=IF([.A94]=[.A95];[.O94];[.O94]+1) -> 44 | P95: of:=IF([.A95]=[.E95];"";IF([.E95]="";"";"あり")) -> 
A96: 松河原上 | C96: 下り | E96: 松河原上 | F96: 柱 | G96: なし | H96: なし | I96: 2012-10 | J96: https://www.google.co.jp/maps/@35.3688375,133.7366155,3a,75y,194.22h,77.61t/data=!3m6!1e1!3m4!1spF7vESniNOliGCCkItZ27g!2e0!7i13312!8i6656?hl=ja | K96: 35.368793, 133.736614 | M96: of:=MID([.K96];1;FIND(",";[.K96])-1) -> 35.368793 | N96: of:=MID([.K96];FIND(" ";[.K96])+1;LEN([.K96])) -> 133.736614 | O96: of:=IF([.A95]=[.A96];[.O95];[.O95]+1) -> 44 | P96: of:=IF([.A96]=[.E96];"";IF([.E96]="";"";"あり")) -> 
A97: 泰久寺入口 | C97: 上り | E97: 泰久寺入口 | F97: 柱 | G97: なし | H97: なし | I97: 2012-10 | J97: https://www.google.co.jp/maps/@35.3685276,133.7342292,3a,49.5y,16.51h,82.56t/data=!3m6!1e1!3m4!1sQBG9SDB5cbmikw8NKViRiA!2e0!7i13312!8i6656?hl=ja | K97: 35.368567, 133.734241 | M97: of:=MID([.K97];1;FIND(",";[.K97])-1) -> 35.368567 | N97: of:=MID([.K97];FIND(" ";[.K97])+1;LEN([.K97])) -> 133.734241 | O97: of:=IF([.A96]=[.A97];[.O96];[.O96]+1) -> 45 | P97: of:=IF([.A97]=[.E97];"";IF([.E97]="";"";"あり")) -> 
A98: 泰久寺入口 | C98: 下り | F98: なし | G98: なし | H98: なし | I98: 2012-10 | K98: 35.368567, 133.734241 | M98: of:=MID([.K98];1;FIND(",";[.K98])-1) -> 35.368567 | N98: of:=MID([.K98];FIND(" ";[.K98])+1;LEN([.K98])) -> 133.734241 | O98: of:=IF([.A97]=[.A98];[.O97];[.O97]+1) -> 45 | P98: of:=IF([.A98]=[.E98];"";IF([.E98]="";"";"あり")) -> 
A99: 泰久寺 | C99: 上り | E99: 泰久寺 | F99: 柱 | G99: あり | H99: あり | I99: 2012-10 | J99: https://www.google.co.jp/maps/@35.3680817,133.7304256,3a,48.6y,38.37h,84.01t/data=!3m6!1e1!3m4!1sJH83TIrm2IdyNeG1g7dQBw!2e0!7i13312!8i6656?hl=ja | K99: 35.368167, 133.730494 | M99: of:=MID([.K99];1;FIND(",";[.K99])-1) -> 35.368167 | N99: of:=MID([.K99];FIND(" ";[.K99])+1;LEN([.K99])) -> 133.730494 | O99: of:=IF([.A98]=[.A99];[.O98];[.O98]+1) -> 46 | P99: of:=IF([.A99]=[.E99];"";IF([.E99]="";"";"あり")) -> 
A100: 泰久寺 | C100: 下り | F100: なし | G100: なし | H100: なし | I100: 2012-10 | K100: 35.368167, 133.730494 | M100: of:=MID([.K100];1;FIND(",";[.K100])-1) -> 35.368167 | N100: of:=MID([.K100];FIND(" ";[.K100])+1;LEN([.K100])) -> 133.730494 | O100: of:=IF([.A99]=[.A100];[.O99];[.O99]+1) -> 46 | P100: of:=IF([.A100]=[.E100];"";IF([.E100]="";"";"あり")) -> 
A101: 崎山入口 | C101: 上り | E101: 崎山入口 | F101: 柱 | G101: なし | H101: なし | I101: 2012-10 | J101: https://www.google.co.jp/maps/@35.3613013,133.7163667,3a,46.5y,278.26h,80.45t/data=!3m6!1e1!3m4!1sc6s2icjbTFMGNczWrGH8nQ!2e0!7i13312!8i6656?hl=ja | K101: 35.361334, 133.716298 | M101: of:=MID([.K101];1;FIND(",";[.K101])-1) -> 35.361334 | N101: of:=MID([.K101];FIND(" ";[.K101])+1;LEN([.K101])) -> 133.716298 | O101: of:=IF([.A100]=[.A101];[.O100];[.O100]+1) -> 47 | P101: of:=IF([.A101]=[.E101];"";IF([.E101]="";"";"あり")) -> 
A102: 崎山入口 | C102: 下り | F102: 柱 | G102: なし | H102: なし | I102: 2012-10 | J102: https://www.google.co.jp/maps/@35.3612202,133.7163082,3a,75y,159.15h,85.6t/data=!3m6!1e1!3m4!1saUoE3dwuZFYAl5ArM0iXBA!2e0!7i13312!8i6656?hl=ja | K102: 35.361151, 133.716309 | M102: of:=MID([.K102];1;FIND(",";[.K102])-1) -> 35.361151 | N102: of:=MID([.K102];FIND(" ";[.K102])+1;LEN([.K102])) -> 133.716309 | O102: of:=IF([.A101]=[.A102];[.O101];[.O101]+1) -> 47 | P102: of:=IF([.A102]=[.E102];"";IF([.E102]="";"";"あり")) -> 
A103: 今西 | C103: 上り | E103: 今西 | F103: 柱 | G103: あり | H103: あり | I103: 2012-10 | J103: https://www.google.co.jp/maps/@35.3604548,133.7139595,3a,72.5y,25.15h,85.46t/data=!3m6!1e1!3m4!1sTtLDqflGGOF5PVfMxvG6RQ!2e0!7i13312!8i6656?hl=ja | K103: 35.360510, 133.714001 | M103: of:=MID([.K103];1;FIND(",";[.K103])-1) -> 35.360510 | N103: of:=MID([.K103];FIND(" ";[.K103])+1;LEN([.K103])) -> 133.714001 | O103: of:=IF([.A102]=[.A103];[.O102];[.O102]+1) -> 48 | P103: of:=IF([.A103]=[.E103];"";IF([.E103]="";"";"あり")) -> 
A104: 今西 | C104: 下り | F104: なし | G104: なし | H104: なし | I104: 2012-10 | K104: 35.360510, 133.714001 | M104: of:=MID([.K104];1;FIND(",";[.K104])-1) -> 35.360510 | N104: of:=MID([.K104];FIND(" ";[.K104])+1;LEN([.K104])) -> 133.714001 | O104: of:=IF([.A103]=[.A104];[.O103];[.O103]+1) -> 48 | P104: of:=IF([.A104]=[.E104];"";IF([.E104]="";"";"あり")) -> 
A105: 今西上 | C105: 上り | F105: なし | G105: なし | H105: なし | I105: 2012-10 | K105: 35.360680, 133.711454 | M105: of:=MID([.K105];1;FIND(",";[.K105])-1) -> 35.360680 | N105: of:=MID([.K105];FIND(" ";[.K105])+1;LEN([.K105])) -> 133.711454 | O105: of:=IF([.A104]=[.A105];[.O104];[.O104]+1) -> 49 | P105: of:=IF([.A105]=[.E105];"";IF([.E105]="";"";"あり")) -> 
A106: 今西上 | C106: 下り | E106: 今西上 | F106: 柱 | G106: なし | H106: なし | I106: 2012-10 | J106: https://www.google.co.jp/maps/@35.3607007,133.7114239,3a,60y,159.97h,82.48t/data=!3m6!1e1!3m4!1sD5uV8BCBXrpP6opELzSO5Q!2e0!7i13312!8i6656?hl=ja | K106: 35.360680, 133.711454 | M106: of:=MID([.K106];1;FIND(",";[.K106])-1) -> 35.360680 | N106: of:=MID([.K106];FIND(" ";[.K106])+1;LEN([.K106])) -> 133.711454 | O106: of:=IF([.A105]=[.A106];[.O105];[.O105]+1) -> 49 | P106: of:=IF([.A106]=[.E106];"";IF([.E106]="";"";"あり")) -> 
A107: 下堀 | C107: 上り | E107: 下堀 | F107: 柱 | G107: あり | H107: あり | I107: 2012-09 | J107: https://www.google.co.jp/maps/@35.3612282,133.706043,3a,75y,65.43h,76.36t/data=!3m6!1e1!3m4!1sjCGNgxnX7CkRmzK_OGdiVQ!2e0!7i13312!8i6656?hl=ja | K107: 35.361270, 133.706105 | M107: of:=MID([.K107];1;FIND(",";[.K107])-1) -> 35.361270 | N107: of:=MID([.K107];FIND(" ";[.K107])+1;LEN([.K107])) -> 133.706105 | O107: of:=IF([.A106]=[.A107];[.O106];[.O106]+1) -> 50 | P107: of:=IF([.A107]=[.E107];"";IF([.E107]="";"";"あり")) -> 
A108: 下堀 | C108: 下り | F108: なし | G108: なし | H108: なし | I108: 2012-09 | K108: 35.361270, 133.706105 | M108: of:=MID([.K108];1;FIND(",";[.K108])-1) -> 35.361270 | N108: of:=MID([.K108];FIND(" ";[.K108])+1;LEN([.K108])) -> 133.706105 | O108: of:=IF([.A107]=[.A108];[.O107];[.O107]+1) -> 50 | P108: of:=IF([.A108]=[.E108];"";IF([.E108]="";"";"あり")) -> 
A109: 堀集会場前 | C109: 上り | E109: 堀集会場前 | F109: 柱 | G109: あり | H109: あり | I109: 2012-10 | J109: https://www.google.co.jp/maps/@35.361366,133.7013899,3a,37.9y,28.14h,84.82t/data=!3m6!1e1!3m4!1sv-8E8fkWKiHKuQweCMBWjQ!2e0!7i13312!8i6656?hl=ja | K109: 35.361430, 133.701430 | M109: of:=MID([.K109];1;FIND(",";[.K109])-1) -> 35.361430 | N109: of:=MID([.K109];FIND(" ";[.K109])+1;LEN([.K109])) -> 133.701430 | O109: of:=IF([.A108]=[.A109];[.O108];[.O108]+1) -> 51 | P109: of:=IF([.A109]=[.E109];"";IF([.E109]="";"";"あり")) -> 
A110: 堀集会場前 | C110: 下り | E110: 堀集会場前 | F110: 柱 | G110: なし | H110: なし | I110: 2012-10 | J110: https://www.google.co.jp/maps/@35.3613712,133.7019866,3a,45.6y,203.3h,87.44t/data=!3m6!1e1!3m4!1s9eHv91iDMvb24RT0U2wVuA!2e0!7i13312!8i6656?hl=ja | K110: 35.361296, 133.701958 | M110: of:=MID([.K110];1;FIND(",";[.K110])-1) -> 35.361296 | N110: of:=MID([.K110];FIND(" ";[.K110])+1;LEN([.K110])) -> 133.701958 | O110: of:=IF([.A109]=[.A110];[.O109];[.O109]+1) -> 51 | P110: of:=IF([.A110]=[.E110];"";IF([.E110]="";"";"あり")) -> 
A111: 山守小学校前 | C111: 上り | E111: 山守小学校前 | F111: 柱 | G111: あり | H111: あり | I111: 2012-10 | J111: https://www.google.co.jp/maps/@35.3623607,133.6972387,3a,22.2y,8.15h,87.53t/data=!3m6!1e1!3m4!1s6WIlw677rjChrjzErxqsNg!2e0!7i13312!8i6656?hl=ja | K111: 35.362487, 133.697241 | M111: of:=MID([.K111];1;FIND(",";[.K111])-1) -> 35.362487 | N111: of:=MID([.K111];FIND(" ";[.K111])+1;LEN([.K111])) -> 133.697241 | O111: of:=IF([.A110]=[.A111];[.O110];[.O110]+1) -> 52 | P111: of:=IF([.A111]=[.E111];"";IF([.E111]="";"";"あり")) -> 
A112: 山守小学校前 | C112: 下り | E112: 山守小学校前 | F112: 柱 | G112: なし | H112: なし | I112: 2012-10 | J112: https://www.google.co.jp/maps/@35.362757,133.696737,3a,48.1y,204.41h,87.99t/data=!3m6!1e1!3m4!1s5AlCEXahEwgcMO58xiWxNA!2e0!7i13312!8i6656?hl=ja | K112: 35.362696, 133.696720 | M112: of:=MID([.K112];1;FIND(",";[.K112])-1) -> 35.362696 | N112: of:=MID([.K112];FIND(" ";[.K112])+1;LEN([.K112])) -> 133.696720 | O112: of:=IF([.A111]=[.A112];[.O111];[.O111]+1) -> 52 | P112: of:=IF([.A112]=[.E112];"";IF([.E112]="";"";"あり")) -> 
A113: 明高東口 | C113: 上り | E113: 明高東口 | F113: 柱 | G113: あり | H113: あり | I113: 2012-09 | J113: https://www.google.co.jp/maps/@35.3671674,133.6866579,3a,60y,32.61h,77.8t/data=!3m6!1e1!3m4!1sKZva82JWLYeQuDlCCZuj3A!2e0!7i13312!8i6656?hl=ja | K113: 35.367177, 133.686686 | M113: of:=MID([.K113];1;FIND(",";[.K113])-1) -> 35.367177 | N113: of:=MID([.K113];FIND(" ";[.K113])+1;LEN([.K113])) -> 133.686686 | O113: of:=IF([.A112]=[.A113];[.O112];[.O112]+1) -> 53 | P113: of:=IF([.A113]=[.E113];"";IF([.E113]="";"";"あり")) -> 
A114: 明高東口 | C114: 下り | E114: 明高東口 | F114: 柱 | G114: なし | H114: なし | I114: 2012-09 | J114: https://www.google.co.jp/maps/@35.3672469,133.6861618,3a,75y,152.97h,74.41t/data=!3m6!1e1!3m4!1sr3o7ha2L-7omhW1eeIRlPw!2e0!7i13312!8i6656?hl=ja | K114: 35.367194, 133.686186 | M114: of:=MID([.K114];1;FIND(",";[.K114])-1) -> 35.367194 | N114: of:=MID([.K114];FIND(" ";[.K114])+1;LEN([.K114])) -> 133.686186 | O114: of:=IF([.A113]=[.A114];[.O113];[.O113]+1) -> 53 | P114: of:=IF([.A114]=[.E114];"";IF([.E114]="";"";"あり")) -> 
A115: 明高入口 | C115: 上り | E115: 明高入口 | F115: 柱 | G115: あり | H115: あり | I115: 2012-09 | J115: https://www.google.co.jp/maps/@35.3689351,133.6807653,3a,60y,39.2h,79.98t/data=!3m6!1e1!3m4!1sD6cpLbcRo4sFPv2WhoY3Bg!2e0!7i13312!8i6656?hl=ja | K115: 35.368948, 133.680808 | M115: of:=MID([.K115];1;FIND(",";[.K115])-1) -> 35.368948 | N115: of:=MID([.K115];FIND(" ";[.K115])+1;LEN([.K115])) -> 133.680808 | O115: of:=IF([.A114]=[.A115];[.O114];[.O114]+1) -> 54 | P115: of:=IF([.A115]=[.E115];"";IF([.E115]="";"";"あり")) -> 
A116: 明高入口 | C116: 下り | F116: なし | G116: なし | H116: なし | I116: 2012-09 | K116: 35.368948, 133.680808 | M116: of:=MID([.K116];1;FIND(",";[.K116])-1) -> 35.368948 | N116: of:=MID([.K116];FIND(" ";[.K116])+1;LEN([.K116])) -> 133.680808 | O116: of:=IF([.A115]=[.A116];[.O115];[.O115]+1) -> 54 | P116: of:=IF([.A116]=[.E116];"";IF([.E116]="";"";"あり")) -> 
A117: 明高 | C117: 上り | E117: 明高 | F117: 柱 | G117: なし | H117: なし | I117: 2012-09 | J117: https://www.google.co.jp/maps/@35.3728271,133.6730685,3a,60y,94.47h,83.63t/data=!3m6!1e1!3m4!1sE4VC_EGSC-RDzISS6q9Dcg!2e0!7i13312!8i6656?hl=ja | K117: 35.372820, 133.673136 | M117: of:=MID([.K117];1;FIND(",";[.K117])-1) -> 35.372820 | N117: of:=MID([.K117];FIND(" ";[.K117])+1;LEN([.K117])) -> 133.673136 | O117: of:=IF([.A116]=[.A117];[.O116];[.O116]+1) -> 55 | P117: of:=IF([.A117]=[.E117];"";IF([.E117]="";"";"あり")) -> 
A118: 明高 | C118: 下り | F118: なし | G118: なし | H118: なし | I118: 2012-09 | K118: 35.372820, 133.673136 | M118: of:=MID([.K118];1;FIND(",";[.K118])-1) -> 35.372820 | N118: of:=MID([.K118];FIND(" ";[.K118])+1;LEN([.K118])) -> 133.673136 | O118: of:=IF([.A117]=[.A118];[.O117];[.O117]+1) -> 55 | P118: of:=IF([.A118]=[.E118];"";IF([.E118]="";"";"あり")) -> 
A119: 大坪 | C119: 上り | E119: 大坪 | F119: 柱 | G119: あり | H119: あり | I119: 2012-09 | J119: https://www.google.co.jp/maps/@35.3627546,133.7540736,3a,90y,303.46h,91.7t/data=!3m6!1e1!3m4!1sDEFD7SJ5rgnUfRqqynkbaA!2e0!7i13312!8i6656?hl=ja | K119: 35.362788, 133.753926 | M119: of:=MID([.K119];1;FIND(",";[.K119])-1) -> 35.362788 | N119: of:=MID([.K119];FIND(" ";[.K119])+1;LEN([.K119])) -> 133.753926 | O119: of:=IF([.A118]=[.A119];[.O118];[.O118]+1) -> 56 | P119: of:=IF([.A119]=[.E119];"";IF([.E119]="";"";"あり")) -> 
A120: 大坪 | C120: 下り | E120: 大坪 | F120: 柱 | G120: なし | H120: なし | I120: 2012-09 | J120: https://www.google.co.jp/maps/@35.3638273,133.7558022,3a,75y,155.29h,84.15t/data=!3m6!1e1!3m4!1sXlu1xwdSgG5wcAFOHDcjsg!2e0!7i13312!8i6656?hl=ja | K120: 35.363722, 133.755822 | M120: of:=MID([.K120];1;FIND(",";[.K120])-1) -> 35.363722 | N120: of:=MID([.K120];FIND(" ";[.K120])+1;LEN([.K120])) -> 133.755822 | O120: of:=IF([.A119]=[.A120];[.O119];[.O119]+1) -> 56 | P120: of:=IF([.A120]=[.E120];"";IF([.E120]="";"";"あり")) -> 
A121: 郡家 | C121: 上り | E121: 郡家 | F121: 柱 | G121: あり | H121: あり | I121: 2012-10 | J121: https://www.google.co.jp/maps/@35.3578684,133.7490748,3a,88.5y,320.6h,91.22t/data=!3m6!1e1!3m4!1s4-5IEP20khj4gNTqHVwmhQ!2e0!7i13312!8i6656?hl=ja | K121: 35.357885, 133.749005 | M121: of:=MID([.K121];1;FIND(",";[.K121])-1) -> 35.357885 | N121: of:=MID([.K121];FIND(" ";[.K121])+1;LEN([.K121])) -> 133.749005 | O121: of:=IF([.A120]=[.A121];[.O120];[.O120]+1) -> 57 | P121: of:=IF([.A121]=[.E121];"";IF([.E121]="";"";"あり")) -> 
A122: 郡家 | C122: 下り | E122: 郡家 | F122: 柱 | G122: なし | H122: なし | I122: 2012-10 | J122: https://www.google.co.jp/maps/@35.3586587,133.7496086,3a,60y,108.95h,86.59t/data=!3m6!1e1!3m4!1s4p7De7MVDZUpDP5J7kJ8IA!2e0!7i13312!8i6656?hl=ja | K122: 35.358624, 133.749733 | M122: of:=MID([.K122];1;FIND(",";[.K122])-1) -> 35.358624 | N122: of:=MID([.K122];FIND(" ";[.K122])+1;LEN([.K122])) -> 133.749733 | O122: of:=IF([.A121]=[.A122];[.O121];[.O121]+1) -> 57 | P122: of:=IF([.A122]=[.E122];"";IF([.E122]="";"";"あり")) -> 
A123: 曽谷入口 | C123: 上り | E123: 曽谷 | F123: 柱 | G123: あり | H123: あり | I123: 2012-09 | J123: https://www.google.co.jp/maps/@35.3535642,133.746803,3a,40.7y,312.97h,89.15t/data=!3m6!1e1!3m4!1sUuYJhcJCcweEjWPp8Qii7w!2e0!7i13312!8i6656?hl=ja | K123: 35.353585, 133.746744 | M123: of:=MID([.K123];1;FIND(",";[.K123])-1) -> 35.353585 | N123: of:=MID([.K123];FIND(" ";[.K123])+1;LEN([.K123])) -> 133.746744 | O123: of:=IF([.A122]=[.A123];[.O122];[.O122]+1) -> 58 | P123: of:=IF([.A123]=[.E123];"";IF([.E123]="";"";"あり")) -> あり
A124: 曽谷入口 | C124: 下り | E124: 曽谷入口 | F124: 柱 | G124: なし | H124: なし | I124: 2012-09 | J124: https://www.google.co.jp/maps/@35.3543854,133.7470792,3a,90y,71.47h,92t/data=!3m6!1e1!3m4!1sBjT3pHUfxPZocDU3Xy8jEQ!2e0!7i13312!8i6656?hl=ja | K124: 35.354400, 133.747226 | M124: of:=MID([.K124];1;FIND(",";[.K124])-1) -> 35.354400 | N124: of:=MID([.K124];FIND(" ";[.K124])+1;LEN([.K124])) -> 133.747226 | O124: of:=IF([.A123]=[.A124];[.O123];[.O123]+1) -> 58 | P124: of:=IF([.A124]=[.E124];"";IF([.E124]="";"";"あり")) -> 
A125: 田中 | C125: 上り | F125: 柱 | G125: あり | H125: あり | I125: 2012-09 | J125: https://www.google.co.jp/maps/@35.3478956,133.7457634,3a,75y,238.91h,79.25t/data=!3m6!1e1!3m4!1swERHHc-ViqdsbmaunAyByQ!2e0!7i13312!8i6656?hl=ja | K125: 35.347846, 133.745703 | M125: of:=MID([.K125];1;FIND(",";[.K125])-1) -> 35.347846 | N125: of:=MID([.K125];FIND(" ";[.K125])+1;LEN([.K125])) -> 133.745703 | O125: of:=IF([.A124]=[.A125];[.O124];[.O124]+1) -> 59 | P125: of:=IF([.A125]=[.E125];"";IF([.E125]="";"";"あり")) -> 
A126: 田中 | C126: 下り | E126: 田中 | F126: 柱 | G126: なし | H126: なし | I126: 2012-09 | J126: https://www.google.co.jp/maps/@35.3481878,133.7458154,3a,46.9y,100.33h,85.34t/data=!3m6!1e1!3m4!1sZzhKt_QegX6jg-FghDCySw!2e0!7i13312!8i6656?hl=ja | K126: 35.348143, 133.745937 | M126: of:=MID([.K126];1;FIND(",";[.K126])-1) -> 35.348143 | N126: of:=MID([.K126];FIND(" ";[.K126])+1;LEN([.K126])) -> 133.745937 | O126: of:=IF([.A125]=[.A126];[.O125];[.O125]+1) -> 59 | P126: of:=IF([.A126]=[.E126];"";IF([.E126]="";"";"あり")) -> 
A127: 山口 | C127: 上り | E127: 山口 | F127: 柱 | G127: あり | H127: あり | I127: 2012-09 | J127: https://www.google.co.jp/maps/@35.3436942,133.7430283,3a,60y,252.51h,85.92t/data=!3m6!1e1!3m4!1s6H08m3bdAbfR2vxcc2KBWA!2e0!7i13312!8i6656?hl=ja | K127: 35.343673, 133.742974 | M127: of:=MID([.K127];1;FIND(",";[.K127])-1) -> 35.343673 | N127: of:=MID([.K127];FIND(" ";[.K127])+1;LEN([.K127])) -> 133.742974 | O127: of:=IF([.A126]=[.A127];[.O126];[.O126]+1) -> 60 | P127: of:=IF([.A127]=[.E127];"";IF([.E127]="";"";"あり")) -> 
A128: 山口 | C128: 下り | E128: 山口 | F128: 柱 | G128: なし | H128: なし | I128: 2012-09 | J128: https://www.google.co.jp/maps/@35.3438433,133.743928,3a,46.7y,141.04h,87.59t/data=!3m6!1e1!3m4!1srpksC2L6cwV2s2TJ1BICEg!2e0!7i13312!8i6656?hl=ja | K128: 35.343807, 133.743981 | M128: of:=MID([.K128];1;FIND(",";[.K128])-1) -> 35.343807 | N128: of:=MID([.K128];FIND(" ";[.K128])+1;LEN([.K128])) -> 133.743981 | O128: of:=IF([.A127]=[.A128];[.O127];[.O127]+1) -> 60 | P128: of:=IF([.A128]=[.E128];"";IF([.E128]="";"";"あり")) -> 
A129: 山口上 | C129: 上り | E129: 山口上 | F129: 柱 | G129: あり | H129: あり | I129: 2012-09 | J129: https://www.google.co.jp/maps/@35.3409985,133.7412058,3a,42.8y,45.05h,91.1t/data=!3m6!1e1!3m4!1szIAMfFLtN8RwLmtzIPA87g!2e0!7i13312!8i6656?hl=ja | K129: 35.341160, 133.741355 | M129: of:=MID([.K129];1;FIND(",";[.K129])-1) -> 35.341160 | N129: of:=MID([.K129];FIND(" ";[.K129])+1;LEN([.K129])) -> 133.741355 | O129: of:=IF([.A128]=[.A129];[.O128];[.O128]+1) -> 61 | P129: of:=IF([.A129]=[.E129];"";IF([.E129]="";"";"あり")) -> 
A130: 山口上 | C130: 下り | F130: なし | G130: なし | H130: なし | I130: 2012-09 | K130: 35.341160, 133.741355 | M130: of:=MID([.K130];1;FIND(",";[.K130])-1) -> 35.341160 | N130: of:=MID([.K130];FIND(" ";[.K130])+1;LEN([.K130])) -> 133.741355 | O130: of:=IF([.A129]=[.A130];[.O129];[.O129]+1) -> 61 | P130: of:=IF([.A130]=[.E130];"";IF([.E130]="";"";"あり")) -> 
A131: 矢櫃 | C131: 上り | E131: 矢櫃 | F131: 柱 | G131: なし | H131: なし | I131: 2012-09 | J131: https://www.google.co.jp/maps/@35.3339871,133.7349779,3a,75y,48.61h,78.22t/data=!3m6!1e1!3m4!1sEtW_aJYr4nLlV8-MATBgag!2e0!7i13312!8i6656?hl=ja | K131: 35.334042, 133.735047 | M131: of:=MID([.K131];1;FIND(",";[.K131])-1) -> 35.334042 | N131: of:=MID([.K131];FIND(" ";[.K131])+1;LEN([.K131])) -> 133.735047 | O131: of:=IF([.A130]=[.A131];[.O130];[.O130]+1) -> 62 | P131: of:=IF([.A131]=[.E131];"";IF([.E131]="";"";"あり")) -> 
A132: 矢櫃 | C132: 下り | F132: なし | G132: なし | H132: なし | I132: 2012-09 | K132: 35.334042, 133.735047 | M132: of:=MID([.K132];1;FIND(",";[.K132])-1) -> 35.334042 | N132: of:=MID([.K132];FIND(" ";[.K132])+1;LEN([.K132])) -> 133.735047 | O132: of:=IF([.A131]=[.A132];[.O131];[.O131]+1) -> 62 | P132: of:=IF([.A132]=[.E132];"";IF([.E132]="";"";"あり")) -> 
A133: 大河原 | C133: 上り | F133: なし | G133: なし | H133: なし | I133: 2012-09 | K133: 35.332901, 133.732611 | M133: of:=MID([.K133];1;FIND(",";[.K133])-1) -> 35.332901 | N133: of:=MID([.K133];FIND(" ";[.K133])+1;LEN([.K133])) -> 133.732611 | O133: of:=IF([.A132]=[.A133];[.O132];[.O132]+1) -> 63 | P133: of:=IF([.A133]=[.E133];"";IF([.E133]="";"";"あり")) -> 
A134: 大河原 | C134: 下り | E134: 大河原 | F134: 柱 | G134: なし | H134: なし | I134: 2012-09 | J134: https://www.google.co.jp/maps/@35.3329021,133.7325329,3a,90y,96.63h,86.04t/data=!3m6!1e1!3m4!1sakX0PyloZXa6q7wUh9g6lw!2e0!7i13312!8i6656?hl=ja | K134: 35.332901, 133.732611 | M134: of:=MID([.K134];1;FIND(",";[.K134])-1) -> 35.332901 | N134: of:=MID([.K134];FIND(" ";[.K134])+1;LEN([.K134])) -> 133.732611 | O134: of:=IF([.A133]=[.A134];[.O133];[.O133]+1) -> 63 | P134: of:=IF([.A134]=[.E134];"";IF([.E134]="";"";"あり")) -> 
A135: 住吉町 | C135: 上り日本交通 | F135: 板 | G135: なし | H135: なし | I135: 2012-09 | J135: https://www.google.co.jp/maps/@35.4313306,133.8319807,3a,75y,311.11h,77.44t/data=!3m6!1e1!3m4!1stgzrYiHAI30SulbHpWSccQ!2e0!7i13312!8i6656 | K135: 35.431353, 133.831915 | M135: of:=MID([.K135];1;FIND(",";[.K135])-1) -> 35.431353 | N135: of:=MID([.K135];FIND(" ";[.K135])+1;LEN([.K135])) -> 133.831915 | O135: of:=IF([.A134]=[.A135];[.O134];[.O134]+1) -> 64 | P135: of:=IF([.A135]=[.E135];"";IF([.E135]="";"";"あり")) -> 
A136: 住吉町 | C136: 下り日本交通 | E136: 住吉町 | F136: 板 | G136: なし | H136: なし | I136: 2012-09 | J136: https://www.google.co.jp/maps/@35.4314542,133.832137,3a,75y,95.82h,85.43t/data=!3m6!1e1!3m4!1sWAPwZjpzsSEwBEVLlaAjkQ!2e0!7i13312!8i6656 | K136: 35.431455, 133.832197 | M136: of:=MID([.K136];1;FIND(",";[.K136])-1) -> 35.431455 | N136: of:=MID([.K136];FIND(" ";[.K136])+1;LEN([.K136])) -> 133.832197 | O136: of:=IF([.A135]=[.A136];[.O135];[.O135]+1) -> 64 | P136: of:=IF([.A136]=[.E136];"";IF([.E136]="";"";"あり")) -> 
A137: 住吉町 | C137: 上り日ノ丸自動車 | E137: 住吉町 | F137: 板 | G137: なし | H137: なし | I137: 2012-09 | J137: https://www.google.co.jp/maps/@35.4317965,133.8332562,3a,46.6y,316.49h,81.15t/data=!3m7!1e1!3m5!1sfx-fuW5jMrqcMt1k0gbEcA!2e0!6s%2F%2Fgeo2.ggpht.com%2Fcbk%3Fpanoid%3Dfx-fuW5jMrqcMt1k0gbEcA%26output%3Dthumbnail%26cb_client%3Dmaps_sv.tactile.gps%26thumb%3D2% | K137: 35.431844, 133.833225 | M137: of:=MID([.K137];1;FIND(",";[.K137])-1) -> 35.431844 | N137: of:=MID([.K137];FIND(" ";[.K137])+1;LEN([.K137])) -> 133.833225 | O137: of:=IF([.A136]=[.A137];[.O136];[.O136]+1) -> 64 | P137: of:=IF([.A137]=[.E137];"";IF([.E137]="";"";"あり")) -> 
A138: 住吉町 | C138: 下り日ノ丸自動車 | E138: 住吉町 | F138: 板 | G138: なし | H138: なし | I138: 2012-09 | J138: https://www.google.co.jp/maps/@35.4317965,133.8332562,3a,46.6y,111.02h,86.11t/data=!3m7!1e1!3m5!1sfx-fuW5jMrqcMt1k0gbEcA!2e0!6s%2F%2Fgeo2.ggpht.com%2Fcbk%3Fpanoid%3Dfx-fuW5jMrqcMt1k0gbEcA%26output%3Dthumbnail%26cb_client%3Dmaps_sv.tactile.gps%26thumb%3D2% | K138: 35.431781, 133.833319 | M138: of:=MID([.K138];1;FIND(",";[.K138])-1) -> 35.431781 | N138: of:=MID([.K138];FIND(" ";[.K138])+1;LEN([.K138])) -> 133.833319 | O138: of:=IF([.A137]=[.A138];[.O137];[.O137]+1) -> 64 | P138: of:=IF([.A138]=[.E138];"";IF([.E138]="";"";"あり")) -> 
A139: 総合運動公園入口 | C139: 上り | E139: 総合運動公園入口 | F139: 板 | G139: なし | H139: なし | I139: 2015-04 | J139: https://www.google.co.jp/maps/@35.4306379,133.8292113,3a,60y,324.14h,86.62t/data=!3m6!1e1!3m4!1seKfM1b4hCSI9AkQ0uVIZLQ!2e0!7i13312!8i6656 | K139: 35.430659, 133.829191 | M139: of:=MID([.K139];1;FIND(",";[.K139])-1) -> 35.430659 | N139: of:=MID([.K139];FIND(" ";[.K139])+1;LEN([.K139])) -> 133.829191 | O139: of:=IF([.A138]=[.A139];[.O138];[.O138]+1) -> 65 | P139: of:=IF([.A139]=[.E139];"";IF([.E139]="";"";"あり")) -> 
A140: 総合運動公園入口 | C140: 下り | E140: 総合運動公園入口 | F140: 板 | G140: なし | H140: なし | I140: 2015-04 | J140: https://www.google.co.jp/maps/@35.4306209,133.8287247,3a,46.8y,131.14h,85.97t/data=!3m6!1e1!3m4!1sgADERUy51OtbtnSedQ0Pyg!2e0!7i13312!8i6656 | K140: 35.430557, 133.828806 | M140: of:=MID([.K140];1;FIND(",";[.K140])-1) -> 35.430557 | N140: of:=MID([.K140];FIND(" ";[.K140])+1;LEN([.K140])) -> 133.828806 | O140: of:=IF([.A139]=[.A140];[.O139];[.O139]+1) -> 65 | P140: of:=IF([.A140]=[.E140];"";IF([.E140]="";"";"あり")) -> 
A141: 市役所・打吹公園入口 | C141: 上り | E141: 市役所打吹公園入口 | F141: 板 | G141: あり | H141: なし | I141: 2015-04 | J141: https://www.google.co.jp/maps/@35.4308663,133.8255451,3a,58.3y,328.06h,86.21t/data=!3m6!1e1!3m4!1sxh_OVjB_mJzmBnMzwmCRiQ!2e0!7i13312!8i6656 | K141: 35.430895, 133.825525 | M141: of:=MID([.K141];1;FIND(",";[.K141])-1) -> 35.430895 | N141: of:=MID([.K141];FIND(" ";[.K141])+1;LEN([.K141])) -> 133.825525 | O141: of:=IF([.A140]=[.A141];[.O140];[.O140]+1) -> 66 | P141: of:=IF([.A141]=[.E141];"";IF([.E141]="";"";"あり")) -> あり
A142: 市役所・打吹公園入口 | C142: 下り | E142: 市役所打吹公園入口 | F142: 板 | G142: あり | H142: なし | I142: 2015-04 | J142: https://www.google.co.jp/maps/@35.4308663,133.8255451,3a,48.3y,147.89h,85.69t/data=!3m6!1e1!3m4!1sxh_OVjB_mJzmBnMzwmCRiQ!2e0!7i13312!8i6656 | K142: 35.430781, 133.825630 | M142: of:=MID([.K142];1;FIND(",";[.K142])-1) -> 35.430781 | N142: of:=MID([.K142];FIND(" ";[.K142])+1;LEN([.K142])) -> 133.825630 | O142: of:=IF([.A141]=[.A142];[.O141];[.O141]+1) -> 66 | P142: of:=IF([.A142]=[.E142];"";IF([.E142]="";"";"あり")) -> あり
A143: 白壁土蔵群前 | C143: 上り | E143: 白壁土蔵群前 | F143: 板 | G143: なし | H143: なし | I143: 2015-04 | J143: https://www.google.co.jp/maps/@35.431071,133.823055,3a,58.4y,50.4h,87.39t/data=!3m6!1e1!3m4!1snPX-Cuv-FFiTVXYmN-nWWg!2e0!7i13312!8i6656 | K143: 35.431087, 133.823115 | M143: of:=MID([.K143];1;FIND(",";[.K143])-1) -> 35.431087 | N143: of:=MID([.K143];FIND(" ";[.K143])+1;LEN([.K143])) -> 133.823115 | O143: of:=IF([.A142]=[.A143];[.O142];[.O142]+1) -> 67 | P143: of:=IF([.A143]=[.E143];"";IF([.E143]="";"";"あり")) -> 
A144: 白壁土蔵群前 | C144: 下り | E144: 白壁土蔵群前 | F144: 板 | G144: なし | H144: なし | I144: 2015-04 | J144: https://www.google.co.jp/maps/@35.4310593,133.8231847,3a,48.5y,163.96h,88.81t/data=!3m6!1e1!3m4!1s56wGpQ47ifj5VgDztR42DA!2e0!7i13312!8i6656 | K144: 35.430985, 133.823223 | M144: of:=MID([.K144];1;FIND(",";[.K144])-1) -> 35.430985 | N144: of:=MID([.K144];FIND(" ";[.K144])+1;LEN([.K144])) -> 133.823223 | O144: of:=IF([.A143]=[.A144];[.O143];[.O143]+1) -> 67 | P144: of:=IF([.A144]=[.E144];"";IF([.E144]="";"";"あり")) -> 
A145: 瀬崎町 | C145: 上り | E145: 瀬崎町 | F145: 板 | G145: あり | H145: あり | I145: 2015-04 | J145: https://www.google.co.jp/maps/@35.4313148,133.8194163,3a,60y,330.34h,86.53t/data=!3m6!1e1!3m4!1s1bcjrVf_WknpluPBtDwg7w!2e0!7i13312!8i6656 | K145: 35.431337, 133.819410 | M145: of:=MID([.K145];1;FIND(",";[.K145])-1) -> 35.431337 | N145: of:=MID([.K145];FIND(" ";[.K145])+1;LEN([.K145])) -> 133.819410 | O145: of:=IF([.A144]=[.A145];[.O144];[.O144]+1) -> 68 | P145: of:=IF([.A145]=[.E145];"";IF([.E145]="";"";"あり")) -> 
A146: 瀬崎町 | C146: 下り | E146: 瀬崎町 | F146: 板 | G146: なし | H146: なし | I146: 2015-04 | J146: https://www.google.co.jp/maps/@35.4313158,133.8197793,3a,46.5y,151.38h,87.41t/data=!3m6!1e1!3m4!1sjo5oOza1hhpKFgerPgXR_g!2e0!7i13312!8i6656 | K146: 35.431244, 133.819968 | M146: of:=MID([.K146];1;FIND(",";[.K146])-1) -> 35.431244 | N146: of:=MID([.K146];FIND(" ";[.K146])+1;LEN([.K146])) -> 133.819968 | O146: of:=IF([.A145]=[.A146];[.O145];[.O145]+1) -> 68 | P146: of:=IF([.A146]=[.E146];"";IF([.E146]="";"";"あり")) -> 
A147: 鍛冶町一丁目 | C147: 上り | E147: 鍛冶町一丁目 | F147: 板 | G147: あり | H147: なし | I147: 2015-04 | J147: https://www.google.co.jp/maps/@35.4298444,133.8155578,3a,72.1y,292.14h,84.13t/data=!3m6!1e1!3m4!1sjbV_BlVkAV61FTK7WOc2SA!2e0!7i13312!8i6656 | K147: 35.429849, 133.815512 | M147: of:=MID([.K147];1;FIND(",";[.K147])-1) -> 35.429849 | N147: of:=MID([.K147];FIND(" ";[.K147])+1;LEN([.K147])) -> 133.815512 | O147: of:=IF([.A146]=[.A147];[.O146];[.O146]+1) -> 69 | P147: of:=IF([.A147]=[.E147];"";IF([.E147]="";"";"あり")) -> 
A148: 鍛冶町一丁目 | C148: 下り | E148: 鍛冶町一丁目 | F148: 板 | G148: あり | H148: なし | I148: 2015-04 | J148: https://www.google.co.jp/maps/@35.4299867,133.8158499,3a,48y,117.88h,87.95t/data=!3m6!1e1!3m4!1sdgybtymVT7l-02l0vkcLYQ!2e0!7i13312!8i6656 | K148: 35.429958, 133.815903 | M148: of:=MID([.K148];1;FIND(",";[.K148])-1) -> 35.429958 | N148: of:=MID([.K148];FIND(" ";[.K148])+1;LEN([.K148])) -> 133.815903 | O148: of:=IF([.A147]=[.A148];[.O147];[.O147]+1) -> 69 | P148: of:=IF([.A148]=[.E148];"";IF([.E148]="";"";"あり")) -> 
A149: 長谷寺西口 | C149: 上り | E149: 長谷寺西口 | F149: 板 | G149: なし | H149: なし | I149: 2015-04 | J149: https://www.google.co.jp/maps/@35.4272297,133.8152959,3a,60y,289.56h,81.62t/data=!3m6!1e1!3m4!1sXfp_5DQrjWkfxjQakNl70A!2e0!7i13312!8i6656 | K149: 35.427240, 133.815266 | M149: of:=MID([.K149];1;FIND(",";[.K149])-1) -> 35.427240 | N149: of:=MID([.K149];FIND(" ";[.K149])+1;LEN([.K149])) -> 133.815266 | O149: of:=IF([.A148]=[.A149];[.O148];[.O148]+1) -> 70 | P149: of:=IF([.A149]=[.E149];"";IF([.E149]="";"";"あり")) -> 
A150: 長谷寺西口 | C150: 下り | E150: 長谷寺西口 | F150: 板 | G150: なし | H150: なし | I150: 2015-04 | J150: https://www.google.co.jp/maps/@35.4272297,133.8152959,3a,60y,95.32h,87.35t/data=!3m6!1e1!3m4!1sXfp_5DQrjWkfxjQakNl70A!2e0!7i13312!8i6656 | K150: 35.427188, 133.815350 | M150: of:=MID([.K150];1;FIND(",";[.K150])-1) -> 35.427188 | N150: of:=MID([.K150];FIND(" ";[.K150])+1;LEN([.K150])) -> 133.815350 | O150: of:=IF([.A149]=[.A150];[.O149];[.O149]+1) -> 70 | P150: of:=IF([.A150]=[.E150];"";IF([.E150]="";"";"あり")) -> 
A151: みどり町 | C151: 上り | E151: みどり町 | F151: 板 | G151: なし | H151: なし | I151: 2015-04 | J151: https://www.google.co.jp/maps/@35.4243384,133.8145165,3a,88.1y,328.54h,76.37t/data=!3m6!1e1!3m4!1s-_eYzrG_eRX0cexIlCVwBw!2e0!7i13312!8i6656 | K151: 35.424391, 133.814478 | M151: of:=MID([.K151];1;FIND(",";[.K151])-1) -> 35.424391 | N151: of:=MID([.K151];FIND(" ";[.K151])+1;LEN([.K151])) -> 133.814478 | O151: of:=IF([.A150]=[.A151];[.O150];[.O150]+1) -> 71 | P151: of:=IF([.A151]=[.E151];"";IF([.E151]="";"";"あり")) -> 
A152: みどり町 | C152: 下り | F152: 板 | G152: なし | H152: なし | I152: 2015-04 | J152: https://www.google.co.jp/maps/@35.4244296,133.8145365,3a,20.8y,124.2h,88.47t/data=!3m6!1e1!3m4!1slG0n77Ir4B39cJsI6rRMuQ!2e0!7i13312!8i6656 | K152: 35.424352, 133.814648 | M152: of:=MID([.K152];1;FIND(",";[.K152])-1) -> 35.424352 | N152: of:=MID([.K152];FIND(" ";[.K152])+1;LEN([.K152])) -> 133.814648 | O152: of:=IF([.A151]=[.A152];[.O151];[.O151]+1) -> 71 | P152: of:=IF([.A152]=[.E152];"";IF([.E152]="";"";"あり")) -> 
A153: 八幡神社前 | C153: 上り | E153: 八幡神社前 | F153: 柱 | G153: なし | H153: なし | I153: 2015-04 | J153: https://www.google.co.jp/maps/@35.4216814,133.8120416,3a,45.3y,321.07h,86.28t/data=!3m6!1e1!3m4!1s9Bd53UKvx9N-ly4jJdDBEA!2e0!7i13312!8i6656 | K153: 35.421723, 133.812002 | M153: of:=MID([.K153];1;FIND(",";[.K153])-1) -> 35.421723 | N153: of:=MID([.K153];FIND(" ";[.K153])+1;LEN([.K153])) -> 133.812002 | O153: of:=IF([.A152]=[.A153];[.O152];[.O152]+1) -> 72 | P153: of:=IF([.A153]=[.E153];"";IF([.E153]="";"";"あり")) -> 
A154: 八幡神社前 | C154: 下り | E154: 八幡神社前 | F154: 柱 | G154: なし | H154: なし | I154: 2015-04 | J154: https://www.google.co.jp/maps/@35.4216814,133.8120416,3a,45.3y,180.66h,83.89t/data=!3m6!1e1!3m4!1s9Bd53UKvx9N-ly4jJdDBEA!2e0!7i13312!8i6656 | K154: 35.421585, 133.812003 | M154: of:=MID([.K154];1;FIND(",";[.K154])-1) -> 35.421585 | N154: of:=MID([.K154];FIND(" ";[.K154])+1;LEN([.K154])) -> 133.812003 | O154: of:=IF([.A153]=[.A154];[.O153];[.O153]+1) -> 72 | P154: of:=IF([.A154]=[.E154];"";IF([.E154]="";"";"あり")) -> 
A155: 生田東口 | C155: 上り | F155: なし | G155: なし | H155: なし | I155: 2015-04 | K155: 35.421466, 133.808154 | M155: of:=MID([.K155];1;FIND(",";[.K155])-1) -> 35.421466 | N155: of:=MID([.K155];FIND(" ";[.K155])+1;LEN([.K155])) -> 133.808154 | O155: of:=IF([.A154]=[.A155];[.O154];[.O154]+1) -> 73 | P155: of:=IF([.A155]=[.E155];"";IF([.E155]="";"";"あり")) -> 
A156: 生田東口 | C156: 下り | E156: 生田東口 | F156: 柱 | G156: なし | H156: なし | I156: 2015-04 | J156: https://www.google.co.jp/maps/@35.4215303,133.8082062,3a,60y,199.72h,81.87t/data=!3m6!1e1!3m4!1solBL-A0G9u2C7IbNQG6r0g!2e0!7i13312!8i6656 | K156: 35.421466, 133.808154 | M156: of:=MID([.K156];1;FIND(",";[.K156])-1) -> 35.421466 | N156: of:=MID([.K156];FIND(" ";[.K156])+1;LEN([.K156])) -> 133.808154 | O156: of:=IF([.A155]=[.A156];[.O155];[.O155]+1) -> 73 | P156: of:=IF([.A156]=[.E156];"";IF([.E156]="";"";"あり")) -> 
A157: 巌城 | C157: 上り | F157: 柱 | G157: なし | H157: なし | I157: 2018-08 | J157: https://www.google.com/maps/@35.4384694,133.8431737,3a,75y,270.2h,74.96t/data=!3m6!1e1!3m4!1sVNw_cyqtXxrctA4aBijCcg!2e0!7i13312!8i6656?hl=ja | K157: 35.438477, 133.843147 | M157: of:=MID([.K157];1;FIND(",";[.K157])-1) -> 35.438477 | N157: of:=MID([.K157];FIND(" ";[.K157])+1;LEN([.K157])) -> 133.843147 | O157: of:=IF([.A156]=[.A157];[.O156];[.O156]+1) -> 74 | P157: of:=IF([.A157]=[.E157];"";IF([.E157]="";"";"あり")) -> 
A158: 巌城 | C158: 下り | F158: 柱 | G158: なし | H158: なし | I158: 2018-08 | J158: https://www.google.com/maps/@35.4387967,133.8431591,3a,75y,65.29h,82.07t/data=!3m7!1e1!3m5!1sJ3k9C-NfGFZHI9RFXj0yUw!2e0!6s%2F%2Fgeo1.ggpht.com%2Fcbk%3Fpanoid%3DJ3k9C-NfGFZHI9RFXj0yUw%26output%3Dthumbnail%26cb_client%3Dmaps_sv.tactile.gps%26thumb%3D2%26w%3 | K158: 35.438811, 133.843331 | M158: of:=MID([.K158];1;FIND(",";[.K158])-1) -> 35.438811 | N158: of:=MID([.K158];FIND(" ";[.K158])+1;LEN([.K158])) -> 133.843331 | O158: of:=IF([.A157]=[.A158];[.O157];[.O157]+1) -> 74 | P158: of:=IF([.A158]=[.E158];"";IF([.E158]="";"";"あり")) -> 
A159: 厚生病院正面玄関前 | C159: 上り | E159: 厚生病院正面玄関前 | F159: 板 | G159: なし | H159: なし | I159: 2018-08 | J159: https://www.google.com/maps/@35.4354422,133.8412336,3a,75y,29.48h,87.52t/data=!3m6!1e1!3m4!1sMMMsy9wt2lj7lIg32FzNUw!2e0!7i13312!8i6656?hl=ja | K159: 35.435499, 133.841266 | M159: of:=MID([.K159];1;FIND(",";[.K159])-1) -> 35.435499 | N159: of:=MID([.K159];FIND(" ";[.K159])+1;LEN([.K159])) -> 133.841266 | O159: of:=IF([.A158]=[.A159];[.O158];[.O158]+1) -> 75 | P159: of:=IF([.A159]=[.E159];"";IF([.E159]="";"";"あり")) -> 
A160: 厚生病院正面玄関前 | C160: 下り | E160: 厚生病院正面玄関前 | F160: 板 | G160: なし | H160: なし | I160: 2018-08 | J160: https://www.google.com/maps/@35.4353857,133.8411595,3a,47.7y,143.02h,83.11t/data=!3m6!1e1!3m4!1swz_D1-91Qody2rsNOfxUYA!2e0!7i13312!8i6656?hl=ja | K160: 35.435325, 133.841206 | M160: of:=MID([.K160];1;FIND(",";[.K160])-1) -> 35.435325 | N160: of:=MID([.K160];FIND(" ";[.K160])+1;LEN([.K160])) -> 133.841206 | O160: of:=IF([.A159]=[.A160];[.O159];[.O159]+1) -> 75 | P160: of:=IF([.A160]=[.E160];"";IF([.E160]="";"";"あり")) -> 
A161: 合同庁舎前 | C161: 上り | E161: 合同庁舎前 | F161: 板 | G161: なし | H161: なし | I161: 2018-08 | J161: https://www.google.com/maps/@35.4304938,133.839228,3a,34.1y,330.29h,87.59t/data=!3m6!1e1!3m4!1svTEt3hHlwiibygI-TXB8lg!2e0!7i13312!8i6656?hl=ja | K161: 35.430548, 133.839176 | M161: of:=MID([.K161];1;FIND(",";[.K161])-1) -> 35.430548 | N161: of:=MID([.K161];FIND(" ";[.K161])+1;LEN([.K161])) -> 133.839176 | O161: of:=IF([.A160]=[.A161];[.O160];[.O160]+1) -> 76 | P161: of:=IF([.A161]=[.E161];"";IF([.E161]="";"";"あり")) -> 
A162: 合同庁舎前 | C162: 下り | E162: 合同庁舎前 | F162: 板 | G162: なし | H162: なし | I162: 2018-08 | J162: https://www.google.com/maps/@35.4304938,133.839228,3a,34.1y,246h,89.12t/data=!3m6!1e1!3m4!1svTEt3hHlwiibygI-TXB8lg!2e0!7i13312!8i6656?hl=ja | K162: 35.430473, 133.839142 | M162: of:=MID([.K162];1;FIND(",";[.K162])-1) -> 35.430473 | N162: of:=MID([.K162];FIND(" ";[.K162])+1;LEN([.K162])) -> 133.839142 | O162: of:=IF([.A161]=[.A162];[.O161];[.O161]+1) -> 76 | P162: of:=IF([.A162]=[.E162];"";IF([.E162]="";"";"あり")) -> 
A163: 倉吉パークスクエア | F163: あり | G163: あり | H163: あり | I163: 2018‐08 | J163: https://www.google.com/maps/@35.430716,133.8359702,3a,15y,351.26h,90.66t/data=!3m8!1e1!3m6!1sAF1QipM3piTMvuuc4W8TwqQxOBUdgqbQl9OY4H0UWu43!2e10!3e11!6shttps:%2F%2Flh5.googleusercontent.com%2Fp%2FAF1QipM3piTMvuuc4W8TwqQxOBUdgqbQl9OY4H0UWu43%3Dw203-h100-k-no | K163: 35.431046, 133.835901 | M163: of:=MID([.K163];1;FIND(",";[.K163])-1) -> 35.431046 | N163: of:=MID([.K163];FIND(" ";[.K163])+1;LEN([.K163])) -> 133.835901 | O163: of:=IF([.A162]=[.A163];[.O162];[.O162]+1) -> 77 | P163: of:=IF([.A163]=[.E163];"";IF([.E163]="";"";"あり")) -> 
A164: 河原町上 | C164: 上り | F164: なし | G164: なし | H164: なし | I164: 2018-08 | K164: 35.429331, 133.810126 | M164: of:=MID([.K164];1;FIND(",";[.K164])-1) -> 35.429331 | N164: of:=MID([.K164];FIND(" ";[.K164])+1;LEN([.K164])) -> 133.810126 | O164: of:=IF([.A163]=[.A164];[.O163];[.O163]+1) -> 78 | P164: of:=IF([.A164]=[.E164];"";IF([.E164]="";"";"あり")) -> 
A165: 河原町上 | C165: 下り | E165: 河原町上 | F165: 柱 | G165: あり | H165: あり | I165: 2018-08 | J165: https://www.google.com/maps/@35.4293904,133.8100436,3a,42.5y,118.97h,89.45t/data=!3m6!1e1!3m4!1sv_TRunVBh2TjbXEfrvlndA!2e0!7i13312!8i6656?hl=ja | K165: 35.429331, 133.810126 | M165: of:=MID([.K165];1;FIND(",";[.K165])-1) -> 35.429331 | N165: of:=MID([.K165];FIND(" ";[.K165])+1;LEN([.K165])) -> 133.810126 | O165: of:=IF([.A164]=[.A165];[.O164];[.O164]+1) -> 78 | P165: of:=IF([.A165]=[.E165];"";IF([.E165]="";"";"あり")) -> 
A166: 八幡町 | C166: 上り | F166: なし | G166: なし | H166: なし | I166: 2018-08 | K166: 35.423000, 133.810967 | M166: of:=MID([.K166];1;FIND(",";[.K166])-1) -> 35.423000 | N166: of:=MID([.K166];FIND(" ";[.K166])+1;LEN([.K166])) -> 133.810967 | O166: of:=IF([.A165]=[.A166];[.O165];[.O165]+1) -> 79 | P166: of:=IF([.A166]=[.E166];"";IF([.E166]="";"";"あり")) -> 
A167: 八幡町 | C167: 下り | E167: 八幡町 | F167: 柱 | G167: なし | H167: なし | I167: 2018-08 | J167: https://www.google.com/maps/@35.4230457,133.8109128,3a,75y,99.74h,84.28t/data=!3m6!1e1!3m4!1smHvT5SS-nNY-LCFwnPcWdQ!2e0!7i13312!8i6656?hl=ja | K167: 35.423000, 133.810967 | M167: of:=MID([.K167];1;FIND(",";[.K167])-1) -> 35.423000 | N167: of:=MID([.K167];FIND(" ";[.K167])+1;LEN([.K167])) -> 133.810967 | O167: of:=IF([.A166]=[.A167];[.O166];[.O166]+1) -> 79 | P167: of:=IF([.A167]=[.E167];"";IF([.E167]="";"";"あり")) -> 
A168: 八幡町上 | C168: 上り | E168: 八幡町上 | F168: 柱 | G168: なし | H168: なし | I168: 2012-09 | J168: https://www.google.com/maps/@35.4212305,133.811146,3a,26.1y,287.08h,82.04t/data=!3m6!1e1!3m4!1soFzNRiw6koFjRZkJiSaAZQ!2e0!7i13312!8i6656?hl=ja | K168: 35.421253, 133.811020 | M168: of:=MID([.K168];1;FIND(",";[.K168])-1) -> 35.421253 | N168: of:=MID([.K168];FIND(" ";[.K168])+1;LEN([.K168])) -> 133.811020 | O168: of:=IF([.A167]=[.A168];[.O167];[.O167]+1) -> 80 | P168: of:=IF([.A168]=[.E168];"";IF([.E168]="";"";"あり")) -> 
A169: 八幡町上 | C169: 下り | E169: 八幡町上 | F169: 柱 | G169: なし | H169: なし | I169: 2012-09 | J169: https://www.google.com/maps/@35.4212305,133.811146,3a,60y,63.52h,83.26t/data=!3m6!1e1!3m4!1soFzNRiw6koFjRZkJiSaAZQ!2e0!7i13312!8i6656?hl=ja | K169: 35.421241, 133.811207 | M169: of:=MID([.K169];1;FIND(",";[.K169])-1) -> 35.421241 | N169: of:=MID([.K169];FIND(" ";[.K169])+1;LEN([.K169])) -> 133.811207 | O169: of:=IF([.A168]=[.A169];[.O168];[.O168]+1) -> 80 | P169: of:=IF([.A169]=[.E169];"";IF([.E169]="";"";"あり")) -> 
A170: 富海 | C170: 上り | E170: 富海 | F170: 柱 | G170: あり | H170: あり | I170: 2012-09 | J170: https://www.google.com/maps/@35.4171783,133.8120673,3a,42.5y,274.97h,82.72t/data=!3m6!1e1!3m4!1sqJe3PbY5hSrCFvBYwZo8vg!2e0!7i13312!8i6656?hl=ja | K170: 35.417140, 133.811928 | M170: of:=MID([.K170];1;FIND(",";[.K170])-1) -> 35.417140 | N170: of:=MID([.K170];FIND(" ";[.K170])+1;LEN([.K170])) -> 133.811928 | O170: of:=IF([.A169]=[.A170];[.O169];[.O169]+1) -> 81 | P170: of:=IF([.A170]=[.E170];"";IF([.E170]="";"";"あり")) -> 
A171: 富海 | C171: 下り | F171: なし | G171: なし | H171: なし | I171: 2012-09 | K171: 35.417140, 133.811928 | M171: of:=MID([.K171];1;FIND(",";[.K171])-1) -> 35.417140 | N171: of:=MID([.K171];FIND(" ";[.K171])+1;LEN([.K171])) -> 133.811928 | O171: of:=IF([.A170]=[.A171];[.O170];[.O170]+1) -> 81 | P171: of:=IF([.A171]=[.E171];"";IF([.E171]="";"";"あり")) -> 
A172: 下大江 | C172: 上り | E172: 下大江 | F172: 柱 | G172: あり | H172: あり | I172: 2012-10 | J172: https://www.google.com/maps/@35.4122728,133.8111344,3a,25.6y,249.75h,83.95t/data=!3m6!1e1!3m4!1s_rBfiuCbxZyRDX5TWbAlfw!2e0!7i13312!8i6656?hl=ja | K172: 35.412210, 133.811050 | M172: of:=MID([.K172];1;FIND(",";[.K172])-1) -> 35.412210 | N172: of:=MID([.K172];FIND(" ";[.K172])+1;LEN([.K172])) -> 133.811050 | O172: of:=IF([.A171]=[.A172];[.O171];[.O171]+1) -> 82 | P172: of:=IF([.A172]=[.E172];"";IF([.E172]="";"";"あり")) -> 
A173: 下大江 | C173: 下り | F173: なし | G173: なし | H173: なし | I173: 2012-10 | K173: 35.412210, 133.811050 | M173: of:=MID([.K173];1;FIND(",";[.K173])-1) -> 35.412210 | N173: of:=MID([.K173];FIND(" ";[.K173])+1;LEN([.K173])) -> 133.811050 | O173: of:=IF([.A172]=[.A173];[.O172];[.O172]+1) -> 82 | P173: of:=IF([.A173]=[.E173];"";IF([.E173]="";"";"あり")) -> 
A174: 東鴨新町 | C174: 上り | E174: 東鴨新町 | F174: 柱 | G174: あり | H174: あり | I174: 2012-10 | J174: https://www.google.com/maps/@35.4096613,133.8097982,3a,60y,323.04h,81.65t/data=!3m6!1e1!3m4!1ss_CS8GwT6SRtaoBiE4FkYA!2e0!7i13312!8i6656?hl=ja | K174: 35.409730, 133.809755 | M174: of:=MID([.K174];1;FIND(",";[.K174])-1) -> 35.409730 | N174: of:=MID([.K174];FIND(" ";[.K174])+1;LEN([.K174])) -> 133.809755 | O174: of:=IF([.A173]=[.A174];[.O173];[.O173]+1) -> 83 | P174: of:=IF([.A174]=[.E174];"";IF([.E174]="";"";"あり")) -> 
A175: 東鴨新町 | C175: 下り | E175: 東鴨新町 | F175: 柱 | G175: なし | H175: なし | I175: 2012-10 | J175: https://www.google.com/maps/@35.4093537,133.8096986,3a,46.3y,36.39h,75.99t/data=!3m6!1e1!3m4!1shTC4s_Lc33qLYT1y-Ol9rA!2e0!7i13312!8i6656?hl=ja | K175: 35.409390, 133.809729 | M175: of:=MID([.K175];1;FIND(",";[.K175])-1) -> 35.409390 | N175: of:=MID([.K175];FIND(" ";[.K175])+1;LEN([.K175])) -> 133.809729 | O175: of:=IF([.A174]=[.A175];[.O174];[.O174]+1) -> 83 | P175: of:=IF([.A175]=[.E175];"";IF([.E175]="";"";"あり")) -> 
A176: 長坂新町入口 | C176: 上り | F176: なし | G176: なし | H176: なし | I176: 2012-10 | K176: 35.407140, 133.807646 | M176: of:=MID([.K176];1;FIND(",";[.K176])-1) -> 35.407140 | N176: of:=MID([.K176];FIND(" ";[.K176])+1;LEN([.K176])) -> 133.807646 | O176: of:=IF([.A175]=[.A176];[.O175];[.O175]+1) -> 84 | P176: of:=IF([.A176]=[.E176];"";IF([.E176]="";"";"あり")) -> 
A177: 長坂新町入口 | C177: 下り | E177: 長坂新町 | F177: 柱 | G177: なし | H177: なし | I177: 2012-10 | J177: https://www.google.com/maps/@35.4071678,133.8076286,3a,75y,176.27h,77.73t/data=!3m6!1e1!3m4!1sgCviFoD-6X7N9c_CoQJmFA!2e0!7i13312!8i6656?hl=ja | K177: 35.407140, 133.807646 | M177: of:=MID([.K177];1;FIND(",";[.K177])-1) -> 35.407140 | N177: of:=MID([.K177];FIND(" ";[.K177])+1;LEN([.K177])) -> 133.807646 | O177: of:=IF([.A176]=[.A177];[.O176];[.O176]+1) -> 84 | P177: of:=IF([.A177]=[.E177];"";IF([.E177]="";"";"あり")) -> あり
A178: 長坂 | C178: 上り | E178: 長坂 | F178: 柱 | G178: あり | H178: あり | I178: 2012-10 | J178: https://www.google.com/maps/@35.4059653,133.80569,3a,47.9y,340.49h,86.61t/data=!3m6!1e1!3m4!1s8GJyIUQQs5tudXchbl9pWg!2e0!7i13312!8i6656?hl=ja | K178: 35.405987, 133.805580 | M178: of:=MID([.K178];1;FIND(",";[.K178])-1) -> 35.405987 | N178: of:=MID([.K178];FIND(" ";[.K178])+1;LEN([.K178])) -> 133.805580 | O178: of:=IF([.A177]=[.A178];[.O177];[.O177]+1) -> 85 | P178: of:=IF([.A178]=[.E178];"";IF([.E178]="";"";"あり")) -> 
A179: 長坂 | C179: 下り | F179: なし | G179: なし | H179: なし | I179: 2012-10 | K179: 35.405987, 133.805580 | M179: of:=MID([.K179];1;FIND(",";[.K179])-1) -> 35.405987 | N179: of:=MID([.K179];FIND(" ";[.K179])+1;LEN([.K179])) -> 133.805580 | O179: of:=IF([.A178]=[.A179];[.O178];[.O178]+1) -> 85 | P179: of:=IF([.A179]=[.E179];"";IF([.E179]="";"";"あり")) -> 
A180: 弓削 | C180: 上り | E180: 弓削 | F180: 柱 | G180: あり | H180: あり | I180: 2012-10 | J180: https://www.google.com/maps/@35.4010248,133.8038663,3a,26.1y,260.55h,83.16t/data=!3m6!1e1!3m4!1s3uzb9nyA-59DFrrw-R301w!2e0!7i13312!8i6656?hl=ja | K180: 35.400979, 133.803785 | M180: of:=MID([.K180];1;FIND(",";[.K180])-1) -> 35.400979 | N180: of:=MID([.K180];FIND(" ";[.K180])+1;LEN([.K180])) -> 133.803785 | O180: of:=IF([.A179]=[.A180];[.O179];[.O179]+1) -> 86 | P180: of:=IF([.A180]=[.E180];"";IF([.E180]="";"";"あり")) -> 
A181: 弓削 | C181: 下り | F181: なし | G181: なし | H181: なし | I181: 2012-10 | K181: 35.400979, 133.803785 | M181: of:=MID([.K181];1;FIND(",";[.K181])-1) -> 35.400979 | N181: of:=MID([.K181];FIND(" ";[.K181])+1;LEN([.K181])) -> 133.803785 | O181: of:=IF([.A180]=[.A181];[.O180];[.O180]+1) -> 86 | P181: of:=IF([.A181]=[.E181];"";IF([.E181]="";"";"あり")) -> 
A182: 大宮 | C182: 上り | E182: 大宮 | F182: 柱 | G182: あり | H182: あり | I182: 2012-10 | J182: https://www.google.com/maps/@35.3981101,133.8029553,3a,60y,288.16h,80.46t/data=!3m6!1e1!3m4!1sEtxluykWVd9LPnKa-SOLkw!2e0!7i13312!8i6656?hl=ja | K182: 35.398122, 133.802897 | M182: of:=MID([.K182];1;FIND(",";[.K182])-1) -> 35.398122 | N182: of:=MID([.K182];FIND(" ";[.K182])+1;LEN([.K182])) -> 133.802897 | O182: of:=IF([.A181]=[.A182];[.O181];[.O181]+1) -> 87 | P182: of:=IF([.A182]=[.E182];"";IF([.E182]="";"";"あり")) -> 
A183: 大宮 | C183: 下り | F183: なし | G183: なし | H183: なし | I183: 2012-10 | K183: 35.398122, 133.802897 | M183: of:=MID([.K183];1;FIND(",";[.K183])-1) -> 35.398122 | N183: of:=MID([.K183];FIND(" ";[.K183])+1;LEN([.K183])) -> 133.802897 | O183: of:=IF([.A182]=[.A183];[.O182];[.O182]+1) -> 87 | P183: of:=IF([.A183]=[.E183];"";IF([.E183]="";"";"あり")) -> 
A184: 岩倉 | C184: 上り | E184: 岩倉 | F184: 柱 | G184: あり | H184: あり | I184: 2012-10 | J184: https://www.google.com/maps/@35.3916201,133.8019642,3a,47.6y,312.36h,78.74t/data=!3m6!1e1!3m4!1sDphbdkMF0N_JNUffnLzq2A!2e0!7i13312!8i6656?hl=ja | K184: 35.391643, 133.801903 | M184: of:=MID([.K184];1;FIND(",";[.K184])-1) -> 35.391643 | N184: of:=MID([.K184];FIND(" ";[.K184])+1;LEN([.K184])) -> 133.801903 | O184: of:=IF([.A183]=[.A184];[.O183];[.O183]+1) -> 88 | P184: of:=IF([.A184]=[.E184];"";IF([.E184]="";"";"あり")) -> 
A185: 岩倉 | C185: 下り | F185: なし | G185: なし | H185: なし | I185: 2012-10 | K185: 35.391643, 133.801903 | M185: of:=MID([.K185];1;FIND(",";[.K185])-1) -> 35.391643 | N185: of:=MID([.K185];FIND(" ";[.K185])+1;LEN([.K185])) -> 133.801903 | O185: of:=IF([.A184]=[.A185];[.O184];[.O184]+1) -> 88 | P185: of:=IF([.A185]=[.E185];"";IF([.E185]="";"";"あり")) -> 
A186: 広瀬口 | C186: 上り | E186: 広瀬口 | F186: 柱 | G186: あり | H186: あり | I186: 2012-10 | J186: https://www.google.com/maps/@35.3886743,133.7975806,3a,50.2y,272.81h,85.23t/data=!3m6!1e1!3m4!1s1p1A3KJ_LeiLD33oeQBsAw!2e0!7i13312!8i6656?hl=ja | K186: 35.388681, 133.797469 | M186: of:=MID([.K186];1;FIND(",";[.K186])-1) -> 35.388681 | N186: of:=MID([.K186];FIND(" ";[.K186])+1;LEN([.K186])) -> 133.797469 | O186: of:=IF([.A185]=[.A186];[.O185];[.O185]+1) -> 89 | P186: of:=IF([.A186]=[.E186];"";IF([.E186]="";"";"あり")) -> 
A187: 広瀬口 | C187: 下り | F187: なし | G187: なし | H187: なし | I187: 2012-10 | K187: 35.388681, 133.797469 | M187: of:=MID([.K187];1;FIND(",";[.K187])-1) -> 35.388681 | N187: of:=MID([.K187];FIND(" ";[.K187])+1;LEN([.K187])) -> 133.797469 | O187: of:=IF([.A186]=[.A187];[.O186];[.O186]+1) -> 89 | P187: of:=IF([.A187]=[.E187];"";IF([.E187]="";"";"あり")) -> 
A188: 広瀬中 | C188: 上り | F188: なし | G188: なし | H188: なし | I188: 2012-10 | K188: 35.383660, 133.796987 | M188: of:=MID([.K188];1;FIND(",";[.K188])-1) -> 35.383660 | N188: of:=MID([.K188];FIND(" ";[.K188])+1;LEN([.K188])) -> 133.796987 | O188: of:=IF([.A187]=[.A188];[.O187];[.O187]+1) -> 90 | P188: of:=IF([.A188]=[.E188];"";IF([.E188]="";"";"あり")) -> 
A189: 広瀬中 | C189: 下り | E189: 広瀬中 | F189: あり | G189: あり | H189: あり | I189: 2012-10 | J189: https://www.google.com/maps/@35.3836168,133.7969468,3a,38.4y,46.85h,81.27t/data=!3m6!1e1!3m4!1sV-4o4VRLfkmzdPHTBSTQUg!2e0!7i13312!8i6656?hl=ja | K189: 35.383660, 133.796987 | M189: of:=MID([.K189];1;FIND(",";[.K189])-1) -> 35.383660 | N189: of:=MID([.K189];FIND(" ";[.K189])+1;LEN([.K189])) -> 133.796987 | O189: of:=IF([.A188]=[.A189];[.O188];[.O188]+1) -> 90 | P189: of:=IF([.A189]=[.E189];"";IF([.E189]="";"";"あり")) -> 
A190: 広瀬 | C190: 上り | F190: なし | G190: あり | H190: あり | I190: 2012-10 | K190: 35.375448, 133.796463 | M190: of:=MID([.K190];1;FIND(",";[.K190])-1) -> 35.375448 | N190: of:=MID([.K190];FIND(" ";[.K190])+1;LEN([.K190])) -> 133.796463 | O190: of:=IF([.A189]=[.A190];[.O189];[.O189]+1) -> 91 | P190: of:=IF([.A190]=[.E190];"";IF([.E190]="";"";"あり")) -> 
A191: 広瀬 | C191: 下り | E191: 広瀬 | F191: 柱 | G191: なし | H191: なし | I191: 2012-10 | J191: https://www.google.com/maps/@35.3753922,133.7964404,3a,26.5y,21.39h,84.79t/data=!3m6!1e1!3m4!1s5rxTz9lBQLf2XbvjiVvOOA!2e0!7i13312!8i6656?hl=ja | K191: 35.375448, 133.796463 | M191: of:=MID([.K191];1;FIND(",";[.K191])-1) -> 35.375448 | N191: of:=MID([.K191];FIND(" ";[.K191])+1;LEN([.K191])) -> 133.796463 | O191: of:=IF([.A190]=[.A191];[.O190];[.O190]+1) -> 91 | P191: of:=IF([.A191]=[.E191];"";IF([.E191]="";"";"あり")) -> 
A192: 人材育成センター前 | C192: 上り | F192: 柱 | G192: なし | H192: なし | I192: 2018-08 | J192: https://www.google.com/maps/@35.4634854,133.8464639,3a,60y,339.74h,90.15t/data=!3m6!1e1!3m4!1sLdcr65FM3U0ypGFeUom_WA!2e0!7i13312!8i6656?hl=ja | K192: 35.463552, 133.846443 | M192: of:=MID([.K192];1;FIND(",";[.K192])-1) -> 35.463552 | N192: of:=MID([.K192];FIND(" ";[.K192])+1;LEN([.K192])) -> 133.846443 | O192: of:=IF([.A191]=[.A192];[.O191];[.O191]+1) -> 92 | P192: of:=IF([.A192]=[.E192];"";IF([.E192]="";"";"あり")) -> 
A193: 人材育成センター前 | C193: 下り | F193: 柱 | G193: なし | H193: なし | I193: 2018-08 | J193: https://www.google.com/maps/@35.4634779,133.8465202,3a,60y,186.76h,81.42t/data=!3m6!1e1!3m4!1stRQNtV3MsTyxLLERcCJd8Q!2e0!7i13312!8i6656?hl=ja | K193: 35.463450, 133.846525 | M193: of:=MID([.K193];1;FIND(",";[.K193])-1) -> 35.463450 | N193: of:=MID([.K193];FIND(" ";[.K193])+1;LEN([.K193])) -> 133.846525 | O193: of:=IF([.A192]=[.A193];[.O192];[.O192]+1) -> 92 | P193: of:=IF([.A193]=[.E193];"";IF([.E193]="";"";"あり")) -> 
A194: 新田 | C194: 上り | F194: なし | G194: なし | H194: なし | I194: 2012-09 | K194: 35.466727, 133.839788 | M194: of:=MID([.K194];1;FIND(",";[.K194])-1) -> 35.466727 | N194: of:=MID([.K194];FIND(" ";[.K194])+1;LEN([.K194])) -> 133.839788 | O194: of:=IF([.A193]=[.A194];[.O193];[.O193]+1) -> 93 | P194: of:=IF([.A194]=[.E194];"";IF([.E194]="";"";"あり")) -> 
A195: 新田 | C195: 下り | E195: 新田 | F195: 柱 | G195: あり | H195: あり | I195: 2012-09 | J195: https://www.google.com/maps/@35.4667455,133.8398428,3a,24.9y,299.3h,83.77t/data=!3m6!1e1!3m4!1sIEj00h-c-fgsaQ2A7p-TDw!2e0!7i13312!8i6656?hl=ja | K195: 35.466727, 133.839788 | M195: of:=MID([.K195];1;FIND(",";[.K195])-1) -> 35.466727 | N195: of:=MID([.K195];FIND(" ";[.K195])+1;LEN([.K195])) -> 133.839788 | O195: of:=IF([.A194]=[.A195];[.O194];[.O194]+1) -> 93 | P195: of:=IF([.A195]=[.E195];"";IF([.E195]="";"";"あり")) -> 
A196: 中江 | C196: 上り | F196: なし | G196: なし | H196: なし | I196: 2012-09 | K196: 35.468967, 133.840597 | M196: of:=MID([.K196];1;FIND(",";[.K196])-1) -> 35.468967 | N196: of:=MID([.K196];FIND(" ";[.K196])+1;LEN([.K196])) -> 133.840597 | O196: of:=IF([.A195]=[.A196];[.O195];[.O195]+1) -> 94 | P196: of:=IF([.A196]=[.E196];"";IF([.E196]="";"";"あり")) -> 
A197: 中江 | C197: 下り | E197: 中江 | F197: 柱 | G197: あり | H197: あり | I197: 2012-09 | J197: https://www.google.com/maps/@35.4690213,133.8406563,3a,50.8y,267.03h,84.35t/data=!3m6!1e1!3m4!1smRZzsroiqbAxOlWxAV3vJw!2e0!7i13312!8i6656?hl=ja | K197: 35.468967, 133.840597 | M197: of:=MID([.K197];1;FIND(",";[.K197])-1) -> 35.468967 | N197: of:=MID([.K197];FIND(" ";[.K197])+1;LEN([.K197])) -> 133.840597 | O197: of:=IF([.A196]=[.A197];[.O196];[.O196]+1) -> 94 | P197: of:=IF([.A197]=[.E197];"";IF([.E197]="";"";"あり")) -> 
A198: 大塚 | C198: 上り | F198: なし | G198: なし | H198: なし | I198: 2012-09 | K198: 35.473466, 133.842113 | M198: of:=MID([.K198];1;FIND(",";[.K198])-1) -> 35.473466 | N198: of:=MID([.K198];FIND(" ";[.K198])+1;LEN([.K198])) -> 133.842113 | O198: of:=IF([.A197]=[.A198];[.O197];[.O197]+1) -> 95 | P198: of:=IF([.A198]=[.E198];"";IF([.E198]="";"";"あり")) -> 
A199: 大塚 | C199: 下り | E199: 大塚 | F199: 柱 | G199: あり | H199: あり | I199: 2012-09 | J199: https://www.google.com/maps/@35.4734179,133.8421548,3a,35.9y,314.87h,85.37t/data=!3m6!1e1!3m4!1ss0Xp8Z3W-8vCUFj0gFM-bg!2e0!7i13312!8i6656?hl=ja | K199: 35.473466, 133.842113 | M199: of:=MID([.K199];1;FIND(",";[.K199])-1) -> 35.473466 | N199: of:=MID([.K199];FIND(" ";[.K199])+1;LEN([.K199])) -> 133.842113 | O199: of:=IF([.A198]=[.A199];[.O198];[.O198]+1) -> 95 | P199: of:=IF([.A199]=[.E199];"";IF([.E199]="";"";"あり")) -> 
A200: 天神橋 | C200: 上り | F200: なし | G200: なし | H200: なし | I200: 2015-05 | K200: 35.479878, 133.843520 | M200: of:=MID([.K200];1;FIND(",";[.K200])-1) -> 35.479878 | N200: of:=MID([.K200];FIND(" ";[.K200])+1;LEN([.K200])) -> 133.843520 | O200: of:=IF([.A199]=[.A200];[.O199];[.O199]+1) -> 96 | P200: of:=IF([.A200]=[.E200];"";IF([.E200]="";"";"あり")) -> 
A201: 天神橋 | C201: 下り | E201: 天神橋 | F201: 柱 | G201: あり | H201: あり | I201: 2015-05 | J201: https://www.google.com/maps/@35.4798943,133.8435425,3a,75y,265.44h,83.66t/data=!3m6!1e1!3m4!1s-ka2s7Gr2FefDL9gbSmrpA!2e0!7i13312!8i6656?hl=ja | K201: 35.479878, 133.843520 | M201: of:=MID([.K201];1;FIND(",";[.K201])-1) -> 35.479878 | N201: of:=MID([.K201];FIND(" ";[.K201])+1;LEN([.K201])) -> 133.843520 | O201: of:=IF([.A200]=[.A201];[.O200];[.O200]+1) -> 96 | P201: of:=IF([.A201]=[.E201];"";IF([.E201]="";"";"あり")) -> 
A202: 江北 | C202: 上り | E202: 江北 | F202: 柱 | G202: あり | H202: あり | I202: 2018-07 | J202: https://www.google.com/maps/@35.4810766,133.8418207,3a,33.5y,6.95h,89.18t/data=!3m6!1e1!3m4!1snpj8XGZTSA13H8raZiJ2Pw!2e0!7i13312!8i6656?hl=ja | K202: 35.481134, 133.841872 | M202: of:=MID([.K202];1;FIND(",";[.K202])-1) -> 35.481134 | N202: of:=MID([.K202];FIND(" ";[.K202])+1;LEN([.K202])) -> 133.841872 | O202: of:=IF([.A201]=[.A202];[.O201];[.O201]+1) -> 97 | P202: of:=IF([.A202]=[.E202];"";IF([.E202]="";"";"あり")) -> 
A203: 江北 | C203: 下り | E203: 江北 | F203: 柱 | G203: なし | H203: なし | I203: 2018-07 | J203: https://www.google.com/maps/@35.4811993,133.8410673,3a,23.3y,216.69h,87.4t/data=!3m6!1e1!3m4!1squHds-b-LzjSKv4R_MvnvA!2e0!7i13312!8i6656?hl=ja | K203: 35.481114, 133.841020 | M203: of:=MID([.K203];1;FIND(",";[.K203])-1) -> 35.481114 | N203: of:=MID([.K203];FIND(" ";[.K203])+1;LEN([.K203])) -> 133.841020 | O203: of:=IF([.A202]=[.A203];[.O202];[.O202]+1) -> 97 | P203: of:=IF([.A203]=[.E203];"";IF([.E203]="";"";"あり")) -> 
A204: 西みどり団地入口 | C204: 上り | E204: 西みどり団地入口 | F204: 柱 | G204: なし | H204: なし | I204: 2018-07 | J204: https://www.google.com/maps/@35.4818409,133.8362475,3a,75y,36.47h,79.83t/data=!3m6!1e1!3m4!1sZfvVxjwototD7WDa63Libw!2e0!7i13312!8i6656?hl=ja | K204: 35.481869, 133.836319 | M204: of:=MID([.K204];1;FIND(",";[.K204])-1) -> 35.481869 | N204: of:=MID([.K204];FIND(" ";[.K204])+1;LEN([.K204])) -> 133.836319 | O204: of:=IF([.A203]=[.A204];[.O203];[.O203]+1) -> 98 | P204: of:=IF([.A204]=[.E204];"";IF([.E204]="";"";"あり")) -> 
A205: 西みどり団地入口 | C205: 下り | E205: 西みどり団地入口 | F205: 柱 | G205: なし | H205: なし | I205: 2018-07 | J205: https://www.google.com/maps/@35.4818329,133.8363597,3a,17.9y,187.47h,86.03t/data=!3m6!1e1!3m4!1siXKOhcdRQP-yM-AgY5AMrQ!2e0!7i13312!8i6656?hl=ja | K205: 35.481743, 133.836362 | M205: of:=MID([.K205];1;FIND(",";[.K205])-1) -> 35.481743 | N205: of:=MID([.K205];FIND(" ";[.K205])+1;LEN([.K205])) -> 133.836362 | O205: of:=IF([.A204]=[.A205];[.O204];[.O204]+1) -> 98 | P205: of:=IF([.A205]=[.E205];"";IF([.E205]="";"";"あり")) -> 
A206: 国坂東口 | C206: 上り | E206: 国坂東口 | F206: 柱 | G206: あり | H206: あり | I206: 2018-07 | J206: https://www.google.com/maps/@35.4821462,133.8311216,3a,51.4y,340.23h,87.19t/data=!3m6!1e1!3m4!1smsBOyUre8mstmz8w1KZMYA!2e0!7i13312!8i6656?hl=ja | K206: 35.482185, 133.831071 | M206: of:=MID([.K206];1;FIND(",";[.K206])-1) -> 35.482185 | N206: of:=MID([.K206];FIND(" ";[.K206])+1;LEN([.K206])) -> 133.831071 | O206: of:=IF([.A205]=[.A206];[.O205];[.O205]+1) -> 99 | P206: of:=IF([.A206]=[.E206];"";IF([.E206]="";"";"あり")) -> 
A207: 国坂東口 | C207: 下り | E207: 国坂東口 | F207: 柱 | G207: なし | H207: なし | I207: 2018-07 | J207: https://www.google.com/maps/@35.4821489,133.8304613,3a,30.1y,209.11h,87.26t/data=!3m6!1e1!3m4!1sSZW-wgg6tv1aG3Fe0_YtPA!2e0!7i13312!8i6656?hl=ja | K207: 35.482065, 133.830411 | M207: of:=MID([.K207];1;FIND(",";[.K207])-1) -> 35.482065 | N207: of:=MID([.K207];FIND(" ";[.K207])+1;LEN([.K207])) -> 133.830411 | O207: of:=IF([.A206]=[.A207];[.O206];[.O206]+1) -> 99 | P207: of:=IF([.A207]=[.E207];"";IF([.E207]="";"";"あり")) -> 
A208: 国坂 | C208: 上り | E208: 国坂 | F208: 柱 | G208: あり | H208: あり | I208: 2018-07 | J208: https://www.google.com/maps/@35.4821677,133.8257934,3a,37.7y,7.71h,86.76t/data=!3m6!1e1!3m4!1sybMW_GbIbxoX0EINz7g-jg!2e0!7i13312!8i6656?hl=ja | K208: 35.482229, 133.825835 | M208: of:=MID([.K208];1;FIND(",";[.K208])-1) -> 35.482229 | N208: of:=MID([.K208];FIND(" ";[.K208])+1;LEN([.K208])) -> 133.825835 | O208: of:=IF([.A207]=[.A208];[.O207];[.O207]+1) -> 100 | P208: of:=IF([.A208]=[.E208];"";IF([.E208]="";"";"あり")) -> 
A209: 国坂 | C209: 下り | E209: 国坂 | F209: 柱 | G209: あり | H209: なし | I209: 2018-07 | J209: https://www.google.com/maps/@35.4821677,133.8257934,3a,39.3y,188.94h,87.82t/data=!3m6!1e1!3m4!1sybMW_GbIbxoX0EINz7g-jg!2e0!7i13312!8i6656?hl=ja | K209: 35.482104, 133.825787 | M209: of:=MID([.K209];1;FIND(",";[.K209])-1) -> 35.482104 | N209: of:=MID([.K209];FIND(" ";[.K209])+1;LEN([.K209])) -> 133.825787 | O209: of:=IF([.A208]=[.A209];[.O208];[.O208]+1) -> 100 | P209: of:=IF([.A209]=[.E209];"";IF([.E209]="";"";"あり")) -> 
A210: 田井 | C210: 上り | E210: 田井 | F210: 柱 | G210: あり | H210: なし | I210: 2015-04 | J210: https://www.google.com/maps/@35.4810895,133.8174798,3a,16.2y,35.43h,89.25t/data=!3m6!1e1!3m4!1s3vPAMa1K7aWScTdnUIsM3Q!2e0!7i13312!8i6656?hl=ja | K210: 35.481191, 133.817571 | M210: of:=MID([.K210];1;FIND(",";[.K210])-1) -> 35.481191 | N210: of:=MID([.K210];FIND(" ";[.K210])+1;LEN([.K210])) -> 133.817571 | O210: of:=IF([.A209]=[.A210];[.O209];[.O209]+1) -> 101 | P210: of:=IF([.A210]=[.E210];"";IF([.E210]="";"";"あり")) -> 
A211: 田井 | C211: 下り | E211: 田井 | F211: 柱 | G211: なし | H211: なし | I211: 2015-04 | J211: https://www.google.com/maps/@35.4811068,133.8176106,3a,50.9y,156.59h,87.03t/data=!3m6!1e1!3m4!1sTDnbknmULiKoVjnFKnTEWg!2e0!7i13312!8i6656?hl=ja | K211: 35.481047, 133.817628 | M211: of:=MID([.K211];1;FIND(",";[.K211])-1) -> 35.481047 | N211: of:=MID([.K211];FIND(" ";[.K211])+1;LEN([.K211])) -> 133.817628 | O211: of:=IF([.A210]=[.A211];[.O210];[.O210]+1) -> 101 | P211: of:=IF([.A211]=[.E211];"";IF([.E211]="";"";"あり")) -> 
A212: 弓原 | C212: 上り | E212: 弓原 | F212: 柱 | G212: あり | H212: あり | I212: 2018-07 | J212: https://www.google.com/maps/@35.4820547,133.812798,3a,35.6y,345.54h,88.89t/data=!3m6!1e1!3m4!1sQNZvvO-yBJL5a3taNd1VzQ!2e0!7i13312!8i6656?hl=ja | K212: 35.481921, 133.812681 | M212: of:=MID([.K212];1;FIND(",";[.K212])-1) -> 35.481921 | N212: of:=MID([.K212];FIND(" ";[.K212])+1;LEN([.K212])) -> 133.812681 | O212: of:=IF([.A211]=[.A212];[.O211];[.O211]+1) -> 102 | P212: of:=IF([.A212]=[.E212];"";IF([.E212]="";"";"あり")) -> 
A213: 弓原 | C213: 下り | E213: 弓原 | F213: 柱 | G213: なし | H213: なし | I213: 2018-07 | J213: https://www.google.com/maps/@35.4822215,133.8120799,3a,15.4y,219.68h,89.42t/data=!3m6!1e1!3m4!1sgFuLgMwCzhvrF9AqrJdK1Q!2e0!7i13312!8i6656?hl=ja | K213: 35.481978, 133.811915 | M213: of:=MID([.K213];1;FIND(",";[.K213])-1) -> 35.481978 | N213: of:=MID([.K213];FIND(" ";[.K213])+1;LEN([.K213])) -> 133.811915 | O213: of:=IF([.A212]=[.A213];[.O212];[.O212]+1) -> 102 | P213: of:=IF([.A213]=[.E213];"";IF([.E213]="";"";"あり")) -> 
A214: 下北条駅前 | C214: 上り | E214: 下北条駅前 | F214: 柱 | G214: なし | H214: なし | I214: 2018-07 | J214: https://www.google.com/maps/@35.483226,133.8080399,3a,75y,346.78h,83.01t/data=!3m6!1e1!3m4!1soje-EDE3H51FGEy56F9CCg!2e0!7i13312!8i6656?hl=ja | K214: 35.483256, 133.808050 | M214: of:=MID([.K214];1;FIND(",";[.K214])-1) -> 35.483256 | N214: of:=MID([.K214];FIND(" ";[.K214])+1;LEN([.K214])) -> 133.808050 | O214: of:=IF([.A213]=[.A214];[.O213];[.O213]+1) -> 103 | P214: of:=IF([.A214]=[.E214];"";IF([.E214]="";"";"あり")) -> 
A215: 下北条駅前 | C215: 下り | E215: 下北条駅前 | F215: 柱 | G215: なし | H215: なし | I215: 2018-07 | J215: https://www.google.com/maps/@35.4832381,133.8079912,3a,43.7y,229.58h,87.08t/data=!3m6!1e1!3m4!1sjlcb5xM-Az4ulmgcVEo0FA!2e0!7i13312!8i6656?hl=ja | K215: 35.483163, 133.807930 | M215: of:=MID([.K215];1;FIND(",";[.K215])-1) -> 35.483163 | N215: of:=MID([.K215];FIND(" ";[.K215])+1;LEN([.K215])) -> 133.807930 | O215: of:=IF([.A214]=[.A215];[.O214];[.O214]+1) -> 103 | P215: of:=IF([.A215]=[.E215];"";IF([.E215]="";"";"あり")) -> 
A216: 下神 | C216: 上り | E216: 下神 | F216: 柱 | G216: あり | H216: あり | I216: 2018-07 | J216: https://www.google.com/maps/@35.4845143,133.8018102,3a,75y,7.23h,87.01t/data=!3m6!1e1!3m4!1sruPsmYAhV1hRKIF8IRtLMw!2e0!7i13312!8i6656?hl=ja | K216: 35.484576, 133.801851 | M216: of:=MID([.K216];1;FIND(",";[.K216])-1) -> 35.484576 | N216: of:=MID([.K216];FIND(" ";[.K216])+1;LEN([.K216])) -> 133.801851 | O216: of:=IF([.A215]=[.A216];[.O215];[.O215]+1) -> 104 | P216: of:=IF([.A216]=[.E216];"";IF([.E216]="";"";"あり")) -> 
A217: 下神 | C217: 下り | E217: 下神 | F217: 柱 | G217: なし | H217: なし | I217: 2018-07 | J217: https://www.google.com/maps/@35.4846381,133.80093,3a,24.7y,188.3h,86.76t/data=!3m6!1e1!3m4!1sVUPYu-eBDuY9BLLF7SuECw!2e0!7i13312!8i6656?hl=ja | K217: 35.484541, 133.800898 | M217: of:=MID([.K217];1;FIND(",";[.K217])-1) -> 35.484541 | N217: of:=MID([.K217];FIND(" ";[.K217])+1;LEN([.K217])) -> 133.800898 | O217: of:=IF([.A216]=[.A217];[.O216];[.O216]+1) -> 104 | P217: of:=IF([.A217]=[.E217];"";IF([.E217]="";"";"あり")) -> 
A218: 松神 | C218: 上り | E218: 松神 | F218: 柱 | G218: あり | H218: あり | I218: 2018-07 | J218: https://www.google.com/maps/@35.4852658,133.7969082,3a,64.1y,2.81h,84.13t/data=!3m6!1e1!3m4!1sZp0bxLLhdc2tV4jbDo9qmg!2e0!7i13312!8i6656?hl=ja | K218: 35.485476, 133.796981 | M218: of:=MID([.K218];1;FIND(",";[.K218])-1) -> 35.485476 | N218: of:=MID([.K218];FIND(" ";[.K218])+1;LEN([.K218])) -> 133.796981 | O218: of:=IF([.A217]=[.A218];[.O217];[.O217]+1) -> 105 | P218: of:=IF([.A218]=[.E218];"";IF([.E218]="";"";"あり")) -> 
A219: 松神 | C219: 下り | E219: 松神 | F219: 柱 | G219: なし | H219: なし | I219: 2018-07 | J219: https://www.google.com/maps/@35.4852741,133.7968521,3a,26.7y,202.82h,86.44t/data=!3m6!1e1!3m4!1sM14W8q4n6JLZJur77xb4Lw!2e0!7i13312!8i6656?hl=ja | K219: 35.485376, 133.796879 | M219: of:=MID([.K219];1;FIND(",";[.K219])-1) -> 35.485376 | N219: of:=MID([.K219];FIND(" ";[.K219])+1;LEN([.K219])) -> 133.796879 | O219: of:=IF([.A218]=[.A219];[.O218];[.O218]+1) -> 105 | P219: of:=IF([.A219]=[.E219];"";IF([.E219]="";"";"あり")) -> 
A220: 東園 | C220: 上り | E220: 東園 | F220: 柱 | G220: あり | H220: なし | I220: 2018-07 | J220: https://www.google.com/maps/@35.4870313,133.7836921,3a,30.8y,-2.21h,90.06t/data=!3m6!1e1!3m4!1sTg8xcIkgOueQYkMvkMAHOQ!2e0!7i13312!8i6656?hl=ja | K220: 35.487197, 133.783740 | M220: of:=MID([.K220];1;FIND(",";[.K220])-1) -> 35.487197 | N220: of:=MID([.K220];FIND(" ";[.K220])+1;LEN([.K220])) -> 133.783740 | O220: of:=IF([.A219]=[.A220];[.O219];[.O219]+1) -> 106 | P220: of:=IF([.A220]=[.E220];"";IF([.E220]="";"";"あり")) -> 
A221: 東園 | C221: 下り | E221: 東園 | F221: 柱 | G221: なし | H221: なし | I221: 2018-07 | J221: https://www.google.com/maps/@35.4870989,133.7831276,3a,51.1y,172.95h,91.43t/data=!3m6!1e1!3m4!1sPrLFKvPm3OFJbo-ieHv0uw!2e0!7i13312!8i6656?hl=ja | K221: 35.487047, 133.783212 | M221: of:=MID([.K221];1;FIND(",";[.K221])-1) -> 35.487047 | N221: of:=MID([.K221];FIND(" ";[.K221])+1;LEN([.K221])) -> 133.783212 | O221: of:=IF([.A220]=[.A221];[.O220];[.O220]+1) -> 106 | P221: of:=IF([.A221]=[.E221];"";IF([.E221]="";"";"あり")) -> 
A222: 東園入口 | C222: 上り | E222: 東園入口 | F222: 柱 | G222: あり | H222: あり | I222: 2018-07 | J222: https://www.google.com/maps/@35.4877836,133.7771851,3a,50.8y,357.51h,91.86t/data=!3m6!1e1!3m4!1sRlX3pqw5OdOWaGzwIpr_Qw!2e0!7i13312!8i6656?hl=ja | K222: 35.487782, 133.777234 | M222: of:=MID([.K222];1;FIND(",";[.K222])-1) -> 35.487782 | N222: of:=MID([.K222];FIND(" ";[.K222])+1;LEN([.K222])) -> 133.777234 | O222: of:=IF([.A221]=[.A222];[.O221];[.O221]+1) -> 107 | P222: of:=IF([.A222]=[.E222];"";IF([.E222]="";"";"あり")) -> 
A223: 東園入口 | C223: 下り | E223: 東園入口 | F223: 柱 | G223: なし | H223: なし | I223: 2018-07 | J223: https://www.google.com/maps/@35.487744,133.7775259,3a,60y,187.93h,82.94t/data=!3m6!1e1!3m4!1szQEI1WBKufcihhQh-JPYCg!2e0!7i13312!8i6656?hl=ja | K223: 35.487573, 133.777533 | M223: of:=MID([.K223];1;FIND(",";[.K223])-1) -> 35.487573 | N223: of:=MID([.K223];FIND(" ";[.K223])+1;LEN([.K223])) -> 133.777533 | O223: of:=IF([.A222]=[.A223];[.O222];[.O222]+1) -> 107 | P223: of:=IF([.A223]=[.E223];"";IF([.E223]="";"";"あり")) -> 
A224: 西園 | C224: 上り | E224: 西園 | F224: 柱 | G224: なし | H224: なし | I224: 2018-07 | J224: https://www.google.com/maps/@35.4890256,133.7677519,3a,60.8y,5.64h,85.89t/data=!3m6!1e1!3m4!1sjh4j8igwEn7QCtFInb2rBw!2e0!7i13312!8i6656?hl=ja | K224: 35.489202, 133.767815 | M224: of:=MID([.K224];1;FIND(",";[.K224])-1) -> 35.489202 | N224: of:=MID([.K224];FIND(" ";[.K224])+1;LEN([.K224])) -> 133.767815 | O224: of:=IF([.A223]=[.A224];[.O223];[.O223]+1) -> 108 | P224: of:=IF([.A224]=[.E224];"";IF([.E224]="";"";"あり")) -> 
A225: 西園 | C225: 下り | E225: 西園 | F225: 柱 | G225: なし | H225: なし | I225: 2018-07 | J225: https://www.google.com/maps/@35.489117,133.766931,3a,18.9y,195.54h,86.33t/data=!3m6!1e1!3m4!1sDZC5qTQb6CMP-f6-yn8aow!2e0!7i13312!8i6656?hl=ja | K225: 35.489094, 133.766953 | M225: of:=MID([.K225];1;FIND(",";[.K225])-1) -> 35.489094 | N225: of:=MID([.K225];FIND(" ";[.K225])+1;LEN([.K225])) -> 133.766953 | O225: of:=IF([.A224]=[.A225];[.O224];[.O224]+1) -> 108 | P225: of:=IF([.A225]=[.E225];"";IF([.E225]="";"";"あり")) -> 
A226: 由良新橋 | C226: 上り | E226: 由良新橋 | F226: 柱 | G226: なし | H226: なし | I226: 2018-08 | J226: https://www.google.com/maps/@35.4894798,133.7614879,3a,41.8y,16.94h,86.19t/data=!3m6!1e1!3m4!1s9qCVTNhR-GIR2lI1zR9tYQ!2e0!7i13312!8i6656?hl=ja | K226: 35.489579, 133.761538 | M226: of:=MID([.K226];1;FIND(",";[.K226])-1) -> 35.489579 | N226: of:=MID([.K226];FIND(" ";[.K226])+1;LEN([.K226])) -> 133.761538 | O226: of:=IF([.A225]=[.A226];[.O225];[.O225]+1) -> 109 | P226: of:=IF([.A226]=[.E226];"";IF([.E226]="";"";"あり")) -> 
A227: 由良新橋 | C227: 下り | E227: 由良新橋 | F227: 柱 | G227: なし | H227: なし | I227: 2018-08 | J227: https://www.google.com/maps/@35.4895495,133.761188,3a,36.7y,194.88h,88.91t/data=!3m6!1e1!3m4!1s-er1x7cchx-aP1iu8k5MMw!2e0!7i13312!8i6656?hl=ja | K227: 35.489504, 133.761171 | M227: of:=MID([.K227];1;FIND(",";[.K227])-1) -> 35.489504 | N227: of:=MID([.K227];FIND(" ";[.K227])+1;LEN([.K227])) -> 133.761171 | O227: of:=IF([.A226]=[.A227];[.O226];[.O226]+1) -> 109 | P227: of:=IF([.A227]=[.E227];"";IF([.E227]="";"";"あり")) -> 
A228: 北栄町大栄庁舎前 | C228: 上り | E228: 北栄町大栄庁舎前 | F228: 柱 | G228: なし | H228: あり | I228: 2018-07 | J228: https://www.google.com/maps/@35.4913055,133.7575739,3a,58.6y,15.75h,87.42t/data=!3m6!1e1!3m4!1sA9XLi4sU_NSVtz6q6nlWgQ!2e0!7i13312!8i6656?hl=ja | K228: 35.491335, 133.757616 | M228: of:=MID([.K228];1;FIND(",";[.K228])-1) -> 35.491335 | N228: of:=MID([.K228];FIND(" ";[.K228])+1;LEN([.K228])) -> 133.757616 | O228: of:=IF([.A227]=[.A228];[.O227];[.O227]+1) -> 110 | P228: of:=IF([.A228]=[.E228];"";IF([.E228]="";"";"あり")) -> 
A229: 北栄町大栄庁舎前 | C229: 下り | E229: 北栄町大栄庁舎前 | F229: 柱 | G229: あり | H229: なし | I229: 2018-07 | J229: https://www.google.com/maps/@35.4910369,133.7583956,3a,40.5y,233.25h,92t/data=!3m6!1e1!3m4!1siy0xigsACpxnyo9ndo9yBA!2e0!7i13312!8i6656?hl=ja | K229: 35.490989, 133.758306 | M229: of:=MID([.K229];1;FIND(",";[.K229])-1) -> 35.490989 | N229: of:=MID([.K229];FIND(" ";[.K229])+1;LEN([.K229])) -> 133.758306 | O229: of:=IF([.A228]=[.A229];[.O228];[.O228]+1) -> 110 | P229: of:=IF([.A229]=[.E229];"";IF([.E229]="";"";"あり")) -> 
A230: 由良駅入口 | C230: 上り | E230: 由良駅入口 | F230: 柱 | G230: あり | H230: あり | I230: 2018-07 | J230: https://www.google.com/maps/@35.4919384,133.7548664,3a,34.4y,20.63h,88.64t/data=!3m6!1e1!3m4!1sh69G2gJfkMdpEKa2iC_Z_A!2e0!7i13312!8i6656?hl=ja | K230: 35.492003, 133.754886 | M230: of:=MID([.K230];1;FIND(",";[.K230])-1) -> 35.492003 | N230: of:=MID([.K230];FIND(" ";[.K230])+1;LEN([.K230])) -> 133.754886 | O230: of:=IF([.A229]=[.A230];[.O229];[.O229]+1) -> 111 | P230: of:=IF([.A230]=[.E230];"";IF([.E230]="";"";"あり")) -> 
A231: 由良駅入口 | C231: 下り | E231: 由良駅入口 | F231: 柱 | G231: なし | H231: あり | I231: 2018-07 | J231: https://www.google.com/maps/@35.4919384,133.7548664,3a,42.3y,175.42h,87.59t/data=!3m6!1e1!3m4!1sh69G2gJfkMdpEKa2iC_Z_A!2e0!7i13312!8i6656?hl=ja | K231: 35.491853, 133.754886 | M231: of:=MID([.K231];1;FIND(",";[.K231])-1) -> 35.491853 | N231: of:=MID([.K231];FIND(" ";[.K231])+1;LEN([.K231])) -> 133.754886 | O231: of:=IF([.A230]=[.A231];[.O230];[.O230]+1) -> 111 | P231: of:=IF([.A231]=[.E231];"";IF([.E231]="";"";"あり")) -> 
A232: 倉吉北高前 | C232: 上り | F232: 柱 | G232: なし | H232: なし | I232: 2018-08 | J232: https://www.google.com/maps/@35.4649527,133.8499166,3a,60y,121.27h,84.65t/data=!3m6!1e1!3m4!1sNIfe04oHaBfm2eL2z7-GHA!2e0!7i13312!8i6656?hl=ja | K232: 35.464928, 133.849985 | M232: of:=MID([.K232];1;FIND(",";[.K232])-1) -> 35.464928 | N232: of:=MID([.K232];FIND(" ";[.K232])+1;LEN([.K232])) -> 133.849985 | O232: of:=IF([.A231]=[.A232];[.O231];[.O231]+1) -> 112 | P232: of:=IF([.A232]=[.E232];"";IF([.E232]="";"";"あり")) -> 
A233: 倉吉北高前 | C233: 下り | F233: 柱 | G233: なし | H233: なし | I233: 2018-08 | J233: https://www.google.com/maps/@35.4649527,133.8499166,3a,75y,315.28h,79.99t/data=!3m6!1e1!3m4!1sNIfe04oHaBfm2eL2z7-GHA!2e0!7i13312!8i6656?hl=ja | K233: 35.464984, 133.849876 | M233: of:=MID([.K233];1;FIND(",";[.K233])-1) -> 35.464984 | N233: of:=MID([.K233];FIND(" ";[.K233])+1;LEN([.K233])) -> 133.849876 | O233: of:=IF([.A232]=[.A233];[.O232];[.O232]+1) -> 112 | P233: of:=IF([.A233]=[.E233];"";IF([.E233]="";"";"あり")) -> 
A234: 福庭北 | C234: 上り | E234: 福庭北 | F234: 柱 | G234: なし | H234: なし | I234: 2018-08 | J234: https://www.google.com/maps/@35.4675056,133.8505612,3a,30.3y,103.04h,85.11t/data=!3m6!1e1!3m4!1sD9l7NkDhkgxOfFfOjDDw6w!2e0!7i13312!8i6656?hl=ja | K234: 35.467485, 133.850619 | M234: of:=MID([.K234];1;FIND(",";[.K234])-1) -> 35.467485 | N234: of:=MID([.K234];FIND(" ";[.K234])+1;LEN([.K234])) -> 133.850619 | O234: of:=IF([.A233]=[.A234];[.O233];[.O233]+1) -> 113 | P234: of:=IF([.A234]=[.E234];"";IF([.E234]="";"";"あり")) -> 
A235: 福庭北 | C235: 下り | F235: 柱 | G235: なし | H235: なし | I235: 2012-09 | J235: https://www.google.com/maps/@35.4670335,133.8504418,3a,75y,319.67h,83.78t/data=!3m6!1e1!3m4!1sm5O3OFH-2TUqMIAOaywNUw!2e0!7i13312!8i6656?hl=ja | K235: 35.467082, 133.850408 | M235: of:=MID([.K235];1;FIND(",";[.K235])-1) -> 35.467082 | N235: of:=MID([.K235];FIND(" ";[.K235])+1;LEN([.K235])) -> 133.850408 | O235: of:=IF([.A234]=[.A235];[.O234];[.O234]+1) -> 113 | P235: of:=IF([.A235]=[.E235];"";IF([.E235]="";"";"あり")) -> 
A236: 清谷 | C236: 上り | E236: 清谷 | F236: 柱 | G236: なし | H236: なし | I236: 2018-07 | J236: https://www.google.com/maps/@35.4727158,133.8519071,3a,75y,78.96h,79.83t/data=!3m6!1e1!3m4!1srXrJuEpRoanZMm3avadoNA!2e0!7i13312!8i6656?hl=ja | K236: 35.472730, 133.851944 | M236: of:=MID([.K236];1;FIND(",";[.K236])-1) -> 35.472730 | N236: of:=MID([.K236];FIND(" ";[.K236])+1;LEN([.K236])) -> 133.851944 | O236: of:=IF([.A235]=[.A236];[.O235];[.O235]+1) -> 114 | P236: of:=IF([.A236]=[.E236];"";IF([.E236]="";"";"あり")) -> 
A237: 清谷 | C237: 下り | E237: 清谷 | F237: 柱 | G237: なし | H237: なし | I237: 2018-07 | J237: https://www.google.com/maps/@35.4725898,133.8518758,3a,52y,294.08h,85.33t/data=!3m6!1e1!3m4!1s2_HTrOJqT1bgKSceTtxYVA!2e0!7i13312!8i6656?hl=ja | K237: 35.472630, 133.851789 | M237: of:=MID([.K237];1;FIND(",";[.K237])-1) -> 35.472630 | N237: of:=MID([.K237];FIND(" ";[.K237])+1;LEN([.K237])) -> 133.851789 | O237: of:=IF([.A236]=[.A237];[.O236];[.O236]+1) -> 114 | P237: of:=IF([.A237]=[.E237];"";IF([.E237]="";"";"あり")) -> 
A238: 田後入口 | C238: 上り | E238: 田後入口 | F238: 柱 | G238: なし | H238: なし | I238: 2018-07 | J238: https://www.google.com/maps/@35.4791283,133.8535221,3a,75y,111.19h,73.36t/data=!3m6!1e1!3m4!1skqTOaPPJzNCSDywcA8GsOw!2e0!7i13312!8i6656?hl=ja | K238: 35.479101, 133.853563 | M238: of:=MID([.K238];1;FIND(",";[.K238])-1) -> 35.479101 | N238: of:=MID([.K238];FIND(" ";[.K238])+1;LEN([.K238])) -> 133.853563 | O238: of:=IF([.A237]=[.A238];[.O237];[.O237]+1) -> 115 | P238: of:=IF([.A238]=[.E238];"";IF([.E238]="";"";"あり")) -> 
A239: 田後入口 | C239: 下り | E239: 田後入口 | F239: 柱 | G239: なし | H239: なし | I239: 2018-07 | J239: https://www.google.com/maps/@35.4792944,133.8535664,3a,29y,289.59h,88.91t/data=!3m6!1e1!3m4!1saU6-NvNpMvkDFbXHBqbcFQ!2e0!7i13312!8i6656?hl=ja | K239: 35.479334, 133.853495 | M239: of:=MID([.K239];1;FIND(",";[.K239])-1) -> 35.479334 | N239: of:=MID([.K239];FIND(" ";[.K239])+1;LEN([.K239])) -> 133.853495 | O239: of:=IF([.A238]=[.A239];[.O238];[.O238]+1) -> 115 | P239: of:=IF([.A239]=[.E239];"";IF([.E239]="";"";"あり")) -> 
A240: 田後 | C240: 上り | E240: 田後 | F240: 柱 | G240: あり | H240: あり | I240: 2018-07 | J240: https://www.google.com/maps/@35.4829847,133.8556835,3a,43.2y,135.43h,86.22t/data=!3m6!1e1!3m4!1srbchFzrQKmQxKprIIzxRrw!2e0!7i13312!8i6656?hl=ja | K240: 35.482899, 133.855778 | M240: of:=MID([.K240];1;FIND(",";[.K240])-1) -> 35.482899 | N240: of:=MID([.K240];FIND(" ";[.K240])+1;LEN([.K240])) -> 133.855778 | O240: of:=IF([.A239]=[.A240];[.O239];[.O239]+1) -> 116 | P240: of:=IF([.A240]=[.E240];"";IF([.E240]="";"";"あり")) -> 
A241: 田後 | C241: 下り | E241: 田後 | F241: 柱 | G241: なし | H241: あり | I241: 2018-07 | J241: https://www.google.com/maps/@35.4825203,133.8554839,3a,75y,325.67h,83.8t/data=!3m6!1e1!3m4!1sAD3hzb4OrduSDlFEsTetnw!2e0!7i13312!8i6656?hl=ja | K241: 35.482603, 133.855467 | M241: of:=MID([.K241];1;FIND(",";[.K241])-1) -> 35.482603 | N241: of:=MID([.K241];FIND(" ";[.K241])+1;LEN([.K241])) -> 133.855467 | O241: of:=IF([.A240]=[.A241];[.O240];[.O240]+1) -> 116 | P241: of:=IF([.A241]=[.E241];"";IF([.E241]="";"";"あり")) -> 
A242: 北溟中学校前 | C242: 上り | E242: 北溟中学校前 | F242: 柱 | G242: なし | H242: なし | I242: 2018-07 | J242: https://www.google.com/maps/@35.4857825,133.8579268,3a,45.6y,115.11h,91.97t/data=!3m6!1e1!3m4!1s2fyDTInSwr_xDXuqjtdWDA!2e0!7i13312!8i6656?hl=ja | K242: 35.485758, 133.858045 | M242: of:=MID([.K242];1;FIND(",";[.K242])-1) -> 35.485758 | N242: of:=MID([.K242];FIND(" ";[.K242])+1;LEN([.K242])) -> 133.858045 | O242: of:=IF([.A241]=[.A242];[.O241];[.O241]+1) -> 117 | P242: of:=IF([.A242]=[.E242];"";IF([.E242]="";"";"あり")) -> 
A243: 北溟中学校前 | C243: 下り | E243: 北溟中学校前 | F243: 柱 | G243: なし | H243: なし | I243: 2018-07 | J243: https://www.google.com/maps/@35.4852851,133.8573975,3a,50.4y,339.79h,86.47t/data=!3m6!1e1!3m4!1sF373Y3odiEEckyzmG1J_NA!2e0!7i13312!8i6656?hl=ja | K243: 35.485374, 133.857388 | M243: of:=MID([.K243];1;FIND(",";[.K243])-1) -> 35.485374 | N243: of:=MID([.K243];FIND(" ";[.K243])+1;LEN([.K243])) -> 133.857388 | O243: of:=IF([.A242]=[.A243];[.O242];[.O242]+1) -> 117 | P243: of:=IF([.A243]=[.E243];"";IF([.E243]="";"";"あり")) -> 
A244: 長瀬西口 | C244: 上り | E244: 長瀬西口 | F244: 柱 | G244: なし | H244: なし | I244: 2018-07 | J244: https://www.google.com/maps/@35.4882082,133.8619693,3a,40.2y,189.69h,87.66t/data=!3m6!1e1!3m4!1sFSb0SSnS3vraGQeR11nJyQ!2e0!7i13312!8i6656?hl=ja | K244: 35.488110, 133.861938 | M244: of:=MID([.K244];1;FIND(",";[.K244])-1) -> 35.488110 | N244: of:=MID([.K244];FIND(" ";[.K244])+1;LEN([.K244])) -> 133.861938 | O244: of:=IF([.A243]=[.A244];[.O243];[.O243]+1) -> 118 | P244: of:=IF([.A244]=[.E244];"";IF([.E244]="";"";"あり")) -> 
A245: 長瀬西口 | C245: 下り | E245: 長瀬西口 | F245: 柱 | G245: なし | H245: なし | I245: 2018-07 | J245: https://www.google.com/maps/@35.4883083,133.8623565,3a,75y,14.17h,80.32t/data=!3m6!1e1!3m4!1soG6K2BSFsY0mGZIbauC9Pg!2e0!7i13312!8i6656?hl=ja | K245: 35.488384, 133.862370 | M245: of:=MID([.K245];1;FIND(",";[.K245])-1) -> 35.488384 | N245: of:=MID([.K245];FIND(" ";[.K245])+1;LEN([.K245])) -> 133.862370 | O245: of:=IF([.A244]=[.A245];[.O244];[.O244]+1) -> 118 | P245: of:=IF([.A245]=[.E245];"";IF([.E245]="";"";"あり")) -> 
A246: 湯梨浜町役場前 | C246: 上り | E246: 湯梨浜町役場前 | F246: 柱 | G246: なし | H246: なし | I246: 2018-07 | J246: https://www.google.com/maps/@35.4893819,133.8659852,3a,18.6y,141.07h,86.35t/data=!3m6!1e1!3m4!1shi0fR6zOmEcXBUb-ekM-AA!2e0!7i13312!8i6656?hl=ja | K246: 35.489301, 133.866068 | M246: of:=MID([.K246];1;FIND(",";[.K246])-1) -> 35.489301 | N246: of:=MID([.K246];FIND(" ";[.K246])+1;LEN([.K246])) -> 133.866068 | O246: of:=IF([.A245]=[.A246];[.O245];[.O245]+1) -> 119 | P246: of:=IF([.A246]=[.E246];"";IF([.E246]="";"";"あり")) -> 
A247: 湯梨浜町役場前 | C247: 下り | E247: 湯梨浜町役場前 | F247: 柱 | G247: なし | H247: なし | I247: 2018-07 | J247: https://www.google.com/maps/@35.4893536,133.8658879,3a,60y,350.21h,86.7t/data=!3m6!1e1!3m4!1s9CKMlTVNcndg9ehN6A_Xxg!2e0!7i13312!8i6656?hl=ja | K247: 35.489387, 133.865872 | M247: of:=MID([.K247];1;FIND(",";[.K247])-1) -> 35.489387 | N247: of:=MID([.K247];FIND(" ";[.K247])+1;LEN([.K247])) -> 133.865872 | O247: of:=IF([.A246]=[.A247];[.O246];[.O246]+1) -> 119 | P247: of:=IF([.A247]=[.E247];"";IF([.E247]="";"";"あり")) -> 
A248: 久留西 | C248: 上り | E248: 久留西 | F248: 柱 | G248: あり | H248: あり | I248: 2018-07 | J248: https://www.google.com/maps/@35.491962,133.8714062,3a,69y,137.92h,87t/data=!3m6!1e1!3m4!1sec_LKwH0UBx41LmUK3r0Fw!2e0!7i13312!8i6656?hl=ja | K248: 35.491926, 133.871490 | M248: of:=MID([.K248];1;FIND(",";[.K248])-1) -> 35.491926 | N248: of:=MID([.K248];FIND(" ";[.K248])+1;LEN([.K248])) -> 133.871490 | O248: of:=IF([.A247]=[.A248];[.O247];[.O247]+1) -> 120 | P248: of:=IF([.A248]=[.E248];"";IF([.E248]="";"";"あり")) -> 
A249: 久留西 | C249: 下り | E249: 久留西 | F249: 柱 | G249: なし | H249: なし | I249: 2018-07 | J249: https://www.google.com/maps/@35.4916004,133.8707652,3a,75y,319.86h,88.29t/data=!3m6!1e1!3m4!1sxFSo1_wrxvsT0oe9MYrnJA!2e0!7i13312!8i6656?hl=ja | K249: 35.491634, 133.870716 | M249: of:=MID([.K249];1;FIND(",";[.K249])-1) -> 35.491634 | N249: of:=MID([.K249];FIND(" ";[.K249])+1;LEN([.K249])) -> 133.870716 | O249: of:=IF([.A248]=[.A249];[.O248];[.O248]+1) -> 120 | P249: of:=IF([.A249]=[.E249];"";IF([.E249]="";"";"あり")) -> 
A250: 長瀬東口 | C250: 上り | E250: 長瀬東口 | F250: 柱 | G250: あり | H250: なし | I250: 2018-07 | J250: https://www.google.com/maps/@35.4958692,133.8731914,3a,28.6y,82.96h,88.44t/data=!3m6!1e1!3m4!1s_ka1qJI1aqUJqM935eIc_Q!2e0!7i13312!8i6656?hl=ja | K250: 35.495872, 133.873325 | M250: of:=MID([.K250];1;FIND(",";[.K250])-1) -> 35.495872 | N250: of:=MID([.K250];FIND(" ";[.K250])+1;LEN([.K250])) -> 133.873325 | O250: of:=IF([.A249]=[.A250];[.O249];[.O249]+1) -> 121 | P250: of:=IF([.A250]=[.E250];"";IF([.E250]="";"";"あり")) -> 
A251: 長瀬東口 | C251: 下り | E251: 長瀬東口 | F251: 柱 | G251: なし | H251: なし | I251: 2018-07 | J251: https://www.google.com/maps/@35.4952597,133.8731773,3a,60y,280.9h,87.03t/data=!3m6!1e1!3m4!1shwOzg4_9DQ-6F1hzdlm5kw!2e0!7i13312!8i6656?hl=ja | K251: 35.495261, 133.873108 | M251: of:=MID([.K251];1;FIND(",";[.K251])-1) -> 35.495261 | N251: of:=MID([.K251];FIND(" ";[.K251])+1;LEN([.K251])) -> 133.873108 | O251: of:=IF([.A250]=[.A251];[.O250];[.O250]+1) -> 121 | P251: of:=IF([.A251]=[.E251];"";IF([.E251]="";"";"あり")) -> 
A252: 橋津中央入口 | C252: 上り | E252: 橋津中央入口 | F252: 柱 | G252: なし | H252: なし | I252: 2018-07 | J252: https://www.google.com/maps/@35.5018631,133.8731965,3a,44.1y,101.57h,84.98t/data=!3m6!1e1!3m4!1sdI9BV-heAy_RUcf5c9B_Ew!2e0!7i13312!8i6656?hl=ja | K252: 35.501869, 133.873195 | M252: of:=MID([.K252];1;FIND(",";[.K252])-1) -> 35.501869 | N252: of:=MID([.K252];FIND(" ";[.K252])+1;LEN([.K252])) -> 133.873195 | O252: of:=IF([.A251]=[.A252];[.O251];[.O251]+1) -> 122 | P252: of:=IF([.A252]=[.E252];"";IF([.E252]="";"";"あり")) -> 
A253: 橋津中央入口 | C253: 下り | E253: 橋津中央入口 | F253: 柱 | G253: なし | H253: なし | I253: 2018-07 | J253: https://www.google.com/maps/@35.5018631,133.8731965,3a,38.5y,263.74h,87.18t/data=!3m6!1e1!3m4!1sdI9BV-heAy_RUcf5c9B_Ew!2e0!7i13312!8i6656?hl=ja | K253: 35.501877, 133.872998 | M253: of:=MID([.K253];1;FIND(",";[.K253])-1) -> 35.501877 | N253: of:=MID([.K253];FIND(" ";[.K253])+1;LEN([.K253])) -> 133.872998 | O253: of:=IF([.A252]=[.A253];[.O252];[.O252]+1) -> 122 | P253: of:=IF([.A253]=[.E253];"";IF([.E253]="";"";"あり")) -> 
A254: 橋津東口 | C254: 上り | E254: 橋津東口 | F254: 柱 | G254: なし | H254: なし | I254: 2018-07 | J254: https://www.google.com/maps/@35.5057843,133.876733,3a,37.2y,142.29h,85.6t/data=!3m6!1e1!3m4!1s9TBNIw76BqsEsVbIgGlr6g!2e0!7i13312!8i6656?hl=ja | K254: 35.505956, 133.876761 | M254: of:=MID([.K254];1;FIND(",";[.K254])-1) -> 35.505956 | N254: of:=MID([.K254];FIND(" ";[.K254])+1;LEN([.K254])) -> 133.876761 | O254: of:=IF([.A253]=[.A254];[.O253];[.O253]+1) -> 123 | P254: of:=IF([.A254]=[.E254];"";IF([.E254]="";"";"あり")) -> 
A255: 橋津東口 | C255: 下り | E255: 橋津東口 | F255: 柱 | G255: あり | H255: あり | I255: 2018-07 | J255: https://www.google.com/maps/@35.5058173,133.8768216,3a,57.3y,330.1h,93.03t/data=!3m6!1e1!3m4!1slOJA7wMtVXBEzmr0G_NKDw!2e0!7i13312!8i6656?hl=ja | K255: 35.506105, 133.876711 | M255: of:=MID([.K255];1;FIND(",";[.K255])-1) -> 35.506105 | N255: of:=MID([.K255];FIND(" ";[.K255])+1;LEN([.K255])) -> 133.876711 | O255: of:=IF([.A254]=[.A255];[.O254];[.O254]+1) -> 123 | P255: of:=IF([.A255]=[.E255];"";IF([.E255]="";"";"あり")) -> 
A256: ハワイ海水浴場前 | C256: 上り | E256: ハワイ海水浴場 | F256: 柱 | G256: なし | H256: なし | I256: 2018-07 | J256: https://www.google.com/maps/@35.5063176,133.8800478,3a,22.6y,183.03h,87.4t/data=!3m6!1e1!3m4!1sugFGLSaFQChf2ZP2XPgSAQ!2e0!7i13312!8i6656?hl=ja | K256: 35.506401, 133.880070 | M256: of:=MID([.K256];1;FIND(",";[.K256])-1) -> 35.506401 | N256: of:=MID([.K256];FIND(" ";[.K256])+1;LEN([.K256])) -> 133.880070 | O256: of:=IF([.A255]=[.A256];[.O255];[.O255]+1) -> 124 | P256: of:=IF([.A256]=[.E256];"";IF([.E256]="";"";"あり")) -> あり
A257: ハワイ海水浴場前 | C257: 下り | E257: ハワイ海水浴場 | F257: 柱 | G257: なし | H257: なし | I257: 2018-07 | J257: https://www.google.com/maps/@35.5061118,133.8807621,3a,44.4y,25.9h,85.4t/data=!3m6!1e1!3m4!1sbAFwnqjtefzO7FGSZO8tRQ!2e0!7i13312!8i6656?hl=ja | K257: 35.506342, 133.880840 | M257: of:=MID([.K257];1;FIND(",";[.K257])-1) -> 35.506342 | N257: of:=MID([.K257];FIND(" ";[.K257])+1;LEN([.K257])) -> 133.880840 | O257: of:=IF([.A256]=[.A257];[.O256];[.O256]+1) -> 124 | P257: of:=IF([.A257]=[.E257];"";IF([.E257]="";"";"あり")) -> あり
A258: 三軒屋 | C258: 上り | E258: 三軒屋 | F258: 柱 | G258: なし | H258: なし | I258: 2018-07 | J258: https://www.google.com/maps/@35.506411,133.8850316,3a,46.8y,153.05h,91.05t/data=!3m6!1e1!3m4!1s6gDTF3ILvaUtskmHdaT0jw!2e0!7i13312!8i6656?hl=ja | K258: 35.506350, 133.885115 | M258: of:=MID([.K258];1;FIND(",";[.K258])-1) -> 35.506350 | N258: of:=MID([.K258];FIND(" ";[.K258])+1;LEN([.K258])) -> 133.885115 | O258: of:=IF([.A257]=[.A258];[.O257];[.O257]+1) -> 125 | P258: of:=IF([.A258]=[.E258];"";IF([.E258]="";"";"あり")) -> 
A259: 三軒屋 | C259: 下り | E259: 三軒屋 | F259: 柱 | G259: なし | H259: なし | I259: 2018-07 | J259: https://www.google.com/maps/@35.5062386,133.8845815,3a,60y,358.55h,76.53t/data=!3m6!1e1!3m4!1s7JRSiYBpG4bBxUxRYmt4mg!2e0!7i13312!8i6656?hl=ja | K259: 35.506348, 133.884614 | M259: of:=MID([.K259];1;FIND(",";[.K259])-1) -> 35.506348 | N259: of:=MID([.K259];FIND(" ";[.K259])+1;LEN([.K259])) -> 133.884614 | O259: of:=IF([.A258]=[.A259];[.O258];[.O258]+1) -> 125 | P259: of:=IF([.A259]=[.E259];"";IF([.E259]="";"";"あり")) -> 
A260: 宇野西口 | C260: 上り | E260: 宇野西口 | F260: 柱 | G260: あり | H260: あり | I260: 2018-07 | J260: https://www.google.com/maps/@35.5068177,133.8927833,3a,44y,160.59h,91.9t/data=!3m6!1e1!3m4!1szbkIVnioXDrF50SbuDHA7w!2e0!7i13312!8i6656?hl=ja | K260: 35.506549, 133.892965 | M260: of:=MID([.K260];1;FIND(",";[.K260])-1) -> 35.506549 | N260: of:=MID([.K260];FIND(" ";[.K260])+1;LEN([.K260])) -> 133.892965 | O260: of:=IF([.A259]=[.A260];[.O259];[.O259]+1) -> 126 | P260: of:=IF([.A260]=[.E260];"";IF([.E260]="";"";"あり")) -> 
A261: 宇野西口 | C261: 下り | E261: 宇野西口 | F261: 柱 | G261: なし | H261: なし | I261: 2018-07 | J261: https://www.google.com/maps/@35.5068606,133.8930584,3a,60y,335.19h,86.96t/data=!3m6!1e1!3m4!1sk_IsWjVut3vktQosIbftVA!2e0!7i13312!8i6656?hl=ja | K261: 35.506784, 133.893142 | M261: of:=MID([.K261];1;FIND(",";[.K261])-1) -> 35.506784 | N261: of:=MID([.K261];FIND(" ";[.K261])+1;LEN([.K261])) -> 133.893142 | O261: of:=IF([.A260]=[.A261];[.O260];[.O260]+1) -> 126 | P261: of:=IF([.A261]=[.E261];"";IF([.E261]="";"";"あり")) -> 
A262: 宇野東口 | C262: 上り | E262: 宇野東口 | F262: 柱 | G262: あり | H262: あり | I262: 2018-07 | J262: https://www.google.com/maps/@35.5073213,133.8967006,3a,75y,195.27h,88.41t/data=!3m6!1e1!3m4!1s9dYyHJ_KarRHtxTnEdSFTA!2e0!7i13312!8i6656?hl=ja | K262: 35.507220, 133.896778 | M262: of:=MID([.K262];1;FIND(",";[.K262])-1) -> 35.507220 | N262: of:=MID([.K262];FIND(" ";[.K262])+1;LEN([.K262])) -> 133.896778 | O262: of:=IF([.A261]=[.A262];[.O261];[.O261]+1) -> 127 | P262: of:=IF([.A262]=[.E262];"";IF([.E262]="";"";"あり")) -> 
A263: 宇野東口 | C263: 下り | E263: 宇野東口 | F263: 柱 | G263: なし | H263: なし | I263: 2018-07 | J263: https://www.google.com/maps/@35.5073298,133.8968026,3a,60y,14.15h,86.51t/data=!3m6!1e1!3m4!1shb_itaewGYu8PfjXK_BMbw!2e0!7i13312!8i6656?hl=ja | K263: 35.507345, 133.896905 | M263: of:=MID([.K263];1;FIND(",";[.K263])-1) -> 35.507345 | N263: of:=MID([.K263];FIND(" ";[.K263])+1;LEN([.K263])) -> 133.896905 | O263: of:=IF([.A262]=[.A263];[.O262];[.O262]+1) -> 127 | P263: of:=IF([.A263]=[.E263];"";IF([.E263]="";"";"あり")) -> 
A264: 宇谷 | C264: 上り | E264: 宇谷 | F264: 柱 | G264: あり | H264: あり | I264: 2018-07 | J264: https://www.google.com/maps/@35.5067673,133.9102156,3a,41.4y,199.24h,91.9t/data=!3m6!1e1!3m4!1s-B1MTWUkxKlqO8zJjr_-3Q!2e0!7i13312!8i6656?hl=ja | K264: 35.506533, 133.910005 | M264: of:=MID([.K264];1;FIND(",";[.K264])-1) -> 35.506533 | N264: of:=MID([.K264];FIND(" ";[.K264])+1;LEN([.K264])) -> 133.910005 | O264: of:=IF([.A263]=[.A264];[.O263];[.O263]+1) -> 128 | P264: of:=IF([.A264]=[.E264];"";IF([.E264]="";"";"あり")) -> 
A265: 宇谷 | C265: 下り | E265: 宇谷 | F265: 柱 | G265: なし | H265: なし | I265: 2018-07 | J265: https://www.google.com/maps/@35.506867,133.9099059,3a,75y,25.6h,89.61t/data=!3m6!1e1!3m4!1sCXvyzbu47UTpsMGgl9DO7Q!2e0!7i13312!8i6656?hl=ja | K265: 35.506723, 133.909816 | M265: of:=MID([.K265];1;FIND(",";[.K265])-1) -> 35.506723 | N265: of:=MID([.K265];FIND(" ";[.K265])+1;LEN([.K265])) -> 133.909816 | O265: of:=IF([.A264]=[.A265];[.O264];[.O264]+1) -> 128 | P265: of:=IF([.A265]=[.E265];"";IF([.E265]="";"";"あり")) -> 
A266: 宇谷東口 | C266: 上り | E266: 宇谷東口 | F266: 柱 | G266: あり | H266: あり | I266: 2018-07 | J266: https://www.google.com/maps/@35.5059754,133.9158194,3a,29.6y,169h,87.24t/data=!3m6!1e1!3m4!1sPnSeCLt2Wc1ihvhEgxkiYg!2e0!7i13312!8i6656?hl=ja | K266: 35.505677, 133.915838 | M266: of:=MID([.K266];1;FIND(",";[.K266])-1) -> 35.505677 | N266: of:=MID([.K266];FIND(" ";[.K266])+1;LEN([.K266])) -> 133.915838 | O266: of:=IF([.A265]=[.A266];[.O265];[.O265]+1) -> 129 | P266: of:=IF([.A266]=[.E266];"";IF([.E266]="";"";"あり")) -> 
A267: 宇谷東口 | C267: 下り | E267: 宇谷東口 | F267: 柱 | G267: なし | H267: なし | I267: 2018-07 | J267: https://www.google.com/maps/@35.5060019,133.915204,3a,75y,10.12h,80.54t/data=!3m6!1e1!3m4!1s6X4Do2mLamjLZmAMPddpAA!2e0!7i13312!8i6656?hl=ja | K267: 35.505829, 133.915422 | M267: of:=MID([.K267];1;FIND(",";[.K267])-1) -> 35.505829 | N267: of:=MID([.K267];FIND(" ";[.K267])+1;LEN([.K267])) -> 133.915422 | O267: of:=IF([.A266]=[.A267];[.O266];[.O266]+1) -> 129 | P267: of:=IF([.A267]=[.E267];"";IF([.E267]="";"";"あり")) -> 
A268: 原入口 | C268: 上り橋津線 | E268: 原入口 | F268: 柱 | G268: あり | H268: あり | I268: 2018-07 | J268: https://www.google.com/maps/@35.5056476,133.9231664,3a,39.4y,168.43h,89.26t/data=!3m6!1e1!3m4!1sQQkKvnTd3Qxw5biST9mIdg!2e0!7i13312!8i6656?hl=ja | K268: 35.505606, 133.923259 | M268: of:=MID([.K268];1;FIND(",";[.K268])-1) -> 35.505606 | N268: of:=MID([.K268];FIND(" ";[.K268])+1;LEN([.K268])) -> 133.923259 | O268: of:=IF([.A267]=[.A268];[.O267];[.O267]+1) -> 130 | P268: of:=IF([.A268]=[.E268];"";IF([.E268]="";"";"あり")) -> 
A269: 原入口 | C269: 下り橋津線 | E269: 原入口 | F269: 柱 | G269: あり | H269: あり | I269: 2018-07 | J269: https://www.google.com/maps/@35.5055363,133.9258151,3a,37y,29.37h,91.32t/data=!3m6!1e1!3m4!1sESplkPYU1oC7MNKhsEwzgg!2e0!7i13312!8i6656?hl=ja | K269: 35.505617, 133.925868 | M269: of:=MID([.K269];1;FIND(",";[.K269])-1) -> 35.505617 | N269: of:=MID([.K269];FIND(" ";[.K269])+1;LEN([.K269])) -> 133.925868 | O269: of:=IF([.A268]=[.A269];[.O268];[.O268]+1) -> 130 | P269: of:=IF([.A269]=[.E269];"";IF([.E269]="";"";"あり")) -> 
A270: 原入口 | C270: 上り松崎・北方線 | E270: 原入口 | F270: 柱 | G270: なし | H270: なし | I270: 2018-08 | J270: https://www.google.com/maps/@35.5047836,133.9262279,3a,35.9y,107.86h,84.66t/data=!3m6!1e1!3m4!1sdjNcp0iuXCMRdWRu92jYBQ!2e0!7i13312!8i6656?hl=ja | K270: 35.504701, 133.926234 | M270: of:=MID([.K270];1;FIND(",";[.K270])-1) -> 35.504701 | N270: of:=MID([.K270];FIND(" ";[.K270])+1;LEN([.K270])) -> 133.926234 | O270: of:=IF([.A269]=[.A270];[.O269];[.O269]+1) -> 130
A271: 原入口 | C271: 下り松崎・北方線 | E271: 原入口 | F271: 柱 | G271: なし | H271: なし | I271: 2018-08 | J271: https://www.google.com/maps/@35.5046975,133.9262073,3a,18.8y,275.75h,86.51t/data=!3m6!1e1!3m4!1sQEtKTp0Gg_hzO8ximW-Y4g!2e0!7i13312!8i6656?hl=ja | K271: 35.504670, 133.925979 | M271: of:=MID([.K271];1;FIND(",";[.K271])-1) -> 35.504670 | N271: of:=MID([.K271];FIND(" ";[.K271])+1;LEN([.K271])) -> 133.925979 | O271: of:=IF([.A270]=[.A271];[.O270];[.O270]+1) -> 130
A272: 泊駅前 | C272: 上り | E272: 泊駅前 | F272: 柱 | G272: あり | H272: あり | I272: 2018-08 | J272: https://www.google.com/maps/@35.5095366,133.9359496,3a,60y,133.56h,90.34t/data=!3m6!1e1!3m4!1scSq3LZWycWVgQH8mGLz93A!2e0!7i13312!8i6656?hl=ja | K272: 35.509459, 133.935991 | M272: of:=MID([.K272];1;FIND(",";[.K272])-1) -> 35.509459 | N272: of:=MID([.K272];FIND(" ";[.K272])+1;LEN([.K272])) -> 133.935991 | O272: of:=IF([.A271]=[.A272];[.O271];[.O271]+1) -> 131 | P272: of:=IF([.A272]=[.E272];"";IF([.E272]="";"";"あり")) -> 
A273: 泊駅前 | C273: 下り | E273: 泊駅前 | F273: 柱 | G273: なし | H273: なし | I273: 2018-08 | J273: https://www.google.com/maps/@35.5092929,133.9358433,3a,51.9y,281.92h,82.9t/data=!3m6!1e1!3m4!1sr6JFY7XEErs80shSBz6LQg!2e0!7i13312!8i6656?hl=ja | K273: 35.509272, 133.935767 | M273: of:=MID([.K273];1;FIND(",";[.K273])-1) -> 35.509272 | N273: of:=MID([.K273];FIND(" ";[.K273])+1;LEN([.K273])) -> 133.935767 | O273: of:=IF([.A272]=[.A273];[.O272];[.O272]+1) -> 131 | P273: of:=IF([.A273]=[.E273];"";IF([.E273]="";"";"あり")) -> 
A274: 泊庁舎前 | C274: 上り | E274: 泊庁舎前 | F274: 柱 | G274: あり | H274: あり | I274: 2018-08 | J274: https://www.google.com/maps/@35.5133832,133.9400648,3a,50.9y,182.55h,90.74t/data=!3m6!1e1!3m4!1sgNRttlqsFQ4ys8TOuCI18w!2e0!7i13312!8i6656?hl=ja | K274: 35.513330, 133.940087 | M274: of:=MID([.K274];1;FIND(",";[.K274])-1) -> 35.513330 | N274: of:=MID([.K274];FIND(" ";[.K274])+1;LEN([.K274])) -> 133.940087 | O274: of:=IF([.A273]=[.A274];[.O273];[.O273]+1) -> 132 | P274: of:=IF([.A274]=[.E274];"";IF([.E274]="";"";"あり")) -> 
A275: 泊庁舎前 | C275: 下り | E275: 泊庁舎前 | F275: 柱 | G275: あり | H275: あり | I275: 2018-08 | J275: https://www.google.com/maps/@35.513211,133.9392149,3a,75y,3.04h,93.6t/data=!3m6!1e1!3m4!1sqqVqywHDpJppEppJ0J0w3g!2e0!7i13312!8i6656?hl=ja | K275: 35.513300, 133.939267 | M275: of:=MID([.K275];1;FIND(",";[.K275])-1) -> 35.513300 | N275: of:=MID([.K275];FIND(" ";[.K275])+1;LEN([.K275])) -> 133.939267 | O275: of:=IF([.A274]=[.A275];[.O274];[.O274]+1) -> 132 | P275: of:=IF([.A275]=[.E275];"";IF([.E275]="";"";"あり")) -> 
A276: 恐竜広場前 | C276: 上り | E276: 恐竜広場前 | F276: 柱 | G276: あり | H276: なし | I276: 2018-08 | J276: https://www.google.com/maps/@35.5135316,133.9448511,3a,46.3y,183.7h,96.35t/data=!3m6!1e1!3m4!1sfxT1k0g1nXZWXu9tLJNx_w!2e0!7i13312!8i6656?hl=ja | K276: 35.513429, 133.944802 | M276: of:=MID([.K276];1;FIND(",";[.K276])-1) -> 35.513429 | N276: of:=MID([.K276];FIND(" ";[.K276])+1;LEN([.K276])) -> 133.944802 | O276: of:=IF([.A275]=[.A276];[.O275];[.O275]+1) -> 133 | P276: of:=IF([.A276]=[.E276];"";IF([.E276]="";"";"あり")) -> 
A277: 恐竜広場前 | C277: 下り | E277: 恐竜広場前 | F277: 柱 | G277: あり | H277: あり | I277: 2018-08 | J277: https://www.google.com/maps/@35.5135401,133.943972,3a,53.6y,356.48h,87.47t/data=!3m6!1e1!3m4!1sp_E68B58b5lr8HvueKZrcA!2e0!7i13312!8i6656?hl=ja | K277: 35.513595, 133.943909 | M277: of:=MID([.K277];1;FIND(",";[.K277])-1) -> 35.513595 | N277: of:=MID([.K277];FIND(" ";[.K277])+1;LEN([.K277])) -> 133.943909 | O277: of:=IF([.A276]=[.A277];[.O276];[.O276]+1) -> 133 | P277: of:=IF([.A277]=[.E277];"";IF([.E277]="";"";"あり")) -> 
A278: 石脇 | C278: 上り | E278: 石脇 | F278: 柱 | G278: あり | H278: あり | I278: 2018-08 | J278: https://www.google.com/maps/@35.5138728,133.9485973,3a,75y,165.91h,80.64t/data=!3m6!1e1!3m4!1s93sri_d2Q-NOwPbi-g6kXA!2e0!7i13312!8i6656?hl=ja | K278: 35.513829, 133.948680 | M278: of:=MID([.K278];1;FIND(",";[.K278])-1) -> 35.513829 | N278: of:=MID([.K278];FIND(" ";[.K278])+1;LEN([.K278])) -> 133.948680 | O278: of:=IF([.A277]=[.A278];[.O277];[.O277]+1) -> 134 | P278: of:=IF([.A278]=[.E278];"";IF([.E278]="";"";"あり")) -> 
A279: 石脇 | C279: 下り | E279: 石脇 | F279: 柱 | G279: あり | H279: あり | I279: 2018-08 | J279: https://www.google.com/maps/@35.5139039,133.9488037,3a,75y,348.1h,91.71t/data=!3m6!1e1!3m4!1s1fv6sQuxedyXVdmNixGfMQ!2e0!7i13312!8i6656?hl=ja | K279: 35.513983, 133.948864 | M279: of:=MID([.K279];1;FIND(",";[.K279])-1) -> 35.513983 | N279: of:=MID([.K279];FIND(" ";[.K279])+1;LEN([.K279])) -> 133.948864 | O279: of:=IF([.A278]=[.A279];[.O278];[.O278]+1) -> 134 | P279: of:=IF([.A279]=[.E279];"";IF([.E279]="";"";"あり")) -> 
A280: 石脇車庫 | E280: 石脇車庫 | F280: 柱 | G280: あり | H280: なし | I280: 2018-08 | J280: https://www.google.com/maps/@35.5152915,133.9543342,3a,75y,348.5h,81.49t/data=!3m6!1e1!3m4!1sv_E6J3Q_e7LKWXUAO44HeQ!2e0!7i13312!8i6656?hl=ja | K280: 35.515364, 133.954275 | M280: of:=MID([.K280];1;FIND(",";[.K280])-1) -> 35.515364 | N280: of:=MID([.K280];FIND(" ";[.K280])+1;LEN([.K280])) -> 133.954275 | O280: of:=IF([.A279]=[.A280];[.O279];[.O279]+1) -> 135 | P280: of:=IF([.A280]=[.E280];"";IF([.E280]="";"";"あり")) -> 
A281: 小浜 | C281: 上り | E281: 小浜 | F281: 柱 | G281: あり | H281: なし | I281: 2018-08 | J281: https://www.google.com/maps/@35.5192303,133.9610809,3a,60y,161.89h,84.99t/data=!3m6!1e1!3m4!1sI58Oeq1uVCdhsW_eGzNjcQ!2e0!7i13312!8i6656?hl=ja | K281: 35.519178, 133.961096 | M281: of:=MID([.K281];1;FIND(",";[.K281])-1) -> 35.519178 | N281: of:=MID([.K281];FIND(" ";[.K281])+1;LEN([.K281])) -> 133.961096 | O281: of:=IF([.A280]=[.A281];[.O280];[.O280]+1) -> 136 | P281: of:=IF([.A281]=[.E281];"";IF([.E281]="";"";"あり")) -> 
A282: 小浜 | C282: 下り | E282: 小浜 | F282: 柱 | G282: あり | H282: なし | I282: 2018-07 | J282: https://www.google.com/maps/@35.5192303,133.9610809,3a,44.4y,269.15h,86.33t/data=!3m6!1e1!3m4!1sI58Oeq1uVCdhsW_eGzNjcQ!2e0!7i13312!8i6656?hl=ja | K282: 35.519210, 133.960993 | M282: of:=MID([.K282];1;FIND(",";[.K282])-1) -> 35.519210 | N282: of:=MID([.K282];FIND(" ";[.K282])+1;LEN([.K282])) -> 133.960993 | O282: of:=IF([.A281]=[.A282];[.O281];[.O281]+1) -> 136 | P282: of:=IF([.A282]=[.E282];"";IF([.E282]="";"";"あり")) -> 
A283: ハワイアロハホール | C283: 上り | F283: 柱 | G283: なし | H283: なし | I283: 2014-09 | J283: https://www.google.com/maps/@35.4871309,133.8643575,3a,75y,259.94h,75.17t/data=!3m6!1e1!3m4!1sRUKyC9N0fuCNrQfoMKbDOg!2e0!7i13312!8i6656?hl=ja | K283: 35.487126, 133.864336 | M283: of:=MID([.K283];1;FIND(",";[.K283])-1) -> 35.487126 | N283: of:=MID([.K283];FIND(" ";[.K283])+1;LEN([.K283])) -> 133.864336 | O283: of:=IF([.A282]=[.A283];[.O282];[.O282]+1) -> 137 | P283: of:=IF([.A283]=[.E283];"";IF([.E283]="";"";"あり")) -> 
A284: ハワイアロハホール | C284: 下り | F284: 柱 | G284: あり | H284: あり | I284: 2014-09 | J284: https://www.google.com/maps/@35.4869337,133.8643559,3a,40.5y,73.99h,89.68t/data=!3m6!1e1!3m4!1sLS-7Hl5HgRHySLqZ2UdUhQ!2e0!7i13312!8i6656?hl=ja | K284: 35.486963, 133.864455 | M284: of:=MID([.K284];1;FIND(",";[.K284])-1) -> 35.486963 | N284: of:=MID([.K284];FIND(" ";[.K284])+1;LEN([.K284])) -> 133.864455 | O284: of:=IF([.A283]=[.A284];[.O283];[.O283]+1) -> 137 | P284: of:=IF([.A284]=[.E284];"";IF([.E284]="";"";"あり")) -> 
A285: 長江入口 | C285: 上り | F285: なし | G285: なし | H285: なし | I285: 2014-09 | K285: 35.483418, 133.867364 | M285: of:=MID([.K285];1;FIND(",";[.K285])-1) -> 35.483418 | N285: of:=MID([.K285];FIND(" ";[.K285])+1;LEN([.K285])) -> 133.867364 | O285: of:=IF([.A284]=[.A285];[.O284];[.O284]+1) -> 138 | P285: of:=IF([.A285]=[.E285];"";IF([.E285]="";"";"あり")) -> 
A286: 長江入口 | C286: 下り | E286: 長江入口 | F286: 柱 | G286: なし | H286: なし | I286: 2014-09 | J286: https://www.google.com/maps/@35.4833603,133.8673118,3a,41.7y,24.3h,85.94t/data=!3m6!1e1!3m4!1sTtXy8AGjj_ZABKmE_im8fw!2e0!7i13312!8i6656?hl=ja | K286: 35.483418, 133.867364 | M286: of:=MID([.K286];1;FIND(",";[.K286])-1) -> 35.483418 | N286: of:=MID([.K286];FIND(" ";[.K286])+1;LEN([.K286])) -> 133.867364 | O286: of:=IF([.A285]=[.A286];[.O285];[.O285]+1) -> 138 | P286: of:=IF([.A286]=[.E286];"";IF([.E286]="";"";"あり")) -> 
A287: 上浅津入口 | C287: 上り | E287: 上浅津入口 | F287: 柱 | G287: なし | H287: なし | I287: 2014-09 | J287: https://www.google.com/maps/@35.4818558,133.876488,3a,63.5y,204.87h,81.93t/data=!3m6!1e1!3m4!1sGzMV5Nyk37W1OMikiW4nuw!2e0!7i13312!8i6656?hl=ja | K287: 35.481814, 133.876462 | M287: of:=MID([.K287];1;FIND(",";[.K287])-1) -> 35.481814 | N287: of:=MID([.K287];FIND(" ";[.K287])+1;LEN([.K287])) -> 133.876462 | O287: of:=IF([.A286]=[.A287];[.O286];[.O286]+1) -> 139 | P287: of:=IF([.A287]=[.E287];"";IF([.E287]="";"";"あり")) -> 
A288: 上浅津入口 | C288: 下り | E288: 上浅津入口 | F288: 柱 | G288: なし | H288: なし | I288: 2014-09 | J288: https://www.google.com/maps/@35.4818558,133.876488,3a,60y,25.11h,83.83t/data=!3m6!1e1!3m4!1sGzMV5Nyk37W1OMikiW4nuw!2e0!7i13312!8i6656?hl=ja | K288: 35.481927, 133.876540 | M288: of:=MID([.K288];1;FIND(",";[.K288])-1) -> 35.481927 | N288: of:=MID([.K288];FIND(" ";[.K288])+1;LEN([.K288])) -> 133.876540 | O288: of:=IF([.A287]=[.A288];[.O287];[.O287]+1) -> 139 | P288: of:=IF([.A288]=[.E288];"";IF([.E288]="";"";"あり")) -> 
A289: 上浅津 | C289: 上り | E289: 上浅津 | F289: 柱 | G289: あり | H289: あり | I289: 2018-08 | J289: https://www.google.com/maps/@35.481169,133.8786998,3a,57.5y,202.55h,93.68t/data=!3m6!1e1!3m4!1s2Ked6rR5Z0wHgpSScXb2Nw!2e0!7i13312!8i6656?hl=ja | K289: 35.481081, 133.878670 | M289: of:=MID([.K289];1;FIND(",";[.K289])-1) -> 35.481081 | N289: of:=MID([.K289];FIND(" ";[.K289])+1;LEN([.K289])) -> 133.878670 | O289: of:=IF([.A288]=[.A289];[.O288];[.O288]+1) -> 140 | P289: of:=IF([.A289]=[.E289];"";IF([.E289]="";"";"あり")) -> 
A290: 上浅津 | C290: 下り | E290: 上浅津 | F290: 柱 | G290: なし | H290: なし | I290: 2018-08 | J290: https://www.google.com/maps/@35.4811352,133.8787939,3a,75y,47.96h,74.56t/data=!3m6!1e1!3m4!1sdfXyihR89qA9hAyt3ugmHA!2e0!7i13312!8i6656?hl=ja | K290: 35.481124, 133.878857 | M290: of:=MID([.K290];1;FIND(",";[.K290])-1) -> 35.481124 | N290: of:=MID([.K290];FIND(" ";[.K290])+1;LEN([.K290])) -> 133.878857 | O290: of:=IF([.A289]=[.A290];[.O289];[.O289]+1) -> 140 | P290: of:=IF([.A290]=[.E290];"";IF([.E290]="";"";"あり")) -> 
A291: はわい温泉 | F291: 柱 | G291: なし | H291: なし | I291: 2018-08 | J291: https://www.google.com/maps/@35.4780699,133.8839533,3a,75y,259.72h,89.82t/data=!3m6!1e1!3m4!1swzyuOwSwNk18I0XX8bs4xg!2e0!7i13312!8i6656?hl=ja | K291: 35.478054, 133.883885 | M291: of:=MID([.K291];1;FIND(",";[.K291])-1) -> 35.478054 | N291: of:=MID([.K291];FIND(" ";[.K291])+1;LEN([.K291])) -> 133.883885 | O291: of:=IF([.A290]=[.A291];[.O290];[.O290]+1) -> 141 | P291: of:=IF([.A291]=[.E291];"";IF([.E291]="";"";"あり")) -> 
A292: ハワイゆ～たうん前 | C292: 上り | F292: 柱 | G292: なし | H292: なし | I292: 2018-08 | J292: https://www.google.com/maps/@35.482411,133.8813607,3a,75y,138.73h,81.93t/data=!3m6!1e1!3m4!1s_yxS2VcEkpgGWGYlUuGVnw!2e0!7i13312!8i6656?hl=ja | K292: 35.482339, 133.881392 | M292: of:=MID([.K292];1;FIND(",";[.K292])-1) -> 35.482339 | N292: of:=MID([.K292];FIND(" ";[.K292])+1;LEN([.K292])) -> 133.881392 | O292: of:=IF([.A291]=[.A292];[.O291];[.O291]+1) -> 142 | P292: of:=IF([.A292]=[.E292];"";IF([.E292]="";"";"あり")) -> 
A293: ハワイゆ～たうん前 | C293: 下り | E293: ハワイゆーたうん前 | F293: 柱 | G293: なし | H293: なし | I293: 2018-08 | J293: https://www.google.com/maps/@35.4824961,133.8813657,3a,46.4y,287.67h,86.01t/data=!3m7!1e1!3m5!1sacBvWk1oJRo_6SyS4013rg!2e0!5s20180801T000000!7i13312!8i6656?hl=ja | K293: 35.482485, 133.881265 | M293: of:=MID([.K293];1;FIND(",";[.K293])-1) -> 35.482485 | N293: of:=MID([.K293];FIND(" ";[.K293])+1;LEN([.K293])) -> 133.881265 | O293: of:=IF([.A292]=[.A293];[.O292];[.O292]+1) -> 142 | P293: of:=IF([.A293]=[.E293];"";IF([.E293]="";"";"あり")) -> あり
A294: 運転免許試験場 | F294: 柱 | G294: あり | H294: なし | I294: 2014-09 | J294: https://www.google.com/maps/@35.4851313,133.8817395,3a,17y,210.01h,90.57t/data=!3m6!1e1!3m4!1scpKXVgypxQ-YcR0Z61MbqA!2e0!7i13312!8i6656?hl=ja | K294: 35.484809, 133.881523 | M294: of:=MID([.K294];1;FIND(",";[.K294])-1) -> 35.484809 | N294: of:=MID([.K294];FIND(" ";[.K294])+1;LEN([.K294])) -> 133.881523 | O294: of:=IF([.A293]=[.A294];[.O293];[.O293]+1) -> 143 | P294: of:=IF([.A294]=[.E294];"";IF([.E294]="";"";"あり")) -> 
A295: 臨海公園前 | C295: 上り | E295: 臨海公園前 | F295: 柱 | G295: なし | H295: なし | I295: 2018-08 | J295: https://www.google.com/maps/@35.4877844,133.8831865,3a,41.7y,90.29h,86.81t/data=!3m6!1e1!3m4!1soyPphe31lHjniu9fJq7ddg!2e0!7i13312!8i6656?hl=ja | K295: 35.487733, 133.883293 | M295: of:=MID([.K295];1;FIND(",";[.K295])-1) -> 35.487733 | N295: of:=MID([.K295];FIND(" ";[.K295])+1;LEN([.K295])) -> 133.883293 | O295: of:=IF([.A294]=[.A295];[.O294];[.O294]+1) -> 144 | P295: of:=IF([.A295]=[.E295];"";IF([.E295]="";"";"あり")) -> 
A296: 臨海公園前 | C296: 下り | E296: 臨海公園前 | F296: 柱 | G296: なし | H296: なし | I296: 2018-08 | J296: https://www.google.com/maps/@35.4875272,133.8831306,3a,18.2y,280.59h,87.1t/data=!3m6!1e1!3m4!1scIMNPs4ZS3r_V8Yy2FN4ew!2e0!7i13312!8i6656?hl=ja | K296: 35.487488, 133.883078 | M296: of:=MID([.K296];1;FIND(",";[.K296])-1) -> 35.487488 | N296: of:=MID([.K296];FIND(" ";[.K296])+1;LEN([.K296])) -> 133.883078 | O296: of:=IF([.A295]=[.A296];[.O295];[.O295]+1) -> 144 | P296: of:=IF([.A296]=[.E296];"";IF([.E296]="";"";"あり")) -> 
A297: 羽合ひかり園前 | C297: 上り | E297: 羽合ひかり園前 | F297: 柱 | G297: なし | H297: なし | I297: 2018-08 | J297: https://www.google.com/maps/@35.490953,133.8838017,3a,41.7y,124.27h,86.25t/data=!3m6!1e1!3m4!1st-5i_64LfPbrIYPs3yRAew!2e0!7i13312!8i6656?hl=ja | K297: 35.490867, 133.883850 | M297: of:=MID([.K297];1;FIND(",";[.K297])-1) -> 35.490867 | N297: of:=MID([.K297];FIND(" ";[.K297])+1;LEN([.K297])) -> 133.883850 | O297: of:=IF([.A296]=[.A297];[.O296];[.O296]+1) -> 145 | P297: of:=IF([.A297]=[.E297];"";IF([.E297]="";"";"あり")) -> 
A298: 羽合ひかり園前 | C298: 下り | E298: 羽合ひかり園前 | F298: 柱 | G298: なし | H298: なし | I298: 2018-08 | J298: https://www.google.com/maps/@35.4908588,133.8837848,3a,27.3y,304.02h,92.94t/data=!3m6!1e1!3m4!1sRBsU5gjjUGdYptvSnBMWsw!2e0!7i13312!8i6656?hl=ja | K298: 35.490888, 133.883675 | M298: of:=MID([.K298];1;FIND(",";[.K298])-1) -> 35.490888 | N298: of:=MID([.K298];FIND(" ";[.K298])+1;LEN([.K298])) -> 133.883675 | O298: of:=IF([.A297]=[.A298];[.O297];[.O297]+1) -> 145 | P298: of:=IF([.A298]=[.E298];"";IF([.E298]="";"";"あり")) -> 
A299: 衛生環境研究所前 | C299: 上り | E299: 衛生環境研究所前 | F299: 柱 | G299: なし | H299: なし | I299: 2014-09 | J299: https://www.google.com/maps/@35.4929588,133.8850633,3a,75y,32.58h,80.1t/data=!3m6!1e1!3m4!1sj4XaUyBV3UBxOQ0zpQNdbw!2e0!7i13312!8i6656?hl=ja | K299: 35.493015, 133.885065 | M299: of:=MID([.K299];1;FIND(",";[.K299])-1) -> 35.493015 | N299: of:=MID([.K299];FIND(" ";[.K299])+1;LEN([.K299])) -> 133.885065 | O299: of:=IF([.A298]=[.A299];[.O298];[.O298]+1) -> 146 | P299: of:=IF([.A299]=[.E299];"";IF([.E299]="";"";"あり")) -> 
A300: 衛生環境研究所前 | C300: 下り | F300: なし | G300: なし | H300: なし | I300: 2014-09 | K300: 35.493015, 133.885065 | M300: of:=MID([.K300];1;FIND(",";[.K300])-1) -> 35.493015 | N300: of:=MID([.K300];FIND(" ";[.K300])+1;LEN([.K300])) -> 133.885065 | O300: of:=IF([.A299]=[.A300];[.O299];[.O299]+1) -> 146 | P300: of:=IF([.A300]=[.E300];"";IF([.E300]="";"";"あり")) -> 
A301: 南谷大橋南側 | C301: 上り | E301: 南谷大橋南側 | F301: 柱 | G301: なし | H301: なし | I301: 2014-09 | J301: https://www.google.com/maps/@35.4947826,133.880701,3a,50.9y,73.07h,87.98t/data=!3m6!1e1!3m4!1sFN9rczp-xFf7_DhOQox6-w!2e0!7i13312!8i6656?hl=ja | K301: 35.494810, 133.880795 | M301: of:=MID([.K301];1;FIND(",";[.K301])-1) -> 35.494810 | N301: of:=MID([.K301];FIND(" ";[.K301])+1;LEN([.K301])) -> 133.880795 | O301: of:=IF([.A300]=[.A301];[.O300];[.O300]+1) -> 147 | P301: of:=IF([.A301]=[.E301];"";IF([.E301]="";"";"あり")) -> 
A302: 南谷大橋南側 | C302: 下り | F302: なし | G302: なし | H302: なし | I302: 2014-09 | K302: 35.494810, 133.880795 | M302: of:=MID([.K302];1;FIND(",";[.K302])-1) -> 35.494810 | N302: of:=MID([.K302];FIND(" ";[.K302])+1;LEN([.K302])) -> 133.880795 | O302: of:=IF([.A301]=[.A302];[.O301];[.O301]+1) -> 147 | P302: of:=IF([.A302]=[.E302];"";IF([.E302]="";"";"あり")) -> 
A303: 上橋津 | C303: 上り | E303: 上橋津 | F303: 柱 | G303: なし | H303: なし | I303: 2014-09 | J303: https://www.google.com/maps/@35.4975292,133.87828,3a,39.9y,91.4h,83.37t/data=!3m6!1e1!3m4!1s1Jj8N92SWu6qHYDVl77xWg!2e0!7i13312!8i6656?hl=ja | K303: 35.497525, 133.878381 | M303: of:=MID([.K303];1;FIND(",";[.K303])-1) -> 35.497525 | N303: of:=MID([.K303];FIND(" ";[.K303])+1;LEN([.K303])) -> 133.878381 | O303: of:=IF([.A302]=[.A303];[.O302];[.O302]+1) -> 148 | P303: of:=IF([.A303]=[.E303];"";IF([.E303]="";"";"あり")) -> 
A304: 上橋津 | C304: 下り | F304: なし | G304: なし | H304: なし | I304: 2014-09 | K304: 35.497525, 133.878381 | M304: of:=MID([.K304];1;FIND(",";[.K304])-1) -> 35.497525 | N304: of:=MID([.K304];FIND(" ";[.K304])+1;LEN([.K304])) -> 133.878381 | O304: of:=IF([.A303]=[.A304];[.O303];[.O303]+1) -> 148 | P304: of:=IF([.A304]=[.E304];"";IF([.E304]="";"";"あり")) -> 
A305: 橋津藩倉入口 | C305: 上り | E305: 橋津藩倉入口 | F305: 柱 | G305: なし | H305: なし | I305: 2014-09 | J305: https://www.google.com/maps/@35.5009781,133.8760265,3a,66.9y,56.49h,74.45t/data=!3m6!1e1!3m4!1sccbksnryasBg5JW2qhnBkw!2e0!7i13312!8i6656?hl=ja | K305: 35.500993, 133.876066 | M305: of:=MID([.K305];1;FIND(",";[.K305])-1) -> 35.500993 | N305: of:=MID([.K305];FIND(" ";[.K305])+1;LEN([.K305])) -> 133.876066 | O305: of:=IF([.A304]=[.A305];[.O304];[.O304]+1) -> 149 | P305: of:=IF([.A305]=[.E305];"";IF([.E305]="";"";"あり")) -> 
A306: 橋津藩倉入口 | C306: 下り | F306: なし | G306: なし | H306: なし | I306: 2014-09 | K306: 35.500993, 133.876066 | M306: of:=MID([.K306];1;FIND(",";[.K306])-1) -> 35.500993 | N306: of:=MID([.K306];FIND(" ";[.K306])+1;LEN([.K306])) -> 133.876066 | O306: of:=IF([.A305]=[.A306];[.O305];[.O305]+1) -> 149 | P306: of:=IF([.A306]=[.E306];"";IF([.E306]="";"";"あり")) -> 
A307: 上井町一丁目東 | C307: 上り | E307: 上井一丁目東 | F307: 柱 | G307: なし | H307: あり | I307: 2018-08 | J307: https://www.google.com/maps/@35.4527427,133.8522175,3a,57y,200.29h,84.53t/data=!3m6!1e1!3m4!1s_YOIbywYsRe4znUoEtlNgA!2e0!7i13312!8i6656?hl=ja | K307: 35.452703, 133.852186 | M307: of:=MID([.K307];1;FIND(",";[.K307])-1) -> 35.452703 | N307: of:=MID([.K307];FIND(" ";[.K307])+1;LEN([.K307])) -> 133.852186 | O307: of:=IF([.A306]=[.A307];[.O306];[.O306]+1) -> 150 | P307: of:=IF([.A307]=[.E307];"";IF([.E307]="";"";"あり")) -> あり
A308: 上井町一丁目東 | C308: 下り | E308: 上井一丁目東 | F308: 柱 | G308: なし | H308: なし | I308: 2018-08 | J308: https://www.google.com/maps/@35.4527427,133.8522175,3a,60y,90t/data=!3m6!1e1!3m4!1s_YOIbywYsRe4znUoEtlNgA!2e0!7i13312!8i6656?hl=ja | K308: 35.452804, 133.852228 | M308: of:=MID([.K308];1;FIND(",";[.K308])-1) -> 35.452804 | N308: of:=MID([.K308];FIND(" ";[.K308])+1;LEN([.K308])) -> 133.852228 | O308: of:=IF([.A307]=[.A308];[.O307];[.O307]+1) -> 150 | P308: of:=IF([.A308]=[.E308];"";IF([.E308]="";"";"あり")) -> あり
A309: 山根入口 | C309: 上り | E309: 山根入口 | F309: 柱 | G309: なし | H309: なし | I309: 2018-08 | J309: https://www.google.com/maps/@35.4526784,133.8545751,3a,75y,180.45h,80.55t/data=!3m6!1e1!3m4!1sMAp9ZLx8yAHyuOqYakU2uw!2e0!7i13312!8i6656?hl=ja | K309: 35.452645, 133.854564 | M309: of:=MID([.K309];1;FIND(",";[.K309])-1) -> 35.452645 | N309: of:=MID([.K309];FIND(" ";[.K309])+1;LEN([.K309])) -> 133.854564 | O309: of:=IF([.A308]=[.A309];[.O308];[.O308]+1) -> 151 | P309: of:=IF([.A309]=[.E309];"";IF([.E309]="";"";"あり")) -> 
A310: 山根入口 | C310: 下り | E310: 山根入口 | F310: 柱 | G310: なし | H310: なし | I310: 2018-08 | J310: https://www.google.com/maps/@35.4526854,133.8547163,3a,25.2y,333.66h,88.39t/data=!3m6!1e1!3m4!1sHYO9EhJT7YvgHZylYk9tUg!2e0!7i13312!8i6656?hl=ja | K310: 35.452769, 133.854664 | M310: of:=MID([.K310];1;FIND(",";[.K310])-1) -> 35.452769 | N310: of:=MID([.K310];FIND(" ";[.K310])+1;LEN([.K310])) -> 133.854664 | O310: of:=IF([.A309]=[.A310];[.O309];[.O309]+1) -> 151 | P310: of:=IF([.A310]=[.E310];"";IF([.E310]="";"";"あり")) -> 
A311: 倉吉病院前 | C311: 上り | E311: 倉吉病院前 | F311: 柱 | G311: なし | H311: なし | I311: 2018-08 | J311: https://www.google.com/maps/@35.452944,133.8572113,3a,54.5y,152.51h,89.57t/data=!3m6!1e1!3m4!1s4xHwSEww8tRHZJb4mc1AcQ!2e0!7i13312!8i6656?hl=ja | K311: 35.452939, 133.857221 | M311: of:=MID([.K311];1;FIND(",";[.K311])-1) -> 35.452939 | N311: of:=MID([.K311];FIND(" ";[.K311])+1;LEN([.K311])) -> 133.857221 | O311: of:=IF([.A310]=[.A311];[.O310];[.O310]+1) -> 152 | P311: of:=IF([.A311]=[.E311];"";IF([.E311]="";"";"あり")) -> 
A312: 倉吉病院前 | C312: 下り | F312: 柱 | G312: なし | H312: なし | I312: 2018-08 | J312: https://www.google.com/maps/@35.452944,133.8572113,3a,75y,9.68h,90.43t/data=!3m6!1e1!3m4!1s4xHwSEww8tRHZJb4mc1AcQ!2e0!7i13312!8i6656?hl=ja | K312: 35.453038, 133.857207 | M312: of:=MID([.K312];1;FIND(",";[.K312])-1) -> 35.453038 | N312: of:=MID([.K312];FIND(" ";[.K312])+1;LEN([.K312])) -> 133.857207 | O312: of:=IF([.A311]=[.A312];[.O311];[.O311]+1) -> 152 | P312: of:=IF([.A312]=[.E312];"";IF([.E312]="";"";"あり")) -> 
A313: 佐美 | C313: 上り | E313: 佐美 | F313: 柱 | G313: あり | H313: あり | I313: 2018-08 | J313: https://www.google.com/maps/@35.4533008,133.8648425,3a,47.4y,183.49h,91.81t/data=!3m6!1e1!3m4!1smia1vCEXPA-JbKFRaCdaTw!2e0!7i13312!8i6656?hl=ja | K313: 35.453233, 133.864812 | M313: of:=MID([.K313];1;FIND(",";[.K313])-1) -> 35.453233 | N313: of:=MID([.K313];FIND(" ";[.K313])+1;LEN([.K313])) -> 133.864812 | O313: of:=IF([.A312]=[.A313];[.O312];[.O312]+1) -> 153 | P313: of:=IF([.A313]=[.E313];"";IF([.E313]="";"";"あり")) -> 
A314: 佐美 | C314: 下り | F314: なし | G314: なし | H314: なし | I314: 2018-08 | K314: 35.453233, 133.864812 | M314: of:=MID([.K314];1;FIND(",";[.K314])-1) -> 35.453233 | N314: of:=MID([.K314];FIND(" ";[.K314])+1;LEN([.K314])) -> 133.864812 | O314: of:=IF([.A313]=[.A314];[.O313];[.O313]+1) -> 153 | P314: of:=IF([.A314]=[.E314];"";IF([.E314]="";"";"あり")) -> 
A315: 埴見入口 | C315: 上り | E315: 埴見入口 | F315: 柱 | G315: あり | H315: あり | I315: 2018-08 | J315: https://www.google.com/maps/@35.4564102,133.8702651,3a,48.3y,68.53h,89.35t/data=!3m6!1e1!3m4!1si8vNqeroE67DX56R3ZFRLQ!2e0!7i13312!8i6656?hl=ja | K315: 35.456448, 133.870356 | M315: of:=MID([.K315];1;FIND(",";[.K315])-1) -> 35.456448 | N315: of:=MID([.K315];FIND(" ";[.K315])+1;LEN([.K315])) -> 133.870356 | O315: of:=IF([.A314]=[.A315];[.O314];[.O314]+1) -> 154 | P315: of:=IF([.A315]=[.E315];"";IF([.E315]="";"";"あり")) -> 
A316: 埴見入口 | C316: 下り | E316: 埴見入口 | F316: 柱 | G316: なし | H316: なし | I316: 2018-08 | J316: https://www.google.com/maps/@35.4562103,133.8701332,3a,21.2y,311.84h,87.14t/data=!3m6!1e1!3m4!1sq_dmVnDYOkTBL28j_RtGvw!2e0!7i13312!8i6656?hl=ja | K316: 35.456270, 133.870052 | M316: of:=MID([.K316];1;FIND(",";[.K316])-1) -> 35.456270 | N316: of:=MID([.K316];FIND(" ";[.K316])+1;LEN([.K316])) -> 133.870052 | O316: of:=IF([.A315]=[.A316];[.O315];[.O315]+1) -> 154 | P316: of:=IF([.A316]=[.E316];"";IF([.E316]="";"";"あり")) -> 
A317: 長和田 | C317: 上り | E317: 長和田 | F317: 柱 | G317: あり | H317: あり | I317: 2018-08 | J317: https://www.google.com/maps/@35.4615866,133.8781138,3a,16y,145.42h,88.23t/data=!3m6!1e1!3m4!1sqdPrkgbMYvv_NVdGARu6vw!2e0!7i13312!8i6656?hl=ja | K317: 35.461523, 133.878191 | M317: of:=MID([.K317];1;FIND(",";[.K317])-1) -> 35.461523 | N317: of:=MID([.K317];FIND(" ";[.K317])+1;LEN([.K317])) -> 133.878191 | O317: of:=IF([.A316]=[.A317];[.O316];[.O316]+1) -> 155 | P317: of:=IF([.A317]=[.E317];"";IF([.E317]="";"";"あり")) -> 
A318: 長和田 | C318: 下り | E318: 長和田 | F318: 柱 | G318: なし | H318: なし | I318: 2018-08 | J318: https://www.google.com/maps/@35.4613704,133.8778051,3a,30.2y,332.51h,85.3t/data=!3m6!1e1!3m4!1s-ioTZATKY2WiM6xgqKLbUg!2e0!7i13312!8i6656?hl=ja | K318: 35.461460, 133.877815 | M318: of:=MID([.K318];1;FIND(",";[.K318])-1) -> 35.461460 | N318: of:=MID([.K318];FIND(" ";[.K318])+1;LEN([.K318])) -> 133.877815 | O318: of:=IF([.A317]=[.A318];[.O317];[.O317]+1) -> 155 | P318: of:=IF([.A318]=[.E318];"";IF([.E318]="";"";"あり")) -> 
A319: 野花 | C319: 上り | F319: 柱 | G319: なし | H319: なし | I319: 2018-08 | J319: https://www.google.com/maps/@35.4624191,133.8887032,3a,50.9y,204.19h,85.17t/data=!3m6!1e1!3m4!1siF_J7Pl8Y9iGrmoFxWbJZA!2e0!7i13312!8i6656?hl=ja | K319: 35.462410, 133.888396 | M319: of:=MID([.K319];1;FIND(",";[.K319])-1) -> 35.462410 | N319: of:=MID([.K319];FIND(" ";[.K319])+1;LEN([.K319])) -> 133.888396 | O319: of:=IF([.A318]=[.A319];[.O318];[.O318]+1) -> 156 | P319: of:=IF([.A319]=[.E319];"";IF([.E319]="";"";"あり")) -> 
A320: 野花 | C320: 下り | F320: 柱 | G320: なし | H320: なし | I320: 2018-08 | J320: https://www.google.com/maps/@35.4624137,133.888567,3a,75y,13.19h,83.47t/data=!3m6!1e1!3m4!1sEZfjqArdSM6aNmq8dWPTzQ!2e0!7i13312!8i6656?hl=ja | K320: 35.462540, 133.888374 | M320: of:=MID([.K320];1;FIND(",";[.K320])-1) -> 35.462540 | N320: of:=MID([.K320];FIND(" ";[.K320])+1;LEN([.K320])) -> 133.888374 | O320: of:=IF([.A319]=[.A320];[.O319];[.O319]+1) -> 156 | P320: of:=IF([.A320]=[.E320];"";IF([.E320]="";"";"あり")) -> 
A321: 引地 | C321: 上り | E321: 引地 | F321: 柱 | G321: あり | H321: あり | I321: 2018-08 | J321: https://www.google.com/maps/@35.4638053,133.8943901,3a,43.8y,130.37h,87.64t/data=!3m6!1e1!3m4!1snH5636oF-IRaiWqWzdQX_g!2e0!7i13312!8i6656?hl=ja | K321: 35.463780, 133.894537 | M321: of:=MID([.K321];1;FIND(",";[.K321])-1) -> 35.463780 | N321: of:=MID([.K321];FIND(" ";[.K321])+1;LEN([.K321])) -> 133.894537 | O321: of:=IF([.A320]=[.A321];[.O320];[.O320]+1) -> 157 | P321: of:=IF([.A321]=[.E321];"";IF([.E321]="";"";"あり")) -> 
A322: 引地 | C322: 下り | E322: 引地 | F322: 柱 | G322: なし | H322: なし | I322: 2018-08 | J322: https://www.google.com/maps/@35.4640109,133.8947459,3a,51y,338.05h,89.88t/data=!3m6!1e1!3m4!1s9d4ueCpuvgF-QUtla4Vatg!2e0!7i13312!8i6656?hl=ja | K322: 35.464095, 133.894779 | M322: of:=MID([.K322];1;FIND(",";[.K322])-1) -> 35.464095 | N322: of:=MID([.K322];FIND(" ";[.K322])+1;LEN([.K322])) -> 133.894779 | O322: of:=IF([.A321]=[.A322];[.O321];[.O321]+1) -> 157 | P322: of:=IF([.A322]=[.E322];"";IF([.E322]="";"";"あり")) -> 
A323: 東郷橋 | C323: 上り | E323: 東郷橋 | F323: 柱 | G323: なし | H323: なし | I323: 2018-08 | J323: https://www.google.com/maps/@35.4655897,133.8969353,3a,47.1y,166.08h,86.23t/data=!3m6!1e1!3m4!1sSxrNah7bD0NBnqEbmeaTsg!2e0!7i13312!8i6656?hl=ja | K323: 35.465507, 133.896949 | M323: of:=MID([.K323];1;FIND(",";[.K323])-1) -> 35.465507 | N323: of:=MID([.K323];FIND(" ";[.K323])+1;LEN([.K323])) -> 133.896949 | O323: of:=IF([.A322]=[.A323];[.O322];[.O322]+1) -> 158 | P323: of:=IF([.A323]=[.E323];"";IF([.E323]="";"";"あり")) -> 
A324: 東郷橋 | C324: 下り | E324: 東郷橋 | F324: 柱 | G324: なし | H324: なし | I324: 2018-08 | J324: https://www.google.com/maps/@35.465375,133.8966798,3a,60y,21.94h,86.28t/data=!3m6!1e1!3m4!1skZyhAS02te-Wjbzc6-Xljw!2e0!7i13312!8i6656?hl=ja | K324: 35.465440, 133.896682 | M324: of:=MID([.K324];1;FIND(",";[.K324])-1) -> 35.465440 | N324: of:=MID([.K324];FIND(" ";[.K324])+1;LEN([.K324])) -> 133.896682 | O324: of:=IF([.A323]=[.A324];[.O323];[.O323]+1) -> 158 | P324: of:=IF([.A324]=[.E324];"";IF([.E324]="";"";"あり")) -> 
A325: 松崎駅前 | C325: 上り | E325: 松崎駅前 | F325: 柱 | G325: なし | H325: なし | I325: 2018-08 | J325: https://www.google.com/maps/@35.4692795,133.900541,3a,47.2y,152.39h,86.87t/data=!3m6!1e1!3m4!1sl0eA3wz_d1tP0AfT7XzQqw!2e0!7i13312!8i6656?hl=ja | K325: 35.469228, 133.900597 | M325: of:=MID([.K325];1;FIND(",";[.K325])-1) -> 35.469228 | N325: of:=MID([.K325];FIND(" ";[.K325])+1;LEN([.K325])) -> 133.900597 | O325: of:=IF([.A324]=[.A325];[.O324];[.O324]+1) -> 159 | P325: of:=IF([.A325]=[.E325];"";IF([.E325]="";"";"あり")) -> 
A326: 松崎駅前 | C326: 下り | E326: 松崎駅前 | F326: 柱 | G326: なし | H326: あり | I326: 2018-08 | J326: https://www.google.com/maps/@35.4694232,133.9008838,3a,60y,34.52h,85.29t/data=!3m6!1e1!3m4!1s2b-7WShKyeNzjZq0MeFulA!2e0!7i13312!8i6656?hl=ja | K326: 35.469466, 133.900910 | M326: of:=MID([.K326];1;FIND(",";[.K326])-1) -> 35.469466 | N326: of:=MID([.K326];FIND(" ";[.K326])+1;LEN([.K326])) -> 133.900910 | O326: of:=IF([.A325]=[.A326];[.O325];[.O325]+1) -> 159 | P326: of:=IF([.A326]=[.E326];"";IF([.E326]="";"";"あり")) -> 
A327: 松崎幼稚園入口 | C327: 上り | E327: 幼稚園入口 | F327: 柱 | G327: なし | H327: なし | I327: 2018-08 | J327: https://www.google.com/maps/@35.4728673,133.9037336,3a,24.9y,134.08h,88.53t/data=!3m6!1e1!3m4!1siQahW14ERVNebTaHwfLqVg!2e0!7i13312!8i6656?hl=ja | K327: 35.472788, 133.903998 | M327: of:=MID([.K327];1;FIND(",";[.K327])-1) -> 35.472788 | N327: of:=MID([.K327];FIND(" ";[.K327])+1;LEN([.K327])) -> 133.903998 | O327: of:=IF([.A326]=[.A327];[.O326];[.O326]+1) -> 160 | P327: of:=IF([.A327]=[.E327];"";IF([.E327]="";"";"あり")) -> あり
A328: 松崎幼稚園入口 | C328: 下り | E328: 幼稚園入口 | F328: 柱 | G328: なし | H328: なし | I328: 2018-08 | J328: https://www.google.com/maps/@35.4729476,133.9037654,3a,51.3y,320.99h,88.24t/data=!3m6!1e1!3m4!1skAoo7Jpns6Jw27BTt5S_Ig!2e0!7i13312!8i6656?hl=ja | K328: 35.472996, 133.903916 | M328: of:=MID([.K328];1;FIND(",";[.K328])-1) -> 35.472996 | N328: of:=MID([.K328];FIND(" ";[.K328])+1;LEN([.K328])) -> 133.903916 | O328: of:=IF([.A327]=[.A328];[.O327];[.O327]+1) -> 160 | P328: of:=IF([.A328]=[.E328];"";IF([.E328]="";"";"あり")) -> あり
A329: 藤津入口 | C329: 上り | E329: 藤津入口 | F329: 柱 | G329: あり | H329: あり | I329: 2014-09 | J329: https://www.google.com/maps/@35.4759639,133.9056134,3a,53y,329.56h,82.85t/data=!3m6!1e1!3m4!1shIwsJEm8hMbka83EDmRyMg!2e0!7i13312!8i6656?hl=ja | K329: 35.476049, 133.905549 | M329: of:=MID([.K329];1;FIND(",";[.K329])-1) -> 35.476049 | N329: of:=MID([.K329];FIND(" ";[.K329])+1;LEN([.K329])) -> 133.905549 | O329: of:=IF([.A328]=[.A329];[.O328];[.O328]+1) -> 161 | P329: of:=IF([.A329]=[.E329];"";IF([.E329]="";"";"あり")) -> 
A330: 藤津入口 | C330: 下り | F330: なし | G330: なし | H330: なし | I330: 2014-09 | K330: 35.476049, 133.905549 | M330: of:=MID([.K330];1;FIND(",";[.K330])-1) -> 35.476049 | N330: of:=MID([.K330];FIND(" ";[.K330])+1;LEN([.K330])) -> 133.905549 | O330: of:=IF([.A329]=[.A330];[.O329];[.O329]+1) -> 161 | P330: of:=IF([.A330]=[.E330];"";IF([.E330]="";"";"あり")) -> 
A331: 白石入口 | C331: 上り | E331: 白石入口 | F331: 柱 | G331: あり | H331: なし | I331: 2018-08 | J331: https://www.google.com/maps/@35.4801154,133.9169509,3a,44.6y,146.24h,91t/data=!3m6!1e1!3m4!1smIN8u4ays-UQ0MnmZLN6cw!2e0!7i13312!8i6656?hl=ja | K331: 35.480036, 133.916953 | M331: of:=MID([.K331];1;FIND(",";[.K331])-1) -> 35.480036 | N331: of:=MID([.K331];FIND(" ";[.K331])+1;LEN([.K331])) -> 133.916953 | O331: of:=IF([.A330]=[.A331];[.O330];[.O330]+1) -> 162 | P331: of:=IF([.A331]=[.E331];"";IF([.E331]="";"";"あり")) -> 
A332: 白石入口 | C332: 下り | F332: なし | G332: なし | H332: なし | I332: 2018-08 | K332: 35.480036, 133.916953 | M332: of:=MID([.K332];1;FIND(",";[.K332])-1) -> 35.480036 | N332: of:=MID([.K332];FIND(" ";[.K332])+1;LEN([.K332])) -> 133.916953 | O332: of:=IF([.A331]=[.A332];[.O331];[.O331]+1) -> 162 | P332: of:=IF([.A332]=[.E332];"";IF([.E332]="";"";"あり")) -> 
A333: 舎人 | C333: 上り | E333: 舎人 | F333: 柱 | G333: なし | H333: なし | I333: 2018-08 | J333: https://www.google.com/maps/@35.4816075,133.918649,3a,50.9y,115.99h,88.65t/data=!3m6!1e1!3m4!1sNPHHV_2nU8EkImdXwByuVw!2e0!7i13312!8i6656?hl=ja | K333: 35.481543, 133.918716 | M333: of:=MID([.K333];1;FIND(",";[.K333])-1) -> 35.481543 | N333: of:=MID([.K333];FIND(" ";[.K333])+1;LEN([.K333])) -> 133.918716 | O333: of:=IF([.A332]=[.A333];[.O332];[.O332]+1) -> 163 | P333: of:=IF([.A333]=[.E333];"";IF([.E333]="";"";"あり")) -> 
A334: 舎人 | C334: 下り | E334: 舎人 | F334: 柱 | G334: なし | H334: なし | I334: 2018-08 | J334: https://www.google.com/maps/@35.4812904,133.9183721,3a,40.8y,303.54h,90.23t/data=!3m6!1e1!3m4!1sfopdArn2-EV5gvsZx86GcA!2e0!7i13312!8i6656?hl=ja | K334: 35.481364, 133.918283 | M334: of:=MID([.K334];1;FIND(",";[.K334])-1) -> 35.481364 | N334: of:=MID([.K334];FIND(" ";[.K334])+1;LEN([.K334])) -> 133.918283 | O334: of:=IF([.A333]=[.A334];[.O333];[.O333]+1) -> 163 | P334: of:=IF([.A334]=[.E334];"";IF([.E334]="";"";"あり")) -> 
A335: 漆原 | C335: 上り | E335: 漆原 | F335: 柱 | G335: なし | H335: なし | I335: 2018-08 | J335: https://www.google.com/maps/@35.4841765,133.9208892,3a,75y,146.96h,81.06t/data=!3m6!1e1!3m4!1sMRghF_PQQZf8ZA3OA6x5SA!2e0!7i13312!8i6656?hl=ja | K335: 35.484104, 133.920888 | M335: of:=MID([.K335];1;FIND(",";[.K335])-1) -> 35.484104 | N335: of:=MID([.K335];FIND(" ";[.K335])+1;LEN([.K335])) -> 133.920888 | O335: of:=IF([.A334]=[.A335];[.O334];[.O334]+1) -> 164 | P335: of:=IF([.A335]=[.E335];"";IF([.E335]="";"";"あり")) -> 
A336: 漆原 | C336: 下り | F336: なし | G336: なし | H336: なし | I336: 2018-08 | K336: 35.484104, 133.920888 | M336: of:=MID([.K336];1;FIND(",";[.K336])-1) -> 35.484104 | N336: of:=MID([.K336];FIND(" ";[.K336])+1;LEN([.K336])) -> 133.920888 | O336: of:=IF([.A335]=[.A336];[.O335];[.O335]+1) -> 164 | P336: of:=IF([.A336]=[.E336];"";IF([.E336]="";"";"あり")) -> 
A337: 北方入口 | C337: 上り | E337: 北方入口 | F337: 柱 | G337: あり | H337: あり | I337: 2018-08 | J337: https://www.google.com/maps/@35.4869264,133.9228551,3a,22.3y,104.63h,88.88t/data=!3m6!1e1!3m4!1s72fl499bhMu8LO7yOwXaBA!2e0!7i13312!8i6656?hl=ja | K337: 35.486868, 133.922926 | M337: of:=MID([.K337];1;FIND(",";[.K337])-1) -> 35.486868 | N337: of:=MID([.K337];FIND(" ";[.K337])+1;LEN([.K337])) -> 133.922926 | O337: of:=IF([.A336]=[.A337];[.O336];[.O336]+1) -> 165 | P337: of:=IF([.A337]=[.E337];"";IF([.E337]="";"";"あり")) -> 
A338: 北方入口 | C338: 下り | E338: 北方入口 | F338: 柱 | G338: なし | H338: なし | I338: 2018-08 | J338: https://www.google.com/maps/@35.487016,133.9229001,3a,60y,259.61h,84.71t/data=!3m6!1e1!3m4!1sZQ_3WciI7wTA07OEHj93Qg!2e0!7i13312!8i6656?hl=ja | K338: 35.487002, 133.922814 | M338: of:=MID([.K338];1;FIND(",";[.K338])-1) -> 35.487002 | N338: of:=MID([.K338];FIND(" ";[.K338])+1;LEN([.K338])) -> 133.922814 | O338: of:=IF([.A337]=[.A338];[.O337];[.O337]+1) -> 165 | P338: of:=IF([.A338]=[.E338];"";IF([.E338]="";"";"あり")) -> 
A339: 原 | C339: 上り | E339: 原 | F339: 柱 | G339: あり | H339: あり | I339: 2018-08 | J339: https://www.google.com/maps/@35.5003942,133.9256885,3a,41.2y,103.86h,87.4t/data=!3m6!1e1!3m4!1sQovLZl-uEZ6TVphGhCj-_Q!2e0!7i13312!8i6656?hl=ja | K339: 35.500326, 133.925742 | M339: of:=MID([.K339];1;FIND(",";[.K339])-1) -> 35.500326 | N339: of:=MID([.K339];FIND(" ";[.K339])+1;LEN([.K339])) -> 133.925742 | O339: of:=IF([.A338]=[.A339];[.O338];[.O338]+1) -> 166 | P339: of:=IF([.A339]=[.E339];"";IF([.E339]="";"";"あり")) -> 
A340: 原 | C340: 下り | E340: 原 | F340: 柱 | G340: あり | H340: なし | I340: 2018-08 | J340: https://www.google.com/maps/@35.5017763,133.9257743,3a,23.1y,279.49h,89.26t/data=!3m6!1e1!3m4!1sdK__GRsZI4m5nPwqXBxzEQ!2e0!7i13312!8i6656?hl=ja | K340: 35.501722, 133.925517 | M340: of:=MID([.K340];1;FIND(",";[.K340])-1) -> 35.501722 | N340: of:=MID([.K340];FIND(" ";[.K340])+1;LEN([.K340])) -> 133.925517 | O340: of:=IF([.A339]=[.A340];[.O339];[.O339]+1) -> 166 | P340: of:=IF([.A340]=[.E340];"";IF([.E340]="";"";"あり")) -> 
A341: 青山剛昌ふるさと館 | F341: 柱 | G341: なし | H341: あり | I341: 2014-04 | J341: https://www.google.com/maps/@35.4981305,133.7624741,3a,41.5y,267.61h,82.09t/data=!3m7!1e1!3m5!1svJ0t2u3deKOMQ3fH_pp6Qg!2e0!5s20140801T000000!7i13312!8i6656?hl=ja | K341: 35.498139, 133.762344 | M341: of:=MID([.K341];1;FIND(",";[.K341])-1) -> 35.498139 | N341: of:=MID([.K341];FIND(" ";[.K341])+1;LEN([.K341])) -> 133.762344 | O341: 167 | P341: of:=IF([.A270]=[.E270];"";IF([.E270]="";"";"あり")) -> 
P342: of:=IF([.A271]=[.E271];"";IF([.E271]="";"";"あり")) -> 